Title,Authors,Platform,Cited_url,Cited_count,Year
Using noise and chaos control to control nonchaotic systems,"DJ Christini, JJ Collins","Physical Review E 52 (6), 5806",https://scholar.google.com/scholar?oi=bibs&hl=en&cites=13491042355814322416,46,1995
Protein interactions: unspinning the web,"J Hasty, JJ Collins","Nature 411 (6833), 30",https://scholar.google.com/scholar?oi=bibs&hl=en&cites=1495397438462155885,45,2001
Definitions and guidelines for research on antibiotic persistence,"NQ Balaban, S Helaine, K Lewis, M Ackermann, B Aldridge, DI Andersson, ...","Nature Reviews Microbiology 17 (7), 441-448",https://scholar.google.com/scholar?oi=bibs&hl=en&cites=15591609562259523352,44,2019
Life after the synthetic cell,"M Bedau, G Church, S Rasmussen, A Caplan, S Benner, M Fussenegger, ...","Nature 465 (7297), 422-424",https://scholar.google.com/scholar?oi=bibs&hl=en&cites=13213622221899297346,44,2010
Controlled movement and suppression of spiral waves in excitable media,"GV Osipov, BV Shulgin, JJ Collins","Physical Review E 58 (6), 6955",https://scholar.google.com/scholar?oi=bibs&hl=en&cites=17045491918830809766,44,1998
Real-time and adaptive method and system for suppressing a pathological non-chaotic rhythm,"DJ Christini, JJ Collins","US Patent 5,836,974",https://scholar.google.com/scholar?oi=bibs&hl=en&cites=2454875678468822783,44,1998
Enhancing aperiodic stochastic resonance through noise modulation,"CC Chow, TT Imhoff, JJ Collins","Chaos: An Interdisciplinary Journal of Nonlinear Science 8 (3), 616-620",https://scholar.google.com/scholar?oi=bibs&hl=en&cites=16661973848022426186,44,1998
Mechanoreceptors in the human elbow ligaments,"S Petrie, JG Collins, M Solomonow, C Wink, R Chuinard, R D'Ambrosia","Journal of Hand Surgery 23 (3), 512-518",https://scholar.google.com/scholar?oi=bibs&hl=en&cites=11821646515398792272,44,1998
Chemogenomics and orthology‐based design of antibiotic combination therapies,"S Chandrasekaran, M Cokol‐Cakmak, N Sahin, K Yilancioglu, H Kazan, ...",Molecular systems biology 12 (5),https://scholar.google.com/scholar?oi=bibs&hl=en&cites=8460660119522569974,43,2016
Genomic approaches to deconstruct pluripotency,"YH Loh, L Yang, JC Yang, H Li, JJ Collins, GQ Daley","Annual review of genomics and human genetics 12, 165-185",https://scholar.google.com/scholar?oi=bibs&hl=en&cites=5094247800299078210,43,2011
Designing microbial consortia with defined social interactions,"W Kong, DR Meldgin, JJ Collins, T Lu","Nature chemical biology 14 (8), 821",https://scholar.google.com/scholar?oi=bibs&hl=en&cites=8111377337658602034,41,2018
Gene regulation: Neutralizing noise in gene networks,"TS Gardner, JJ Collins","Nature 405 (6786), 520",https://scholar.google.com/scholar?oi=bibs&hl=en&cites=5953762255356727555,41,2000
The dynamics of quasi-static posture control,"CC Chow, M Lauk, JJ Collins","Human Movement Science 18 (5), 725-740",https://scholar.google.com/scholar?oi=bibs&hl=en&cites=14303771232569338837,41,1999
Assessing muscle stiffness from quiet stance in Parkinson's disease,"M Lauk, CC Chow, LA Lipsitz, SL Mitchell, JJ Collins",Muscle & Nerve: Official Journal of the American Association of …,https://scholar.google.com/scholar?oi=bibs&hl=en&cites=7060608685269750406,41,1999
A Parkinson's disease gene regulatory network identifies the signaling protein RGS2 as a modulator of LRRK2 activity and neuronal toxicity,"J Dusonchet, H Li, M Guillily, M Liu, K Stafa, C Derada Troletti, JY Boon, ...","Human molecular genetics 23 (18), 4887-4905",https://scholar.google.com/scholar?oi=bibs&hl=en&cites=4392119234421624474,40,2014
Real-time experimental control of a system in its chaotic and nonchaotic regimes,"DJ Christini, V In, ML Spano, WL Ditto, JJ Collins","Physical Review E 56 (4), R3749",https://scholar.google.com/scholar?oi=bibs&hl=en&cites=6626382177697383451,40,1997
Creating single-copy genetic circuits,"JW Lee, A Gyorgy, DE Cameron, N Pyenson, KR Choi, JC Way, PA Silver, ...","Molecular cell 63 (2), 329-336",https://scholar.google.com/scholar?oi=bibs&hl=en&cites=12596894748571755337,39,2016
DNA sense-and-respond protein modules for mammalian cells,"S Slomovic, JJ Collins","Nature methods 12 (11), 1085",https://scholar.google.com/scholar?oi=bibs&hl=en&cites=5796024311980203740,39,2015
Boosting bacterial metabolism to combat antibiotic resistance,"P Bhargava, JJ Collins","Cell metabolism 21 (2), 154-155",https://scholar.google.com/scholar?oi=bibs&hl=en&cites=8178942559917963816,39,2015
Probiotic strains detect and suppress cholera in mice,"N Mao, A Cubillos-Ruiz, DE Cameron, JJ Collins","Science translational medicine 10 (445), eaao2586",https://scholar.google.com/scholar?oi=bibs&hl=en&cites=9161090986397912010,38,2018
Synthetic Biology: Bits and pieces come to life,J Collins,"Nature 483 (7387), S8",https://scholar.google.com/scholar?oi=bibs&hl=en&cites=11575101095638576045,38,2012
Biophysics: Fishing for function in noise,JJ Collins,"Nature 402 (6759), 241",https://scholar.google.com/scholar?oi=bibs&hl=en&cites=13947117293995372182,38,1999
Understanding and sensitizing density-dependent persistence to quinolone antibiotics,"A Gutierrez, S Jain, P Bhargava, M Hamblin, MA Lobritz, JJ Collins","Molecular cell 68 (6), 1147-1154. e3",https://scholar.google.com/scholar?oi=bibs&hl=en&cites=15698910521692515661,37,2017
Regulation of physiologic actions of LRRK2: focus on autophagy,"A Ferree, M Guillily, H Li, K Smith, A Takashima, R Squillace, M Weigele, ...","Neurodegenerative diseases 10 (1-4), 238-241",https://scholar.google.com/scholar?oi=bibs&hl=en&cites=9063837023693815721,37,2012
Antibiotic efficacy—context matters,"JH Yang, SC Bening, JJ Collins","Current opinion in microbiology 39, 73-80",https://scholar.google.com/scholar?oi=bibs&hl=en&cites=6786583953614334646,35,2017
A low-cost paper-based synthetic biology platform for analyzing gut microbiota and host biomarkers,"MK Takahashi, X Tan, AJ Dy, D Braff, RT Akana, Y Furuta, N Donghia, ...","Nature communications 9 (1), 3347",https://scholar.google.com/scholar?oi=bibs&hl=en&cites=4279719380958173571,34,2018
Gene expression during the generation and activation of mouse neutrophils: implication of novel functional and regulatory pathways,"JA Ericson, P Duffau, K Yasuda, A Ortiz-Lopez, K Rothamel, IR Rifkin, ...","PloS one 9 (10), e108553",https://scholar.google.com/scholar?oi=bibs&hl=en&cites=1409076681766335235,33,2014
Influence of gait parameters on the loading of the lower limb,"JJ Collins, MW Whittle","Journal of biomedical engineering 11 (5), 409-412",https://scholar.google.com/scholar?oi=bibs&hl=en&cites=12770300513111925591,33,1989
Biophysical constraints arising from compositional context in synthetic gene networks,"E Yeung, AJ Dy, KB Martin, AH Ng, D Del Vecchio, JL Beck, JJ Collins, ...","Cell systems 5 (1), 11-24. e12",https://scholar.google.com/scholar?oi=bibs&hl=en&cites=18009823922360168044,32,2017
"Real-time, adaptive, model-independent control of low-dimensional chaotic and nonchaotic dynamical systems","DJ Christini, JJ Collins",IEEE Transactions on Circuits and Systems I: Fundamental Theory and …,https://scholar.google.com/scholar?oi=bibs&hl=en&cites=590908376313841580,32,1997
Systems biology strikes gold,"DM Camacho, JJ Collins","Cell 137 (1), 24-26",https://scholar.google.com/scholar?oi=bibs&hl=en&cites=15715890871464316917,31,2009
Encoding chaos in neural spike trains,"KA Richardson, TT Imhoff, P Grigg, JJ Collins","Physical review letters 80 (11), 2485",https://scholar.google.com/scholar?oi=bibs&hl=en&cites=7008406449559592334,31,1998
Antagonistic-synergistic muscle action at the knee during competitive weightlifting,JJ Collins,"Medical and Biological Engineering and Computing 32 (2), 168-174",https://scholar.google.com/scholar?oi=bibs&hl=en&cites=16694991118841295184,31,1994
Reconstruction of complex single-cell trajectories using CellRouter,"EL Da Rocha, RG Rowe, V Lundin, M Malleshaiah, DK Jha, CR Rambo, ...","Nature communications 9 (1), 892",https://scholar.google.com/scholar?oi=bibs&hl=en&cites=16330849752690040143,30,2018
Synthetic biology platform technologies for antimicrobial applications,"D Braff, D Shis, JJ Collins","Advanced drug delivery reviews 105, 35-43",https://scholar.google.com/scholar?oi=bibs&hl=en&cites=16462549795203312704,30,2016
The effects of stochastic monopolar galvanic vestibular stimulation on human postural sway,"AP Scinicariello, JT Inglis, JJ Collins","Journal of Vestibular Research 12 (2, 3), 77-85",https://scholar.google.com/scholar?oi=bibs&hl=en&cites=6112578706717428226,30,2002
BioBits™ Explorer: A modular synthetic biology education kit,"A Huang, PQ Nguyen, JC Stark, MK Takahashi, N Donghia, T Ferrante, ...","Science advances 4 (8), eaat5105",https://scholar.google.com/scholar?oi=bibs&hl=en&cites=10547377909148640479,29,2018
A role for the bacterial GATC methylome in antibiotic stress survival,"NR Cohen, CA Ross, S Jain, RS Shapiro, A Gutierrez, P Belenky, H Li, ...","Nature genetics 48 (5), 581",https://scholar.google.com/scholar?oi=bibs&hl=en&cites=16028604850215282215,29,2016
Differential splicing across immune system lineages,"A Ergun, G Doran, JC Costello, HH Paik, JJ Collins, D Mathis, C Benoist, ...","Proceedings of the National Academy of Sciences 110 (35), 14324-14329",https://scholar.google.com/scholar?oi=bibs&hl=en&cites=1053511452616174771,29,2013
Control of chaos in excitable physiological systems: a geometric analysis,"DJ Christini, JJ Collins","Chaos: An Interdisciplinary Journal of Nonlinear Science 7 (4), 544-549",https://scholar.google.com/scholar?oi=bibs&hl=en&cites=6400558435092257085,29,1997
A blueprint for a synthetic genetic feedback controller to reprogram cell fate,"D Del Vecchio, H Abdallah, Y Qian, JJ Collins","Cell systems 4 (1), 109-120. e11",https://scholar.google.com/scholar?oi=bibs&hl=en&cites=1166860384280227241,28,2017
Plug-and-play with RNA,"FJ Isaacs, JJ Collins","Nature biotechnology 23 (3), 306",https://scholar.google.com/scholar?oi=bibs&hl=en&cites=5995139528374964867,27,2005
How best to build a cell,JJ Collins,"Nature 509 (7499), 155-157",https://scholar.google.com/scholar?oi=bibs&hl=en&cites=481718603791770423,26,2014
Networking opportunities for bacteria,"DJ Dwyer, MA Kohanski, JJ Collins","Cell 135 (7), 1153-1156",https://scholar.google.com/scholar?oi=bibs&hl=en&cites=4768852486971058920,26,2008
Detection in the presence of media noise,"G Burd, Z Wu","US Patent 6,931,585","https://scholar.google.com/scholar?oi=bibs&hl=en&cites=11577193548091040540,3078044062337521656",26,2005
Visualizing the effects of filtering chaotic signals,"MT Rosenstein, JJ Collins","Computers & graphics 18 (4), 587-592",https://scholar.google.com/scholar?oi=bibs&hl=en&cites=3951381393750186033,25,1994
CRISPR-based genomic tools for the manipulation of genetically intractable microorganisms,"RS Shapiro, A Chavez, JJ Collins","Nature Reviews Microbiology 16 (6), 333",https://scholar.google.com/scholar?oi=bibs&hl=en&cites=6923598809565515852,24,2018
RNAi reveals phase-specific global regulators of human somatic cell reprogramming,"CXD Toh, JW Chan, ZS Chong, HF Wang, HC Guo, S Satapathy, D Ma, ...","Cell reports 15 (12), 2597-2607",https://scholar.google.com/scholar?oi=bibs&hl=en&cites=18213151990452781074,24,2016
The distribution of genomic variations in human iPSCs is related to replication-timing reorganization during reprogramming,"J Lu, H Li, M Hu, T Sasaki, A Baccei, DM Gilbert, JS Liu, JJ Collins, ...","Cell reports 7 (1), 70-78",https://scholar.google.com/scholar?oi=bibs&hl=en&cites=14102249068976566376,24,2014
Engineered enzymatically active bacteriophage and methods for dispersing biofilms,"JJ Collins, TKT Lu","US Patent 8,153,119","https://scholar.google.com/scholar?oi=bibs&hl=en&cites=11151418099788373813,6981520013961958422",24,2012
Next-generation biocontainment systems for engineered organisms,"JW Lee, CTY Chan, S Slomovic, JJ Collins","Nature chemical biology 14 (6), 530-537",https://scholar.google.com/scholar?oi=bibs&hl=en&cites=11682277570332363927,23,2018
Understanding biological regulation through synthetic biology,"CJ Bashor, JJ Collins","Annual review of biophysics 47, 399-423",https://scholar.google.com/scholar?oi=bibs&hl=en&cites=9678158936920616739,23,2018
A pathway and genetic factors contributing to elevated gene expression noise in stationary phase,"NJ Guido, P Lee, X Wang, TC Elston, JJ Collins","Biophysical journal 93 (11), L55-L57",https://scholar.google.com/scholar?oi=bibs&hl=en&cites=5438591475888663017,23,2007
Gait transitions,JJ Collins,"The handbook of brain theory and neural networks, 420-423",https://scholar.google.com/scholar?oi=bibs&hl=en&cites=7509924513761763253,23,1998
BioBits™ Bright: A fluorescent synthetic biology education kit,"JC Stark, A Huang, PQ Nguyen, RS Dubner, KJ Hsu, TC Ferrante, ...","Science advances 4 (8), eaat5107",https://scholar.google.com/scholar?oi=bibs&hl=en&cites=14904910362204779217,22,2018
Variation and genetic control of gene expression in primary immunocytes across inbred mouse strains,"S Mostafavi, A Ortiz-Lopez, MA Bogue, K Hattori, C Pop, D Koller, ...","The Journal of Immunology 193 (9), 4485-4496",https://scholar.google.com/scholar?oi=bibs&hl=en&cites=12935510489266722412,22,2014
Introduction to focus issue: quantitative approaches to genetic networks,"R Albert, JJ Collins, L Glass","Chaos: An Interdisciplinary Journal of Nonlinear Science 23 (2), 025001",https://scholar.google.com/scholar?oi=bibs&hl=en&cites=5601179343964158123,22,2013
A random number generator based on the logit transform of the logistic variable,"JJ Collins, M Fanciulli, RG Hohlfeld, DC Finch, GH Sandri, ES Shtatland","Computers in Physics 6 (6), 630-632",https://scholar.google.com/scholar?oi=bibs&hl=en&cites=13190442672278842760,22,1992
Signal processing in single cells,"FJ Isaacs, WJ Blake, JJ Collins","Science 307 (5717), 1886-1888",https://scholar.google.com/scholar?oi=bibs&hl=en&cites=5838050236655235627,21,2005
ZSCAN10 expression corrects the genomic instability of iPSCs from aged donors,"M Skamagki, C Correia, P Yeung, T Baslan, S Beck, C Zhang, CA Ross, ...","Nature cell biology 19 (9), 1037",https://scholar.google.com/scholar?oi=bibs&hl=en&cites=5268570989179388211,20,2017
"Modular nucleic acid-based circuits for counters, binary operations, memory and logic","JJ Collins, T Lu","US Patent 8,645,115",https://scholar.google.com/scholar?oi=bibs&hl=en&cites=9551400791778867700,18,2014
Combined administration of testosterone plus an ornithine decarboxylase inhibitor as a selective prostate‐sparing anabolic therapy,"R Jasuja, JC Costello, R Singh, V Gupta, CS Spina, G Toraldo, H Jang, ...","Aging cell 13 (2), 303-310",https://scholar.google.com/scholar?oi=bibs&hl=en&cites=2008820995801741971,17,2014
Insulating gene circuits from context by RNA processing,"CJ Bashor, JJ Collins","Nature biotechnology 30 (11), 1061",https://scholar.google.com/scholar?oi=bibs&hl=en&cites=15072191288087550279,17,2012
Wisdom of crowds for robust gene network inference,"M Daniel, JC Costello, K Robert, NM Vega, RJ Prill, DM Camacho, ...",,https://scholar.google.com/scholar?oi=bibs&hl=en&cites=11279431319783284124,17,2012
"Rewiring bacteria, two components at a time","MA Kohanski, JJ Collins","Cell 133 (6), 947-948",https://scholar.google.com/scholar?oi=bibs&hl=en&cites=5107302280235184788,17,2008
High-throughput creation and functional profiling of DNA sequence variant libraries using CRISPR–Cas9 in yeast,"X Guo, A Chavez, A Tung, Y Chan, C Kaas, Y Yin, R Cecchi, SL Garnier, ...","Nature biotechnology 36 (6), 540",https://scholar.google.com/scholar?oi=bibs&hl=en&cites=3483639521952103665,16,2018
In vivo gene sensors,"JJ Collins, TKT Lu","US Patent 8,329,889",https://scholar.google.com/scholar?oi=bibs&hl=en&cites=1118446956798034923,16,2012
Engineered enzymatically active bacteriophages and methods of uses thereof,"JJ Collins, H Kobayashi, M Kearn, M Araki, A Friedland, TKT Lu","US Patent 8,182,804",https://scholar.google.com/scholar?oi=bibs&hl=en&cites=1444570587900007814,16,2012
Bistable genetic toggle switch,"T Gardner, JJ Collins","US Patent 6,841,376",https://scholar.google.com/scholar?oi=bibs&hl=en&cites=5151018908429494854,16,2005
Frequency control of an oscillatory reaction by reversible binding of an autocatalyst,"M Dolnik, TS Gardner, IR Epstein, JJ Collins","Physical review letters 82 (7), 1582",https://scholar.google.com/scholar?oi=bibs&hl=en&cites=5586894962896535362,16,1999
Gait analysis,"E Biden, J O'Connor, JJ Collins","Knee ligaments: structure, function, injury and repair, 291-293",https://scholar.google.com/scholar?oi=bibs&hl=en&cites=2283800173630713550,16,1990
Comprehensive mapping of pluripotent stem cell metabolism using dynamic genome-scale network modeling,"S Chandrasekaran, J Zhang, Z Sun, L Zhang, CA Ross, YC Huang, ...","Cell reports 21 (10), 2965-2977",https://scholar.google.com/scholar?oi=bibs&hl=en&cites=6018223605928511823,15,2017
Lethality of MalE-LacZ hybrid protein shares mechanistic attributes with oxidative component of antibiotic lethality,"N Takahashi, CC Gruber, JH Yang, X Liu, D Braff, CN Yashaswini, ...","Proceedings of the National Academy of Sciences 114 (34), 9164-9169",https://scholar.google.com/scholar?oi=bibs&hl=en&cites=15063919636611292515,15,2017
Using engineered bacteria to characterize infection dynamics and antibiotic effects in vivo,"LK Certain, JC Way, MJ Pezone, JJ Collins","Cell host & microbe 22 (3), 263-268. e4",https://scholar.google.com/scholar?oi=bibs&hl=en&cites=17810864549277509838,14,2017
Complex signal processing in synthetic gene circuits using cooperative regulatory assemblies,"CJ Bashor, N Patel, S Choubey, A Beyzavi, J Kondev, JJ Collins, ...","Science 364 (6440), 593-597",https://scholar.google.com/scholar?oi=bibs&hl=en&cites=1807886392088563849,13,2019
Harnessing single-cell genomics to improve the physiological fidelity of organoid-derived cell types,"BE Mead, J Ordovas-Montanes, AP Braun, LE Levy, P Bhargava, ...","BMC biology 16 (1), 62",https://scholar.google.com/scholar?oi=bibs&hl=en&cites=273110731833709443,13,2018
A White-Box Machine Learning Approach for Revealing Antibiotic Mechanisms of Action,"JH Yang, SN Wright, M Hamblin, D McCloskey, MA Alcantar, ...","Cell 177 (6), 1649-1661. e9",https://scholar.google.com/scholar?oi=bibs&hl=en&cites=14466310082058011447,12,2019
Precise Cas9 targeting enables genomic mutation prevention,"A Chavez, BW Pruitt, M Tuttle, RS Shapiro, RJ Cecchi, J Winston, ...","Proceedings of the National Academy of Sciences 115 (14), 3669-3673",https://scholar.google.com/scholar?oi=bibs&hl=en&cites=8256605971620009216,12,2018
Zfp322a Regulates mouse ES cell pluripotency and enhances reprogramming efficiency,"H Ma, HM Ng, X Teh, H Li, YH Lee, YM Chong, YH Loh, JJ Collins, ...","PLoS genetics 10 (2), e1004038",https://scholar.google.com/scholar?oi=bibs&hl=en&cites=9128210350085254515,12,2014
Systems biology makes it personal,"MP Brynildsen, JJ Collins","Molecular cell 34 (2), 137-138",https://scholar.google.com/scholar?oi=bibs&hl=en&cites=18239017212836129458,12,2009
Inferring microbial genetic networks,"TS Gardner, S Shimer, JJ Collins","ASM News 70 (3), 121-126",https://scholar.google.com/scholar?oi=bibs&hl=en&cites=13307615231805296811,12,2004
Targeted erythropoietin selectively stimulates red blood cell expansion in vivo,"DR Burrill, A Vernet, JJ Collins, PA Silver, JC Way","Proceedings of the National Academy of Sciences 113 (19), 5245-5250",https://scholar.google.com/scholar?oi=bibs&hl=en&cites=10505815251635771328,11,2016
Bits and pieces come to life,J Collins,"Nature 483 (Suppl 7387), S8",https://scholar.google.com/scholar?oi=bibs&hl=en&cites=16824108870166105826,11,2012
Systems and methods for reverse engineering models of biological networks,"D Bernardo, J Collins, T Gardner, M Thompson","US Patent App. 11/174,989",https://scholar.google.com/scholar?oi=bibs&hl=en&cites=11428680515123452786,11,2007
Functionalization of endogenous bacteria,"TKT Lu, RJ Citorik, J Collins, RJ Krom","US Patent 9,957,511",https://scholar.google.com/scholar?oi=bibs&hl=en&cites=594330127005054321,8,2018
Compositions and methods for antibiotic potentiation and drug discovery,"G Cottarel, J Wierzbowski, K Pal, M Kohanski, D Dwyer, J Collins, ...","US Patent App. 12/279,237",https://scholar.google.com/scholar?oi=bibs&hl=en&cites=13595381647149561243,8,2009
Tapping the computing power of biological molecules gives rise to tiny machines that can speak directly to living cells.,"D Baker, G Church, J Collins, D Endy, J Jacobson, J Keasling, P Modrich, ...","Scientific American 294 (5), 44-51",https://scholar.google.com/scholar?oi=bibs&hl=en&cites=3895389219200336648,8,2006
Stochastic regulation of gene expression,"J Hasty, J Pradines, M Dolnik, JJ Collins","AIP Conference Proceedings 502 (1), 191-196",https://scholar.google.com/scholar?oi=bibs&hl=en&cites=3663851186126253435,8,2000
Bacteriophages expressing antimicrobial peptides and uses thereof,"JJ Collins, M Koeris, TKT Lu, TM Chau, G Stephanopoulos, C Yoon","US Patent App. 13/224,776","https://scholar.google.com/scholar?oi=bibs&hl=en&cites=7539573437748319724,4465378526101794037",7,2015
Editorial–Synthetic Biology,"JJ Collins, D Endy, CA Hutchison III, RJ Roberts","Nucleic acids research 38 (8), 2513-2513",https://scholar.google.com/scholar?oi=bibs&hl=en&cites=11131899989917667005,7,2010
Enhancing Human Balance Control by Apply Random Vibrations to the Ankle Tendons,"A Priplata, B Patritti, A Rosengarten, J Meister, J Niemi, L Lipsitz, J Collins",Medicine & Science in Sports & Exercise 38 (5),https://scholar.google.com/scholar?oi=bibs&hl=en&cites=10124007236295716332,7,2006
And the noise played on: stochastic gene expression and HIV-1 infection,"WJ Blake, JJ Collins","Cell 122 (2), 147-149",https://scholar.google.com/scholar?oi=bibs&hl=en&cites=10868914267443558948,7,2005
Vibrating insoles improve balance in diabetic patients with peripheral neuropathy,"AA Priplata, JB Niemi, A Veves, LA Lipsitz, JJ Collins","Medicine & Science in Sports & Exercise 36 (5), S6",https://scholar.google.com/scholar?oi=bibs&hl=en&cites=17442521899529146346,7,2004
"Knee ligaments: structure, function, injury, and repair","E Biden, J O’Connor, JJ Collins","Raven, New York",https://scholar.google.com/scholar?oi=bibs&hl=en&cites=15071141731715238505,7,1990
Joint mechanics-modelling of the lower limb.,JJ Collins,University of Oxford,https://scholar.google.com/scholar?oi=bibs&hl=en&cites=16650081933650529760,7,1990
Programmable CRISPR-responsive smart materials,"MA English, LR Soenksen, RV Gayet, H de Puig, NM Angenent-Mari, ...","Science 365 (6455), 780-785",https://scholar.google.com/scholar?oi=bibs&hl=en&cites=250468504090177128,6,2019
"Rapid, Low-Cost Detection of Water Contaminants Using Regulated In Vitro Transcription","KK Alam, JK Jung, MS Verosloff, PR Clauer, JW Lee, DA Capdevila, ...","BioRxiv, 619296",https://scholar.google.com/scholar?oi=bibs&hl=en&cites=834474301477729470,6,2019
Editorial overview: Antimicrobials: Grappling with the complexities of antibiotics and resistance,"R Kishony, JJ Collins","Current opinion in microbiology 21, v-vi",https://scholar.google.com/scholar?oi=bibs&hl=en&cites=9103899115933937793,6,2014
Systems and methods for reverse engineering models of biological networks,"T Gardner, J Collins, D Di Bernardo, J Tegner, M Yeung","US Patent App. 10/506,734",https://scholar.google.com/scholar?oi=bibs&hl=en&cites=2463936454755549992,6,2006
Adjustable threshold switch,"T Gardner, JJ Collins","US Patent 6,828,140",https://scholar.google.com/scholar?oi=bibs&hl=en&cites=2979109799124185216,6,2004
Multi-state genetic oscillator,"T Gardner, JJ Collins","US Patent 6,737,269",https://scholar.google.com/scholar?oi=bibs&hl=en&cites=270167690320412423,6,2004
Bacterial metabolism and antibiotic efficacy,"JM Stokes, AJ Lopatkin, MA Lobritz, JJ Collins",Cell metabolism,https://scholar.google.com/scholar?oi=bibs&hl=en&cites=16482934163323089249,5,2019
Engineered bacteriophages as adjuvants for antimicrobial agents and compositions and methods of use thereof,"JJ Collins, TKT Lu","US Patent 9,056,899",https://scholar.google.com/scholar?oi=bibs&hl=en&cites=9325332931646631800,5,2015
Defining cellular identity through network biology,"P Cahan, SA Morris, JJ Collins, GQ Daley","Cell Cycle 13 (21), 3313-3314",https://scholar.google.com/scholar?oi=bibs&hl=en&cites=8798370028015173638,5,2014
Engineering synthetic bacteriophage to combat antibiotic-resistant bacteria,"TK Lu, JJ Collins","2009 IEEE 35th Annual Northeast Bioengineering Conference, 1-2",https://scholar.google.com/scholar?oi=bibs&hl=en&cites=14158971794030580384,5,2009
Gait Variability Is Reduced by Sub-threshold Vibrations to The Feet,"HG Kang, AM Galica, AA Priplata, OV Starobinets, SE D’Andrea, ...",North American Congress on Biomechanics,https://scholar.google.com/scholar?oi=bibs&hl=en&cites=16468157783166033998,5,2008
Wavelets of excitability in sensory neurons,"J Hasty, JJ Collins, K Wiesenfeld, P Grigg","Journal of neurophysiology 86 (4), 2097-2101",https://scholar.google.com/scholar?oi=bibs&hl=en&cites=15904282886161546786,5,2001
Tuning stochastic resonance,"JJ Collins, CC Chow, TT Imhoff","Nature 378, 341-342",https://scholar.google.com/scholar?oi=bibs&hl=en&cites=15855336214498043677,5,1995
Ultrasound scattering from spherical tumours,"MK Hinders, JJ Collins, MMN Collins, TM Fang, GH Sandri","Physics in Medicine & Biology 37 (11), 2035",https://scholar.google.com/scholar?oi=bibs&hl=en&cites=115520413592924535,5,1992
A multiplexable assay for screening antibiotic lethality against drug-tolerant bacteria,"JM Stokes, A Gutierrez, AJ Lopatkin, IW Andrews, S French, I Matic, ...","Nature methods 16 (4), 303",https://scholar.google.com/scholar?oi=bibs&hl=en&cites=5803097627619571608,4,2019
