Title,Authors,Platform,Cited_url,Cited_count,Year
"O, Connor, DH; Gehrke, L.; Collins, JJ","K Pardee, AA Green, MK Takahashi, D Braff, G Lambert, JW Lee, ...","Cell 165, 1255-1266",https://scholar.google.com/scholar?oi=bibs&hl=en&cites=15757496930680731372,4,2016
Compositions and methods to boost endogenous ros production from bacteria,"JJ Collins, MP Brynildsen, JA Winkler, C Spina","US Patent App. 14/370,558",https://scholar.google.com/scholar?oi=bibs&hl=en&cites=16707807443681467105,4,2015
Bacteriophages expressing amyloid peptides and uses thereof,"TKT Lu, S Lindquist, R Krishnan, J Collins, CW O'donnell, BB Leighton, ...","US Patent App. 13/387,888",https://scholar.google.com/scholar?oi=bibs&hl=en&cites=1889104030149079955,4,2012
Engineered enzymatically active bacteriophages and methods of uses thereof,"JJ Collins, H Kobayashi, M Kearn, M Araki, A Friedland, TKT Lu","Oak Ridge National Lab.(ORNL), Oak Ridge, TN (United States)",https://scholar.google.com/scholar?oi=bibs&hl=en&cites=18005945981806244032,4,2012
Bacteria as control engineers,"KR Allison, JJ Collins","Molecular cell 41 (1), 4-5",https://scholar.google.com/scholar?oi=bibs&hl=en&cites=18059252448664657501,4,2011
Balancing act,JJ Collins,"IEEE Spectrum 42 (4), 28-33",https://scholar.google.com/scholar?oi=bibs&hl=en&cites=14010496347330204200,4,2005
Tactile stimulation of insoles and balance control in elderly people,"AA Priplata, JB Niemi, JD Harry, LA Lipsitz, JJ Collins","The Lancet 363 (9402), 85-86",https://scholar.google.com/scholar?oi=bibs&hl=en&cites=13507741879780930102,4,2004
The mathematical springs in insect steps,"J Collins, I Stewart","New Scientist-UK Edition 144 (1946), 36-40",https://scholar.google.com/scholar?oi=bibs&hl=en&cites=15555198028479396260,4,1994
De novo-designed translation-repressing riboregulators for multi-input cellular logic,"J Kim, Y Zhou, PD Carlson, M Teichmann, S Chaudhary, FC Simmel, ...","Nature chemical biology 15 (12), 1173-1182",https://scholar.google.com/scholar?oi=bibs&hl=en&cites=16570295913307934575,3,2019
"Modular nucleic acid-based circuits for counters, binary operations, memory, and logic","JJ Collins, TKT Lu","US Patent 9,624,554",https://scholar.google.com/scholar?oi=bibs&hl=en&cites=16470405276483107557,3,2017
Intermediate metabolism products to potentiate aminoglycoside antibiotics in bacterial infections,"JJ Collins, S Meylan, S Moskowitz","US Patent App. 14/914,516",https://scholar.google.com/scholar?oi=bibs&hl=en&cites=7198304597695345549,3,2016
Erratum: Donor cell type can influence the epigenome and differentiation potential of human induced pluripotent stem cells,"K Kim, R Zhao, A Doi, K Ng, J Unternaehrer, P Cahan, H Hongguang, ...","Nature biotechnology 30 (1), 112",https://scholar.google.com/scholar?oi=bibs&hl=en&cites=17031777505519007471,3,2012
Grand challenges for biological and environmental research: A long-term vision,"A Arkin, N Baliga, J Braam, G Church, J Collins, R Cottingham, J Ecker, ...",,https://scholar.google.com/scholar?oi=bibs&hl=en&cites=945124802742573451,3,2010
Suppressing arrhythmias in cardiac models with overdrive pacing,"GV Osipov, AT Stamp, JJ Collins",2000 2nd International Conference. Control of Oscillations and Chaos …,https://scholar.google.com/scholar?oi=bibs&hl=en&cites=8731875170121466748,3,2000
A nonlinear dynamical analysis of the human postural control system,"JJ Collins, MT Rosenstein, CJ De Luca",Proceedings of the Annual International Conference of the IEEE Engineering …,https://scholar.google.com/scholar?oi=bibs&hl=en&cites=2930144823364280939,3,1991
Bacterial metabolic state more accurately predicts antibiotic lethality than growth rate,"AJ Lopatkin, JM Stokes, EJ Zheng, JH Yang, MK Takahashi, L You, ...","Nature microbiology 4 (12), 2109-2117",https://scholar.google.com/scholar?oi=bibs&hl=en&cites=18283773918996921674,2,2019
A systems biology pipeline identifies regulatory networks for stem cell engineering,"MA Kinney, LT Vo, JM Frame, J Barragan, AJ Conway, S Li, KK Wong, ...","Nature biotechnology 37 (7), 810-818",https://scholar.google.com/scholar?oi=bibs&hl=en&cites=2323404545753162108,2,2019
Crispr effector system based diagnostics,"O Abudayyeh, JJ Collins, J Gootenberg, F Zhang, ES Lander, A Regev","US Patent App. 15/922,576",https://scholar.google.com/scholar?oi=bibs&hl=en&cites=10640054564272380577,2,2018
Proton-motive force stimulation to potentiate aminoglycoside antibiotics against persistent bacteria,"JJ Collins, KR Allison, MP Brynildsen","US Patent App. 10/080,766",https://scholar.google.com/scholar?oi=bibs&hl=en&cites=5853158850662405984,2,2018
Proton-motive force stimulation to potentiate aminoglycoside antibiotics against persistent bacteria,"JJ Collins, KR Allison, MP Brynildsen","US Patent App. 15/263,766",https://scholar.google.com/scholar?oi=bibs&hl=en&cites=3164346242325232751,2,2017
High-throughput creation and functional profiling of eukaryotic DNA sequence variant libraries using CRISPR/Cas9,"X Guo, A Chavez, A Tung, Y Chan, R Cecchi, SL Garnier, C Kaas, ...","bioRxiv, 195776",https://scholar.google.com/scholar?oi=bibs&hl=en&cites=5175261613470185241,2,2017
Proton-motive force stimulation to potentiate aminoglycoside antibiotics against persistent bacteria,"JJ Collins, KR Allison, MP Brynildsen","US Patent 9,480,696",https://scholar.google.com/scholar?oi=bibs&hl=en&cites=6558636314264160821,2,2016
Method to determine transcriptional regulation pathways in organisms,"TS Gardner, JJ Collins, B Hayete, J Faith","US Patent 8,306,752",https://scholar.google.com/scholar?oi=bibs&hl=en&cites=3764234791543559724,2,2012
Gene network models identify targets for mammary tumor normalization,"A Brock, H Li, S Krause, M Kowalski, JJ Collins, DE Ingber","Cancer Research 72 (8 Supplement), 4920-4920","https://scholar.google.com/scholar?oi=bibs&hl=en&cites=15792513956348709467,9717989071296116602",2,2012
Bone marrow-on-a-chip,"YS Torisawa, CS Spina, JJ Collins, DE Ingber",16th International Conference on Miniaturized Systems for Chemistry and Life …,https://scholar.google.com/scholar?oi=bibs&hl=en&cites=16111145127572536789,2,2012
Expanding and enhancing our antibacterial arsenal,"JJ Collins, S Donadio","Current opinion in microbiology 14 (5), 511-512",https://scholar.google.com/scholar?oi=bibs&hl=en&cites=16084597557121732649,2,2011
Gene regulation: hacking the network on a sugar high,"T Ellis, X Wang, JJ Collins","Molecular cell 30 (1), 1-2",https://scholar.google.com/scholar?oi=bibs&hl=en&cites=6681164848960800941,2,2008
Z Zhu,"A Aggarwal, A Benner, A Caplan, A Desai, A Fomenkov, A Gonen, ...",,https://scholar.google.com/scholar?oi=bibs&hl=en&cites=256619548687048287,2,2005
"Interdisciplinary Physics: Biological Physics, Quantum Information, etc.-Synthetic Gene Network for Entraining and Amplifying Cellular Oscillations","J Hasty, M Dolnik, V Rottschafer, JJ Collins","Physical Review Letters 88 (14), 148101-148300",https://scholar.google.com/scholar?oi=bibs&hl=en&cites=8506178332382541199,2,2002
Electrical stimulation of the somatosensory system,"KA Richardson, JJ Collins","Handbook of Biological Physics 4, 1-22",https://scholar.google.com/scholar?oi=bibs&hl=en&cites=6471578889351449654,2,2001
Spike-frequency adaptation improves noise-shaping in model neuronal networks,"D McMillen, DJ Mar, CC Chow, JJ Collins",APS Meeting Abstracts,https://scholar.google.com/scholar?oi=bibs&hl=en&cites=1293665271262853650,2,2000
An analytic solution for energy deposition in model spherical tumours undergoing ultrasound-hyperthermia treatments,"MK Hinders, TM Fang, MFM Collins, JJ Collins","Physics in Medicine & Biology 39 (1), 107",https://scholar.google.com/scholar?oi=bibs&hl=en&cites=10808422061058944145,2,1994
Construction of a genetic toggle switch in,"TS Gardner, C Cantor, J Collins",Escherichia coli,https://scholar.google.com/scholar?oi=bibs&hl=en&cites=5829838571687484352,2,0
Deep learning for RNA synthetic biology,"NM Angenent-Mari, AS Garruss, LR Soenksen, G Church, JJ Collins","bioRxiv, 872077",https://scholar.google.com/scholar?oi=bibs&hl=en&cites=17816786415530413420,1,2019
CRISPR Guide RNA Cloning for Mammalian Systems,"S Nageshwaran, A Chavez, NC Yeo, X Guo, A Lance-Byrne, A Tung, ...","JoVE (Journal of Visualized Experiments), e57998",https://scholar.google.com/scholar?oi=bibs&hl=en&cites=10767031106361470353,1,2018
Engineering models to scale,"AJ Dy, JJ Collins","Cell 165 (3), 516-517",https://scholar.google.com/scholar?oi=bibs&hl=en&cites=11705190346749555674,1,2016
The Effect of Compositional Context on Synthetic Gene Networks,"E Yeung, AJ Dy, KB Martin, AH Ng, D Del Vecchio, JL Beck, JJ Collins, ...","BioRxiv, 083329",https://scholar.google.com/scholar?oi=bibs&hl=en&cites=3989300048135604474,1,2016
Compositions and methods for treating fungal infections,"JJ Collins, PA BELENKY, DM CAMACHO",,"https://scholar.google.com/scholar?oi=bibs&hl=en&cites=8481512936276652709,3757846466313800784",1,2014
Making a Noisy Gene: HDACs Turn Up the Static,"RM Kumar, JJ Collins","Molecular cell 47 (2), 151-153",https://scholar.google.com/scholar?oi=bibs&hl=en&cites=38520385405567635,1,2012
"Cellular signal processing: Out of one, many","RM Kumar, JJ Collins","Molecular cell 45 (2), 143-144",https://scholar.google.com/scholar?oi=bibs&hl=en&cites=15793627540772578672,1,2012
"Antioxidant strategies to tolerate antibiotics (vol 334, pg 915, 2011)","P Belenky, JJ Collins",Science 334 (6063),,1,2011
Combinatorial promoter design for engineering noisy gene expression,"G Balazsi, K Murphy, J Collins",The Febs Journal 274,https://scholar.google.com/scholar?oi=bibs&hl=en&cites=13228975124289277299,1,2007
Phenotypic consequences of promoter-mediated transcriptional noise: Experiment and computational modeling,"G Balazsi, W Blake, M Kohanski, K Murphy, J Collins",APS Meeting Abstracts,https://scholar.google.com/scholar?oi=bibs&hl=en&cites=6394262409515748764,1,2007
Taking the inventory inside single cells,"G Balázsi, JJ Collins","Nature chemical biology 3 (3), 141",https://scholar.google.com/scholar?oi=bibs&hl=en&cites=9819267731434821347,1,2007
The shewanella federation: Functional genomic investigations of dissimilatory metal-reducing Shewanella,"JK Fredrickson, CS Giometti, E Kolker, KH Nealson, JM Tiedje, J Zhou, ...","Contractor-Grantee Workshop III, 50",https://scholar.google.com/scholar?oi=bibs&hl=en&cites=1084620425691887792,1,2005
Tactile stimulation of insoles and balance control in elderly people,"AA Priplata, JB Niemi, JD Harry, LA Lipsitz, JJ Collins","Lancet 362 (9402), 85-85",https://scholar.google.com/scholar?oi=bibs&hl=en&cites=16459177630828180263,1,2003
"Autocatalytic gene expression: in numero quantitative predictions, in vivo stochastic dynamics","FJ Isaacs, J Hasty, CR Cantor, JJ Collins",Preprint,https://scholar.google.com/scholar?oi=bibs&hl=en&cites=14474130497127121351,1,2002
Controlling cardiac arrhythmias: The relevance of nonlinear dynamics,"DJ Christini, JJ Collins, K Hall, L Glass","Handbook of Biological Physics 4, 205-227",https://scholar.google.com/scholar?oi=bibs&hl=en&cites=8697794827608362504,1,2001
Postural control mechanisms in normal and toe-standing,"L Nolan, DC Kerrigan, JJ Collins",,https://scholar.google.com/scholar?oi=bibs&hl=en&cites=6654023954680245810,1,2001
POSTURAL CONTROL AND GAIT DEFICIENCIES IN ELDERLY ADULTS 892,"PE Martin, MD Grabiner, JJ Collins, SP Messier, JA Ashton-Miller","Medicine & Science in Sports & Exercise 28 (5), 150",https://scholar.google.com/scholar?oi=bibs&hl=en&cites=18300206002154709522,1,1996
Quantitative posturography: Age-related changes in postural stability,"JJ Collins, CJ DeLuca, JF Jabre","Journal of Rehabilitation Research and Development 30, 100",https://scholar.google.com/scholar?oi=bibs&hl=en&cites=3715476370013903825,1,1994
Stochastic and chaos analyses of postural sway: A comparative approach,"JJ Collins, MT Rosenstein, CJ De Luca","Journal of Biomechanics 27 (6), 757",https://scholar.google.com/scholar?oi=bibs&hl=en&cites=4225008406428501523,1,1994
Engineering microbial peer pressure,"CW Johnston, JJ Collins","Science 365 (6457), 986-987",,0,2019
