Title,Authors,Platform,Cited_url,Cited_count,Year
Construction of a genetic toggle switch in ,"TS Gardner, CR Cantor, JJ Collins","Nature 403 (6767), 339",https://scholar.google.com/scholar?oi=bibs&hl=en&cites=7098418079648392218,4146,2000
A practical method for calculating largest Lyapunov exponents from small data sets,"MT Rosenstein, JJ Collins, CJ De Luca","Physica D: Nonlinear Phenomena 65 (1-2), 117-134",https://scholar.google.com/scholar?oi=bibs&hl=en&cites=14461756895836231178,3305,1993
Highly efficient reprogramming to pluripotency and directed differentiation of human cells with synthetic modified mRNA,"L Warren, PD Manos, T Ahfeldt, YH Loh, H Li, F Lau, W Ebina, PK Mandal, ...","Cell stem cell 7 (5), 618-630",https://scholar.google.com/scholar?oi=bibs&hl=en&cites=13390849125769756401,2458,2010
Stochasticity in gene expression: from theories to phenotypes,"M Kærn, TC Elston, WJ Blake, JJ Collins","Nature Reviews Genetics 6 (6), 451",https://scholar.google.com/scholar?oi=bibs&hl=en&cites=13779754005980983965,2233,2005
A common mechanism of cellular death induced by bactericidal antibiotics,"MA Kohanski, DJ Dwyer, B Hayete, CA Lawrence, JJ Collins","Cell 130 (5), 797-810",https://scholar.google.com/scholar?oi=bibs&hl=en&cites=2864966001846484824,2006,2007
Noise in eukaryotic gene expression,"WJ Blake, M Kærn, CR Cantor, JJ Collins","Nature 422 (6932), 633",https://scholar.google.com/scholar?oi=bibs&hl=en&cites=6070974557067805801,1626,2003
Large-scale mapping and validation of Escherichia coli transcriptional regulation from a compendium of expression profiles,"JJ Faith, B Hayete, JT Thaden, I Mogno, J Wierzbowski, G Cottarel, ...","PLoS biology 5 (1), e8",https://scholar.google.com/scholar?oi=bibs&hl=en&cites=15434224257857450045,1460,2007
How antibiotics kill bacteria: from targets to networks,"MA Kohanski, DJ Dwyer, JJ Collins","Nature Reviews Microbiology 8 (6), 423",https://scholar.google.com/scholar?oi=bibs&hl=en&cites=14022826127093332488,1376,2010
Inferring genetic networks and identifying compound mode of action via expression profiling,"TS Gardner, D Di Bernardo, D Lorenz, JJ Collins","Science 301 (5629), 102-105",https://scholar.google.com/scholar?oi=bibs&hl=en&cites=12084316055087450453,1295,2003
Open-loop and closed-loop control of posture: a random-walk analysis of center-of-pressure trajectories,"JJ Collins, CJ De Luca","Experimental brain research 95 (2), 308-318",https://scholar.google.com/scholar?oi=bibs&hl=en&cites=7845769072548355205,1274,1993
Gene-expression profiles and transcriptional regulatory pathways that underlie the identity and diversity of mouse tissue macrophages,"EL Gautier, T Shay, J Miller, M Greter, C Jakubzick, S Ivanov, J Helft, ...","Nature immunology 13 (11), 1118","https://scholar.google.com/scholar?oi=bibs&hl=en&cites=16331069732987044480,11757422047225017307",1207,2012
Wisdom of crowds for robust gene network inference,"D Marbach, JC Costello, R Küffner, NM Vega, RJ Prill, DM Camacho, ...","Nature methods 9 (8), 796",https://scholar.google.com/scholar?oi=bibs&hl=en&cites=12728558948013552670,1090,2012
Synthetic biology: applications come of age,"AS Khalil, JJ Collins","Nature Reviews Genetics 11 (5), 367",https://scholar.google.com/scholar?oi=bibs&hl=en&cites=17739250007071191023,1082,2010
The Immunological Genome Project: networks of gene expression in immune cells,"TSP Heng, MW Painter, K Elpek, V Lukacs-Kornek, N Mauermann, ...","Nature immunology 9 (10), 1091",https://scholar.google.com/scholar?oi=bibs&hl=en&cites=11271710436468552519,939,2008
Stochastic resonance without tuning,"JJ Collins, CC Chow, TT Imhoff","Nature 376 (6537), 236",https://scholar.google.com/scholar?oi=bibs&hl=en&cites=10841456991463319930,896,1995
Engineered gene circuits,"J Hasty, D McMillen, JJ Collins","Nature 420 (6912), 224",https://scholar.google.com/scholar?oi=bibs&hl=en&cites=980107789734140492,873,2002
Reverse engineering gene networks using singular value decomposition and robust regression,"MKS Yeung, J Tegnér, JJ Collins","Proceedings of the National Academy of Sciences 99 (9), 6163-6168",https://scholar.google.com/scholar?oi=bibs&hl=en&cites=2522071631169291368,766,2002
Cellular decision making and biological noise: from microbes to mammals,"G Balázsi, A van Oudenaarden, JJ Collins","Cell 144 (6), 910-925",https://scholar.google.com/scholar?oi=bibs&hl=en&cites=2956211602305540283,732,2011
Computational studies of gene regulatory networks: ,"J Hasty, D McMillen, F Isaacs, JJ Collins","Nature Reviews Genetics 2 (4), 268",https://scholar.google.com/scholar?oi=bibs&hl=en&cites=12372702287190322587,726,2001
Noise-based switches and amplifiers for gene expression,"J Hasty, J Pradines, M Dolnik, JJ Collins","Proceedings of the National Academy of Sciences 97 (5), 2075-2080",https://scholar.google.com/scholar?oi=bibs&hl=en&cites=15121979347813568438,686,2000
Programmable cells: interfacing natural and engineered gene networks,"H Kobayashi, M Kaern, M Araki, K Chung, TS Gardner, CR Cantor, ...","Proceedings of the National Academy of Sciences 101 (22), 8414-8419",https://scholar.google.com/scholar?oi=bibs&hl=en&cites=6021370387734269275,665,2004
Dispersing biofilms with engineered enzymatic bacteriophage,"TK Lu, JJ Collins","Proceedings of the National Academy of Sciences 104 (27), 11197-11202",https://scholar.google.com/scholar?oi=bibs&hl=en&cites=4354744807231258168,659,2007
Sublethal antibiotic treatment leads to multidrug resistance via radical-induced mutagenesis,"MA Kohanski, MA DePristo, JJ Collins","Molecular cell 37 (3), 311-320",https://scholar.google.com/scholar?oi=bibs&hl=en&cites=13386671567586221136,657,2010
Biomechanical gait alterations independent of speed in the healthy elderly: evidence for specific limiting impairments,"DC Kerrigan, MK Todd, U Della Croce, LA Lipsitz, JJ Collins","Archives of physical medicine and rehabilitation 79 (3), 317-322",https://scholar.google.com/scholar?oi=bibs&hl=en&cites=978921049015707701,648,1998
"Aging, muscle activity, and balance control: physiologic changes associated with balance impairment","CA Laughton, M Slavin, K Katdare, L Nolan, JF Bean, DC Kerrigan, ...","Gait & posture 18 (2), 101-108",https://scholar.google.com/scholar?oi=bibs&hl=en&cites=11655517908754595645,610,2003
Synthetic gene networks that count,"AE Friedland, TK Lu, X Wang, D Shi, G Church, JJ Collins","science 324 (5931), 1199-1202",https://scholar.google.com/scholar?oi=bibs&hl=en&cites=16172374866270130490,587,2009
Metabolite-enabled eradication of bacterial persisters by aminoglycosides,"KR Allison, MP Brynildsen, JJ Collins","Nature 473 (7346), 216",https://scholar.google.com/scholar?oi=bibs&hl=en&cites=12069547254435401974,577,2011
Aperiodic stochastic resonance in excitable systems,"JJ Collins, CC Chow, TT Imhoff","Physical Review E 52 (4), R3321",https://scholar.google.com/scholar?oi=bibs&hl=en&cites=14845706095870929722,565,1995
Vibrating insoles and balance control in elderly people,"AA Priplata, JB Niemi, JD Harry, LA Lipsitz, JJ Collins","The Lancet 362 (9390), 1123-1124",https://scholar.google.com/scholar?oi=bibs&hl=en&cites=10501770871121629938,562,2003
Coupled nonlinear oscillators and the symmetries of animal gaits,"JJ Collins, IN Stewart","Journal of Nonlinear Science 3 (1), 349-392",https://scholar.google.com/scholar?oi=bibs&hl=en&cites=3269100880684002207,562,1993
Highly efficient Cas9-mediated transcriptional programming,"A Chavez, J Scheiman, S Vora, BW Pruitt, M Tuttle, EPR Iyer, S Lin, ...","Nature methods 12 (4), 326",https://scholar.google.com/scholar?oi=bibs&hl=en&cites=15970315533994916061,560,2015
Phenotypic consequences of promoter-mediated transcriptional noise,"WJ Blake, G Balázsi, MA Kohanski, FJ Isaacs, KF Murphy, Y Kuang, ...","Molecular cell 24 (6), 853-865",https://scholar.google.com/scholar?oi=bibs&hl=en&cites=5179801045617488574,552,2006
Engineered riboregulators enable post-transcriptional control of gene expression,"FJ Isaacs, DJ Dwyer, C Ding, DD Pervouchine, CR Cantor, JJ Collins","Nature biotechnology 22 (7), 841",https://scholar.google.com/scholar?oi=bibs&hl=en&cites=18381561032045328585,538,2004
Reconstruction expansion as a geometry-based framework for choosing proper delay times,"MT Rosenstein, JJ Collins, CJ De Luca","Physica D: Nonlinear Phenomena 73 (1-2), 82-98",https://scholar.google.com/scholar?oi=bibs&hl=en&cites=16292458694674618523,532,1994
Deciphering the transcriptional network of the dendritic cell lineage,"JC Miller, BD Brown, T Shay, EL Gautier, V Jojic, A Cohain, G Pandey, ...","Nature immunology 13 (9), 888",https://scholar.google.com/scholar?oi=bibs&hl=en&cites=7811105121761870603,531,2012
Noise-enhanced tactile sensation.,"JJ Collins, TT Imhoff, P Grigg",Nature,https://scholar.google.com/scholar?oi=bibs&hl=en&cites=16711422889492493215,509,1996
Prediction and measurement of an autoregulatory genetic module,"FJ Isaacs, J Hasty, CR Cantor, JJ Collins","Proceedings of the National Academy of Sciences 100 (13), 7714-7719",https://scholar.google.com/scholar?oi=bibs&hl=en&cites=16767004921801363777,505,2003
Donor cell type can influence the epigenome and differentiation potential of human induced pluripotent stem cells,"K Kim, R Zhao, A Doi, K Ng, J Unternaehrer, P Cahan, H Hongguang, ...","Nature biotechnology 29 (12), 1117",https://scholar.google.com/scholar?oi=bibs&hl=en&cites=7749290318746177334,500,2011
"Diversity-based, model-guided construction of synthetic gene networks with predicted functions","T Ellis, X Wang, JJ Collins","Nature biotechnology 27 (5), 465",https://scholar.google.com/scholar?oi=bibs&hl=en&cites=16379113337143113624,494,2009
Reverse engineering gene networks: integrating genetic perturbations with dynamical modeling,"J Tegner, MKS Yeung, J Hasty, JJ Collins","Proceedings of the National Academy of Sciences 100 (10), 5944-5949",https://scholar.google.com/scholar?oi=bibs&hl=en&cites=11898123151078079192,494,2003
Bacterial charity work leads to population-wide resistance,"HH Lee, MN Molla, CR Cantor, JJ Collins","Nature 467 (7311), 82",https://scholar.google.com/scholar?oi=bibs&hl=en&cites=6187836696249423731,480,2010
Random walking during quiet standing,"JJ Collins, CJ De Luca","Physical review letters 73 (5), 764",https://scholar.google.com/scholar?oi=bibs&hl=en&cites=14077798590976788333,457,1994
Chemogenomic profiling on a genome-wide scale using reverse-engineered gene networks,"D di Bernardo, MJ Thompson, TS Gardner, SE Chobot, EL Eastwood, ...","Nature biotechnology 23 (3), 377",https://scholar.google.com/scholar?oi=bibs&hl=en&cites=17017098775559812164,447,2005
A brief history of synthetic biology,"DE Cameron, CJ Bashor, JJ Collins","Nature Reviews Microbiology 12 (5), 381",https://scholar.google.com/scholar?oi=bibs&hl=en&cites=2081109358389026204,446,2014
Engineered bacteriophage targeting gene networks as adjuvants for antibiotic therapy,"TK Lu, JJ Collins","Proceedings of the National Academy of Sciences 106 (12), 4629-4634",https://scholar.google.com/scholar?oi=bibs&hl=en&cites=17858480423233649860,439,2009
Mistranslation of membrane proteins and two-component system activation trigger antibiotic-mediated cell death,"MA Kohanski, DJ Dwyer, J Wierzbowski, G Cottarel, JJ Collins","Cell 135 (4), 679-690",https://scholar.google.com/scholar?oi=bibs&hl=en&cites=6783301156889523868,419,2008
Silver enhances antibiotic activity against gram-negative bacteria,"JR Morones-Ramirez, JA Winkler, CS Spina, JJ Collins","Science translational medicine 5 (190), 190ra81-190ra81",https://scholar.google.com/scholar?oi=bibs&hl=en&cites=3588495447293049007,416,2013
MicroRNAs as modulators of smoking-induced gene expression changes in human airway epithelium,"F Schembri, S Sridhar, C Perdomo, AM Gustafson, X Zhang, A Ergun, J Lu, ...","Proceedings of the National Academy of Sciences 106 (7), 2319-2324",https://scholar.google.com/scholar?oi=bibs&hl=en&cites=5507825145288833826,411,2009
The effects of visual input on open-loop and closed-loop postural control mechanisms,"JJ Collins, CJ De Luca","Experimental Brain Research 103 (1), 151-163",https://scholar.google.com/scholar?oi=bibs&hl=en&cites=14070049919114880683,401,1995
Noise-enhanced information transmission in rat SA1 cutaneous mechanoreceptors via aperiodic stochastic resonance,"JJ Collins, TT Imhoff, P Grigg","Journal of Neurophysiology 76 (1), 642-645",https://scholar.google.com/scholar?oi=bibs&hl=en&cites=2829089824667616592,400,1996
Gyrase inhibitors induce an oxidative damage cellular death pathway in Escherichia coli,"DJ Dwyer, MA Kohanski, B Hayete, JJ Collins",Molecular systems biology 3 (1),https://scholar.google.com/scholar?oi=bibs&hl=en&cites=14316134466435622885,395,2007
RNA synthetic biology,"FJ Isaacs, DJ Dwyer, JJ Collins","Nature biotechnology 24 (5), 545",https://scholar.google.com/scholar?oi=bibs&hl=en&cites=4791213885737567644,392,2006
A bottom-up approach to gene regulation,"NJ Guido, X Wang, D Adalsteinsson, D McMillen, J Hasty, CR Cantor, ...","Nature 439 (7078), 856",https://scholar.google.com/scholar?oi=bibs&hl=en&cites=4976912133576608108,390,2006
Symmetry in locomotor central pattern generators and animal gaits,"M Golubitsky, I Stewart, PL Buono, JJ Collins","Nature 401 (6754), 693",https://scholar.google.com/scholar?oi=bibs&hl=en&cites=5715491113036090129,390,1999
Nucleic acid detection with CRISPR-Cas13a/C2c2,"JS Gootenberg, OO Abudayyeh, JW Lee, P Essletzbichler, AJ Dy, J Joung, ...","Science 356 (6336), 438-442",https://scholar.google.com/scholar?oi=bibs&hl=en&cites=2883760243285581214,380,2017
Next-generation synthetic gene networks,"TK Lu, AS Khalil, JJ Collins","Nature biotechnology 27 (12), 1139",https://scholar.google.com/scholar?oi=bibs&hl=en&cites=11536479955426835258,375,2009
Antibiotics induce redox-related physiological alterations as part of their lethality,"DJ Dwyer, PA Belenky, JH Yang, IC MacDonald, JD Martell, N Takahashi, ...","Proceedings of the National Academy of Sciences 111 (20), E2100-E2109",https://scholar.google.com/scholar?oi=bibs&hl=en&cites=13655615340611993490,370,2014
Synthetic biology moving into the clinic,"WC Ruder, T Lu, JJ Collins","Science 333 (6047), 1248-1252",https://scholar.google.com/scholar?oi=bibs&hl=en&cites=7838745943584348027,367,2011
A community effort to assess and improve drug sensitivity prediction algorithms,"JC Costello, LM Heiser, E Georgii, M Gönen, MP Menden, NJ Wang, ...","Nature biotechnology 32 (12), 1202",https://scholar.google.com/scholar?oi=bibs&hl=en&cites=14914623498842388342,365,2014
"Rapid, low-cost detection of Zika virus using programmable biomolecular components","K Pardee, AA Green, MK Takahashi, D Braff, G Lambert, JW Lee, ...","Cell 165 (5), 1255-1266",https://scholar.google.com/scholar?oi=bibs&hl=en&cites=18426325095978479970,362,2016
Noise-enhanced human balance control,"A Priplata, J Niemi, M Salen, J Harry, LA Lipsitz, JJ Collins","Physical review letters 89 (23), 238101",https://scholar.google.com/scholar?oi=bibs&hl=en&cites=90932220488972716,352,2002
Antibiotic treatment expands the resistance reservoir and ecological network of the phage metagenome,"SR Modi, HH Lee, CS Spina, JJ Collins","Nature 499 (7457), 219",https://scholar.google.com/scholar?oi=bibs&hl=en&cites=6195063440223577579,346,2013
Aperiodic stochastic resonance,"JJ Collins, CC Chow, AC Capela, TT Imhoff","Physical Review E 54 (5), 5575",https://scholar.google.com/scholar?oi=bibs&hl=en&cites=15916262442674023657,345,1996
Noise‐enhanced balance control in patients with diabetes and patients with stroke,"AA Priplata, BL Patritti, JB Niemi, R Hughes, DC Gravelle, LA Lipsitz, ...","Annals of neurology 59 (1), 4-12",https://scholar.google.com/scholar?oi=bibs&hl=en&cites=9097093108192072195,343,2006
Age-related changes in open-loop and closed-loop postural control mechanisms,"JJ Collins, CJ De Luca, A Burrows, LA Lipsitz","Experimental brain research 104 (3), 480-492",https://scholar.google.com/scholar?oi=bibs&hl=en&cites=4181617063781476722,339,1995
CellNet: network biology applied to stem cell engineering,"P Cahan, H Li, SA Morris, EL Da Rocha, GQ Daley, JJ Collins","Cell 158 (4), 903-915",https://scholar.google.com/scholar?oi=bibs&hl=en&cites=17072294575423953763,338,2014
Toehold switches: de-novo-designed regulators of gene expression,"AA Green, PA Silver, JJ Collins, P Yin","Cell 159 (4), 925-939",https://scholar.google.com/scholar?oi=bibs&hl=en&cites=3694515226763031060,336,2014
based synthetic gene networks,"K Pardee, AA Green, T Ferrante, DE Cameron, A DaleyKeyser, P Yin, ...","Cell 159 (4), 940-954","https://scholar.google.com/scholar?oi=bibs&hl=en&cites=16408571583688769262,6315560557671410367",336,2014
Role of reactive oxygen species in antibiotic action and resistance,"DJ Dwyer, MA Kohanski, JJ Collins","Current opinion in microbiology 12 (5), 482-489",https://scholar.google.com/scholar?oi=bibs&hl=en&cites=11944249487888410529,332,2009
Reduced hip extension during walking: healthy elderly and fallers versus young adults,"DC Kerrigan, LW Lee, JJ Collins, PO Riley, LA Lipsitz","Archives of physical medicine and rehabilitation 82 (1), 26-30",https://scholar.google.com/scholar?oi=bibs&hl=en&cites=13316037766145134640,327,2001
Synchronizing genetic relaxation oscillators by intercell signaling,"D McMillen, N Kopell, J Hasty, JJ Collins","Proceedings of the National Academy of Sciences 99 (2), 679-684",https://scholar.google.com/scholar?oi=bibs&hl=en&cites=11461506709088769893,325,2002
Antibiotics and the gut microbiota,"SR Modi, JJ Collins, DA Relman","The Journal of clinical investigation 124 (10), 4212-4218",https://scholar.google.com/scholar?oi=bibs&hl=en&cites=17657318723991177071,322,2014
Designer gene networks: Towards fundamental cellular control,"J Hasty, F Isaacs, M Dolnik, D McMillen, JJ Collins","Chaos: An Interdisciplinary Journal of Nonlinear Science 11 (1), 207-220",https://scholar.google.com/scholar?oi=bibs&hl=en&cites=14097124557327298257,319,2001
Oxidation of the guanine nucleotide pool underlies cell death by bactericidal antibiotics,"JJ Foti, B Devadoss, JA Winkler, JJ Collins, GC Walker","Science 336 (6079), 315-319",https://scholar.google.com/scholar?oi=bibs&hl=en&cites=9023612240829569186,316,2012
Hard-wired central pattern generators for quadrupedal locomotion,"JJ Collins, SA Richmond","Biological Cybernetics 71 (5), 375-385",https://scholar.google.com/scholar?oi=bibs&hl=en&cites=15401712489896605700,315,1994
Reprogramming of T cells from human peripheral blood,"YH Loh, O Hartung, H Li, C Guo, JM Sahalie, PD Manos, A Urbach, ...","Cell stem cell 7 (1), 15-19",https://scholar.google.com/scholar?oi=bibs&hl=en&cites=11565203895190747888,308,2010
Noise in human muscle spindles,"P Cordo, JT Inglis, S Verschueren, JJ Collins, DM Merfeld, S Rosenblum, ...","Nature 383 (6603), 769",https://scholar.google.com/scholar?oi=bibs&hl=en&cites=14437708206774773317,305,1996
Contributions of microbiome and mechanical deformation to intestinal bacterial overgrowth and inflammation in a human gut-on-a-chip,"HJ Kim, H Li, JJ Collins, DE Ingber","Proceedings of the National Academy of Sciences 113 (1), E7-E15",https://scholar.google.com/scholar?oi=bibs&hl=en&cites=7361025277469836448,302,2016
Transcriptional profiling of stroma from inflamed and resting lymph nodes defines immunological hallmarks,"D Malhotra, AL Fletcher, J Astarita, V Lukacs-Kornek, P Tayalia, ...","Nature immunology 13 (5), 499",https://scholar.google.com/scholar?oi=bibs&hl=en&cites=14382957716443953727,299,2012
A tunable genetic switch based on RNAi and repressor proteins for regulating gene expression in mammalian cells,"TL Deans, CR Cantor, JJ Collins","Cell 130 (2), 363-372",https://scholar.google.com/scholar?oi=bibs&hl=en&cites=8280874781876091728,298,2007
Signaling-mediated bacterial persister formation,"NM Vega, KR Allison, AS Khalil, JJ Collins","Nature chemical biology 8 (5), 431",https://scholar.google.com/scholar?oi=bibs&hl=en&cites=6867213976437264583,296,2012
Effects of colored noise on stochastic resonance in sensory neurons,"D Nozaki, DJ Mar, P Grigg, JJ Collins","Physical Review Letters 82 (11), 2402",https://scholar.google.com/scholar?oi=bibs&hl=en&cites=5808933424745763148,292,1999
The redundant nature of locomotor optimization laws,JJ Collins,"Journal of biomechanics 28 (3), 251-267",https://scholar.google.com/scholar?oi=bibs&hl=en&cites=1059717677698859314,278,1995
A synthetic biology framework for programming eukaryotic transcription functions,"AS Khalil, TK Lu, CJ Bashor, CL Ramirez, NC Pyenson, JK Joung, ...","Cell 150 (3), 647-658",https://scholar.google.com/scholar?oi=bibs&hl=en&cites=9448218470714144156,270,2012
Oncogenic NRAS signaling differentially regulates survival and proliferation in melanoma,"LN Kwong, JC Costello, H Liu, S Jiang, TL Helms, AE Langsdorf, ...","Nature medicine 18 (10), 1503",https://scholar.google.com/scholar?oi=bibs&hl=en&cites=6367300507211205515,268,2012
Microbial persistence and the road to drug resistance,"NR Cohen, MA Lobritz, JJ Collins","Cell host & microbe 13 (6), 632-642",https://scholar.google.com/scholar?oi=bibs&hl=en&cites=2500883203904929732,257,2013
Deconstructing transcriptional heterogeneity in pluripotent stem cells,"RM Kumar, P Cahan, AK Shalek, R Satija, AJ DaleyKeyser, H Li, J Zhang, ...","Nature 516 (7529), 56",https://scholar.google.com/scholar?oi=bibs&hl=en&cites=5750797665335012619,253,2014
Bactericidal antibiotics induce mitochondrial dysfunction and oxidative damage in mammalian cells,"S Kalghatgi, CS Spina, JC Costello, M Liesa, JR Morones-Ramirez, ...","Science translational medicine 5 (192), 192ra85-192ra85",https://scholar.google.com/scholar?oi=bibs&hl=en&cites=12862288930557728213,252,2013
The engineering of gene regulatory networks,"M Kaern, WJ Blake, JJ Collins","Annual review of biomedical engineering 5 (1), 179-206",https://scholar.google.com/scholar?oi=bibs&hl=en&cites=8295072255312702744,249,2003
A modular network for legged locomotion,"M Golubitsky, I Stewart, PL Buono, JJ Collins","Physica D: Nonlinear Phenomena 115 (1-2), 56-72",https://scholar.google.com/scholar?oi=bibs&hl=en&cites=14804448765659908171,248,1998
Programmable bacteria detect and record an environmental signal in the mammalian gut,"JW Kotula, SJ Kerns, LA Shaket, L Siraj, JJ Collins, JC Way, PA Silver","Proceedings of the National Academy of Sciences 111 (13), 4838-4843",https://scholar.google.com/scholar?oi=bibs&hl=en&cites=14291226490700223170,246,2014
Antibiotic efficacy is linked to bacterial cellular respiration,"MA Lobritz, P Belenky, CBM Porter, A Gutierrez, JH Yang, EG Schwarz, ...","Proceedings of the National Academy of Sciences 112 (27), 8173-8180",https://scholar.google.com/scholar?oi=bibs&hl=en&cites=6969309277420882642,244,2015
Antibiotic-induced bacterial cell death exhibits physiological and biochemical hallmarks of apoptosis,"DJ Dwyer, DM Camacho, MA Kohanski, JM Callura, JJ Collins","Molecular cell 46 (5), 561-572",https://scholar.google.com/scholar?oi=bibs&hl=en&cites=499632800067442992,243,2012
Open-loop and closed-loop postural control mechanisms in Parkinson's disease: increased mediolateral activity during quiet standing,"SL Mitchell, JJ Collin, CJ De Luca, A Burrows, LA Lipsitz","Neuroscience letters 197 (2), 133-136",https://scholar.google.com/scholar?oi=bibs&hl=en&cites=10992706425887678301,238,1995
Dynamic control of cardiac alternans,"K Hall, DJ Christini, M Tremblay, JJ Collins, L Glass, J Billette","Physical Review Letters 78 (23), 4518",https://scholar.google.com/scholar?oi=bibs&hl=en&cites=13556550739784762738,234,1997
"Multiplexed and portable nucleic acid detection platform with Cas13, Cas12a, and Csm6","JS Gootenberg, OO Abudayyeh, MJ Kellner, J Joung, JJ Collins, F Zhang","Science 360 (6387), 439-444",https://scholar.google.com/scholar?oi=bibs&hl=en&cites=2991839221215639547,233,2018
Life-support system benefits from noise,"B Suki, AM Alencar, MK Sujeer, KR Lutchen, JJ Collins, JS Andrade Jr, ...","Nature 393 (6681), 127",https://scholar.google.com/scholar?oi=bibs&hl=en&cites=4241723780018945863,227,1998
Bone marrow–on–a–chip replicates hematopoietic niche physiology ,"Y Torisawa, CS Spina, T Mammoto, A Mammoto, JC Weaver, T Tat, ...","Nature methods 11 (6), 663",https://scholar.google.com/scholar?oi=bibs&hl=en&cites=16058300288749706713,224,2014
Syntrophic exchange in synthetic microbial communities,"MT Mee, JJ Collins, GM Church, HH Wang","Proceedings of the National Academy of Sciences 111 (20), E2149-E2156",https://scholar.google.com/scholar?oi=bibs&hl=en&cites=10302369023012022811,219,2014
Hexapodal gaits and coupled nonlinear oscillator models,"JJ Collins, I Stewart","Biological cybernetics 68 (4), 287-298",https://scholar.google.com/scholar?oi=bibs&hl=en&cites=15744160957807246160,216,1993
Synthetic gene network for entraining and amplifying cellular oscillations,"J Hasty, M Dolnik, V Rottschäfer, JJ Collins","Physical Review Letters 88 (14), 148101",https://scholar.google.com/scholar?oi=bibs&hl=en&cites=2521981728830960966,213,2002
Potentiating antibacterial activity by predictably enhancing endogenous microbial ROS production,"MP Brynildsen, JA Winkler, CS Spina, IC MacDonald, JJ Collins","Nature biotechnology 31 (2), 160",https://scholar.google.com/scholar?oi=bibs&hl=en&cites=13242249735609597159,211,2013
Noise-mediated enhancements and decrements in human tactile sensation,"JJ Collins, TT Imhoff, P Grigg","Physical Review E 56 (1), 923",https://scholar.google.com/scholar?oi=bibs&hl=en&cites=1307297971929946341,211,1997
Engineering life: building a fab for biology,Bio FAB Group,"Scientific American 294 (6), 44-51",https://scholar.google.com/scholar?oi=bibs&hl=en&cites=15451575886886944438,206,2006
