Title,Authors,Platform,Cited_url,Cited_count,Year
A lithium–oxygen battery based on lithium superoxide,"J Lu, YJ Lee, X Luo, KC Lau, M Asadi, HH Wang, S Brombosz, J Wen, ...","Nature 529 (7586), 377",https://scholar.google.com/scholar?oi=bibs&hl=en&cites=5758065980712563426,391,2016
Disproportionation in Li–O2 batteries based on a large surface area carbon cathode,"D Zhai, HH Wang, J Yang, KC Lau, K Li, K Amine, LA Curtiss","Journal of the American Chemical Society 135 (41), 15364-15372",https://scholar.google.com/scholar?oi=bibs&hl=en&cites=2054645680824406986,226,2013
Evidence for lithium superoxide-like species in the discharge product of a Li–O 2 battery,"J Yang, D Zhai, HH Wang, KC Lau, JA Schlueter, P Du, DJ Myers, YK Sun, ...","Physical Chemistry Chemical Physics 15 (11), 3764-3771",https://scholar.google.com/scholar?oi=bibs&hl=en&cites=15751075287084189233,175,2013
Carbon coating to suppress the reduction decomposition of electrolyte on the Li4Ti5O12 electrode,"YB He, F Ning, B Li, QS Song, W Lv, H Du, D Zhai, F Su, QH Yang, F Kang","Journal of Power Sources 202, 253-261",https://scholar.google.com/scholar?oi=bibs&hl=en&cites=10927957602583470872,128,2012
Raman Evidence for Late Stage Disproportionation in a Li–O,"D Zhai, HH Wang, KC Lau, J Gao, PC Redfern, F Kang, B Li, ...","The journal of physical chemistry letters 5 (15), 2705-2710",https://scholar.google.com/scholar?oi=bibs&hl=en&cites=13744269460336243519,115,2014
Porous graphitic carbons prepared by combining chemical activation with catalytic graphitization,"D Zhai, H Du, B Li, Y Zhu, F Kang","Carbon 49 (2), 725-729",https://scholar.google.com/scholar?oi=bibs&hl=en&cites=6759279440131062709,102,2011
Interfacial Effects on Lithium Superoxide Disproportionation in Li-O,"D Zhai, KC Lau, HH Wang, J Wen, DJ Miller, J Lu, F Kang, B Li, W Yang, ...","Nano letters 15 (2), 1041-1046",https://scholar.google.com/scholar?oi=bibs&hl=en&cites=9410943289036970138,71,2015
The preparation of graphene decorated with manganese dioxide nanoparticles by electrostatic adsorption for use in supercapacitors,"D Zhai, B Li, H Du, G Gao, L Gan, Y He, Q Yang, F Kang","Carbon 50 (14), 5034-5043",https://scholar.google.com/scholar?oi=bibs&hl=en&cites=2490257978984266398,47,2012
Preparation of mesophase-pitch-based activated carbons for electric double layer capacitors with high energy density,"D Zhai, B Li, F Kang, H Du, C Xu","Microporous and Mesoporous Materials 130 (1-3), 224-228",https://scholar.google.com/scholar?oi=bibs&hl=en&cites=4797864577416153482,45,2010
"A study on charge storage mechanism of α-MnO2 by occupying tunnels with metal cations (Ba2+, K+)","D Zhai, B Li, C Xu, H Du, Y He, C Wei, F Kang","Journal of Power Sources 196 (18), 7860-7867",https://scholar.google.com/scholar?oi=bibs&hl=en&cites=6128186677463310624,40,2011
Dendrite-free potassium–oxygen battery based on a liquid alloy anode,"W Yu, KC Lau, Y Lei, R Liu, L Qin, W Yang, B Li, LA Curtiss, D Zhai, ...","ACS applied materials & interfaces 9 (37), 31871-31878",https://scholar.google.com/scholar?oi=bibs&hl=en&cites=3907749359899507822,28,2017
Ce–O Covalence in Silicate Oxyapatites and Its Influence on Luminescence Dynamics,"D Zhai, L Ning, Y Huang, G Liu","The Journal of Physical Chemistry C 118 (29), 16051-16059",https://scholar.google.com/scholar?oi=bibs&hl=en&cites=7663512248065419127,24,2014
The effect of pre-carbonization of mesophase pitch-based activated carbons on their electrochemical performance for electric double-layer capacitors,"D Zhai, B Li, H Du, G Wang, F Kang","Journal of Solid State Electrochemistry 15 (4), 787-794",https://scholar.google.com/scholar?oi=bibs&hl=en&cites=14755328121720702040,23,2011
Effects of TiO2 crystal structure on the performance of Li4Ti5O12 anode material,"F Ning, YB He, B Li, H Du, D Zhai, F Kang","Journal of Alloys and Compounds 513, 524-529",https://scholar.google.com/scholar?oi=bibs&hl=en&cites=4138241801800917808,22,2012
A high-performance lithium ion oxygen battery consisting of Li2O2 cathode and lithiated aluminum anode with nafion membrane for reduced O2 crossover,"L Qin, D Zhai, W Lv, W Yang, J Huang, S Yao, J Cui, WG Chong, ...","Nano energy 40, 258-263",https://scholar.google.com/scholar?oi=bibs&hl=en&cites=1550289168837145903,21,2017
Mesoporous Cr 2 O 3 nanotubes as an efficient catalyst for Li–O 2 batteries with low charge potential and enhanced cyclic performance,"XZ Zhang, D Han, YB He, DY Zhai, D Liu, H Du, B Li, F Kang","Journal of Materials Chemistry A 4 (20), 7727-7735",https://scholar.google.com/scholar?oi=bibs&hl=en&cites=16080216401557862802,20,2016
Exploring Stability of Nonaqueous Electrolytes for Potassium-Ion Batteries,"Y Lei, L Qin, R Liu, KC Lau, Y Wu, D Zhai, B Li, F Kang","ACS Applied Energy Materials 1 (5), 1828-1833",https://scholar.google.com/scholar?oi=bibs&hl=en&cites=17685156798685466669,18,2018
Achieving Low Overpotential Lithium–Oxygen Batteries by Exploiting a New Electrolyte Based on ,"R Liu, Y Lei, W Yu, H Wang, L Qin, D Han, W Yang, D Zhou, Y He, D Zhai, ...","ACS Energy Letters 2 (2), 313-318",https://scholar.google.com/scholar?oi=bibs&hl=en&cites=16356527239509236143,15,2017
The effect of potassium impurities deliberately introduced into activated carbon cathodes on the performance of lithium–oxygen batteries,"D Zhai, KC Lau, HH Wang, J Wen, DJ Miller, F Kang, B Li, K Zavadil, ...","ChemSusChem 8 (24), 4235-4241",https://scholar.google.com/scholar?oi=bibs&hl=en&cites=11928611026497658430,12,2015
Room-temperature liquid metal-based anodes for high-energy potassium-based electrochemical devices,"L Qin, W Yang, W Lv, L Liu, Y Lei, W Yu, F Kang, JK Kim, D Zhai, QH Yang","Chemical communications 54 (58), 8032-8035",https://scholar.google.com/scholar?oi=bibs&hl=en&cites=6938538376332779163,11,2018
Graphene-directed formation of a nitrogen-doped porous carbon sheet with high catalytic performance for the oxygen reduction reaction,"L Qin, Y Yuan, W Wei, W Lv, S Niu, YB He, D Zhai, F Kang, JK Kim, ...","The Journal of Physical Chemistry C 122 (25), 13508-13514",https://scholar.google.com/scholar?oi=bibs&hl=en&cites=8957509247184325397,11,2017
Dense graphene monolith oxygen cathodes for ultrahigh volumetric energy densities,"L Qin, D Zhai, W Lv, W Wei, W Yu, Y Lei, W Yang, J Huang, S Yao, J Cui, ...","Energy Storage Materials 9, 134-139",https://scholar.google.com/scholar?oi=bibs&hl=en&cites=6153784157075230778,10,2017
A soluble phenolic mediator contributing to enhanced discharge capacity and low charge overpotential for lithium-oxygen batteries,"W Yu, W Yang, R Liu, L Qin, Y Lei, L Liu, D Zhai, B Li, F Kang","Electrochemistry Communications 79, 68-72",https://scholar.google.com/scholar?oi=bibs&hl=en&cites=11005779181788739608,10,2017
Oxygen-enriched carbon nanotubes as a bifunctional catalyst promote the oxygen reduction/evolution reactions in Li-O2 batteries,"L Qin, W Lv, W Wei, F Kang, D Zhai, QH Yang","Carbon 141, 561-567",https://scholar.google.com/scholar?oi=bibs&hl=en&cites=3884292626403649421,8,2019
Investigations of Si thin films as anode of lithium-ion batteries,"Q Wu, B Shi, J Bareño, Y Liu, VA Maroni, D Zhai, DW Dees, W Lu","ACS applied materials & interfaces 10 (4), 3487-3494",https://scholar.google.com/scholar?oi=bibs&hl=en&cites=12511438435009536213,8,2018
Molecular Sieve Induced Solution Growth of Li,"W Yu, H Wang, J Hu, W Yang, L Qin, R Liu, B Li, D Zhai, F Kang","ACS applied materials & interfaces 10 (9), 7989-7995",https://scholar.google.com/scholar?oi=bibs&hl=en&cites=17825054161811192397,7,2018
Dielectric response on the critical breakdown field in ZnO varistors,"J Li, B Li, D Zhai, S Li, MA Alim","Journal of Physics D: Applied Physics 39 (23), 4969",https://scholar.google.com/scholar?oi=bibs&hl=en&cites=11519194495091683490,6,2006
Capillary Encapsulation of Metallic Potassium in Aligned Carbon Nanotubes for Use as Stable Potassium Metal Anodes,"L Qin, Y Lei, H Wang, J Dong, Y Wu, D Zhai, F Kang, Y Tao, QH Yang","Advanced Energy Materials, 1901427",https://scholar.google.com/scholar?oi=bibs&hl=en&cites=1760568075896804163,5,2019
"Synthesis, Characterization and Electrochemical Performance of Manganese Dioxide in a Quaternary Microemulsion: the Role of the Co-surfactant and Water","B Li, G Gao, D Zhai, C Wei, Y He, H Du, F Kang","Int. J. Electrochem. Sci 8, 8740-8751",https://scholar.google.com/scholar?oi=bibs&hl=en&cites=13746894503073333145,4,2013
Unveiling the influence of electrode/electrolyte interface on the capacity fading for typical graphite-based potassium-ion batteries,"Y Lei, D Han, J Dong, L Qin, X Li, D Zhai, B Li, Y Wu, F Kang","Energy Storage Materials 24, 319-328",https://scholar.google.com/scholar?oi=bibs&hl=en&cites=1875953618455497736,1,2020
Controllable Electrochemical Fabrication of KO,"W Yu, H Wang, L Qin, J Hu, L Liu, B Li, D Zhai, F Kang","ACS applied materials & interfaces 10 (20), 17156-17166",https://scholar.google.com/scholar?oi=bibs&hl=en&cites=9908813763934750643,1,2018
Influence of the KOH activation of carbon nanotubes on their electrochemical behavior in lithium-air batteries,"H Wang, L Qin, Y Lei, W Yu, R Liu, W Lu, D Zhai, Q Yang","Carbon 100 (110), 519",https://scholar.google.com/scholar?oi=bibs&hl=en&cites=2945627787548693874,1,2016
Correlation Between Microstructure and Potassium Storage Behavior in Reduced Graphene Oxide Materials,"Y Chen, L Qin, Y Lei, X Li, J Dong, D Zhai, B Li, F Kang",ACS applied materials & interfaces,,0,2019
Artificial Solid‐Electrolyte Interphase Enabled High‐Capacity and Stable Cycling Potassium Metal Batteries,"H Wang, J Hu, J Dong, KC Lau, L Qin, Y Lei, B Li, D Zhai, Y Wu, F Kang",Advanced Energy Materials,,0,2019
Localized High‐Concentration Electrolytes Boost Potassium Storage in High‐Loading Graphite,"L Qin, N Xiao, J Zheng, Y Lei, D Zhai, Y Wu",Advanced Energy Materials,,0,2019
Utilizing an autogenously protective atmosphere to synthesize a Prussian white cathode with ultrahigh capacity-retention for potassium-ion batteries,"J Dong, Y Lei, D Han, H Wang, D Zhai, B Li, F Kang","Chemical Communications 55 (83), 12555-12558",,0,2019
Tuning hybrid liquid/solid electrolytes by lowering Li salt concentration for lithium batteries,"W Yang, QD Wang, Y Lei, ZP Wan, L Qin, W Yu, RL Liu, DY Zhai, H Li, ...","Chinese Physics B 27 (6), 068201",,0,2018
Mesoporous Cr₂O₃ nanotubes as an efficient catalyst for Li–O₂ batteries with low charge potential and enhanced cyclic performance,"XZ Zhang, D Han, YB He, DY Zhai, D Liu, H Du, B Li, F Kang",Journal of materials chemistry A,,0,2016
The effect of the microstructure of mesophase-pitch-based activated carbons on their electrochemical performance for electric double layer capacitors,"B Li, G Wang, D Zhai, F Kang","Carbon 13 (49), 4609",,0,2011
