Title,Authors,Platform,Cited_url,Cited_count,Year
Advanced asymmetric supercapacitors based on Ni (OH) 2/graphene and porous graphene electrodes with high energy density,"J Yan, Z Fan, W Sun, G Ning, T Wei, Q Zhang, R Zhang, L Zhi, F Wei","Advanced Functional Materials 22 (12), 2632-2641",https://scholar.google.com/scholar?oi=bibs&hl=en&cites=13402419440876995222,1434,2012
A Three‐Dimensional Carbon Nanotube/Graphene Sandwich and Its Application as Electrode in Supercapacitors,"Z Fan, J Yan, L Zhi, Q Zhang, T Wei, J Feng, M Zhang, W Qian, F Wei","Advanced Materials 22 (33), 3723-3728",https://scholar.google.com/scholar?oi=bibs&hl=en&cites=10205961161144001078,1139,2010
Toward Safe Lithium Metal Anode in Rechargeable Batteries: A Review,"XB Cheng, R Zhang, CZ Zhao, Q Zhang","Chemical Reviews 117 (15), 10403-10473",https://scholar.google.com/scholar?oi=bibs&hl=en&cites=7190861991392541061,1001,2017
Scalable synthesis of hierarchically structured carbon nanotube–graphene fibres for capacitive energy storage,"D Yu, K Goh, H Wang, L Wei, W Jiang, Q Zhang, L Dai, Y Chen","Nature nanotechnology 9 (7), 555",https://scholar.google.com/scholar?oi=bibs&hl=en&cites=16126463803172831669,917,2014
A review of solid electrolyte interphases on lithium metal anode,"XB Cheng, R Zhang, CZ Zhao, F Wei, JG Zhang, Q Zhang","Advanced Science 3 (3), 1500213",https://scholar.google.com/scholar?oi=bibs&hl=en&cites=17694134102888141651,614,2016
Powering lithium–sulfur battery performance by propelling polysulfide redox at sulfiphilic hosts,"Z Yuan, HJ Peng, TZ Hou, JQ Huang, CM Chen, DW Wang, XB Cheng, ...","Nano letters 16 (1), 519-527",https://scholar.google.com/scholar?oi=bibs&hl=en&cites=15788226088342434578,592,2016
Highly efficient metal-free growth of nitrogen-doped single-walled carbon nanotubes on plasma-etched substrates for oxygen reduction,"D Yu, Q Zhang, L Dai","Journal of the American Chemical Society 132 (43), 15127-15129",https://scholar.google.com/scholar?oi=bibs&hl=en&cites=1364597831153663574,532,2010
Review on High‐Loading and High‐Energy Lithium–Sulfur Batteries,"HJ Peng, JQ Huang, XB Cheng, Q Zhang","Advanced Energy Materials 7 (24), 1700260",https://scholar.google.com/scholar?oi=bibs&hl=en&cites=3410442864910758814,525,2017
Nanostructured metal oxides and sulfides for lithium–sulfur batteries,"X Liu, JQ Huang, Q Zhang, L Mai","Advanced materials 29 (20), 1601759",https://scholar.google.com/scholar?oi=bibs&hl=en&cites=14545140190105319030,517,2017
"The Road for Nanomaterials Industry: A Review of Carbon Nanotube Production, Post‐Treatment, and Bulk Applications for Composites and Energy Storage","Q Zhang, JQ Huang, WZ Qian, YY Zhang, F Wei","Small 9 (8), 1237-1265",https://scholar.google.com/scholar?oi=bibs&hl=en&cites=16023740528282964825,510,2013
Unstacked double-layer templated graphene for high-rate lithium-sulphur batteries,"MQ Zhao, Q Zhang, JQ Huang, GL Tian, JQ Nie, HJ Peng, F Wei","Nature communications 5, 3410",https://scholar.google.com/scholar?oi=bibs&hl=en&cites=9055541563825805995,506,2014
Fluoroethylene carbonate additives to render uniform Li deposits in lithium metal batteries,"XQ Zhang, XB Cheng, X Chen, C Yan, Q Zhang","Advanced Functional Materials 27 (10), 1605989",https://scholar.google.com/scholar?oi=bibs&hl=en&cites=2935496987294386194,444,2017
Nitrogen‐Doped Graphene/Carbon Nanotube Hybrids: In Situ Formation on Bifunctional Catalysts and Their Superior Electrocatalytic Activity for Oxygen Evolution/Reduction Reaction,"GL Tian, MQ Zhao, D Yu, XY Kong, JQ Huang, Q Zhang, F Wei","Small 10 (11), 2251-2259",https://scholar.google.com/scholar?oi=bibs&hl=en&cites=1744040966533406048,443,2014
Ionic shield for polysulfides towards highly-stable lithium–sulfur batteries,"JQ Huang, Q Zhang, HJ Peng, XY Liu, WZ Qian, F Wei","Energy & Environmental Science 7 (1), 347-353",https://scholar.google.com/scholar?oi=bibs&hl=en&cites=10615205144010523289,441,2014
Graphene/single-walled carbon nanotube hybrids: one-step catalytic growth and applications for high-rate Li–S batteries,"MQ Zhao, XF Liu, Q Zhang, GL Tian, JQ Huang, W Zhu, F Wei","ACS nano 6 (12), 10759-10769",https://scholar.google.com/scholar?oi=bibs&hl=en&cites=2485661391876346912,430,2012
Nitrogen‐Doped Aligned Carbon Nanotube/Graphene Sandwiches: Facile Catalytic Growth on Bifunctional Natural Catalysts and Their Applications as Scaffolds for High‐Rate Lithium …,"C Tang, Q Zhang, MQ Zhao, JQ Huang, XB Cheng, GL Tian, HJ Peng, ...","Advanced Materials 26 (35), 6100-6105",https://scholar.google.com/scholar?oi=bibs&hl=en&cites=2824853542613559921,418,2014
Permselective Graphene Oxide Membrane for Highly Stable and Anti-Self-Discharge Lithium–Sulfur Batteries,"JQ Huang, TZ Zhuang, Q Zhang, HJ Peng, CM Chen, F Wei","ACS nano 9 (3), 3002-3011",https://scholar.google.com/scholar?oi=bibs&hl=en&cites=7074990320790179306,417,2015
Dendrite‐Free Lithium Deposition Induced by Uniformly Distributed Lithium Ions for Efficient Lithium Metal Batteries,"XB Cheng, TZ Hou, R Zhang, HJ Peng, CZ Zhao, JQ Huang, Q Zhang","Advanced Materials 28 (15), 2888-2895",https://scholar.google.com/scholar?oi=bibs&hl=en&cites=5627757433769519488,413,2016
"Hierarchical nanocomposites derived from nanocarbons and layered double hydroxides‐properties, synthesis, and applications","MQ Zhao, Q Zhang, JQ Huang, F Wei","Advanced Functional Materials 22 (4), 675-694",https://scholar.google.com/scholar?oi=bibs&hl=en&cites=5551421297817907160,413,2012
Hierarchical NiMn layered double hydroxide/carbon nanotubes architecture with superb energy density for flexible supercapacitors,"J Zhao, J Chen, S Xu, M Shao, Q Zhang, F Wei, J Ma, M Wei, DG Evans, ...","Advanced Functional Materials 24 (20), 2938-2946",https://scholar.google.com/scholar?oi=bibs&hl=en&cites=7425553777042214221,378,2014
Nanoarchitectured Graphene/CNT@ Porous Carbon with Extraordinary Electrical Conductivity and Interconnected Micro/Mesopores for Lithium‐Sulfur Batteries,"HJ Peng, JQ Huang, MQ Zhao, Q Zhang, XB Cheng, XY Liu, WZ Qian, ...","Advanced Functional Materials 24 (19), 2772-2781",https://scholar.google.com/scholar?oi=bibs&hl=en&cites=8848335273035358631,378,2014
Spatially Confined Hybridization of Nanometer‐Sized NiFe Hydroxides into Nitrogen‐Doped Graphene Frameworks Leading to Superior Oxygen Evolution Reactivity,"C Tang, HS Wang, HF Wang, Q Zhang, GL Tian, JQ Nie, F Wei","Advanced Materials 27 (30), 4516-4522",https://scholar.google.com/scholar?oi=bibs&hl=en&cites=5654392336551885255,377,2015
Lithiophilic sites in doped graphene guide uniform lithium nucleation for dendrite‐free lithium metal anodes,"R Zhang, XR Chen, X Chen, XB Cheng, XQ Zhang, C Yan, Q Zhang","Angewandte Chemie International Edition 56 (27), 7764-7768",https://scholar.google.com/scholar?oi=bibs&hl=en&cites=8983618997001883173,355,2017
Hierarchical Free‐Standing Carbon‐Nanotube Paper Electrodes with Ultrahigh Sulfur‐Loading for Lithium–Sulfur Batteries,"Z Yuan, HJ Peng, JQ Huang, XY Liu, DW Wang, XB Cheng, Q Zhang","Advanced Functional Materials 24 (39), 6105-6112",https://scholar.google.com/scholar?oi=bibs&hl=en&cites=10255464188848207183,349,2014
Conductive nanostructured scaffolds render low local current density to inhibit lithium dendrite growth,"R Zhang, XB Cheng, CZ Zhao, HJ Peng, JL Shi, JQ Huang, J Wang, F Wei, ...","Advanced Materials 28 (11), 2155-2162",https://scholar.google.com/scholar?oi=bibs&hl=en&cites=10229976933300382630,332,2016
Topological Defects in Metal‐Free Nanocarbon for Oxygen Electrocatalysis,"C Tang, HF Wang, X Chen, BQ Li, TZ Hou, B Zhang, Q Zhang, MM Titirici, ...","Advanced Materials 28 (32), 6845-6851",https://scholar.google.com/scholar?oi=bibs&hl=en&cites=13008111430064421556,331,2016
"Open‐Ended, N‐Doped Carbon Nanotube–Graphene Hybrid Nanostructures as High‐Performance Catalyst Support","R Lv, T Cui, MS Jun, Q Zhang, A Cao, DS Su, Z Zhang, SH Yoon, ...","Advanced Functional Materials 21 (5), 999-1006",https://scholar.google.com/scholar?oi=bibs&hl=en&cites=11348371396112440148,329,2011
Multi-functional separator/interlayer system for high-stable lithium-sulfur batteries: Progress and prospects,"JQ Huang, Q Zhang, F Wei","Energy Storage Materials 1, 127-145",https://scholar.google.com/scholar?oi=bibs&hl=en&cites=1629032579105177150,327,2015
Carbon nanotube mass production: principles and processes,"Q Zhang, JQ Huang, MQ Zhao, WZ Qian, F Wei","ChemSusChem 4 (7), 864-889",https://scholar.google.com/scholar?oi=bibs&hl=en&cites=7547797101380562712,302,2011
"Nanocarbon for oxygen reduction electrocatalysis: dopants, edges, and defects","C Tang, Q Zhang","Advanced Materials 29 (13), 1604103",https://scholar.google.com/scholar?oi=bibs&hl=en&cites=6753149918388198580,294,2017
Design Principles for Heteroatom‐Doped Nanocarbon to Achieve Strong Anchoring of Polysulfides for Lithium–Sulfur Batteries,"TZ Hou, X Chen, HJ Peng, JQ Huang, BQ Li, Q Zhang, B Li","Small 12 (24), 3283-3291",https://scholar.google.com/scholar?oi=bibs&hl=en&cites=1234590210699011017,289,2016
A cooperative interface for highly efficient lithium–sulfur batteries,"HJ Peng, ZW Zhang, JQ Huang, G Zhang, J Xie, WT Xu, JL Shi, X Chen, ...","Advanced Materials 28 (43), 9551-9558",https://scholar.google.com/scholar?oi=bibs&hl=en&cites=9508985338056984359,280,2016
Structural evolution during annealing of thermally reduced graphene nanosheets for application in supercapacitors,"CM Chen, Q Zhang, MG Yang, CH Huang, YG Yang, MZ Wang","Carbon 50 (10), 3572-3584",https://scholar.google.com/scholar?oi=bibs&hl=en&cites=17174424393702475944,271,2012
Aligned carbon nanotube/sulfur composite cathodes with high sulfur content for lithium–sulfur batteries,"XB Cheng, JQ Huang, Q Zhang, HJ Peng, MQ Zhao, F Wei","Nano Energy 4, 65-72",https://scholar.google.com/scholar?oi=bibs&hl=en&cites=2049745858539358161,268,2014
Toward full exposure of “active sites”: nanocarbon electrocatalyst with surface enriched nitrogen for superior oxygen reduction and evolution reactivity,"GL Tian, Q Zhang, B Zhang, YG Jin, JQ Huang, DS Su, F Wei","Advanced Functional Materials 24 (38), 5956-5961",https://scholar.google.com/scholar?oi=bibs&hl=en&cites=16704094706030347141,263,2014
Growth of half-meter long carbon nanotubes based on Schulz–Flory distribution,"R Zhang, Y Zhang, Q Zhang, H Xie, W Qian, F Wei","Acs Nano 7 (7), 6156-6161",https://scholar.google.com/scholar?oi=bibs&hl=en&cites=10730610358178742056,261,2013
Strongly Coupled Interfaces between a Heterogeneous Carbon Host and a Sulfur‐Containing Guest for Highly Stable Lithium‐Sulfur Batteries: Mechanistic Insight into Capacity …,"HJ Peng, TZ Hou, Q Zhang, JQ Huang, XB Cheng, MQ Guo, Z Yuan, ...","Advanced Materials Interfaces 1 (7), 1400227",https://scholar.google.com/scholar?oi=bibs&hl=en&cites=4621852414480645313,260,2014
Enhanced electrochemical kinetics on conductive polar mediators for lithium–sulfur batteries,"HJ Peng, G Zhang, X Chen, ZW Zhang, WT Xu, JQ Huang, Q Zhang","Angewandte Chemie International Edition 55 (42), 12990-12995",https://scholar.google.com/scholar?oi=bibs&hl=en&cites=13303380925349242440,257,2016
Prestoring Lithium into Stable 3D Nickel Foam Host as Dendrite‐Free Lithium Metal Anode,"SS Chi, Y Liu, WL Song, LZ Fan, Q Zhang","Advanced Functional Materials 27 (24), 1700348",https://scholar.google.com/scholar?oi=bibs&hl=en&cites=2203361667544209093,246,2017
Fabrication and electrochemical performances of hierarchical porous Ni (OH) 2 nanoflakes anchored on graphene sheets,"J Yan, W Sun, T Wei, Q Zhang, Z Fan, F Wei","Journal of Materials Chemistry 22 (23), 11494-11502",https://scholar.google.com/scholar?oi=bibs&hl=en&cites=169875952054242988,240,2012
A review of flexible lithium–sulfur and analogous alkali metal–chalcogen rechargeable batteries,"HJ Peng, JQ Huang, Q Zhang","Chemical Society Reviews 46 (17), 5237-5288",https://scholar.google.com/scholar?oi=bibs&hl=en&cites=13361797414656793074,232,2017
Advanced micro/nanostructures for lithium metal anodes,"R Zhang, NW Li, XB Cheng, YX Yin, Q Zhang, YG Guo","Advanced Science 4 (3), 1600445",https://scholar.google.com/scholar?oi=bibs&hl=en&cites=18235987119159029497,220,2017
Defect Engineering toward Atomic Co–N,"C Tang, B Wang, HF Wang, Q Zhang","Advanced Materials 29 (37), 1703185",https://scholar.google.com/scholar?oi=bibs&hl=en&cites=7946074318647016556,219,2017
Implantable Solid Electrolyte Interphase in Lithium-Metal Batteries,"XB Cheng, C Yan, X Chen, C Guan, JQ Huang, HJ Peng, R Zhang, ...","Chem 2 (2), 258-270",https://scholar.google.com/scholar?oi=bibs&hl=en&cites=7734179841040933211,217,2017
An anion-immobilized composite electrolyte for dendrite-free lithium metal anodes,"CZ Zhao, XQ Zhang, XB Cheng, R Zhang, R Xu, PY Chen, HJ Peng, ...","Proceedings of the National Academy of Sciences 114 (42), 11069-11074",https://scholar.google.com/scholar?oi=bibs&hl=en&cites=13888131059422568615,215,2017
"Ternary Hybrids of Amorphous Nickel Hydroxide–Carbon Nanotube‐Conducting Polymer for Supercapacitors with High Energy Density, Excellent Rate Capability, and Long Cycle Life","W Jiang, D Yu, Q Zhang, K Goh, L Wei, Y Yong, R Jiang, J Wei, Y Chen","Advanced Functional Materials 25 (7), 1063-1073",https://scholar.google.com/scholar?oi=bibs&hl=en&cites=5189008941860859884,214,2015
Janus separator of polypropylene‐supported cellular graphene framework for sulfur cathodes with high utilization in lithium–sulfur batteries,"HJ Peng, DW Wang, JQ Huang, XB Cheng, Z Yuan, F Wei, Q Zhang","Advanced Science 3 (1), 1500268",https://scholar.google.com/scholar?oi=bibs&hl=en&cites=12716019683952641571,212,2016
Dual-phase lithium metal anode containing a polysulfide-induced solid electrolyte interphase and nanostructured graphene framework for lithium–sulfur batteries,"XB Cheng, HJ Peng, JQ Huang, R Zhang, CZ Zhao, Q Zhang","ACS nano 9 (6), 6373-6382",https://scholar.google.com/scholar?oi=bibs&hl=en&cites=3481358728568993652,208,2015
CaO‐Templated Growth of Hierarchical Porous Graphene for High‐Power Lithium–Sulfur Battery Applications,"C Tang, BQ Li, Q Zhang, L Zhu, HF Wang, JL Shi, F Wei","Advanced Functional Materials 26 (4), 577-585",https://scholar.google.com/scholar?oi=bibs&hl=en&cites=9439772992671679929,203,2016
Nanostructured energy materials for electrochemical energy conversion and storage: A review,"X Zhang, X Cheng, Q Zhang","Journal of energy chemistry 25 (6), 967-984",https://scholar.google.com/scholar?oi=bibs&hl=en&cites=18381760811811957040,200,2016
"Aromatic sulfide, sulfoxide, and sulfone mediated mesoporous carbon monolith for use in supercapacitor","X Zhao, Q Zhang, CM Chen, B Zhang, S Reiche, A Wang, T Zhang, ...","Nano Energy 1 (4), 624-630",https://scholar.google.com/scholar?oi=bibs&hl=en&cites=1098734824306669529,194,2012
Synthesis of biodiesel from cottonseed oil and methanol using a carbon-based solid acid catalyst,"Q Shu, Q Zhang, GH Xu, Z Nawaz, DZ Wang, JF Wang","Fuel Processing Technology 90 (7-8), 1002-1008",https://scholar.google.com/scholar?oi=bibs&hl=en&cites=12512082904598297055,193,2009
Hierarchically aminated graphene honeycombs for electrochemical capacitive energy storage,"CM Chen, Q Zhang, XC Zhao, B Zhang, QQ Kong, MG Yang, QH Yang, ...","Journal of Materials Chemistry 22 (28), 14076-14084",https://scholar.google.com/scholar?oi=bibs&hl=en&cites=15869470740815037444,185,2012
A general approach to cobalt-based homobimetallic phosphide ultrathin nanosheets for highly efficient oxygen evolution in alkaline media,"X Xiao, CT He, S Zhao, J Li, W Lin, Z Yuan, Q Zhang, S Wang, L Dai, D Yu","Energy & Environmental Science 10 (4), 893-899",https://scholar.google.com/scholar?oi=bibs&hl=en&cites=14507513971839488838,183,2017
Superlubricity in centimetres-long double-walled carbon nanotubes under ambient conditions,"R Zhang, Z Ning, Y Zhang, Q Zheng, Q Chen, H Xie, Q Zhang, W Qian, ...","Nature nanotechnology 8 (12), 912",https://scholar.google.com/scholar?oi=bibs&hl=en&cites=16041356392260971122,181,2013
Annealing a graphene oxide film to produce a free standing high conductive graphene film,"CM Chen, JQ Huang, Q Zhang, WZ Gong, QH Yang, MZ Wang, YG Yang","Carbon 50 (2), 659-667",https://scholar.google.com/scholar?oi=bibs&hl=en&cites=9883738093986255545,180,2012
Entrapment of sulfur in hierarchical porous graphene for lithium–sulfur batteries with high rate performance from− 40 to 60° C,"JQ Huang, XF Liu, Q Zhang, CM Chen, MQ Zhao, SM Zhang, W Zhu, ...","Nano Energy 2 (2), 314-321",https://scholar.google.com/scholar?oi=bibs&hl=en&cites=202365312374735427,179,2013
Popcorn inspired porous macrocellular carbon: rapid puffing fabrication from rice and its applications in lithium–sulfur batteries,"Y Zhong, X Xia, S Deng, J Zhan, R Fang, Y Xia, X Wang, Q Zhang, J Tu","Advanced Energy Materials 8 (1), 1701110",https://scholar.google.com/scholar?oi=bibs&hl=en&cites=14318799196873688444,176,2018
Macroporous ‘bubble’graphene film via template-directed ordered-assembly for high rate supercapacitors,DS Su,"Chemical Communications 48 (57), 7149-7151",https://scholar.google.com/scholar?oi=bibs&hl=en&cites=7561347914446538693,176,2012
Controlled Functionalization of Carbonaceous Fibers for Asymmetric Solid‐State Micro‐Supercapacitors with High Volumetric Energy Density,"D Yu, K Goh, Q Zhang, L Wei, H Wang, W Jiang, Y Chen","Advanced Materials 26 (39), 6790-6797",https://scholar.google.com/scholar?oi=bibs&hl=en&cites=3138460005051233171,174,2014
Rational integration of polypropylene/graphene oxide/nafion as ternary‐layered separator to retard the shuttle of polysulfides for lithium–sulfur batteries,"TZ Zhuang, JQ Huang, HJ Peng, LY He, XB Cheng, CM Chen, Q Zhang","Small 12 (3), 381-389",https://scholar.google.com/scholar?oi=bibs&hl=en&cites=5042633389997968219,172,2016
Lithium bond chemistry in lithium–sulfur batteries,"TZ Hou, WT Xu, X Chen, HJ Peng, JQ Huang, Q Zhang","Angewandte Chemie International Edition 56 (28), 8178-8182",https://scholar.google.com/scholar?oi=bibs&hl=en&cites=9932349042313631794,160,2017
Binder-free activated carbon/carbon nanotube paper electrodes for use in supercapacitors,"G Xu, C Zheng, Q Zhang, J Huang, M Zhao, J Nie, X Wang, F Wei","Nano Research 4 (9), 870-881",https://scholar.google.com/scholar?oi=bibs&hl=en&cites=9855650031343614972,152,2011
Bifunctional transition metal hydroxysulfides: room‐temperature sulfurization and their applications in Zn–air batteries,"HF Wang, C Tang, B Wang, BQ Li, Q Zhang","Advanced Materials 29 (35), 1702327",https://scholar.google.com/scholar?oi=bibs&hl=en&cites=14570386762887124301,151,2017
Towards High‐Safe Lithium Metal Anodes: Suppressing Lithium Dendrites via Tuning Surface Energy,"D Wang, W Zhang, W Zheng, X Cui, T Rojo, Q Zhang","Advanced Science 4 (1), 1600168",https://scholar.google.com/scholar?oi=bibs&hl=en&cites=6642178550626671348,150,2017
3D Carbonaceous Current Collectors: The Origin of Enhanced Cycling Stability for High‐Sulfur‐Loading Lithium–Sulfur Batteries,"HJ Peng, WT Xu, L Zhu, DW Wang, JQ Huang, XB Cheng, Z Yuan, F Wei, ...","Advanced Functional Materials 26 (35), 6351-6358",https://scholar.google.com/scholar?oi=bibs&hl=en&cites=11959147415050911103,150,2016
Coralloid carbon fiber-based composite Lithium anode for robust lithium metal batteries,"R Zhang, X Chen, X Shen, XQ Zhang, XR Chen, XB Cheng, C Yan, ...","Joule 2 (4), 764-777",https://scholar.google.com/scholar?oi=bibs&hl=en&cites=14987839315237013235,146,2018
Designing Host Materials for Sulfur Cathodes: From Physical Confinement to Surface Chemistry,"HJ Peng, Q Zhang","Angewandte Chemie International Edition 54 (38), 11018-11020",https://scholar.google.com/scholar?oi=bibs&hl=en&cites=7452528142201754347,146,2015
Dendrite‐Free Nanostructured Anode: Entrapment of Lithium in a 3D Fibrous Matrix for Ultra‐Stable Lithium–Sulfur Batteries,"XB Cheng, HJ Peng, JQ Huang, F Wei, Q Zhang","Small 10 (21), 4257-4263",https://scholar.google.com/scholar?oi=bibs&hl=en&cites=10439712994568873007,146,2014
Embedded High Density Metal Nanoparticles with Extraordinary Thermal Stability Derived from Guest− Host Mediated Layered Double Hydroxides,"MQ Zhao, Q Zhang, W Zhang, JQ Huang, Y Zhang, DS Su, F Wei","Journal of the American Chemical Society 132 (42), 14739-14741",https://scholar.google.com/scholar?oi=bibs&hl=en&cites=6025084085323839382,145,2010
Direct observation of graphene growth and associated copper substrate dynamics by in situ scanning electron microscopy,"ZJ Wang, G Weinberg, Q Zhang, T Lunkenbein, A Klein-Hoffmann, ...","ACS nano 9 (2), 1506-1519",https://scholar.google.com/scholar?oi=bibs&hl=en&cites=5815282145827656267,142,2015
Nitrogen doped holey graphene as an efficient metal-free multifunctional electrochemical catalyst for hydrazine oxidation and oxygen reduction,"D Yu, L Wei, W Jiang, H Wang, B Sun, Q Zhang, K Goh, R Si, Y Chen","Nanoscale 5 (8), 3457-3464",https://scholar.google.com/scholar?oi=bibs&hl=en&cites=5329904813075893086,142,2013
Catalytic self-limited assembly at hard templates: a mesoscale approach to graphene nanoshells for lithium–sulfur batteries,"HJ Peng, J Liang, L Zhu, JQ Huang, XB Cheng, X Guo, W Ding, W Zhu, ...","ACS nano 8 (11), 11280-11289",https://scholar.google.com/scholar?oi=bibs&hl=en&cites=17571059356550372581,140,2014
High-performance flexible lithium-ion electrodes based on robust network architecture,"X Jia, Z Chen, A Suwarnasarn, L Rice, X Wang, H Sohn, Q Zhang, BM Wu, ...","Energy & Environmental Science 5 (5), 6845-6849",https://scholar.google.com/scholar?oi=bibs&hl=en&cites=3839732526390298786,139,2012
Li 2 S 5-based ternary-salt electrolyte for robust lithium metal anode,"CZ Zhao, XB Cheng, R Zhang, HJ Peng, JQ Huang, R Ran, ZH Huang, ...","Energy Storage Materials 3, 77-84",https://scholar.google.com/scholar?oi=bibs&hl=en&cites=5422173004621678226,138,2016
A review of electrocatalytic reduction of dinitrogen to ammonia under ambient conditions,"X Cui, C Tang, Q Zhang","Advanced Energy Materials 8 (22), 1800369",https://scholar.google.com/scholar?oi=bibs&hl=en&cites=15152467869183225667,136,2018
The mass production of carbon nanotubes using a nano-agglomerate fluidized bed reactor: A multiscale space–time analysis,"F Wei, Q Zhang, WZ Qian, H Yu, Y Wang, GH Luo, GH Xu, DZ Wang","Powder Technology 183 (1), 10-20",https://scholar.google.com/scholar?oi=bibs&hl=en&cites=13264535534758961060,135,2008
Interconnected carbon nanotube/graphene nanosphere scaffolds as free-standing paper electrode for high-rate and ultra-stable lithium–sulfur batteries,"L Zhu, HJ Peng, J Liang, JQ Huang, CM Chen, X Guo, W Zhu, P Li, ...","Nano Energy 11, 746-755",https://scholar.google.com/scholar?oi=bibs&hl=en&cites=9483385576080692668,134,2015
Lithium metal protection through in-situ formed solid electrolyte interphase in lithium-sulfur batteries: The role of polysulfides on lithium anode,"C Yan, XB Cheng, CZ Zhao, JQ Huang, ST Yang, Q Zhang","Journal of Power Sources 327, 212-220",https://scholar.google.com/scholar?oi=bibs&hl=en&cites=5072830313766315680,132,2016
Superstrong ultralong carbon nanotubes for mechanical energy storage,"R Zhang, Q Wen, W Qian, DS Su, Q Zhang, F Wei","Advanced materials 23 (30), 3387-3391",https://scholar.google.com/scholar?oi=bibs&hl=en&cites=5661613213297009045,129,2011
The gap between long lifespan Li-S coin and pouch cells: The importance of lithium metal anode protection,"XB Cheng, C Yan, JQ Huang, P Li, L Zhu, L Zhao, Y Zhang, W Zhu, ...","Energy Storage Materials 6, 18-25",https://scholar.google.com/scholar?oi=bibs&hl=en&cites=12277571915120135856,126,2017
Highly stable lithium metal batteries enabled by regulating the solvation of lithium ions in nonaqueous electrolytes,"XQ Zhang, X Chen, XB Cheng, BQ Li, X Shen, C Yan, JQ Huang, Q Zhang","Angewandte Chemie International Edition 57 (19), 5301-5305",https://scholar.google.com/scholar?oi=bibs&hl=en&cites=17319535045098960545,124,2018
Direct growth of flexible LiMn 2 O 4/CNT lithium-ion cathodes,"X Jia, C Yan, Z Chen, R Wang, Q Zhang, L Guo, F Wei, Y Lu","Chemical Communications 47 (34), 9669-9671",https://scholar.google.com/scholar?oi=bibs&hl=en&cites=1673345374972838661,124,2011
Three‐Dimensional Hierarchically Ordered Porous Carbons with Partially Graphitic Nanostructures for Electrochemical Capacitive Energy Storage,"CH Huang, Q Zhang, TC Chou, CM Chen, DS Su, RA Doong","ChemSusChem 5 (3), 563-571",https://scholar.google.com/scholar?oi=bibs&hl=en&cites=13935481501195131557,121,2012
Aligned sulfur-coated carbon nanotubes with a polyethylene glycol barrier at one end for use as a high efficiency sulfur cathode,"JQ Huang, Q Zhang, SM Zhang, XF Liu, W Zhu, WZ Qian, F Wei","Carbon 58, 99-106",https://scholar.google.com/scholar?oi=bibs&hl=en&cites=15494188044072681675,120,2013
Energy‐Absorbing Hybrid Composites Based on Alternate Carbon‐Nanotube and Inorganic Layers,"Q Zhang, M Zhao, Y Liu, A Cao, W Qian, Y Lu, F Wei","Advanced Materials 21 (28), 2876-2880",https://scholar.google.com/scholar?oi=bibs&hl=en&cites=13412605435134325508,120,2009
Growth deceleration of vertically aligned carbon nanotube arrays: Catalyst deactivation or feedstock diffusion controlled?,"R Xiang, Z Yang, Q Zhang, G Luo, W Qian, F Wei, M Kadowaki, ...","The Journal of Physical Chemistry C 112 (13), 4892-4896",https://scholar.google.com/scholar?oi=bibs&hl=en&cites=6554438682464996060,120,2008
Hierarchical Composites of Single/Double‐Walled Carbon Nanotubes Interlinked Flakes from Direct Carbon Deposition on Layered Double Hydroxides,"MQ Zhao, Q Zhang, XL Jia, JQ Huang, YH Zhang, F Wei","Advanced Functional Materials 20 (4), 677-685",https://scholar.google.com/scholar?oi=bibs&hl=en&cites=18162458674843709858,119,2010
