Title,Authors,Platform,Cited_url,Cited_count,Year
Using the Facebook group as a learning management system: An exploratory study,"Q Wang, HL Woo, CL Quek, Y Yang, M Liu","British Journal of Educational Technology 43 (3), 428-438",https://scholar.google.com/scholar?oi=bibs&hl=en&cites=3503779113601550435,678,2012
Cervical adenocarcinoma and squamous cell carcinoma incidence trends among white women and black women in the United States for 1976–2000,"SS Wang, ME Sherman, A Hildesheim, JV Lacey Jr, S Devesa","Cancer 100 (5), 1035-1044",https://scholar.google.com/scholar?oi=bibs&hl=en&cites=6920948775716406942,423,2004
A generic model for guiding the integration of ICT into teaching and learning,Q Wang,"Innovations in education and teaching international 45 (4), 411-419",https://scholar.google.com/scholar?oi=bibs&hl=en&cites=2039087680191070221,373,2008
Systematic planning for ICT integration in topic learning,"Q Wang, HL Woo","Educational technology & society 10 (1), 148-156",https://scholar.google.com/scholar?oi=bibs&hl=en&cites=8797803751232379614,261,2007
Comparing asynchronous online discussions and face‐to‐face discussions in a classroom setting,"Q Wang, HL Woo","British journal of educational technology 38 (2), 272-286",https://scholar.google.com/scholar?oi=bibs&hl=en&cites=10911118498599772188,229,2007
Combined neural stimulation and cardiac resynchronization therapy,"J Moffitt, S Wang, BH Kenknight, I Libbus","US Patent 7,587,238",https://scholar.google.com/scholar?oi=bibs&hl=en&cites=16127618801437174330,207,2009
Design and evaluation of a collaborative learning environment,Q Wang,"Computers & Education 53 (4), 1138-1146",https://scholar.google.com/scholar?oi=bibs&hl=en&cites=3573794300502507461,180,2009
Integrated lead for applying cardiac resynchronization therapy and neural stimulation therapy,"I Libbus, JC Spinelli, R Westlund, J Moffitt, SH Wang","US Patent 7,840,266",https://scholar.google.com/scholar?oi=bibs&hl=en&cites=9071698921744797899,156,2010
Investigating critical thinking and knowledge construction in an interactive learning environment,"Q Wang, HL Woo, J Zhao","Interactive learning environments 17 (1), 95-104",https://scholar.google.com/scholar?oi=bibs&hl=en&cites=11417259231176867254,133,2009
Public attitudes regarding the donation and storage of blood specimens for genetic research,"SS Wang, F Fridinger, KM Sheedy, MJ Khoury","Public Health Genomics 4 (1), 18-26",https://scholar.google.com/scholar?oi=bibs&hl=en&cites=7050763917865214691,125,2001
Genome characterization of the oleaginous fungus Mortierella alpina,"L Wang, W Chen, Y Feng, Y Ren, Z Gu, H Chen, H Wang, MJ Thomas, ...","PloS one 6 (12), e28319",https://scholar.google.com/scholar?oi=bibs&hl=en&cites=11124601509956185563,112,2011
Designing a web-based constructivist learning environment,Q Wang,"Interactive Learning Environments 17 (1), 1-13",https://scholar.google.com/scholar?oi=bibs&hl=en&cites=6439969057770689626,105,2009
Using online shared workspaces to support group collaborative learning,Q Wang,"Computers & Education 55 (3), 1270-1276",https://scholar.google.com/scholar?oi=bibs&hl=en&cites=3941159192835421469,103,2010
AMP-activated protein kinase suppresses endothelial cell inflammation through phosphorylation of transcriptional coactivator p300,"Y Zhang, J Qiu, X Wang, Y Zhang, M Xia","Arteriosclerosis, thrombosis, and vascular biology 31 (12), 2897-2908",https://scholar.google.com/scholar?oi=bibs&hl=en&cites=14562166626668868061,97,2011
Environmental tobacco smoke.,"JM Samet, SS Wang","Environmental toxicants: human exposures and their health effects., 319-375",https://scholar.google.com/scholar?oi=bibs&hl=en&cites=10519918032318453599,89,2000
Adenosine monophosphate-activated protein kinase induces cholesterol efflux from macrophage-derived foam cells and alleviates atherosclerosis in apolipoprotein E-deficient mice,"D Li, D Wang, Y Wang, W Ling, X Feng, M Xia","Journal of Biological Chemistry 285 (43), 33499-33509",https://scholar.google.com/scholar?oi=bibs&hl=en&cites=918893597418719549,88,2010
"Bladder cancer and drinking water: a population-based case-control study in Washington County, Maryland (United States)","DM Freedman, KP Cantor, NL Lee, LS Chen, HH Lei, CE Ruhl, SS Wang","Cancer Causes & Control 8 (5), 738-744",https://scholar.google.com/scholar?oi=bibs&hl=en&cites=6790765187964673371,81,1997
Student‐facilitators' roles in moderating online discussions,Q Wang,"British Journal of Educational Technology 39 (5), 859-874",https://scholar.google.com/scholar?oi=bibs&hl=en&cites=15071796382290819442,80,2008
Hierarchical NiAl layered double hydroxide/multiwalled carbon nanotube/nickel foam electrodes with excellent pseudocapacitive properties,"B Wang, GR Williams, Z Chang, M Jiang, J Liu, X Lei, X Sun","ACS applied materials & interfaces 6 (18), 16304-16311",https://scholar.google.com/scholar?oi=bibs&hl=en&cites=7756348506158581644,78,2014
Average power balancing control of a STATCOM based on the cascaded H-bridge PWM converter with star configuration,"SF Chou, BS Wang, SW Chen, CT Lee, PT Cheng, H Akagi, P Barbosa","2013 IEEE Energy Conversion Congress and Exposition, 970-977",https://scholar.google.com/scholar?oi=bibs&hl=en&cites=15544837033908388725,74,2013
Medium chain acyl‐CoA dehydrogenase deficiency: Human genome epidemiology review,"SS Wang, PM Fernhoff, WH Harnnon, MJ Khoury","Genetics in Medicine 1 (7), 332",https://scholar.google.com/scholar?oi=bibs&hl=en&cites=16828369349671838145,72,1999
Combined neural stimulation and cardiac resynchronization therapy,"J Moffitt, S Wang, BH Kenknight, I Libbus","US Patent 8,131,362",https://scholar.google.com/scholar?oi=bibs&hl=en&cites=16086146384201913762,68,2012
Self-generated diffusioosmotic flows from calcium carbonate micropumps,"JJ McDermott, A Kar, M Daher, S Klara, G Wang, A Sen, D Velegol","Langmuir 28 (44), 15491-15497",https://scholar.google.com/scholar?oi=bibs&hl=en&cites=1100108050839493519,66,2012
A case study of engaging primary school students in learning science by using Active Worlds,"KH Ang, Q Wang","Proceedings of the first international LAMS conference, 5-14",https://scholar.google.com/scholar?oi=bibs&hl=en&cites=529622120954187236,65,2006
Using Facebook for teaching and learning: a review of the literature,"Y Yang, Q Wang, HL Woo, CL Quek",International Journal of Continuing Engineering Education and Life Long …,https://scholar.google.com/scholar?oi=bibs&hl=en&cites=6103775462333478537,64,2011
Cyanidin-3-O-β-glucoside regulates fatty acid metabolism via an AMP-activated protein kinase-dependent signaling pathway in human HepG2 cells,"H Guo, G Liu, R Zhong, Y Wang, D Wang, M Xia","Lipids in health and disease 11 (1), 10",https://scholar.google.com/scholar?oi=bibs&hl=en&cites=2563726285153115928,63,2012
Financial literacy overconfidence and stock market participation,"T Xia, Z Wang, K Li","Social indicators research 119 (3), 1233-1245",https://scholar.google.com/scholar?oi=bibs&hl=en&cites=17691853016410857572,62,2014
Implantable medical device for generating cardiac pressure-volume loop and optimizing therapy,"JO Gilkerson, Y Zhang, Y Zhang, S Wang","US Patent 7,580,746",https://scholar.google.com/scholar?oi=bibs&hl=en&cites=15330726268266887693,62,2009
Digital microfluidic operations on micro-electrode dot array architecture,"G Wang, D Teng, SK Fan","IET nanobiotechnology 5 (4), 152-160",https://scholar.google.com/scholar?oi=bibs&hl=en&cites=13880386875563869475,55,2011
Influence of microstructure on the erosion and erosion–corrosion characteristics of 316 stainless steel,"RJK Wood, JC Walker, TJ Harvey, S Wang, SS Rajahram","Wear 306 (1-2), 254-262",https://scholar.google.com/scholar?oi=bibs&hl=en&cites=17333966525028631424,52,2013
An exploration of three-dimensional integrated assessment for computational thinking,"B Zhong, Q Wang, J Chen, Y Li","Journal of Educational Computing Research 53 (4), 562-590",https://scholar.google.com/scholar?oi=bibs&hl=en&cites=5848731152260173675,51,2016
Activation of volume-sensitive outwardly rectifying chloride channel by ROS contributes to ER stress and cardiac contractile dysfunction: involvement of CHOP through Wnt,"M Shen, L Wang, B Wang, T Wang, G Yang, L Shen, X Guo, Y Liu, Y Xia, ...","Cell death & disease 5 (11), e1528",https://scholar.google.com/scholar?oi=bibs&hl=en&cites=11422129065621074775,50,2014
"A Novel, Facile Approach to Frondosin B and 5-","J Zhang, L Li, Y Wang, W Wang, J Xue, Y Li","Organic letters 14 (17), 4528-4530",https://scholar.google.com/scholar?oi=bibs&hl=en&cites=7466266302131721928,48,2012
Affordances of Facebook for learning,"Y Idris, Q Wang",International Journal of Continuing Engineering Education and Life Long …,https://scholar.google.com/scholar?oi=bibs&hl=en&cites=5976419433228212710,48,2009
Caryophyllene Sesquiterpenes from the Marine-Derived Fungus ,"WJ Wang, DY Li, YC Li, HM Hua, EL Ma, ZL Li","Journal of natural products 77 (6), 1367-1371",https://scholar.google.com/scholar?oi=bibs&hl=en&cites=962883515337034737,47,2014
EBUS-TBNA provides highest RNA yield for multiple biomarker testing from routinely obtained small biopsies in non-small cell lung cancer patients-a comparative study of three …,"G Schmid-Bindert, Y Wang, H Jiang, H Sun, T Henzler, H Wang, LR Pilz, ...","PLoS One 8 (10), e77948",https://scholar.google.com/scholar?oi=bibs&hl=en&cites=238824847506561642,47,2013
Involvement of oxygen-regulated protein 150 in AMP-activated protein kinase-mediated alleviation of lipid-induced endoplasmic reticulum stress,"Y Wang, Z Wu, D Li, D Wang, X Wang, X Feng, M Xia","Journal of Biological Chemistry 286 (13), 11119-11131",https://scholar.google.com/scholar?oi=bibs&hl=en&cites=896272507212580798,47,2011
Interactive networks and social knowledge construction behavioral patterns in primary school teachers' online collaborative learning activities,"S Zhang, Q Liu, W Chen, Q Wang, Z Huang","Computers & Education 104, 1-17",https://scholar.google.com/scholar?oi=bibs&hl=en&cites=2879907434251379193,46,2017
Heteroaryl sulfonamides and CCR2/CCR9,"W Chen, A Krasinski","US Patent 8,519,135",https://scholar.google.com/scholar?oi=bibs&hl=en&cites=3404149304029239664,46,2013
Adiponectin increases macrophages cholesterol efflux and suppresses foam cell formation in patients with type 2 diabetes mellitus,"M Wang, D Wang, Y Zhang, X Wang, Y Liu, M Xia","Atherosclerosis 229 (1), 62-70",https://scholar.google.com/scholar?oi=bibs&hl=en&cites=12275564185200334319,46,2013
Investigation of erosion–corrosion mechanisms of UNS S31603 using FIB and TEM,"SS Rajahram, TJ Harvey, JC Walker, SC Wang, RJK Wood","Tribology international 46 (1), 161-173",https://scholar.google.com/scholar?oi=bibs&hl=en&cites=7967493772346520360,46,2012
Effect of dietary Bacillus subtilis on proportion of Bacteroidetes and Firmicutes in swine intestine and lipid metabolism,"C Cui, CJ Shen, G Jia, KN Wang","Genet Mol Res 12 (12), 1766-1776",https://scholar.google.com/scholar?oi=bibs&hl=en&cites=16557078884053737625,45,2013
E-learning in China,"Q Wang, Z Zhu, L Chen, H Yan","Campus-Wide Information Systems 26 (2), 77-81",https://scholar.google.com/scholar?oi=bibs&hl=en&cites=14670132802243229545,44,2009
Dynamin‐related protein 1‐mediated mitochondrial fission contributes to post‐traumatic cardiac dysfunction in rats and the protective effect of melatonin,"M Ding, J Ning, N Feng, Z Li, Z Liu, Y Wang, Y Wang, X Li, C Huo, X Jia, ...","Journal of pineal research 64 (1), e12447",https://scholar.google.com/scholar?oi=bibs&hl=en&cites=1816132883121598325,43,2018
Retinol binding protein 4 stimulates hepatic sterol regulatory element‐binding protein 1 and increases lipogenesis through the peroxisome proliferator‐activated receptor‐γ …,"M Xia, Y Liu, H Guo, D Wang, Y Wang, W Ling","Hepatology 58 (2), 564-575",https://scholar.google.com/scholar?oi=bibs&hl=en&cites=18312444275543751475,43,2013
"Menstrual and reproductive factors, and hormonal contraception use: associations with non-Hodgkin lymphoma in a pooled analysis of InterLymph case–control studies","EV Kane, E Roman, N Becker, L Bernstein, P Boffetta, PM Bracci, ...","Annals of oncology 23 (9), 2362-2374",https://scholar.google.com/scholar?oi=bibs&hl=en&cites=2115739652681712297,42,2012
ClC-3-independent Sensitivity of Apoptosis to Cl–Channel Blockers in Mouse Cardiomyocytes,"N Takahashi, X Wang, S Tanabe, H Uramoto, K Jishage, S Uchida, ...","Cellular Physiology and Biochemistry 15 (6), 263-270",https://scholar.google.com/scholar?oi=bibs&hl=en&cites=3334006514285308249,42,2005
酸沉降影响下庐山森林生态系统土壤溶液溶解有机碳分布,王连峰， 潘根兴， 石盛莉， 黄明星， 张乐华,"植物营养与肥料学报 8 (1), 29-34",https://scholar.google.com/scholar?oi=bibs&hl=en&cites=18412307471533778718,42,2002
Field-programmable lab-on-a-chip based on microelectrode dot array architecture,"G Wang, D Teng, YT Lai, YW Lu, Y Ho, CY Lee","IET nanobiotechnology 8 (3), 163-171",https://scholar.google.com/scholar?oi=bibs&hl=en&cites=10751320253280979791,41,2013
Insights into support wettability in tuning catalytic performance in the oxidation of aliphatic alcohols to acids,"M Wang, F Wang, J Ma, C Chen, S Shi, J Xu","Chemical Communications 49 (59), 6623-6625",https://scholar.google.com/scholar?oi=bibs&hl=en&cites=4109727557401768037,41,2013
Prevalence of human parvovirus B19 DNA in cardiac tissues of patients with congenital heart diseases indicated by nested PCR and in situ hybridization,"X Wang, G Zhang, F Liu, M Han, D Xu, Y Zang","Journal of clinical virology 31 (1), 20-24",https://scholar.google.com/scholar?oi=bibs&hl=en&cites=190612602232765503,41,2004
"Associations of retinol-binding protein 4 with oxidative stress, inflammatory markers, and metabolic syndrome in a middle-aged and elderly Chinese population","Y Liu, D Wang, D Li, R Sun, M Xia","Diabetology & metabolic syndrome 6 (1), 25",https://scholar.google.com/scholar?oi=bibs&hl=en&cites=1526256974125701798,40,2014
Baicalin protects the cardiomyocytes from ER stress-induced apoptosis: inhibition of CHOP through induction of endothelial nitric oxide synthase,"M Shen, L Wang, G Yang, L Gao, B Wang, X Guo, C Zeng, Y Xu, L Shen, ...","PLoS One 9 (2), e88389",https://scholar.google.com/scholar?oi=bibs&hl=en&cites=7792044894461302661,40,2014
Supplementation with Cyanidin-3-,"Y Wang, Y Zhang, X Wang, Y Liu, M Xia","The Journal of nutrition 142 (6), 1033-1037",https://scholar.google.com/scholar?oi=bibs&hl=en&cites=16864931176004132005,40,2012
Asian Americans and obesity in California: a protective effect of biculturalism,"S Wang, J Quan, AM Kanaya, A Fernandez","Journal of immigrant and minority health 13 (2), 276-283",https://scholar.google.com/scholar?oi=bibs&hl=en&cites=15596526074487146184,40,2011
"Variations in life history parameters and their influence on rate of population increase of different pathogenic isolates of the pine wood nematode, Bursaphelenchus xylophilus","Y Wang, K Suzuki, D Sakaue, T Yamada","Nematology 7 (3), 459-467",https://scholar.google.com/scholar?oi=bibs&hl=en&cites=3644850933205907213,40,2005
"Tuber pseudoexcavatum sp. nov. A new species from China commercialised in Spain, France and Italy with additional comments on Chinese truffles","Y Wang, G Moreno, LJ Riousset, JL Manjón, G Riousset, G Fourre, ...",Cryptogamie Mycologie (France),https://scholar.google.com/scholar?oi=bibs&hl=en&cites=3399971572720380031,40,1998
A review of active control approaches in stabilizing combustion systems in aerospace industry,"D Zhao, Z Lu, H Zhao, XY Li, B Wang, P Liu","Progress in Aerospace Sciences 97, 35-60",https://scholar.google.com/scholar?oi=bibs&hl=en&cites=12178705753911161620,39,2018
Iboga-Type Alkaloids from ,"BQ Tang, WJ Wang, XJ Huang, GQ Li, L Wang, RW Jiang, TT Yang, L Shi, ...","Journal of natural products 77 (8), 1839-1846",https://scholar.google.com/scholar?oi=bibs&hl=en&cites=9986377423421728824,38,2014
Mast cells expressing interleukin 17 in the muscularis propria predict a favorable prognosis in esophageal squamous cell carcinoma,"B Wang, L Li, Y Liao, J Li, X Yu, Y Zhang, J Xu, H Rao, S Chen, L Zhang, ...","Cancer immunology, immunotherapy 62 (10), 1575-1585",https://scholar.google.com/scholar?oi=bibs&hl=en&cites=10012523419503003827,37,2013
Fabrication of micro-nano surface texture by CsCl lithography with antireflection and photoelectronic properties for solar cells,"J Liu, M Ashmkhan, G Dong, B Wang, F Yi","Solar Energy Materials and Solar Cells 108, 93-97",https://scholar.google.com/scholar?oi=bibs&hl=en&cites=12115961019828559544,37,2013
S100A6 protein negatively regulates CacyBP/SIP-mediated inhibition of gastric cancer cell proliferation and tumorigenesis,"X Ning, S Sun, K Zhang, J Liang, Y Chuai, Y Li, X Wang","PloS one 7 (1), e30185",https://scholar.google.com/scholar?oi=bibs&hl=en&cites=5510547588047214237,37,2012
"Reinforcement learning model, algorithms and its application","W Qiang, Z Zhongli","2011 International Conference on Mechatronic Science, Electric Engineering …",https://scholar.google.com/scholar?oi=bibs&hl=en&cites=8829322040448061932,37,2011
Adiponectin inhibits hyperlipidemia-induced platelet aggregation via attenuating oxidative/nitrative stress,"WQ Wang, HF Zhang, GX Gao, QX Bai, R Li, XM Wang","Physiological research 60 (2), 347",https://scholar.google.com/scholar?oi=bibs&hl=en&cites=6602908835648629264,37,2011
Synthesis of well oil-dispersible BaYF5: Yb3+/Er3+ nanocrystals with green upconversion fluorescence,"SUN Jiayue, X Jianbo, XIA Zhiguo, DU Haiyan","Journal of Rare Earths 28, 219-221",https://scholar.google.com/scholar?oi=bibs&hl=en&cites=12931063671817955340,37,2010
Investigating students’ critical thinking in weblogs: An exploratory study in a Singapore secondary school,"Q Wang, HL Woo","Asia Pacific Education Review 11 (4), 541-551",https://scholar.google.com/scholar?oi=bibs&hl=en&cites=17644634560939382055,37,2010
Reduced vascular responsiveness to adiponectin in hyperlipidemic rats—mechanisms and significance,"R Li, M Xu, X Wang, Y Wang, WB Lau, Y Yuan, W Yi, X Wei, BL Lopez, ...","Journal of molecular and cellular cardiology 49 (3), 508-515",https://scholar.google.com/scholar?oi=bibs&hl=en&cites=6672001084602158587,37,2010
Integrated lead for applying cardiac resynchronization therapy and neural stimulation therapy,"I Libbus, JC Spinelli, R Westlund, J Moffitt, SH Wang","US Patent 8,483,823",https://scholar.google.com/scholar?oi=bibs&hl=en&cites=1763641520292292541,36,2013
Optimizing virus-induced gene silencing efficiency with Cymbidium mosaic virus in Phalaenopsis flower,"MH Hsieh, HC Lu, ZJ Pan, HH Yeh, SS Wang, WH Chen, HH Chen","Plant Science 201, 25-41",https://scholar.google.com/scholar?oi=bibs&hl=en&cites=16977228752918198266,36,2013
Cytotoxic quassinoids from Ailanthus altissima,"Y Wang, WJ Wang, C Su, DM Zhang, LP Xu, RR He, L Wang, J Zhang, ...","Bioorganic & medicinal chemistry letters 23 (3), 654-657",https://scholar.google.com/scholar?oi=bibs&hl=en&cites=11469905806595197963,36,2013
A case study of using an online community of practice for teachers’ professional development at a secondary school in China,"Q Wang, Z Lu","Learning, Media and Technology 37 (4), 429-446",https://scholar.google.com/scholar?oi=bibs&hl=en&cites=5547585421762577787,36,2012
"Human parainfluenza virus-associated respiratory tract infection among children and genetic analysis of HPIV-3 strains in Beijing, China","N Mao, Y Ji, Z Xie, H Wang, H Wang, J An, X Zhang, Y Zhang, Z Zhu, ...","PloS one 7 (8), e43893",https://scholar.google.com/scholar?oi=bibs&hl=en&cites=2000759799542799283,36,2012
The antitumor immune responses induced by nanoemulsion-encapsulated MAGE1-HSP70/SEA complex protein vaccine following peroral administration route,"W Ge, Y Li, ZS Li, SH Zhang, YJ Sun, PZ Hu, XM Wang, Y Huang, SY Si, ...","Cancer immunology, immunotherapy 58 (2), 201-208",https://scholar.google.com/scholar?oi=bibs&hl=en&cites=10896461553964796738,36,2009
Inhibition of CYP2E1 attenuates chronic alcohol intake-induced myocardial contractile dysfunction and apoptosis,"RH Zhang, JY Gao, HT Guo, GI Scott, AR Eason, XM Wang, J Ren","Biochimica et Biophysica Acta (BBA)-Molecular Basis of Disease 1832 (1), 128-141",https://scholar.google.com/scholar?oi=bibs&hl=en&cites=15907189539076961102,35,2013
Removal of the residual surfactants in transparent and conductive single-walled carbon nanotube films,"J Wang, J Sun, L Gao, Y Wang, J Zhang, H Kajiura, YM Li, K Noda","The Journal of Physical Chemistry C 113 (41), 17685-17690",https://scholar.google.com/scholar?oi=bibs&hl=en&cites=10808778915718005005,35,2009
Impact of interleukin-10 polymorphisms (− 1082 and− 3575) on the survival of patients with lymphoid neoplasms,"E Domingo-Domènech, Y Benavente, E González-Barca, C Montalban, ...","Haematologica 92 (11), 1475-1481",https://scholar.google.com/scholar?oi=bibs&hl=en&cites=4913817620485460235,35,2007
The genomic landscape of pediatric myelodysplastic syndromes,"JR Schwartz, J Ma, T Lamprecht, M Walsh, S Wang, V Bryant, G Song, ...","Nature communications 8 (1), 1557",https://scholar.google.com/scholar?oi=bibs&hl=en&cites=9646887904345320640,34,2017
Wireless information and power transfer to maximize information throughput in WBAN,"L Wang, F Hu, Z Ling, B Wang","IEEE Internet of Things Journal 4 (5), 1663-1670",https://scholar.google.com/scholar?oi=bibs&hl=en&cites=3335102931757837249,34,2017
Scaling of divertor power footprint width in RF-heated type-III ELMy H-mode on the EAST superconducting tokamak,"L Wang, HY Guo, GS Xu, SC Liu, KF Gan, HQ Wang, XZ Gong, Y Liang, ...","Nuclear Fusion 54 (11), 114002",https://scholar.google.com/scholar?oi=bibs&hl=en&cites=7836558736106794457,34,2014
IL-21 modulates release of proinflammatory cytokines in LPS-stimulated macrophages through distinct signaling pathways,"S Li, W Wang, S Fu, J Wang, H Liu, S Xie, B Liu, Y Li, Q Lv, Z Li, W Xue, ...",Mediators of inflammation 2013,https://scholar.google.com/scholar?oi=bibs&hl=en&cites=16721521651057421202,34,2013
Virus-induced gene silencing unravels multiple transcription factors involved in floral growth and development in ,"MH Hsieh, ZJ Pan, PH Lai, HC Lu, HH Yeh, CC Hsu, WL Wu, MC Chung, ...","Journal of experimental botany 64 (12), 3869-3884",https://scholar.google.com/scholar?oi=bibs&hl=en&cites=501756199211025641,33,2013
Predicting malignancy in mediastinal lymph nodes by endobronchial ultrasound: a new ultrasound scoring system,"G SCHMID‐BINDERT, H Jiang, G Kaehler, J Saur, T Henzler, H Wang, ...","Respirology 17 (8), 1190-1198",https://scholar.google.com/scholar?oi=bibs&hl=en&cites=15946103094976804422,33,2012
The affordances of weblogs and discussion forums for learning: A comparative analysis,"Q Wang, HL Woo","Educational Technology, 34-38",https://scholar.google.com/scholar?oi=bibs&hl=en&cites=13824953824400504451,33,2008
Common variants in genes that mediate immunity and risk of multiple myeloma,"EE Brown, Q Lan, T Zheng, Y Zhang, SS Wang, S Hoar‐Zahm, ...","International journal of cancer 120 (12), 2715-2722",https://scholar.google.com/scholar?oi=bibs&hl=en&cites=9224687257863768581,33,2007
Defining the genetic susceptibility to cervical neoplasia—A genome-wide association study,"PJ Leo, MM Madeleine, S Wang, SM Schwartz, F Newell, ...","PLoS genetics 13 (8), e1006866",https://scholar.google.com/scholar?oi=bibs&hl=en&cites=7479536228325062096,32,2017
Enhanced CO2 capture capacity of limestone by discontinuous addition of hydrogen chloride in carbonation at calcium looping conditions,"Y Li, X Ma, W Wang, C Chi, J Shi, L Duan","Chemical Engineering Journal 316, 438-448",https://scholar.google.com/scholar?oi=bibs&hl=en&cites=1711080679766799027,32,2017
Treatment outcome for patients with primary NSCLC and synchronous solitary metastasis,"Q Xu, Y Wang, H Liu, S Meng, S Zhou, J Xu, G Schmid-Bindert, C Zhou","Clinical and Translational Oncology 15 (10), 802-809",https://scholar.google.com/scholar?oi=bibs&hl=en&cites=3418990474074417407,32,2013
Mitochondrial aldehyde dehydrogenase obliterates endoplasmic reticulum stress-induced cardiac contractile dysfunction via correction of autophagy,"B Zhang, Y Zhang, KH La Cour, KL Richmond, XM Wang, J Ren","Biochimica et Biophysica Acta (BBA)-Molecular Basis of Disease 1832 (4), 574-584",https://scholar.google.com/scholar?oi=bibs&hl=en&cites=1936961656162913285,32,2013
Meta-analysis of observational studies on cholecystectomy and the risk of colorectal adenoma,"C Zhao, Z Ge, Y Wang, J Qian","European journal of gastroenterology & hepatology 24 (4), 375-381",https://scholar.google.com/scholar?oi=bibs&hl=en&cites=16784895812282855844,32,2012
Droplet routing in high-level synthesis of configurable digital microfluidic biochips based on microelectrode dot array architecture,"Z Chen, DHY Teng, GCJ Wang, SK Fan","BioChip Journal 5 (4), 343-352",https://scholar.google.com/scholar?oi=bibs&hl=en&cites=18247539576339787301,32,2011
Genetic characteristics in children with cochlear implants and the corresponding auditory performance,"CC Wu, TC Liu, SH Wang, CJ Hsu, CM Wu","The Laryngoscope 121 (6), 1287-1293",https://scholar.google.com/scholar?oi=bibs&hl=en&cites=15102893379688278809,32,2011
Human leukocyte antigen (,"AM Abdou, X Gao, W Cozen, JR Cerhan, N Rothman, MP Martin, S Davis, ...","Leukemia 24 (5), 1055",https://scholar.google.com/scholar?oi=bibs&hl=en&cites=3502899614489863781,32,2010
Progress in development and application of solid-state NMR for solid acid catalysis,"A Zheng, SJ HUANG, W Qiang, H Zhang, D Feng, L Shang-Bin","Chinese Journal of Catalysis 34 (3), 436-491",https://scholar.google.com/scholar?oi=bibs&hl=en&cites=1121228800430444332,31,2013
