Title,Authors,Platform,Cited_url,Cited_count,Year
Reasoning and reformulating for linguistic knowledge improvement: A comparative case study in a CSCL classroom,"W Xie, W Chen, Y Wen, CK Looi",,https://scholar.google.com/scholar?oi=bibs&hl=en&cites=10009186849356284384,1,2012
Group Scribbles-enhanced collaborative learning improves reading skills: An experiment study in primary classrooms,"W Chen, CP Lin, W Xie, C Chu, NYL Tan",,https://scholar.google.com/scholar?oi=bibs&hl=en&cites=10552912633206002484,1,2012
Collaborative languaging for L1 learning in a CSCL classroom via Group Scribbles: An exploratory case study,"W Chen, W Xie, CK Looi",,https://scholar.google.com/scholar?oi=bibs&hl=en&cites=16320842014588479098,1,2012
GroupScribbles 软件支持的课堂协作学习的设计研究,陈文莉， 吕赐杰， 谢雯婷,"中国电化教育, 1-9",https://scholar.google.com/scholar?oi=bibs&hl=en&cites=11162485998387126330,1,2011
Constructivist-oriented Data-logging Activities in Chinese Chemistry Classroom: Enhancing Students’ Conceptual Understanding and Their Metacognition,"CS Chai, F Deng, W Chen","The Asia-Pacific Education Researcher 20 (2), 1-1",https://scholar.google.com/scholar?oi=bibs&hl=en&cites=15474224260308489111,1,2011
Analysis of small group interactions in a seamless language learning environment: An artifact-oriented approach,"LH Wong, W Chen, Y Zhan, CK Chin",,https://scholar.google.com/scholar?oi=bibs&hl=en&cites=5440209254313244808,1,2011
Integrating technology in the classroom: Favourable conditions for teachers' upward development trajectories,"FH Chen, CK Looi, W Chen",,https://scholar.google.com/scholar?oi=bibs&hl=en&cites=7388683090637003936,1,2010
GroupScribbles as a rapid CSCL tool: Learning experiences of pre-service teachers,"YLN Tan, W Chen, CK Looi",Proceedings of the 17th International Conference on Computers in Education 2009,https://scholar.google.com/scholar?oi=bibs&hl=en&cites=8954094330682081947,1,2009
Knowledge building in second language learning,"W Chen, Y Wen, C Looi",Proceedings of the 17th International Conference on Computers in Education …,https://scholar.google.com/scholar?oi=bibs&hl=en&cites=9744937483510087149,1,2009
将科技中介学习的研究成果转化为实践: 学习科学的角度,吕赐杰， 陈文莉,"中国电化教育, 1-7",https://scholar.google.com/scholar?oi=bibs&hl=en&cites=7092377683573242319,1,2008
Analysis of Learning Process of Online Discussion in a Large Class,"K Toyokawa, W Chen, CK Looi",Proceedings of the 2007 conference on Supporting Learning Flow through …,https://scholar.google.com/scholar?oi=bibs&hl=en&cites=14470403128549756841,1,2007
Effects of instructor's facial expressions on students' learning with video lectures,"Y Wang, Q Liu, W Chen, Q Wang, D Stein","British Journal of Educational Technology 50 (3), 1381-1395",,0,2019
A Spiral Model of Collaborative Knowledge Improvement to Support Collaborative,"W Chen, S Zhang, Y Wen, CK Looi, J Yeo",International Society of the Learning Sciences (ISLS),,0,2019
Collaboration Script Appropriation in a Science Class,"S Zhang, W Chen, Y Wen, CK Looi, ASW Chai, JL Ang",International Society of the Learning Sciences (ISLS),,0,2019
Preparing for Future Learning By Knowledge Co-Creation and Collaboration,W Chen,"Proceedings of the UR International Conference on Educational Sciences, 18-19",,0,2018
Chinese Character Composition Game for Collaborative Language Learning,"Y Wen, W Chen","International Society of the Learning Sciences, Inc.[ISLS].",,0,2018
Measuring process and outcome of the scientific argumentation in a CSCL environment,"W Chen, CK Looi",,,0,2017
Horizon Scanning and Implications in the Near Future,"SC Tan, HM Cheah, W Chen, D Choy","Pushing the Frontier, 143-155",,0,2017
Impact of ICT Masterplans,"SC Tan, HM Cheah, W Chen, D Choy","Pushing the Frontier, 119-128",,0,2017
ICT Environments in Singapore,"SC Tan, HM Cheah, W Chen, D Choy","Pushing the Frontier, 45-55",,0,2017
Innovative Technology-Mediated Classroom Practices from Research,"SC Tan, HM Cheah, W Chen, D Choy","Pushing the Frontier, 85-98",,0,2017
Idea Interactions and Translation: Scaling Up and Deepening ICT-Integration Practices,"SC Tan, HM Cheah, W Chen, D Choy","Pushing the Frontier, 99-118",,0,2017
Integrating ICT into K-12 Education–A Global Perspective,"SC Tan, HM Cheah, W Chen, D Choy","Pushing the Frontier, 11-25",,0,2017
Research & Development on ICT Integration in Schools,"SC Tan, HM Cheah, W Chen, D Choy","Pushing the Frontier, 73-83",,0,2017
A Critical Dialogue on Technology-Enhanced Interest-Driven Creation (IDC),"TW Chan, LH Wong, G Biswas, M Chang, HU Hoppe, J Mason, CK Looi, ...","International Conference on Computers in Education (ICCE 2016), i40-i42",,0,2016
Doctoral student consortia proceedings of the 24th International Conference on Computers in Education,"B CHANG, Y SONG, M SASIKUMAR, G BISWAS, W CHEN, W CHEN, ...",Asia-Pacific Society for Computers in Education,,0,2016
Designing Automated Assessment FOR Collaborative Argumentation in Classroom: A Pilot Study,"W Chen, CK Looi, W Xie, Y Wen","International Society of the Learning Sciences, Inc.[ISLS].",,0,2015
A Study of GS-Based “Factor” Collaborative Learning in a Primary School,"CC Lin, CP Lin, WL Chen",The 23rd International Conference on Computers in Education (ICCE 2015),,0,2015
Integrating Technology in the Classroom: Factors that Account for Teachers' Regressive Developmental Trajectories,"CK Looi, W Chen, FH Chen",International Journal of Web-Based Learning and Teaching Technologies …,,0,2014
A Collaborative Professional Development Model for Rapid Collaborative Knowledge Improvement in Singapore Schools,"W Chen, Y Song, CK Looi","The Asia-Pacific Education Researcher 21 (1), 1-1",,0,2012
Supporting Inquiry Learning with Mobile 2.0: A Two-Phased Design Approach,"HJ So, I Botički, Y Toh, W Chen, P Seow",AERA 2011 conference,,0,2011
GroupScribbles-enabled Collaborative Learning in Chinese Language Learning: Research and Practice in A Singapore Secondary Classroom,"CK Wen, Y., Chen, W.L., & Looi",Application of ICT in Chinese language Learning: Global Perspectives in 21 …,,0,2010
Internet and the Socialization of Immigrants,W Chen,Wen Jin Tang Publishing house. Taiwan: Taipei,,0,2008
二十世纪传播学的兴起,申凡， 陈文莉,"新闻传播, 46-47",,0,2001
论传播的反功能,陈文莉,"新闻大学, 95-96",,0,2001
从武汉地区新闻媒介的发展状况看我国新闻传播的权能控制,陈文莉,"新闻与传播研究 6 (004), 46-52",,0,1999
"Xin Pei Voon, Lung-Hsiang Wong","W Chen, CK Looi",,,0,0
Exploring Chinese Undergraduate Students’ Perceptions of Collaboration and Satisfaction in the Context of Online Collaborative Learning,"S ZHANG, W CHEN, CK LOOI",,,0,0
On the Technical Development of Group Scribbles,"D Moh, CK Looi, W Chen, Y Wen, W Xie",,,0,0
