Title,Authors,Platform,Cited_url,Cited_count,Year
The diagnostic value of anti-cyclic citrullinated peptide antibody and anti-keratin antibody in patients with rheumatoid arthritis,"DT Wang, L Chen, YR Wang","Inner Mongolia Med J 39 (7), 797-798",https://scholar.google.com/scholar?oi=bibs&hl=en&cites=12015023173104644464,1,2007
A Survey of Chinese Online Courses,Q Wang,李克东. 多学科交叉视野下的信息技术与教育应用——第十一届全球华人计算机教育应 …,https://scholar.google.com/scholar?oi=bibs&hl=en&cites=17098233405907692876,1,2007
UWB precise positioning sensor network with simple tag structure,"M Wang, H Qiu, J Liu","2006 International Conference on Communication Technology, 1-3",https://scholar.google.com/scholar?oi=bibs&hl=en&cites=7211473391302863431,1,2006
Recent Advances in Immobilization and Doped of TiO_2 Photocatalyst,"M SONG, T ZHOU, F WANG","Materials Review, 5",https://scholar.google.com/scholar?oi=bibs&hl=en&cites=3184645800961655613,1,2006
膦基多元羧酸对纯棉织物防皱整理,王强， 张芹， 范雪荣,"纺织学报 26 (5), 68-71",https://scholar.google.com/scholar?oi=bibs&hl=en&cites=14037483479804271713,1,2005
Risk of non-Hodgkin lymphoma (NHL) in relation to germline variation in DNA repair genes,"DA Hill, SS Wang, P Hartge, JR Cerhan, S Davis, W Cozen, RK Severson, ...","Cancer Research 65 (9 Supplement), 966-966",https://scholar.google.com/scholar?oi=bibs&hl=en&cites=7276901557417546457,1,2005
Phase diagram of unconventional superconductors on triangular lattices,"HW Chen, Q Han, ZD Wang","International Journal of Modern Physics B 19 (01n03), 119-121",https://scholar.google.com/scholar?oi=bibs&hl=en&cites=14675703539949935756,1,2005
A Study of Comprehensive Method in the Assessment and Discrimination Classifying of the Physical Fitness of University Students [J],"T WANG, M XU, R LI",Journal of Tianjin Institute of Physical Education 2,https://scholar.google.com/scholar?oi=bibs&hl=en&cites=4489572961607275078,1,2005
Preparation of a novel activated carbon coating fiber for solid phase micro-extraction and its application for halocarbon compound analysis in water,"S Wang, Y Wang, H You, Z Liang","Se pu= Chinese journal of chromatography 22 (5), 547-550",https://scholar.google.com/scholar?oi=bibs&hl=en&cites=1219494259358642436,1,2004
Calibration Circuit Design in the Complex Resistivity Logging Tool [J],"S KE, Y HE, J WANG, S DAI, J SHI",Well Logging Technology 1,https://scholar.google.com/scholar?oi=bibs&hl=en&cites=13036927737232045501,1,2004
Study on Fabrication of Zirconia Nanopowder plasma-Sprayed Coating,"Y SHUI, P ZHANG, C JIANG, S WANG, Y XIAO","Transactions of Materids and Heat Treatment, 4",https://scholar.google.com/scholar?oi=bibs&hl=en&cites=3392039638237108355,1,2004
An Elementary Research on Non-stationary Process Power Spectral Density Function,"L WANG, G PAN, M XUE",JOURNAL OF ENGINEERING MATHEMATICS,https://scholar.google.com/scholar?oi=bibs&hl=en&cites=17291049805185737882,1,2003
Dissolved aluminum and organic carbon in soil solution under six tree stands in Lushan forest ecosystems,"L Wang, G Pan, S Shi, L Zhang, M Huang","Ying yong sheng tai xue bao= The journal of applied ecology 14 (10), 1602-1606",https://scholar.google.com/scholar?oi=bibs&hl=en&cites=651053113289114669,1,2003
Coronary angiography with sixteen-slice spiral CT: an initial study,"ZY Jin, ZH Zhang, SB Lin, DJ Li, JJ Lu, H You, Y Wang, LH Wang, ...","Zhonghua yi xue za zhi 83 (13), 1150-1155",https://scholar.google.com/scholar?oi=bibs&hl=en&cites=915761695996169056,1,2003
In situ IR studies on the oxidative carbonylation of methanol to dimethyl carbonate.,"XB Ma, ZH Li, BW Wang, GH Xu","ABSTRACTS OF PAPERS OF THE AMERICAN CHEMICAL SOCIETY 225, U874-U874",https://scholar.google.com/scholar?oi=bibs&hl=en&cites=914062818840936819,1,2003
Study on Preparation of Tantalum Coating for Crucible Surface and Its Application,"Y Xiao, X LIU, C JIANG, Y SHUI, S WANG","Foundry Technology 24 (6; ISSU 139), 551-552",https://scholar.google.com/scholar?oi=bibs&hl=en&cites=5984267891235115611,1,2003
NO 对慢性病贫血大鼠转铁蛋白受体表达的影响 (英文),王强， 廖清奎， 董巍,"中国当代儿科杂志 5 (2), 90-94",https://scholar.google.com/scholar?oi=bibs&hl=en&cites=14469250809928686340,1,2003
Traumatic interhemispheric subdural hematoma,朴永旭， 陈礼刚， 汪庆华， 王方， 曾凡俊， 卢敏,"中华创伤杂志: 英文版 6 (3), 186-189",https://scholar.google.com/scholar?oi=bibs&hl=en&cites=8900521732085670968,1,2003
Differential Capillary Effect Model of Fabric and Its Application,王其， 冯勋伟,"东华大学学报: 英文版 20 (2), 36-38",https://scholar.google.com/scholar?oi=bibs&hl=en&cites=3137267538126191088,1,2003
Geometric configuration and properties of methane series,"C Lu, W Chen, J Liao, H Wang, X Wang, Y Sun","CHINESE JOURNAL OF COMPUTATIONAL PHYSICS 20 (1), 88-90",https://scholar.google.com/scholar?oi=bibs&hl=en&cites=8289279307040692376,1,2003
Optical and electrical characterizations of ZnSe self-organized quantum dots grown by molecular beam epitaxy,"LW Lu, ZG Wang","Acta Physica Sinica 51 (2), 310-314",https://scholar.google.com/scholar?oi=bibs&hl=en&cites=9641423755437455193,1,2002
Effects of N-Desulfated Heparin on Liver Ischemia and Reperfusion Injury in Rats,"JH CHEN, T ZHOU, F WANG",Acta Universitatis Medicinalis Secondae Shanghai 3,https://scholar.google.com/scholar?oi=bibs&hl=en&cites=1344255393163481497,1,2002
Study on the Motivations of the Female Participants [J],"Q TAO, J WANG",Journal of Nanjing Institute of Physical Education (Social Science) 4,https://scholar.google.com/scholar?oi=bibs&hl=en&cites=15183365654944493833,1,2002
Influence of focal adhesion kinase (FAK) on the biological behaviors of human hepatocellular carcinoma cells,"Y Fang, X Fang, L Wang","Zhonghua zhong liu za zhi [Chinese journal of oncology] 23 (2), 125-127",https://scholar.google.com/scholar?oi=bibs&hl=en&cites=2071864874656564306,1,2001
The combining ability analysis of potato clones on resistance to potato late blight (Phytophthora infestans),"Y Yang, W Luo, E Chujoy, J Wang, W He, Y Wang, Q Zhao, X Zhang","Journal of Shandong Agricultural University 32 (2), 147-151,156",https://scholar.google.com/scholar?oi=bibs&hl=en&cites=3096310429306714704,1,2001
Contribution of the KChIP2 accessory subunit to native ItoK+ channels in canine heart,"B Rosati, S Lypen, ZM Pan, HS Wang, IS Cohen, JE Dixon, D McKinnon","Biophysical Journal 80 (1), 638A-638A",https://scholar.google.com/scholar?oi=bibs&hl=en&cites=4979586302853706678,1,2001
Computer control of surface physics beamline at NSRL,"X Yu, Q Wang, F Xu, H Pan, P Xu","Nuclear Techniques 24 (7), 534-540",https://scholar.google.com/scholar?oi=bibs&hl=en&cites=17360115536051780254,1,2001
Study on the Conversion of Methane to C~ 2 Hydrocarbons through Symmetric Electrical Field Enhancing Catalysis,"BW Wang, GH Xu, HW Sun","Journal of Natural Gas Chemistry 10 (2), 101-109",https://scholar.google.com/scholar?oi=bibs&hl=en&cites=878116540493363656,1,2001
Improvement on the Synthetic Technology of Cotton Fabric Flame-retardant PN,"X Fang, Y Wang, Z Liu","FINE CHEMICALS-DALIAN- 18 (6), 337-338",https://scholar.google.com/scholar?oi=bibs&hl=en&cites=558996953469864960,1,2001
Determination of three principal components in chuanjing tablets by using high performance liquid chromatography,"FM Li, F Qiu, WH Wang, XJ Guo, X Di","Se pu= Chinese journal of chromatography 18 (5), 442-444",https://scholar.google.com/scholar?oi=bibs&hl=en&cites=16959511999544398994,1,2000
The preparation of globular copper (II) template condensation polymer and its behavior of the selective adsorption,"XD Wang, XW He, HS Guo, XS Wang, FX Li, BS Wang","CHINESE JOURNAL OF ANALYTICAL CHEMISTRY 28 (7), 805-809",https://scholar.google.com/scholar?oi=bibs&hl=en&cites=4422753471262869797,1,2000
Acute pancreatitis associated with temporal lobectomy and intractable seizure.,"TT Liu, CC Chen, YH Yang, SS Wang, FY Chang, SD Lee","Zhonghua yi xue za zhi= Chinese medical journal; Free China ed 63 (3), 226-229",https://scholar.google.com/scholar?oi=bibs&hl=en&cites=4203509626767617713,1,2000
Biopanning of HGV E2 antigen epitope from a phage-displayed random 6 peptides library,"S Ke, Z Qi, M Shi, Z Yao, B Shen","Chinese journal of biochemistry and molecular biology 16 (4), 533-536",https://scholar.google.com/scholar?oi=bibs&hl=en&cites=4181035013339715333,1,2000
alpha and beta ryanodine receptor isoforms of frog skeletal muscle display no obvious functional difference in their response to Ca2+ and imperatoxin A,"JL Wang, O Fuentes, XS Zhu, HH Valdivia","BIOPHYSICAL JOURNAL 78 (1), 425A-425A",https://scholar.google.com/scholar?oi=bibs&hl=en&cites=381793585545629296,1,2000
Hepatocellular carcinoma presenting as a pyogenic liver abscess in a patient with hemochromatosis.,"YH Yang, CC Chen, JH Chiang, SP Kung, SH Tsay, SS Wang, FY Chang, ...","Zhonghua yi xue za zhi= Chinese medical journal; Free China ed 63 (1), 53-57",https://scholar.google.com/scholar?oi=bibs&hl=en&cites=12341170356588492644,1,2000
Public attitudes regarding the donation and storage of blood specimens for genetic research.,"S Wang, F Fridinger, KA Sheedy, H Linnan, MJ Khoury","American Journal of Human Genetics 65 (4), A411-A411",https://scholar.google.com/scholar?oi=bibs&hl=en&cites=6312678702025530374,1,1999
Dynamic changes of neurotrophic factors in different cerebral areas after full cerebral ischemia and reperfusion in old rats,"A Li, J Yao, C Song, Y Wang, S Wang","Zhonghua nei ke za zhi 38 (9), 619-621",https://scholar.google.com/scholar?oi=bibs&hl=en&cites=9366999123818081039,1,1999
Effects of chronic exposure to angiotensin on i (to) and Kv4. 3.,"H Yu, H Wang, R Wymore, D McKinnon, J Gao, IS Cohen","BIOPHYSICAL JOURNAL 74 (2), A158-A158",https://scholar.google.com/scholar?oi=bibs&hl=en&cites=9808546080015579188,1,1998
Investigation on Capillary Electrochromatographic Retention Behavior of Several Aromatic Compounds on Cyanopropyl-Bonded Phase,"W Wei, Y Wang, G Luo, Y Zhou, H You, C Yan","CHINESE JOURNAL OF CHROMATOGRAPHY 16, 520-522",https://scholar.google.com/scholar?oi=bibs&hl=en&cites=182195163993926014,1,1998
Study on volatile oil of Artemisia macilenta and its mosquito repelling effect,"Y Wen, B Wang","Chinese Bulletin of Botany 15 (1), 76-77",https://scholar.google.com/scholar?oi=bibs&hl=en&cites=2143404558354095758,1,1998
On almost periodic solutions of a higher order almost periodic system,王全义,"微分方程年刊: 英文版, 296-303",https://scholar.google.com/scholar?oi=bibs&hl=en&cites=5058943671224010257,1,1997
Cloning and characterization of the Kv4. 3 channel: A candidate for the transient outward current in dog and human heart.,"JE Dixon, WM Shi, HS Wang, C McDonald, HG Yu, RS Wymore, IS Cohen, ...","Circulation 94 (8), 29-29",https://scholar.google.com/scholar?oi=bibs&hl=en&cites=13103861795828445710,1,1996
Pd/Zn/Pd ohmic contact to p-InP,"MH Park, LC Wang, JY Cheng, F Deng, SS Lau, CJ Palmstrom",Proceedings of 8th International Conference on Indium Phosphide and Related …,https://scholar.google.com/scholar?oi=bibs&hl=en&cites=12638124133478715931,1,1996
Study on the Reaction of Covalent Hydride with Mercury. II. A Highly Sensitive Method for the Determination of Trace Amounts of Bismuth,"W Shi, B Wang","JOURNAL OF INSTRUMENTAL ANALYSIS 13, 95-95",https://scholar.google.com/scholar?oi=bibs&hl=en&cites=15645767281762577485,1,1994
Two-Stage Actuation Control System for CNC Contouring Systems,"O Masory, J Wang","1992 American Control Conference, 375-378",https://scholar.google.com/scholar?oi=bibs&hl=en&cites=10609230866460149261,1,1992
A Frame-based Representation for the Design of Sheet Metal Parts,"J WANG, W Wilson",Transactions of the North American Manufacturing Research Institution of SME …,https://scholar.google.com/scholar?oi=bibs&hl=en&cites=3092442352151169298,1,1991
The mechanism of superconductivity for ternary oxide superconductor,"BL GU, J WANG, YM LOU, YM TAO","Science in China Series A-Mathematics, Physics, Astronomy & Technological …",https://scholar.google.com/scholar?oi=bibs&hl=en&cites=2224699117968698876,1,1987
Approaches to effective use of Facebook for teaching and learning,"Q Wang, HL Woo, CL Quek","Hangzhou, China: Proceedings of 15th Global Chinese Conference on Computers …",https://scholar.google.com/scholar?oi=bibs&hl=en&cites=296360051655315783,1,0
Experimental study of perforated-wall rotating detonation combustors,"H Wen, B Wang","Combustion and Flame 213, 52-62",,0,2020
Effects of eddy shocklets on the segregation and evaporation of droplets in highly compressible shear layers,"Z Ren, B Wang, F Zhang, L Zheng","AIP Advances 9 (12), 125101",,0,2019
Modeling and analysis of triggering pulse to thermoacoustic instability in an end-burning-grain model solid rocket motor,"S Ji, B Wang","Aerospace Science and Technology 95, 105409",,0,2019
Estimated number of adult survivors of childhood cancer in United States with cancer‐predisposing germline variants,"CL Wilson, Z Wang, Q Liu, MJ Ehrhardt, R Mostafavi, J Easton, H Mulder, ...",Pediatric blood & cancer,,0,2019
Childhood Sexual Coercion and Increased Risk for Illicit Drug Use in US Women–Findings from 2011-2017 National Survey of Family Growth Data,"S Wang, J Luo, K Hawkes, C Rivers, C Porter, H Fu",APHA's 2019 Annual Meeting and Expo (Nov. 2-Nov. 6),,0,2019
Sexual Coercion is Associated with Elevated Risks for Illicit Drug Use and Sexually Transmitted Infection in Men who have Sex Men,"C Porter, C Rivers, K Hawkes, N Holt, J Luo, S Wang, H Fu",APHA's 2019 Annual Meeting and Expo (Nov. 2-Nov. 6),,0,2019
Racial Disparities in Pre-Pregnancy Obesity and Gestational Diabetes in Virginia Mothers-Results from 2009-2016 Pregnancy Risk Assessment Monitoring System Data,"K Hawkes, C Rivers, S Wang, C Porter, K Smith, H Fu",APHA's 2019 Annual Meeting and Expo (Nov. 2-Nov. 6),,0,2019
Flavipesines A and B and Asperchalasines E–H: Cytochalasans and Merocytochalasans from ,"X Zhang, L Yang, W Wang, Z Wu, J Wang, W Sun, XN Li, C Chen, H Zhu, ...","Journal of natural products 82 (11), 2994-3001",,0,2019
Distance Learners' Learning Experience and Perceptions on the Design and Implementation of an Online Flipped Classroom Learning Model,"F Shu, C Zhao, Q Wang, Y Huang, H Li, D Wu",2019 Eighth International Conference on Educational Innovation through …,,0,2019
Inherited variants at 3q13. 33 and 3p24. 1 are associated with risk of diffuse large B-cell lymphoma and implicate immune pathways,"G Kleinstern, H Yan, MAT Hildebrandt, J Vijai, SI Berndt, H Ghesquières, ...",Human molecular genetics,,0,2019
Norcepharadione B attenuates H,"X Jia, Y Liu, X Li, C Huo, D Li, R Xu, L Hou, X Wang","Experimental Biology and Medicine, 1535370219881358",,0,2019
Studies of Reynolds stress and the turbulent generation of edge poloidal flows on the HL-2A tokamak,"T Long, PH Diamond, M Xu, R Ke, L Nie, B Li, ZH Wang, JQ Xu, XR Duan","Nuclear Fusion 59 (10), 106010",,0,2019
Genetic overlap between autoimmune diseases and non‐Hodgkin lymphoma subtypes,"L Din, M Sheikh, N Kosaraju, KE Smedby, S Bernatsky, SI Berndt, ...",Genetic epidemiology,,0,2019
Bisdemethoxycurcumin Protection of Cardiomyocyte Mainly Depends on Nrf2/HO-1 Activation Mediated by the PI3K/AKT Pathway,"X Li, C Huo, Y Xiao, R Xu, Y Liu, X Jia, X Wang","Chemical research in toxicology 32 (9), 1871-1879",,0,2019
Room Geometry Reconstruction Based on Speech and Acoustic Image Methodology,"X Song, M Wang, H Qiu",2019 IEEE International Conference on Smart Internet of Things (SmartIoT …,,0,2019
Promoting and Monitoring Cognitive Engagement of Online Students in Blended Synchronous Learning,Q Wang,"EdMedia+ Innovate Learning, 1685-1689",,0,2019
"The association between HLA and non-Hodgkin lymphoma subtypes, among a transplant-indicated population","C Zhong, L Gragert, M Maiers, BT Hill, J Garcia-Gomez, K Gendzekhadze, ...","Leukemia & Lymphoma, 1-10",,0,2019
Host genetic variation in tumor necrosis factor and nuclear factor-κB pathways and overall survival in mantle cell lymphoma: A discovery and replication study.,"Y Wang, TM Habermann, SS Wang, MJ Maurer, V Sarangi, BK Link, ...","American journal of hematology 94 (6), E153",,0,2019
Theoretical and numerical studies on shock reflection at water/air two-phase interface: Fast-slow case,"G Xiang, B Wang","International Journal of Multiphase Flow 114, 219-228",,0,2019
Aspirin Reduces Long Term Stroke Risk in Women with Prior Hypertensive Disorders of Pregnancy (S35. 005),"E Miller, A Boehme, N Chung, S Wang, J Lacey, K Lakshminarayan, ...","Neurology 92 (15 Supplement), S35. 005",,0,2019
Numerical study of influence of J× B force on melt layer under conditions relevant to ITER ELMs,"Y Huang, JZ Sun, J Cai, ZY Sun, CF Sang, DZ Wang","Chinese Physics B 28 (4), 045201",,0,2019
An Subarea Localization Algorithm based on Combination Features using Representative Audio Fingerprint,"M Wang, K Li, L Luo, X Song, Z Zhou, H Qin",2019 IEEE International Conference on Artificial Intelligence and Computer …,,0,2019
China’s technological achievements on ITER enhanced heat flux first wall in the pre-PA qualification,"K Wang, J Chen, P Wang, X Liu, L Bao, R Raffray, V Barabash, Z Wang, ...",Fusion Engineering and Design,,0,2019
Thrust control strategy based on the minimum combustor inlet Mach number to enhance the overall performance of a scramjet engine,"Z Ji, H Zhang, B Wang","Proceedings of the Institution of Mechanical Engineers, Part G: Journal of …",,0,2019
Molecular Phylogeographic Analyses and Species Delimitations Reveal ,"H LI, L KONG, K WANG, S ZHANG, M MOTOKAWA, Y WU, W WANG, Y LI",Integrative zoology,,0,2019
Auditory Scene Analysis-based Feature Extraction for Indoor Subarea Localization Using Smartphones,"X Song, M Wang, H Qiu, K Li, C Ang",IEEE Sensors Journal,,0,2019
Genetic variation near CXCL12 is associated with susceptibility to HIV-related non-Hodgkin lymphoma,"CW Thorball, T Oudot-Mellakh, C Hammer, FA Santoni, J Niay, ...","medRxiv, 19011999",,0,2019
What’s on Your Mind? Promoting Cognitive Engagement Using Utterance Annotations in Online Collaborative Learning,"L Yang, Q Wang",,,0,2019
Analysis of Temporal Characteristics of Collaborative Knowledge Construction in Teacher Workshops,"N Zhang, Q Liu, J Zhu, Q Wang, K Xie","Technology, Knowledge and Learning, 1-14",,0,2019
"Fusaresters A–E, new γ-pyrone-containing polyketides from fungus Fusarium sp. Hungcl and structure revision of fusariumin D","J Gong, C Chen, S Mo, J Liu, W Wang, Y Zang, H Li, C Chai, H Zhu, Z Hu, ...",Organic & biomolecular chemistry,,0,2019
Mitigation of ELMs by Electrostatic Field in Tokamaks,"Z Wang, X Chen, Y Yan, H Li, Q Liu, M Mou, N Wu, Z Wang, R Ke, L Nie, ...","Journal of High Energy Physics, Gravitation and Cosmology 5 (01), 149",,0,2018
Diagnosing-Based Mixed/Sources Localization With Unknown Sensor Defect Arrays,"J Xu, B Wang, J Kong, D Li, F Hu","2018 IEEE International Conference on Communication Systems (ICCS), 40-44",,0,2018
Pregnancy‐related factors and risk of B‐cell non‐Hodgkin lymphoma among women in Los Angeles,"J Luo, SS Wang, Y Lu, J Sullivan‐Halley, W Cozen, H Ma, L Bernstein",British journal of haematology,,0,2018
Polygenic Risk Score in Follicular Lymphoma Risk and Prognosis in a Population-Based Case-Control Study in Los Angeles County,"C Zhong, J Luo, CR Chao, S Neuhausen, JY Song, DD Weisenburger, ...","Blood 132 (Suppl 1), 2296-2296",,0,2018
Anthropometric Traits and Risk of Non-Hodgkin Lymphoma (NHL) and Major NHL Subtypes: A Pooled Prospective Analysis,"BM Birmann, K Wang, KA Bertrand, CR Chao, EL Deubler, SS Wang, ...","Blood 132 (Suppl 1), 2972-2972",,0,2018
Precision Medicine for Sickle Cell Disease through Whole Genome Sequencing,"E Rampersaud, LE Palmer, JS Hankins, VA Sheehan, W Bi, H Mulder, ...","Blood 132 (Suppl 1), 3641-3641",,0,2018
Energy Accumulating Based Wireless Information and Power Transfer,"J Hou, F Hu, B Wang, Z Chang","2018 IEEE 23rd International Conference on Digital Signal Processing (DSP), 1-5",,0,2018
Modeling of fuel retention and hydrogen-isotope exchange removal from the pre-damaged tungsten material,"Z Wang, C Sang, M Chang, S Liu, D Wang","Fusion Engineering and Design 136, 372-376",,0,2018
Clinical implication and viral mutation in basal core promoter/pre-core of hepatitis B virus C/D recombinant,"H Li, Q She, Y Liu, Y Ding, S Shi, J Li, H Wu, Z Wang","Hepatology international 12 (5), 447-455",,0,2018
Triple Probe Error Evaluation Caused by Spatial Separation in the HL-2A Tokamak,"G Dong, R Ke, L Nie, M Xu, Z Wang, T Long, Y Wu, B Yuan, S Gong","IEEE Transactions on Plasma Science 46 (9), 3214-3218",,0,2018
"Cover Image, Volume 90, Number 7, July 2018","H Deng, X Deng, Y Liu, Y Xu, Y Lan, M Gao, M Xu, H Gao, X Wu, B Liao, ...","Journal of Medical Virology 90 (7), i-i",,0,2018
An Enhanced Paradigm for Cognitive Cooperation Networks: Two-to-One Energy and Spectrum Dual-Cooperation,"Z Liu, W Xu, J Wang, T Dong, H Qiu","Sensors 18 (7), 2085",,0,2018
Structure and evolution of double minutes in a pediatric high-grade glioma,"KC Xu, L Ding, TC Chang, S Wang, YD Wang, H Mulder, Y Shao, ...","Cancer Research 78 (13 Supplement), 1181-1181",,0,2018
Deep-Coverage Whole-Genome Sequencing of Childhood Cancer Survivors Exposed to Alkylating Agents Identifies a Locus Near TAC1/ASNS for Decreased Sperm Concentration and …,"Y Sapkota, CL Wilson, W Moon, L Lu, Q Liu, S Wang, Z Wang, G Wu, ...",,,0,2018
Preeclampsia and Early Stroke Incidence in the California Teachers Study,"EC Miller, AK Boehme, Y Park Moon, YKK Cheung, NT Chung, SS Wang, ...","Stroke 49 (Suppl_1), A174-A174",,0,2018
Design of an interactive online learning environment,"Q Wang, CL Quek",National Institute of Education (Singapore),,0,2018
Bacteria endocarditis consolidation with vertebra bone tuberculosis: a case report,"Y Liu, X Wang, Z Wang, Y Zhu, L Zhang, X Li, R Xu, W Ge","BMC infectious diseases 17 (1), 38",,0,2017
Physics of neutral gas jet interaction with magnetized plasmas,"Z Wang, X Xu, P Diamond, M Xu, X Duan, D Yu, Y Zhou, Y Shi, L Nie, ...",Bulletin of the American Physical Society 62,,0,2017
A new linear plasma device for various edge plasma studies at SWIP,"M Xu, P Zheng, G Tynan, T Che, Z Wang, D Guo, R Wei",APS Meeting Abstracts,,0,2017
Joint Range and DOA Estimation for Near-Field Signals with a Few Snapshots,"B Wang, Z Yao, D Liu, Y Shi","International Conference in Communications, Signal Processing, and Systems …",,0,2017
Numerical Investigation of a Planar Shock Wave Interacting with an Acentric Water Ring,"G Xiang, B Wang","International Symposium on Shock Waves, 551-560",,0,2017
Instabilities of Rotating Detonation,"H Wen, Q Xie, B Wang","International Symposium on Shock Waves, 301-310",,0,2017
Microstructure and Microhardness of a Laser Additive Forming Repaired Steam Turbine Blade,"X Zhang, T Liu, S Wang, C Jiang","Chinese Materials Conference, 379-385",,0,2017
Host Genetic Variation in the TNF and NF-ĸB Pathways and Prognosis in Mantle Cell Lymphoma: An Analysis of Two Studies,"Y Wang, TM Habermann, SS Wang, MJ Maurer, BK Link, AL Feldman, ...",,,0,2017
Complete mitochondrial genome of maritime striped squirrel ,"H Cong, L Kong, M Motokawa, W Wang, Y Li","Mitochondrial DNA Part A 28 (2), 240-241",,0,2017
埃博霉素 B 抑制脊髓损伤后瘢痕形成的机制,"W Zhao, Y Chai, Y Hou, D Wang, J Xing, C Yang, Q Fang","中国神经再生研究 (英文版) 12 (3), 478-485",,0,2017
Abstract 53,"J Willey, J Voutsinas, A Sherzai, S Wang, L Bernstein, M Elkind, ...",Stroke 48 (Suppl_1),,0,2017
Changes in Physical Activity and Risk of Stroke in the California Teachers Study,"JZ Willey, J Voutsinas, A Sherzai, SS Wang, L Bernstein, MS Elkind, ...","Stroke 48 (suppl_1), A53-A53",,0,2017
Clinical Sciences,"JZ Willey, J Voutsinas, A Sherzai, H Ma, L Bernstein, MSV Elkind, ...",,,0,2017
Lupus-related single nucleotide polymorphisms and risk of diffuse large B-cell lymphoma,"A Kricker, HO Adami, D Albanes, E Angelucci, SM Ansell, YW Asmann, ...",BMJ Group,,0,2017
Special Issue on Design for Blended Learning,"Q Wang, H Yu",INTERNATIONAL JOURNAL OF CONTINUING ENGINEERING EDUCATION AND LIFE-LONG …,,0,2017
The Parallel Implementation of Deep Neural Decision Tree Based on Spark,"Z HUANG, J WANG, L ZHENG, J FU",Computer Science and Technology: Proceedings of the International Conference …,,0,2017
Full Length Articles,"P Buckley, E Doyle, S Doyle, WL Chyr, PD Shen, YC Chiang, JB Lin, ...",Journal of Educational Technology & Society 20 (3),,0,2017
Investigating the effect of coopetition designs on students' perceived social support in collaborative learning,"X Wang, Q Wang",International Journal of Social Media and Interactive Learning Environments …,,0,2017
Transition of oblique detonation wave in a two-phase hydrocarbon-air mixture,"Z Ren, B Wang",21st AIAA International Space Planes and Hypersonics Technologies Conference …,,0,2017
Flow Cytometry-Based Detection of Fusion Oncogenes Associated with Hematopoietic Disorders Using Forster Resonance Energy Transfer Probes,"SK Tian, DD Grier, MW Beaty, W Wang","US Patent App. 15/081,255",,0,2016
The Genomic Landscape of Pediatric Myelodysplastic Syndromes,"JR Schwartz, MP Walsh, J Ma, T Lamprecht, S Wang, G Wu, J Easton, ...","Blood 128 (22), 956-956",,0,2016
Using real-time response rates to improve study recruitment: Lessons from the California Teachers Study (CTS) cohort,"K Savage, N Chung, J Benbow, C Clarke, C Duffy, K Barens, ...","APHA 2016 Annual Meeting & Expo (Oct. 29-Nov. 2, 2016)",,0,2016
