Title,Authors,Platform,Cited_url,Cited_count,Year
Quantifying Surface Roughness Effects on Phonon Transport in Silicon Nanowires,"J Lim, K Hippalgaonkar, SC Andrews, A Majumdar, P Yang",Nano Letters,https://scholar.google.com/scholar?oi=bibs&hl=en&cites=14524235508487107891,269,2012
Anisotropic in-plane thermal conductivity of black phosphorus nanoribbons at temperatures higher than 100K,"S Lee, F Yang, J Suh, S Yang, Y Lee, G Li, HS Choe, A Suslu, Y Chen, ...",Nature Communications 6,https://scholar.google.com/scholar?oi=bibs&hl=en&cites=3914508911341669554,202,2015
Large Thermoelectric Figure-of-Merits from SiGe Nanowires by Simultaneously Measuring Electrical and Thermal Transport Properties,C Yu,Nano Letters,https://scholar.google.com/scholar?oi=bibs&hl=en&cites=1722764800017414154,168,2012
Fabrication of microdevices with integrated nanowires for investigating low-dimensional phonon transport,"K Hippalgaonkar, B Huang, R Chen, K Sawyer, P Ercius, A Majumdar","Nano letters 10 (11), 4341-4348",https://scholar.google.com/scholar?oi=bibs&hl=en&cites=15204676803849129711,147,2010
Anomalously low electronic thermal conductivity in metallic vanadium dioxide,"S Lee, K Hippalgaonkar, F Yang, J Hong, C Ko, J Suh, K Liu, K Wang, ...","Science 355 (6323), 371-374",https://scholar.google.com/scholar?oi=bibs&hl=en&cites=500164955917503479,137,2017
Temperature-Gated Thermal Rectifier for Active Heat Flow Control,"J Zhu, K Hippalgaonkar, S Shen, K Wang, Y Abate, S Lee, J Wu, X Yin, ...","Nano letters 14 (8), 4867-4872","https://scholar.google.com/scholar?oi=bibs&hl=en&cites=14196804603321683188,7013506435233385443",84,2014
High thermoelectric power factor in two-dimensional crystals of ,"K Hippalgaonkar, Y Wang, Y Ye, DY Qiu, H Zhu, Y Wang, J Moore, ...","Physical Review B 95 (11), 115407","https://scholar.google.com/scholar?oi=bibs&hl=en&cites=15704715931829651798,9992387666812294996",79,2017
Axially Engineered Metal-Insulator Phase Transition by Graded Doping VO2 Nanowires,"S Lee, C Cheng, H Guo, K Hippalgaonkar, K Wang, J Suh, K Liu, J Wu",Journal of the American Chemical Society,https://scholar.google.com/scholar?oi=bibs&hl=en&cites=18369717586052258298,76,2013
Li‐Ion Batteries: Multifunctional 0D–2D Ni,"ZZ Luo, Y Zhang, C Zhang, HT Tan, Z Li, A Abutaha, XL Wu, Q Xiong, ...",Advanced Energy Materials 7 (2),,64,2017
Multifunctional 0D–2D Ni,"ZZ Luo, Y Zhang, C Zhang, HT Tan, Z Li, A Abutaha, XL Wu, Q Xiong, ...","Advanced Energy Materials 7 (2), 1601285",https://scholar.google.com/scholar?oi=bibs&hl=en&cites=8166629391560247373,64,2017
Observation of anisotropy in thermal conductivity of individual single-crystalline bismuth nanowires.,"JW Roh, K Hippalgaonkar, JH Ham, R Chen, MZ Li, P Ercius, A Majumdar, ...","ACS nano 5 (5), 3954-3960",https://scholar.google.com/scholar?oi=bibs&hl=en&cites=13633524936402816406,64,2011
2D black phosphorus for energy storage and thermoelectric applications,"Y Zhang, Y Zheng, K Rui, HH Hng, K Hippalgaonkar, J Xu, W Sun, J Zhu, ...","Small 13 (28), 1700661",https://scholar.google.com/scholar?oi=bibs&hl=en&cites=14622987497839733871,60,2017
Thermal Conductance of the 2D MoS2/h-BN and graphene/h-BN Interfaces,"Y Liu, ZY Ong, J Wu, Y Zhao, K Watanabe, T Taniguchi, D Chi, G Zhang, ...","Scientific Reports 7, 43886",https://scholar.google.com/scholar?oi=bibs&hl=en&cites=16262118367705334631,41,2017
Second-Harmonic Generation from Sub-5 nm Gaps by Directed Self-Assembly of Nanoparticles onto Template-Stripped Gold Substrates,"Z Dong, M Asbahi, J Lin, D Zhu, YM Wang, K Hippalgaonkar, HS Chu, ...","Nano letters 15 (9), 5976-5981",https://scholar.google.com/scholar?oi=bibs&hl=en&cites=5229572279792482537,41,2015
"Accelerating materials development via automation, machine learning, and high-performance computing","JP Correa-Baena, K Hippalgaonkar, J van Duren, S Jaffer, ...","Joule 2 (8), 1410-1420",https://scholar.google.com/scholar?oi=bibs&hl=en&cites=6277606941104905396,25,2018
Crystalline polymer nanofibers with ultra-high strength and thermal conductivity,"R Shrestha, P Li, B Chatterjee, T Zheng, X Wu, Z Liu, T Luo, S Choi, ...","Nature communications 9 (1), 1664",https://scholar.google.com/scholar?oi=bibs&hl=en&cites=3428915115081359975,22,2018
n‐Type SnSe,"Y Luo, Y Zheng, Z Luo, S Hao, C Du, Q Liang, Z Li, KA Khor, ...","Advanced Energy Materials 8 (8), 1702167",https://scholar.google.com/scholar?oi=bibs&hl=en&cites=62600934895138893,17,2018
Ultralow Thermal Conductivity of Single‐Crystalline Porous Silicon Nanowires,"Y Zhao, L Yang, L Kong, MH Nai, D Liu, J Wu, Y Liu, SY Chiam, WK Chim, ...","Advanced Functional Materials 27 (40), 1702824",https://scholar.google.com/scholar?oi=bibs&hl=en&cites=318055364073254959,16,2017
Enhanced Thermoelectric Performance of PEDOT: PSS Films by Sequential Post‐Treatment with Formamide,"AKK Kyaw, TA Yemata, X Wang, SL Lim, WS Chin, K Hippalgaonkar, J Xu",Macromolecular Materials and Engineering 303 (2),https://scholar.google.com/scholar?oi=bibs&hl=en&cites=9638172261863490875,13,2018
Designing hybrid architectures for advanced thermoelectric materials,"Y Zheng, Y Luo, C Du, B Zhu, Q Liang, HH Hng, K Hippalgaonkar, J Xu, ...","Materials Chemistry Frontiers 1 (12), 2457-2473",https://scholar.google.com/scholar?oi=bibs&hl=en&cites=1454477889501093254,13,2017
Polymer morphology and interfacial charge transfer dominate over energy-dependent scattering in organic-inorganic thermoelectrics,"P Kumar, EW Zaia, E Yildirim, DVM Repaka, SW Yang, JJ Urban, ...","Nature Communications 9 (1), 5347",https://scholar.google.com/scholar?oi=bibs&hl=en&cites=1640186784037857421,12,2018
Full‐Parameter Omnidirectional Thermal Metadevices of Anisotropic Geometry,"T Han, P Yang, Y Li, D Lei, B Li, K Hippalgaonkar, CW Qiu","Advanced Materials 30 (49), 1804019",https://scholar.google.com/scholar?oi=bibs&hl=en&cites=7970980088352557105,11,2018
Effect of dimensionality on thermoelectric powerfactor of molybdenum disulfide,"HK Ng, D Chi, K Hippalgaonkar","Journal of Applied Physics 121 (20), 204303",https://scholar.google.com/scholar?oi=bibs&hl=en&cites=14529268019623265624,11,2017
Perspectives on Thermoelectricity in Layered and 2D Materials,"J Wu, Y Chen, J Wu, K Hippalgaonkar","Advanced Electronic Materials 4 (12), 1800248",https://scholar.google.com/scholar?oi=bibs&hl=en&cites=15645409796967188343,10,2018
Poly (nickel-ethylenetetrathiolate) and Its Analogs: Theoretical Prediction of High-Performance Doping-Free Thermoelectric Polymers,"W Shi, G Wu, K Hippalgaonkar, JS Wang, J Xu, SW Yang","Journal of the American Chemical Society 140 (41), 13200-13204",https://scholar.google.com/scholar?oi=bibs&hl=en&cites=4600943084667740296,9,2018
Minimizing Isolate Catalyst Motion in Metal-Assisted Chemical Etching for Deep Trenching of Silicon Nanohole Array,"L Kong, Y Zhao, B Dasgupta, Y Ren, K Hippalgaonkar, X Li, WK Chim, ...","ACS applied materials & interfaces 9 (24), 20981-20990",https://scholar.google.com/scholar?oi=bibs&hl=en&cites=13768615129004472507,9,2017
"Machine Learning for Novel Thermal-Materials Discovery: Early Successes, Opportunities, and Challenges","H Zhang, K Hippalgaonkar, T Buonassisi, OM Løvvik, E Sagvolden, ...",arXiv preprint arXiv:1901.05801,"https://scholar.google.com/scholar?oi=bibs&hl=en&cites=16101205645355944575,1758535048782242314,17716432327570165907",6,2019
Probing the Physical Origin of Anisotropic Thermal Transport in Black Phosphorus Nanoribbons,"Y Zhao, G Zhang, MH Nai, G Ding, D Li, Y Liu, K Hippalgaonkar, CT Lim, ...","Advanced Materials 30 (50), 1804928",https://scholar.google.com/scholar?oi=bibs&hl=en&cites=17921565374728194252,6,2018
Graph Convolutional Neural Networks for Polymers Property Prediction,"M Zeng, JN Kumar, Z Zeng, R Savitha, VR Chandrasekhar, ...",arXiv preprint arXiv:1811.06231,"https://scholar.google.com/scholar?oi=bibs&hl=en&cites=2278178910587181075,1471092739588075163",6,2018
"New horizons in thermoelectric materials: Correlated electrons, organic transport, machine learning, and more","JJ Urban, AK Menon, Z Tian, A Jain, K Hippalgaonkar","Journal of Applied Physics 125 (18), 180902",https://scholar.google.com/scholar?oi=bibs&hl=en&cites=11387580891364401281,2,2019
Tunable thermal conductivity in mesoporous silicon by slight porosity change,"JH Seol, DS Barth, J Zhu, D Ćoso, K Hippalgaonkar, J Lim, J Han, ...","Applied Physics Letters 111 (6), 063104",https://scholar.google.com/scholar?oi=bibs&hl=en&cites=6716661636349560146,2,2017
Employing a Bifunctional Molybdate Precursor To Grow the Highly Crystalline MoS,"SW Tong, H Medina, W Liao, J Wu, W Wu, J Chai, M Yang, A Abutaha, ...","ACS applied materials & interfaces 11 (15), 14239-14248",https://scholar.google.com/scholar?oi=bibs&hl=en&cites=5591099886965361207,1,2019
Effects Of Structural Phase Transition On Thermoelectric Performance in Lithium-Intercalated Molybdenum Disulfide (Li,"HK Ng, A Abutaha, D Voiry, I Verzhbitskiy, Y Cai, G Zhang, Y Liu, J Wu, ...","ACS applied materials & interfaces 11 (13), 12184-12189",https://scholar.google.com/scholar?oi=bibs&hl=en&cites=14455121815956975164,1,2019
Kondo Impurities in Two Dimensional MoS2 for Achieving Ultrahigh Thermoelectric Powerfactor,"J Wu, Y Liu, Y Liu, Y Cai, Y Zhao, HK Ng, K Watanabe, T Taniguchi, ...",arXiv preprint arXiv:1901.04661,https://scholar.google.com/scholar?oi=bibs&hl=en&cites=982882208056861364,1,2019
Predicting thermoelectric properties from crystal graphs and material descriptors-first application for functional materials,"L Laugier, D Bash, J Recatala, HK Ng, S Ramasamy, CS Foo, ...",arXiv preprint arXiv:1811.06219,,1,2018
Predicting thermoelectric properties from crystal graphs and material descriptors-first application for functional materials,"L Laugier, D Bash, J Recatala, HK Ng, S Ramasamy, CS Foo, ...",arXiv preprint arXiv:1811.06219,https://scholar.google.com/scholar?oi=bibs&hl=en&cites=14069107273667720873,1,2018
High-contrast and reversible polymer thermal regulator by structural phase transition,"R Shrestha, Y Luan, S Shin, T Zhang, X Luo, JS Lundh, W Gong, ...","Science Advances 5 (12), eaax3777",,0,2019
Unprecedented Enhancement of Thermoelectric Power Factor Induced by Pressure in Small‐Molecule Organic Semiconductors,"W Shi, T Deng, G Wu, K Hippalgaonkar, JS Wang, SW Yang","Advanced Materials 31 (36), 1901956",,0,2019
2D Single‐Layer π‐Conjugated Nickel Bis (dithiolene) Complex: A Good‐Electron‐Poor‐Phonon Thermoelectric Material,"T Deng, X Yong, W Shi, CK Gan, W Li, K Hippalgaonkar, JC Zheng, ...","Advanced Electronic Materials 5 (4), 1800892",,0,2019
High Performance Field Effect Transistor based on Large-sized Highly Crystalline MoS,"SW Tong, H Medina, W Liao, C Zhu, K Hippalgaonkar, DZ Chi","2019 Electron Devices Technology and Manufacturing Conference (EDTM), 188-190",,0,2019
Hassle-free Approach to Thermal Transport Measurements Using Spatial-Temporal Temperature Data,"D Ding, K Hippalgaonkar",arXiv preprint arXiv:1903.02708,,0,2019
Inertial effective mass as an effective descriptor for thermoelectrics via data-driven evaluation,"A Suwardi, D Bash, HK Ng, JR Gomez, DVM Repaka, P Kumar, ...","Journal of Materials Chemistry A 7 (41), 23762-23769",,0,2019
Resolving Thermal Conductivity Spectrums through Time-resolved Spatial-Temporal Imaging,"D Ding, K Hippalgaonkar",APS Meeting Abstracts,,0,2019
SYMPOSIUM TP03,"M Chabinyc, T Hendricks, K Hippalgaonkar, S Yee",,,0,2018
Lithography-free resistance thermometry based technique to accurately measure Seebeck coefficient and electrical conductivity for organic and inorganic thin films,"P Kumar, DVM Repaka, K Hippalgaonkar","Review of Scientific Instruments 88 (12), 125112",,0,2017
Experimental Studies of Thermal Transport in Nanostructures,"K Hippalgaonkar, JH Seol, D Xu, D Li","Thermal Transport in Carbon-Based Nanomaterials, 319-357",,0,2017
Tunable Thermal Transport in Polysilsesquioxane (PSQ) Hybrid Crystals,"P Li, S Yang, T Zhang, R Shrestha, K Hippalgaonkar, T Luo, X Zhang, ...","Scientific reports 6, 21452",,0,2016
Thermoelectric Powerfactor and Density of States in 2D MoS2,"K Hippalgaonkar, Y Wang, Y Ye, H Zhu, Y Wang, J Moore, X Zhang",APS Meeting Abstracts,,0,2016
Unusual behaviour of thermal conductivity in vanadium dioxide across the metal-insulator transition,"K Hippalgaonkar, S Lee, C Ko, F Yang, J Suh, K Liu, K Wang, X Zhang, ...",APS March Meeting Abstracts,,0,2016
High Powerfactor in single and few-layer MoS2,"Y Wang, Y Ye, K Hippalgaonkar, Y Wang, X Zhang",APS March Meeting Abstracts,,0,2015
Using morphology and structure to tune solid-state thermal properties,K Hippalgaonkar,University of California Berkeley,,0,2013
Phonon Transport in one-dimensional Silicon Nanowires,"K Hippalgaonkar, J Tang, R Chen, B Huang, K Sawyer, P Ercius, P Yang, ...",APS Meeting Abstracts,,0,2010
Ultralow thermal conductivity in Electrolessly Etched (EE) Silicon Nanowires,"K Hippalgaonkar, R Chen, B Budaev, J Tang, S Andrews, P Murphy, ...",APS Meeting Abstracts,,0,2009
Room temperature observation of point defect on gold surface using thermovoltage mapping,"A Roy, CM Tan, SJ O’Shea, K Hippalgaonkar, W Hofbauer","Microelectronics Reliability 47 (9-11), 1580-1584",,0,2007
Thermal and Thermoelectric Physics in 2D MoS2,K Hippalgaonkar,,,0,0
Supplementary Information for Thermal Conductance of the 2D MoS2/h-BN and graphene/h-BN Interfaces,"Y Liu, ZY Ong, J Wu, Y Zhao, K Watanabe, T Taniguchi, D Chi, G Zhang, ...",,,0,0
