Title,Authors,Platform,Cited_url,Cited_count,Year
Scintillation optimization of linear Gaussian beam array propagating through weak turbulence,"H Tang, X Yuan, B Wang","Journal of Modern Optics 60 (20), 1830-1837",https://scholar.google.com/scholar?oi=bibs&hl=en&cites=14236128930536287960,3,2013
Parallel multisplitting two-stage iterative methods with general weighting matrices for non-symmetric positive definite systems,"CL Wang, GY Meng","Applied Mathematics Letters 26 (11), 1065-1069",https://scholar.google.com/scholar?oi=bibs&hl=en&cites=10884832168943044453,3,2013
The Dehydration of Methanol to Dimethyl Ether over a Novel Solid Acid-base Catalyst,"B Wang, Y Wen, W Huang","Energy Sources, Part A: Recovery, Utilization, and Environmental Effects 35 …",https://scholar.google.com/scholar?oi=bibs&hl=en&cites=3081522703383283580,3,2013
Subcutaneous panniculitis-like T cell lymphoma with mesenteric involvement,"W Wang, TS Pardee, MW Beaty","Journal of Hematopathology 6 (3), 155-159",https://scholar.google.com/scholar?oi=bibs&hl=en&cites=6565988279573910443,3,2013
Multiple periodic oscillations in the radio light curves of NRAO 530,"MJ Xie, JY Wang, T An, L Zheng, X Han","Science China Physics, Mechanics and Astronomy 56 (9), 1798-1805",https://scholar.google.com/scholar?oi=bibs&hl=en&cites=13194530281847920929,3,2013
Characteristics and prognostic factors for head and neck non-Hodgkin's lymphoma in Chinese patients,"J Wang, CP Cai, SF He, SL Wang","The Journal of Laryngology & Otology 127 (7), 699-704",https://scholar.google.com/scholar?oi=bibs&hl=en&cites=17119636042732008725,3,2013
"A novel, risk stratification model using bayesian networks for continuous flow left ventricular assist device 90-day survival","NA Loghmanpour, MK Kanwar, Y Wang, TA Snyder, DA Horstmanshof, ...","The Journal of Heart and Lung Transplantation 32 (4), S232",https://scholar.google.com/scholar?oi=bibs&hl=en&cites=8557562967779060191,3,2013
A kinetic code system to study impurity deposition and fuel retention in gaps between divertor tiles,"S Dai, C Sang, J Sun, D Wang","Contributions to Plasma Physics 52 (4), 309-316",https://scholar.google.com/scholar?oi=bibs&hl=en&cites=11362969380389978028,3,2012
Relationship between Helicobacter pylori infection and coronary artery disease,"Y CHUAI, H SONG, M XUE, X NING, Z HE, Y LI, X WANG",Chinese Heart Journal 1,https://scholar.google.com/scholar?oi=bibs&hl=en&cites=14401692888447147224,3,2012
Analysis of organic carbon storage and characteristics of China's peatlands.,"ZG Liu, M Wang, XH Ma","China Environmental Science 32 (10), 1814-1819",https://scholar.google.com/scholar?oi=bibs&hl=en&cites=256282445826905935,3,2012
On-road vehicle detection based on color segmentation and tracking using Harris-SIFT,"ZH Zheng, B Wang","Advanced Materials Research 433, 5334-5338",https://scholar.google.com/scholar?oi=bibs&hl=en&cites=2199345575985972545,3,2012
Corrosion and Conversion Film Technology of Magnesium Alloy,"F Wang, TP Xuan, D Meng",Plating & Finishing 8,https://scholar.google.com/scholar?oi=bibs&hl=en&cites=9752765466071257773,3,2012
Comparison of two kinds of intramedullary nails in the treatment of femoral shaft fractures in adults,"C Wei, W Juan, YL Su, Q Zhagn, W Bo, ZY Li, Y Zhang","Chinese medical journal 124 (23), 3900-3905",https://scholar.google.com/scholar?oi=bibs&hl=en&cites=1133672609379446363,3,2011
Chemical constituents from ,"WJ Wang, Y Wang, QW Zhang, XQ Zhang, TT Yang, Y Dai, L Wang, ...","Journal of Asian natural products research 13 (9), 845-850",https://scholar.google.com/scholar?oi=bibs&hl=en&cites=11391179462463596824,3,2011
Electronic Raman spectra in iron-based superconductors with two-orbital model,"HY Lu, D Wang, S Chen, W Wang, PF Gong","Physica C: Superconductivity and its Applications 471 (15-16), 453-457",https://scholar.google.com/scholar?oi=bibs&hl=en&cites=3044947703205778103,3,2011
云克和,于仁波， 孙振秀， 王青民,"肿瘤防治研究 38 (4), 455-457",https://scholar.google.com/scholar?oi=bibs&hl=en&cites=12196003115550031873,3,2011
Unconventional Fulde-Ferrel-Larkin-Ovchinnikov states in spin-orbit coupled condensates: exact results,"Q Han, J Liu, DB Zhang, ZD Wang",arXiv preprint arXiv:1104.0614,https://scholar.google.com/scholar?oi=bibs&hl=en&cites=1118368697117114187,3,2011
Effect of radius of curvature on seismic response of curved bridge,"B Wang, YX Liu","Advanced Materials Research 255, 1261-1265",https://scholar.google.com/scholar?oi=bibs&hl=en&cites=6675811696335769484,3,2011
Clinical effect and safety of Lugua Polypeptide injection in the treatment of rheumatoid arthritis,"Q Tao, Y Xu, D Jin, P Lu, J Wang, W Luo, W Kong, X Yan","Journal of Clinical Orthopaedics 14, 336-8",https://scholar.google.com/scholar?oi=bibs&hl=en&cites=14180815882479739004,3,2011
复合抑制剂对酪氨酸酶活性的相互作用研究,王庆华， 黄演婷， 舒锦华,"中山大学学报自然科学版 50 (4), 91-95",https://scholar.google.com/scholar?oi=bibs&hl=en&cites=8128429814713916487,3,2011
Mobile learning in China,"Y Yang, Q Wang",Mobile information communication technologies adoption in developing …,https://scholar.google.com/scholar?oi=bibs&hl=en&cites=6909559993750998823,3,2011
Characterization of Chinese Beryllium as the Candidate Armor Material of ITER First Wall,"X Liu, JM Chen, JH Wu, NM Zhang, QM Wang, XR Duan, Y Liu, ZH Wang, ...","23rd IAEA Fusion Energy Conference, 11-16",https://scholar.google.com/scholar?oi=bibs&hl=en&cites=15127527084936908965,3,2010
Study on Jujube Pigment Extraction by Microwave Technology [J],"Y XIANG, D WANG",Storage & Process 1,https://scholar.google.com/scholar?oi=bibs&hl=en&cites=7447827529629352369,3,2010
Hydrothermal synthesis of hydroxyapatite whiskers [J],"D MENG, J LIU, L JIANG, F WANG",Journal of Shandong Institute of Light Industry (Natural Science Edition) 3,https://scholar.google.com/scholar?oi=bibs&hl=en&cites=210162332464315582,3,2010
Study on Urban Intersection Traffic State Evaluation Based on Fuzzy Reasoning [J],"C SUN, Y ZHANG, B WANG, J XU",Traffic & Transportation 2,https://scholar.google.com/scholar?oi=bibs&hl=en&cites=5301341056702279100,3,2010
Four-year Efficacy and Safety of Adefovir Dipivoxil for the Treatment of Chronic Hepatitis B [J],"X OU, X WANG, H YOU, J JIA, Y WANG, W DUAN, Y LI, J LI, B WANG",Journal of Capital Medical University 5,https://scholar.google.com/scholar?oi=bibs&hl=en&cites=17320967943415538021,3,2010
The development of the distance education college of East China Normal University: a case study,"L Ye, X Su, H Yan","Campus-Wide Information Systems 26 (2), 108-113",https://scholar.google.com/scholar?oi=bibs&hl=en&cites=4138447689774761135,3,2009
Discussion on characteristics of time-lapse seismic differential waveform of thin oil layer,"D WANG, Z LIU, X CHEN, S WU","Progress in Geophysics 24 (1), 170-175",https://scholar.google.com/scholar?oi=bibs&hl=en&cites=5769987394837090938,3,2009
动物园鸟类肠道寄生虫感染情况调查及治疗效果分析,齐萌， 王强， 黄磊， 菅复春， 张龙现， 宁长申,"中国畜牧兽医, 165-167",https://scholar.google.com/scholar?oi=bibs&hl=en&cites=17367816244309353948,3,2009
"Pyrolysis on crude oil and characteristics of Sha 4 member cracking gas, Dongying depression","S Gao, Y Chen, Y Li, B Wang, C Yin, W Li, X Yang","Natural Gas Geoscience 20, 32-35",https://scholar.google.com/scholar?oi=bibs&hl=en&cites=4790212185637768447,3,2009
Numerical simulation of gas-liquid-solid three-phase flow field in canopy wet desulfurization dust catcher [J],"F WANG, C LI, G ZENG, S LI, D WANG, L ZUO, Y ZHANG",Chemical Engineering (China) 4,https://scholar.google.com/scholar?oi=bibs&hl=en&cites=16015101308822144894,3,2009
Changes of nucleolin expression and cellular localization during HUVEC apoptosis induced by hydrogen peroxide,"HY Wang, XL Liu, BM Jiang",Zhong nan da xue xue bao. Yi xue ban= Journal of Central South University …,https://scholar.google.com/scholar?oi=bibs&hl=en&cites=16317740240352026945,3,2008
Effects of perindopril and enalapril on atherosclerosis development of apolipoprotein E knockout mice,"Q Lu, YN Ke, WL Cheng, Y Wang, CA Yu, JY Wen","Zhonghua xin xue guan bing za zhi 36 (4), 350-354",https://scholar.google.com/scholar?oi=bibs&hl=en&cites=587122764165721074,3,2008
Study on flavor of silkies on feeding medlar [J],"J YUAN, L HAN, P WEN, L ZHAO, X WANG, Y CHENG",Food Science and Technology 5,https://scholar.google.com/scholar?oi=bibs&hl=en&cites=17399549772892370156,3,2008
Analysis and comparison of nutritional components of peacock's eggs [J],"X WANG, F YANG, J YUAN",Food Science and Technology 3,https://scholar.google.com/scholar?oi=bibs&hl=en&cites=16193122568071508070,3,2008
Chronic indomethacin treatment enhances the portal-systemic collateral vascular response to vasopressin in bile-duct ligated rats,"HC Huang, SS Wang, CC Chang, FY Lee, FY Chang, HC Lin, MC Hou, ...","Journal of the Chinese Medical Association 70 (12), 521-526",https://scholar.google.com/scholar?oi=bibs&hl=en&cites=17753818931173116047,3,2007
Synthesis of Mg5 (CO3) 4 (OH) 2• 4H2O with Flower-like Micro-structure and Its Catalytic Activity for Transesterification of Dimethyl Carbonate with Phenol,"W Qiang, K WANG, X WU, S LUO, C HU","Chemical Research in Chinese Universities 23 (6), 641-645",https://scholar.google.com/scholar?oi=bibs&hl=en&cites=5282948867060133189,3,2007
Research of Transformation from Communication Diagram to Petri Net,"Y Sun, B Jiang, H Wang","Journal of System Simulation 19 (1), 104-107",https://scholar.google.com/scholar?oi=bibs&hl=en&cites=11731815715935533481,3,2007
Incomplete SAOR Preconditioning Algorithms for Solving Large Sparse Linear Systems [J],"R WEN, G MENG, C WANG",Chinese Journal of Engineering Mathematics 4,https://scholar.google.com/scholar?oi=bibs&hl=en&cites=11890423514943770536,3,2007
The Effects of Property of Sliding Friction Coefficient and the Rate of Oil on Idesia Polycarpa Var. vestita with Different Moisture Contents [J],"W SHI, J LIU, Y SU, B WANG",Journal of Agricultural Mechanization Research 6,https://scholar.google.com/scholar?oi=bibs&hl=en&cites=4209495020470911863,3,2007
Effect of carbon on microstructures and mechanical properties of Ti-60 high-temperature titanium alloy,"S Zhang, B Wang, Z Liu, Y Gao, R Yang","CHINESE JOURNAL OF MATERIALS RESEARCH 21 (4), 433",https://scholar.google.com/scholar?oi=bibs&hl=en&cites=13982345704192031459,3,2007
A method for 4-D parameter estimation of near-field sources,"Z Huang, S Wang, B Wang","2006 IEEE International Conference on Networking, Sensing and Control, 997-1000",https://scholar.google.com/scholar?oi=bibs&hl=en&cites=7729633607988787387,3,2006
New readout circuit of uncooled infrared focal plane arrays without TEC,"X Chen, X Li, X Yi, S WANG","Infrared and Laser Engineering 35 (5), 551",https://scholar.google.com/scholar?oi=bibs&hl=en&cites=3638984660921316135,3,2006
Optimization of RAPD Conditions of a Rare and Endangered Bamboo of Qiongzhuea tumidinoda [J],"B WANG, S GAO, Q CHEN",Journal of Sichuan Agricultural University 3,https://scholar.google.com/scholar?oi=bibs&hl=en&cites=6599942566611707700,3,2006
The preparation of functional soybean oligosaccharides drink [J],"X GUO, S WANG, C PAN","Science and Technology of Cereals, Oils and Foods 4",https://scholar.google.com/scholar?oi=bibs&hl=en&cites=13192739348347393486,3,2006
Designing an Agent-Based Learning Environment--A Preliminary Study on a Pre-Service Teacher Course.,"HL Woo, Q Wang","New Horizons in Education 52, 39-52",https://scholar.google.com/scholar?oi=bibs&hl=en&cites=10267570679944106816,3,2005
"Non-Hodgkin lymphoma and immune gene polymorphisms: inflammatory cytokines, Th1/Th2 cytokines, innate immunity, chemokines, adhesion molecules, and interferons","SS Wang, P Hartge, JR Cerhan, S Davis, W Cozen, RK Severson, ...","Cancer Research 65 (9 Supplement), 1036-1037",https://scholar.google.com/scholar?oi=bibs&hl=en&cites=2530791281712771976,3,2005
On-line and dual pre-concentration technique for large volume injection in capillary electrophoresis,"Y Li, YZ He, YY Hu, L Wang","CHINESE JOURNAL OF ANALYTICAL CHEMISTRY 33 (2), 248-250",https://scholar.google.com/scholar?oi=bibs&hl=en&cites=11100651037916689850,3,2005
Discrimination on opinions related to vegetation attributes of loess plateau,"W Hansheng, W Qingning","Scientia Silvae Sinicae 41 (5), 149",https://scholar.google.com/scholar?oi=bibs&hl=en&cites=14386156435272428346,3,2005
c-axis textured La2CuO4 thin films prepared by NaClO oxidation: II. Electron microscopic characterization,"CC Wang, H Wang, J Chen, J Zhu","Superconductor Science and Technology 17 (8), 1051",https://scholar.google.com/scholar?oi=bibs&hl=en&cites=12921825858976073034,3,2004
"Investigation on Knowledge, Attitude on Cancer Causes and Control and its Influence Factors in High Cancer Incidence Region [J]","C LI, Y WANG, Y SHU, Q HUANG, L BA, J LIU, C ZHOU, J WANG, ...",Acta Academiae Medicinae Nanjing 5,https://scholar.google.com/scholar?oi=bibs&hl=en&cites=11644206087034759562,3,2004
骨髓成纤维细胞条件培养液对体外巨核系细胞生成的促进作用,周小莹， 黄艳红， 王绮如， 卢光琇， 谭孟群,"中南大学学报 (医学版) 29 (6), 658-661",https://scholar.google.com/scholar?oi=bibs&hl=en&cites=3650480287865663608,3,2004
Management of Service Value [J],"Y SU, B WANG",Industrial Engineering Journal 5,https://scholar.google.com/scholar?oi=bibs&hl=en&cites=18084945012097976034,3,2004
High performance liquid chromatography analysis of chlorophenol compounds in the water environment,R Guohong,环境化学 22 (3),https://scholar.google.com/scholar?oi=bibs&hl=en&cites=6219839391511754611,3,2003
Experimental study of inductive apoptosis of Hep-6 in liver tumor cells line by magnetic nanoparticle encapsulated epirubicin,"OU Shanxing, X Xiao, H Lai, J Xian, J Yang, J Wang, SU Zenggui","Chinese Journal of Tissue Engineering Research 7 (20), 2812-2813",https://scholar.google.com/scholar?oi=bibs&hl=en&cites=1399400148901557547,3,2003
The Analysis for the Comprehensive Benefit of Shanghai Urban Open Spaces [J],"Y HU, L WANG, Q XIAO",Journal of Chinese Landscape Architecture 4,https://scholar.google.com/scholar?oi=bibs&hl=en&cites=9210325299965559272,3,2002
Optimal Scheduling of Multiproduct Batch Chemical Process with Environmental Impact Considerations,"Z Yao, X Yuan, JU Wang","JOURNAL OF CHEMICAL INDUSTRY AND ENGINEERING-CHINA- 53 (2), 167-171",https://scholar.google.com/scholar?oi=bibs&hl=en&cites=11839510334535472765,3,2002
Deepen Reform the Motive Power of Sustainable Development of Landscape Green [J],"Y HU, L WANG, Q XIAO",Journal of Chinese Landscape Architecture 3,https://scholar.google.com/scholar?oi=bibs&hl=en&cites=13526153559366861596,3,2001
Experimental study on factors affecting the probability distribution of discharge striking points,"X Wang, H Zhan, Y Wang, G Qian",High Voltage Engineering Symposium,https://scholar.google.com/scholar?oi=bibs&hl=en&cites=7045743312233574644,3,1999
Multi-channel FIR laser interferometry on the HL-1 tokamak,"ZC Deng, GY Diao, Y Zhou, QC Zhang, DC Lei, XY Liu, ZH Wang, ...","Fusion engineering and design 34, 403-406",https://scholar.google.com/scholar?oi=bibs&hl=en&cites=8935851290479059758,3,1997
牛奶的表观粘度与脂肪含量的相关性研究,王伯初， 杨瑞芳,"食品科学 18 (4), 51-53",https://scholar.google.com/scholar?oi=bibs&hl=en&cites=12245942699308108403,3,1997
Rate-dependent block of maximum velocity of depolarization by Guan-fu base A in guinea pig papilary muscle actio npotentials,季慧芳， 张陆勇， 王秋娟， 刘静涵,中国药理学与毒理学杂志,https://scholar.google.com/scholar?oi=bibs&hl=en&cites=15856344053386516333,3,1997
Thermal properties of wholly aromatic copolyamides and their blends,"MZ Liu, CS Song, S Wang","Thermochimica acta 233 (2), 277-281",https://scholar.google.com/scholar?oi=bibs&hl=en&cites=14356900790163559424,3,1994
α-Fetoprotein and Its Concanavalin A Affinity in Acute Exacerbation of Chronic Hepatitis B.,"SS Wang, S Govindarajan, SD Lee, M Ashcavai",American Journal of Gastroenterology 84 (1),https://scholar.google.com/scholar?oi=bibs&hl=en&cites=7406347619482381350,3,1989
Enhancement of continuously rotating detonation in hydrogen and oxygen-enriched air,"Q Xie, B Wang, H Wen, W He, P Wolanski","Proceedings of the Combustion Institute 37 (3), 3425-3432",https://scholar.google.com/scholar?oi=bibs&hl=en&cites=3560705317083537288,2,2019
Quasi-coherent mode simulation during inter-ELM period in HL-2A,"TF Tang, H Shi, ZH Wang, WL Zhong, TY Xia, XQ Xu, JZ Sun, DZ Wang","Physics of Plasmas 25 (12), 122510",https://scholar.google.com/scholar?oi=bibs&hl=en&cites=422411315540851963,2,2018
Indoor pedestrian self-positioning based on image acoustic source impulse using a sensor-rich smartphone,"X Song, M Wang, H Qiu, L Luo","Sensors 18 (12), 4143",https://scholar.google.com/scholar?oi=bibs&hl=en&cites=16473069722401953916,2,2018
3D modelling of tungsten fuzz growth under the bombardment of helium plasma,"Q Shi, S Dai, D Wang","Fusion Engineering and Design 136, 554-557",https://scholar.google.com/scholar?oi=bibs&hl=en&cites=6978274763208251148,2,2018
Cytologic patterns of cervical adenocarcinomas with emphasis on factors associated with underdiagnosis,"RD Conrad, AH Liu, N Wentzensen, RR Zhang, ST Dunn, SS Wang, ...","Cancer cytopathology 126 (11), 950-958",https://scholar.google.com/scholar?oi=bibs&hl=en&cites=773832133144620512,2,2018
Xanthone-derived polyketides from the thai mangrove endophytic fungus Phomopsis sp. xy21,"HB Hu, YF Luo, P Wang, WJ Wang, J Wu","Fitoterapia 131, 265-271",https://scholar.google.com/scholar?oi=bibs&hl=en&cites=12726538646558088584,2,2018
Anomaly Detection With Subgraph Search and Vertex Classification Preprocessing in Chung-Lu Random Networks,"B Wang, Y Zhao, F Hu, YC Liang","IEEE Transactions on Signal Processing 66 (20), 5255-5268",https://scholar.google.com/scholar?oi=bibs&hl=en&cites=15850045959072818697,2,2018
Numerical investigation on the interaction of planar shock wave with an initial ellipsoidal bubble in liquid medium,"G Xiang, B Wang","AIP Advances 8 (7), 075128",https://scholar.google.com/scholar?oi=bibs&hl=en&cites=18163527394404971623,2,2018
Naturally occurring antiviral drug resistance in HIV patients who are mono‐infected or co‐infected with HBV or HCV in China,"H Deng, X Deng, Y Liu, Y Xu, Y Lan, M Gao, M Xu, H Gao, X Wu, B Liao, ...","Journal of medical virology 90 (7), 1246-1256",https://scholar.google.com/scholar?oi=bibs&hl=en&cites=2081886903092957760,2,2018
Acute Massive Gastrointestinal Bleeding in the Elderly.,"JY Gao, JF Chen, H Su, HY Fang, LP Wu, YJ Han, XM Wang",Journal of the College of Physicians and Surgeons--Pakistan: JCPSP 28 (6 …,https://scholar.google.com/scholar?oi=bibs&hl=en&cites=8152449815756530153,2,2018
The effects of particle recycling on the divertor plasma: A particle-in-cell with Monte Carlo collision simulation,"M Chang, C Sang, Z Sun, W Hu, D Wang","Physics of Plasmas 25 (5), 052507",https://scholar.google.com/scholar?oi=bibs&hl=en&cites=10675376065597906934,2,2018
Utilization of Nonthermal Plasma in Pulse Detonation Engine Ignition,"DF Zheng, B Wang","Journal of Propulsion and Power 34 (2), 539-549",https://scholar.google.com/scholar?oi=bibs&hl=en&cites=14664821521989372278,2,2017
"Isolation and characterization of H4N6 avian influenza viruses from mallard ducks in Beijing, China","J Hu, X Xu, C Wang, G Bing, H Sun, J Pu, J Liu, Y Sun","PloS one 12 (9), e0184437",https://scholar.google.com/scholar?oi=bibs&hl=en&cites=14765889574172860265,2,2017
Evolution of flame kernel in one eddy turnover of high-speed droplet laden shear layers,"Z Ren, B Wang, S Yang, Q Xie, H Liu, D Wang","Journal of Loss Prevention in the Process Industries 49, 938-946",https://scholar.google.com/scholar?oi=bibs&hl=en&cites=17807471099928097844,2,2017
Germline mutations in cancer predisposition genes and risk for subsequent neoplasms among long-term survivors of childhood cancer in the St. Jude Lifetime Cohort,"Z Wang, CL Wilson, J Easton, D Hedges, Q Liu, G Wu, M Rusch, ...","Cancer Research 77 (13 Supplement), 3001-3001",https://scholar.google.com/scholar?oi=bibs&hl=en&cites=11266492795386065907,2,2017
Space millimeter-wavelength very long baseline interferometry simulation software,"T An, B Lao, J Wang, Y Lu, Y Wei, X Wu",2016 8th IEEE International Conference on Communication Software and …,https://scholar.google.com/scholar?oi=bibs&hl=en&cites=17868268876889273561,2,2016
Application and Revision of Montreal Cognitive Assessment in China's Military Retirees with Mild Cognitive Impairment,"Y Zhai, Q Chao, H Li, B Wang, R Xu, N Wang, Y Han, X He, X Jia, X Wang","PloS one 11 (1), e0145547",https://scholar.google.com/scholar?oi=bibs&hl=en&cites=6224695946514949486,2,2016
Molecular evidence revealed ,"L Kong, W Wang, H Cong, T son Nguyen, Q Yang, Y Wu, Y Li","Mitochondrial DNA Part A 27 (1), 265-269",https://scholar.google.com/scholar?oi=bibs&hl=en&cites=10889999655577514961,2,2016
Temporal evolution of long-timescale periodicities in ULX NGC 5408 X-1,"T An, XL Lu, JY Wang","Astronomy & Astrophysics 585, A89",https://scholar.google.com/scholar?oi=bibs&hl=en&cites=12972154761498463511,2,2016
Lupus-Related SNPs and Risk of Diffuse Large B-Cell Non-Hodgkin Lymphoma: Abstract Number: 763,"S Bernatsky, J Spinelli, P Gaffney, K Smedby, R Ramsey-Goldman, ...","Arthritis & Rheumatology 67, 1034-1035",https://scholar.google.com/scholar?oi=bibs&hl=en&cites=16160618361915022617,2,2015
Impact factors analysis on child neglect of children aged 3-6 year-old in rural areas of China,"F Wang, J Pan, S Zhang, H Zhang, W Wang, F Tao, R Qin, G Gu, S Shi, ...",Zhonghua yu fang yi xue za zhi [Chinese journal of preventive medicine] 49 …,https://scholar.google.com/scholar?oi=bibs&hl=en&cites=3918007048459686284,2,2015
Complete mitochondrial genome of the black giant squirrel Ratufa bicolor (Rodentia: Sciuridae),"L Kong, W Wang, H Cong, Z Liu, Y Li","Mitochondrial DNA 26 (5), 759-760",https://scholar.google.com/scholar?oi=bibs&hl=en&cites=17716513611098960777,2,2015
Clinical and prognostic significance of 3q26. 2 and other chromosome 3 abnormalities in chronic myelogenous leukemia in era of tyrosine kinase inhibitors,"W Wang, JE Cortes, P Lin, MW Beaty, D Ai, HM Amin, TJ McDonnell, ...","Blood, blood-2015-05-646489",https://scholar.google.com/scholar?oi=bibs&hl=en&cites=2887878745727880730,2,2015
Optimal transmission policies for energy harvesting transmitter with hybrid energy source in fading wireless channel,"D Liu, J Lin, J Wang, Y Shen, Y Chen","WSEAS Trans. on Commun. 14, 131-139",https://scholar.google.com/scholar?oi=bibs&hl=en&cites=17524322584016815651,2,2015
Modification of the grey evaluation model based on the optimization of a center-point triangular whitenization weight function,"H Wang, J Zhu, Z Fang, X Liu","Journal of Grey System 26 (1), 34",https://scholar.google.com/scholar?oi=bibs&hl=en&cites=10416609950469504258,2,2014
"Raman microspectroscopic analysis of polychrome wooden artifact from the Astana tomb of the Tang Dynasty, Xinjiang, China","Y SI, H JIANG, B WANG","Spectroscopy and Spectral Analysis 33 (10), 2607-2611",https://scholar.google.com/scholar?oi=bibs&hl=en&cites=28693411369270852,2,2013
Systematic review of Xiyanping injection for hand foot mouth disease,"J Wang, JX Ren, YM Xie, WW Wang, J Hu, X Liao",Zhongguo Zhong yao za zhi= Zhongguo zhongyao zazhi= China journal of Chinese …,https://scholar.google.com/scholar?oi=bibs&hl=en&cites=11628306093311800120,2,2013
Effect of erythromycin on electrical activity and gastric emptying of the intrathoracic stomach after esophagectomy for esophageal cancer,"JF Liu, CJ Liu, ZH Shi, XB Liu, T Jiang, FS Wang, FM Cao, BQ Li",Zhonghua wei chang wai ke za zhi= Chinese journal of gastrointestinal …,https://scholar.google.com/scholar?oi=bibs&hl=en&cites=12811622302224149430,2,2013
Spatial characteristics of construction land expansion in China: A comparison analysis regarding fixed capital and non-agricultural labor,"H JIANG, B WANG, C LI, F QU",China Land Sciences 5,https://scholar.google.com/scholar?oi=bibs&hl=en&cites=9052071849824508104,2,2013
三维平行微间隙流场数值模拟,陈汇龙， 王强， 刘玉辉， 刘彤， 刘志斌,"排灌机械工程学报 31 (3), 253-258",https://scholar.google.com/scholar?oi=bibs&hl=en&cites=17931868698753292539,2,2013
Effect of scattering from localized surface plasmon resonance on improving the luminescence efficiency of silicon nitride light-emitting devices,"F Wang, C Ren, D Li, D Yang","Journal of nanoparticle research 15 (1), 1419",https://scholar.google.com/scholar?oi=bibs&hl=en&cites=16328466451357061975,2,2013
"Samarium Diiodide Mediated Highly Diastereoselective Conjugate Reduction of the α, β-Unsaturated Ester Moiety in Heterocyclic Compounds","H Jiang, R Na, L Zhang, H Liu, Z Li, B Wang, H Guo","Synthesis 44 (23), 3633-3638",https://scholar.google.com/scholar?oi=bibs&hl=en&cites=14379539848586411354,2,2012
Electronic structure of three-dimensional topological insulators: thickness dependence and warping effect,"HY Lu, D Wang, S Chen, YY Xiang","The European Physical Journal B 85 (4), 308",https://scholar.google.com/scholar?oi=bibs&hl=en&cites=2427717068052862495,2,2012
An edge-directed smoothness algorithm for image interpolation,"DF Zhao, B Wang, DW Yang",Dianzi Yu Xinxi Xuebao(Journal of Electronics and Information Technology) 34 …,https://scholar.google.com/scholar?oi=bibs&hl=en&cites=17541663212800354164,2,2012
