Title,Authors,Platform,Cited_url,Cited_count,Year
An Unusual ,"H Mazloum, PA Totten, GE Brooks, CR Dawson, S Falkow, JF James, ...","Journal of Infectious Diseases 154 (2), 212-224",https://scholar.google.com/scholar?oi=bibs&hl=en&cites=15831289933240716284,20,1986
Plasmid-mediated chromosomal gene transfer in Neisseria gonorrhoeae.,"M Roberts, S Falkow","Journal of bacteriology 134 (1), 66-70",https://scholar.google.com/scholar?oi=bibs&hl=en&cites=12869556466491297968,20,1978
Covalently closed circular DNA molecules deficient in superhelical density as intermediates in plasmid life cycle,"JH Crosa, LK Luttropp, S Falkow","Nature 261 (5560), 516",https://scholar.google.com/scholar?oi=bibs&hl=en&cites=16766352357498766288,20,1976
The marine clade of the family,JP Bowman,"Flavobacteriaceae. The Prokaryotes 7, 677-694",https://scholar.google.com/scholar?oi=bibs&hl=en&cites=16165115603136543653,19,2006
Characterization of conjugative plasmid EDP208.,"BB Finlay, W Paranchych, S Falkow","Journal of bacteriology 156 (1), 230-235",https://scholar.google.com/scholar?oi=bibs&hl=en&cites=2060437240432580175,19,1983
Genetic and molecular characteristics of Vir plasmids of bovine septicemic Escherichia coli.,"J Lopez-Alvarez, CL Gyles, PL Shipley, S Falkow","Journal of bacteriology 141 (2), 758-769",https://scholar.google.com/scholar?oi=bibs&hl=en&cites=762502353483373882,19,1980
Physical studies of the drug-resistance transfer factor in Proteus,"DK Haapala, S Falkow","Journal of bacteriology 106 (1), 294",https://scholar.google.com/scholar?oi=bibs&hl=en&cites=8405198729810339827,19,1971
High resolution FESEM and TEM reveal bacterial spore attachment,"BJ Panessa-Warren, GT Tortora, JB Warren","Microscopy and Microanalysis 13 (4), 251-266",https://scholar.google.com/scholar?oi=bibs&hl=en&cites=17523843578699906290,18,2007
Diagnosis of Chlamydia trachomatis in biopsied tissue specimens by using in situ DNA hybridization,"JE Horn, EW Kappus, S Falkow, TC Quinn","The Journal of infectious diseases 157 (6), 1249-1253",https://scholar.google.com/scholar?oi=bibs&hl=en&cites=3969900338209671037,18,1988
The use of gene-specific DNA probes for the identification of enteric pathogens.,"P Claus, SL Moseley, S Falkow","Progress in food & nutrition science 7 (3-4), 139-142",https://scholar.google.com/scholar?oi=bibs&hl=en&cites=8178107124015287068,18,1983
A possible model for the development of plasmid-mediated penicillin resistance in the gonococcus,"S Falkow, LP Elwell, J De Graaff, F Heffron, L Mayer","Sexually Transmitted Diseases, 120-133",https://scholar.google.com/scholar?oi=bibs&hl=en&cites=13036976087417093449,18,1976
The “zen” of bacterial pathogenicity,S FALkow,"The Bacteria: Molecular Basis of Bacterial Pathogenesis 11, 3",https://scholar.google.com/scholar?oi=bibs&hl=en&cites=4735117652928529609,17,2012
Expression of gonococcal protein II in ,"L Palmer, GF Brooks, S Falkow","Molecular microbiology 3 (5), 663-671",https://scholar.google.com/scholar?oi=bibs&hl=en&cites=7612225280139142211,17,1989
Genetic studies of the molecular basis of whooping cough.,"AA Weiss, EL Hewlett, GA Myers, S Falkow","Developments in biological standardization 61, 11-19",https://scholar.google.com/scholar?oi=bibs&hl=en&cites=15324320978467076808,17,1985
Inclusions in prokaryotes,"C Dahl, A Prange","Springer, New York","https://scholar.google.com/scholar?oi=bibs&hl=en&cites=1410683208191300049,14786491667131812033",16,2006
The microbe's view of infection,S Falkow,"Annals of internal medicine 129 (3), 247-248",https://scholar.google.com/scholar?oi=bibs&hl=en&cites=12476913360079173953,16,1998
Microbial pathogenesis and tyrosine dephosphorylation: surprising ‘bedfellows',"JC Clemens, K Guan, JB Bliska, S Falkow, JE Dixon","Molecular microbiology 5 (11), 2617-2620",https://scholar.google.com/scholar?oi=bibs&hl=en&cites=6853880384260172821,16,1991
Use of autonomously replicating mini-R6K plasmids in the analysis of the replication regions of the R plasmid R6K,"JH Crosa, LK Luttropp, S Falkow","Cold Spring Harbor symposia on quantitative biology 43, 111-120",https://scholar.google.com/scholar?oi=bibs&hl=en&cites=12899867613974462691,16,1979
Relationship between β converting and γ non-converting corynebacteriophage DNA,"G Buck, N Groman, S Falkow","Nature 271 (5646), 683",https://scholar.google.com/scholar?oi=bibs&hl=en&cites=8223437168653845209,16,1978
Identification of Streptococcus bovis biotype I strains among S. bovis clinical isolates by PCR,"WB Songy, KL Ruoff, RR Facklam, MJ Ferraro, S Falkow","Journal of clinical microbiology 40 (8), 2913-2918",https://scholar.google.com/scholar?oi=bibs&hl=en&cites=7278216683014082778,15,2002
Mimicry of a G protein mutation by pertussis toxin expression in transgenic Caenorhabditis elegans,"C Darby, S Falkow","Infection and immunity 69 (10), 6271-6275",https://scholar.google.com/scholar?oi=bibs&hl=en&cites=4395591851061007721,15,2001
Genomic clues for defining bacterial pathogenicity,"NR Salama, S Falkow","Microbes and infection 1 (8), 615-619",https://scholar.google.com/scholar?oi=bibs&hl=en&cites=14596444034204121466,15,1999
Yersinia INV nucleic acids,"RR Isberg, V Miller, S Falkow","US Patent 5,338,842",https://scholar.google.com/scholar?oi=bibs&hl=en&cites=4267167040711368458,15,1994
Characterization of a Salmonella choleraesuis mutant that cannot multiply within epithelial cells,"BB Finlay, S Chatfield, KY Leung, G Dougan, S Falkow","Canadian journal of Microbiology 37 (7), 568-572",https://scholar.google.com/scholar?oi=bibs&hl=en&cites=16901986914831334922,15,1991
Membrane attachment of R-factor deoxyribonucleic acid in compatible and incompatible cell pairs following conjugation,"V Hershfield, DJ LeBlanc, S Falkow","Journal of bacteriology 115 (3), 1208-1211",https://scholar.google.com/scholar?oi=bibs&hl=en&cites=14865281771831449841,15,1973
Studies on superinfection immunity among transmissible plasmids in Escherichia coli,"DJ LeBlanc, S Falkow","Journal of molecular biology 74 (4), 689-701",https://scholar.google.com/scholar?oi=bibs&hl=en&cites=1942580730369279180,15,1973
"Nucleic acids, genetic exchange and bacterial speciation",S Falkow,"The American journal of medicine 39 (5), 753-765",https://scholar.google.com/scholar?oi=bibs&hl=en&cites=1394206031130332639,15,1965
The prokaryotes: a hand book on the biology of bacteria. Archaea. Bacteria: Firmicutes,"M Dworkin, S Falkow, E Rosenberg, KH Schleifer, E Stackebrandt",Actinomycetes 3,https://scholar.google.com/scholar?oi=bibs&hl=en&cites=14715850661340551603,14,2007
Biology of streptomycetes,"H Schrempf, M Dworkin, S Falkow, E Rosenberg, KH Schleifer, ...","The Prokaryotes, A Handbook on the Biology of Bacteria. 3rd edn (Dworkin M …",https://scholar.google.com/scholar?oi=bibs&hl=en&cites=4001453309418471546,14,2007
Destroying the life and career of a valued physician-scientist who tried to protect us from plague: was it really necessary?,"BE Murray, KE Anderson, K Arnold, JG Bartlett, CC Carpenter, S Falkow, ...","Clinical infectious diseases 40 (11), 1644-1648",https://scholar.google.com/scholar?oi=bibs&hl=en&cites=2351024477360948576,14,2005
"Isolation, expression, and nucleotide sequencing of the pilin structural gene of the Brazilian purpuric fever clone of Haemophilus influenzae biogroup aegyptius.","JW St Geme, S Falkow","Infection and immunity 61 (5), 2233-2237",https://scholar.google.com/scholar?oi=bibs&hl=en&cites=4043181095485953073,14,1993
Construction and characterization of new cloning vehicles. II. A multipurpose cloning system. 1977.,"F Bolivar, RL Rodriguez, PJ Greene, MC Betlach, HL Heynker, HW Boyer, ...","Biotechnology (Reading, Mass.) 24, 153-171",https://scholar.google.com/scholar?oi=bibs&hl=en&cites=16506751905788384090,14,1992
Chemically defined vaccine against urinary infections,"P O'hanley, GK Schoolnik, D Lark, S Falkow","US Patent 4,736,017",https://scholar.google.com/scholar?oi=bibs&hl=en&cites=15186832171876718900,14,1988
Recombinant DNA risk assessment studies in man: efficacy of poorly mobilizable plasmids in biologic containment.,"MM Levine, JB Kaper, H Lockman, RE Black, ML Clements, S Falkow","Recombinant DNA technical bulletin 6 (3), 89-97",https://scholar.google.com/scholar?oi=bibs&hl=en&cites=12311907596897671153,14,1983
CHARACTERIZATION OF CLONED GENES FROM CHLAMYDIA TRACHOMATIS.,ML Palmer,,https://scholar.google.com/scholar?oi=bibs&hl=en&cites=18431361344186295957,13,1987
Reevaluation of bacteriocinogeny in Neisseria gonorrhoeae.,"JS Knapp, S Falkow, KK Holmes","Journal of clinical pathology 28 (4), 274-278",https://scholar.google.com/scholar?oi=bibs&hl=en&cites=16824273536262367202,13,1975
Plasmid formation after lambda bacteriophage infection of Escherichia coli-Salmonella typhosa hybrids,"S Falkow, LS Baron","Journal of bacteriology 102 (1), 288-290",https://scholar.google.com/scholar?oi=bibs&hl=en&cites=2722483806090811168,13,1970
I never met a microbe I didn't like,S Falkow,"Nature medicine 14 (10), 1053",https://scholar.google.com/scholar?oi=bibs&hl=en&cites=15318468236533146268,12,2008
"The Prokaryotes: Volume 7: Proteobacteria: Delta, Epsilon Subclass","M Dworkin, S Falkow, E Rosenberg, KH Schleifer, E Stackebrandt",Springer-Verlag,https://scholar.google.com/scholar?oi=bibs&hl=en&cites=6516340112647936094,12,2006
Interplay between determinants of cellular entry and cellular disruption in the enteropathogenic Yersinia,"JB Bliska, S Falkow","Current Opinion in Infectious Diseases 7 (3), 323-328",https://scholar.google.com/scholar?oi=bibs&hl=en&cites=2667825412354634284,12,1994
Springer-Verlag: New York,"M Dworkin, S Falkow, E Rosenberg","NY, USA",https://scholar.google.com/scholar?oi=bibs&hl=en&cites=9868428465958043422,11,2003
 is launched,S Falkow,"Cellular microbiology 1 (1), 3-6",https://scholar.google.com/scholar?oi=bibs&hl=en&cites=4315534103002992514,11,1999
From microbial genomics to meta‐genomics,"A Covacci, GC Kennedy, B Cormack, R Rappuoli, S Falkow","Drug development research 41 (3‐4), 180-192",https://scholar.google.com/scholar?oi=bibs&hl=en&cites=2377824747744262414,11,1997
Uropathogenic Escherichia coli: molecular mechanisms of adherence,"GK Schoolnik, P O’Hanley, D Lark, S Normark, K Vosti, S Falkow","Urogenital Infections, 53-62",https://scholar.google.com/scholar?oi=bibs&hl=en&cites=10886840069399135271,11,1987
Genetic Analysis of Bacterial Virulence Determinants in ,"RR Isberg, S Falkow","Genetic Approaches to Microbial Pathogenicity, 1-11",https://scholar.google.com/scholar?oi=bibs&hl=en&cites=4038500215054103637,11,1985
Introduction to the mechanisms of genetic exchange in the gonococcus: Plasmids and conjugation in Neisseria gonorrhoeae,"M Roberts, LP Elwell, S Falkow","Immunobiology of Neisseria gonorrhoeae, 38-43",https://scholar.google.com/scholar?oi=bibs&hl=en&cites=17590044304146326340,11,1978
"Bacteria: Firmicutes, Cyanobacteria in The prokaryotes: A Handbook on the Biology of Bacteria","M Dworkin, S Falkow, E Rosenberg, KH Schleifer, E Stackebrandt","New York, NY: Springer Science&Business Media, LLC",https://scholar.google.com/scholar?oi=bibs&hl=en&cites=6485363419493945497,10,2006
Capsule Loss by ,"JW St. Geme III, S Falkow","Journal of Infectious Diseases 165 (Supplement_1), S117-S118",https://scholar.google.com/scholar?oi=bibs&hl=en&cites=13670191366076639108,10,1992
The use of DNA hybridization for the identification of pathogenic bacteria,S Falkow,"Rapid Methods and Automation in Microbiology and Immunology, 30-33",https://scholar.google.com/scholar?oi=bibs&hl=en&cites=374513590283813381,10,1985
The use of molecular techniques to study microbial determinants of pathogenicity,"AA Weiss, S Falkow","Philosophical Transactions of the Royal Society of London. B, Biological …",https://scholar.google.com/scholar?oi=bibs&hl=en&cites=2263536022894637279,10,1983
Исчезающая микробиота,"MJ Blaser, S Falkow","Клиническая фармакология и терапия 23 (4), 7-16",https://scholar.google.com/scholar?oi=bibs&hl=en&cites=17944128128656051563,9,2014
"The prokaryotes. Vol. 4. Bacteria: firmicutes, cyanobacteria: a handbook on the biology of bacteria","M Dworkin, S Falkow",Springer,https://scholar.google.com/scholar?oi=bibs&hl=en&cites=7430445166430846871,9,2006
Characterization,IE Esu,Classification and Management problems of the major soil orders in Nigeria …,https://scholar.google.com/scholar?oi=bibs&hl=en&cites=16681932898020376956,9,2005
“Statement on scientific publication and security” fails to provide necessary guidelines,S Falkow,"Proceedings of the National Academy of Sciences 100 (10), 5575-5575",https://scholar.google.com/scholar?oi=bibs&hl=en&cites=3392197619103140348,9,2003
Haemophilus adherence and penetration proteins,"JWS Geme III, S Falkow","US Patent 6,245,337",https://scholar.google.com/scholar?oi=bibs&hl=en&cites=17150516397013741836,9,2001
Host-parasite relationships,S Falkow,"Sherris medical microbiology. Appleton and Lange, East Norwalk, Conn, 141-167",https://scholar.google.com/scholar?oi=bibs&hl=en&cites=15391807203469916068,9,1994
Characterization and cloning of cysteine-rich proteins from Chlamydia trachomatis: a preliminary report,"P Bavoil, L Palmer, S Falkow, D Gump","Chlamydial infections. Cambridge University Press, Cam-bridge, 97-100",https://scholar.google.com/scholar?oi=bibs&hl=en&cites=3335511624516319320,9,1986
The prokaryotes: an evolving electronic resource for the microbiological community.,"B Biavati, P Mattarelli, M Dworkin, S Falkow, E Rosenberg, KH Schleifer, ...",,https://scholar.google.com/scholar?oi=bibs&hl=en&cites=3469634273010987965,8,2006
Staphylococcus aureus infection of human primary keratinocytes,"B Aufiero, Z Duanmu, M Guo, NB Meduri, S Falkow, GJ Murakawa","Journal of dermatological science 36 (3), 173-175",https://scholar.google.com/scholar?oi=bibs&hl=en&cites=5078881061821221320,8,2004
"I'll have the chopped liver please, or how I learned to love the clone",S Falkow,"ASM News-American Society for Microbiology 67 (11), 555-559",https://scholar.google.com/scholar?oi=bibs&hl=en&cites=15194364771334196624,8,2001
Microorganism having attenuated invasiveness,"S Falkow, CA Lee","US Patent 5,663,317",https://scholar.google.com/scholar?oi=bibs&hl=en&cites=9960096829499391132,8,1997
Identification of the Whipple's disease bacillus.,"CR Steinman, P Rumore","The New England journal of medicine 328 (1), 62",https://scholar.google.com/scholar?oi=bibs&hl=en&cites=15330189626124329622,8,1993
Increased survival in calves of Escherichia coli K-12 carrying an Ent plasmid.,"S Falkow, LP Williams, SL Seaman, LD Rollins","Infection and immunity 13 (3), 1005-1007",https://scholar.google.com/scholar?oi=bibs&hl=en&cites=3786830363635865454,8,1976
Antibiotics in animal feeds.,S Falkow,"The New England journal of medicine 282 (12), 693-694",https://scholar.google.com/scholar?oi=bibs&hl=en&cites=8217507672552737710,8,1970
Restriction in genetic crosses between Escherichia coli and Shigella flexneri,"S Falkow, SB Formal","Journal of bacteriology 100 (1), 540",https://scholar.google.com/scholar?oi=bibs&hl=en&cites=12078136059403011073,8,1969
The prokaryotes. A handbook on the biology of bacteria. 2006,"M Dworkin, S Falkow, E Rosenberg, KH Schleifer, E Stackebrandt","Editorial Springer. Tercera edición. New York, NY 939p","https://scholar.google.com/scholar?oi=bibs&hl=en&cites=12392730746007270226,870055846132202427",8,0
Disappearing microbiota,"MJ Blaser, S Falkow","Trans. from english. Klinicheskaya farmacologiya i terapiya 4, 7-16",https://scholar.google.com/scholar?oi=bibs&hl=en&cites=8412710684743878283,7,2014
"The prokaryotes. Proteobacteria: gamma subclass, vol. 6","M Dworking, S Falkow, E Rosenberg, K Schleifer, E Stackebrandt","Springer, New York, NY",https://scholar.google.com/scholar?oi=bibs&hl=en&cites=13254814420892306497,7,2006
Isolation of Rochalimaea species.,DA Relman,"The New England journal of medicine 328 (19), 1422-1423",https://scholar.google.com/scholar?oi=bibs&hl=en&cites=2441042066209023697,7,1993
Entry of ,"CA Lee, S Falkow","Biology of Salmonella, 169-179",https://scholar.google.com/scholar?oi=bibs&hl=en&cites=927282396056683174,7,1993
Development of a tissue culture model for gonococcal invasion,"JH Shaw, F Hayes, GF Brooks, S Falkow","Gonococci and Meningococci, 441-447",https://scholar.google.com/scholar?oi=bibs&hl=en&cites=1746458742804789688,7,1988
Selection of DNA probes for use in the diagnosis of infectious disease,"L Palmer, S Falkow","Rapid Detection and Identification of Infectious Agents, 211-218",https://scholar.google.com/scholar?oi=bibs&hl=en&cites=8706797112534564661,7,1985
Murine model for pertussis vaccine encephalopathy: role of the major histocompatibility complex; antibody to albumin and to Bordetella pertussis and pertussis toxin.,"L Steinman, A Weiss, N Adelman, M Lim, J Oehlert, R Zuniga, E Hewlett, ...","Developments in biological standardization 61, 439-446",https://scholar.google.com/scholar?oi=bibs&hl=en&cites=3678939413728458801,7,1985
R-plasmids and nosocomial infection,"DR Schaberg, LS Tompkins, C Rubens, S Falkow",Plasmids and transposons: Environmental effects and maintenance mechanisms …,https://scholar.google.com/scholar?oi=bibs&hl=en&cites=15503938300179100171,7,1980
Mobilization of the ,"G Dougan, JH Crosa, S Falkow","Journal of Infectious Diseases 137 (5), 676-680",https://scholar.google.com/scholar?oi=bibs&hl=en&cites=5745690148754024302,7,1978
"The Prokaryotes a Handbook on the Biology of Bacteria, Volume 1: Symbiotic Associations, Biotechnology","M Dworkin, S Falkow, E Rosenberg, KH Schleifer, E Stackebrandt","Applied Microbiology,, 137-185",https://scholar.google.com/scholar?oi=bibs&hl=en&cites=14990842782443338346,6,2006
Cellulose-decomposing bacteria and their enzyme systems,"M Dworkin, S Falkow, E Rosenberg, KH Schleifer, E Stackebrandt, ...","The Prokaryotes. Springer, New York, 578-617",https://scholar.google.com/scholar?oi=bibs&hl=en&cites=10919410531058896800,6,2006
The prokaryotes: a handbook on the biology of bacteria,"R Huber, WA Eder","Dworkin, M., Falkow, S., Rosenberg, E., Eds 3, 23-51",https://scholar.google.com/scholar?oi=bibs&hl=en&cites=7955678057584293120,6,2006
"An efficient procedure for the synthesis of 1, 1-diacetates from aldehydes with acetic anhydride catalyzed by silica sulfate","TS Jin, Y Zhao, SQ Gu, LB Liu, TS Li","NISCAIR-CSIR, India",https://scholar.google.com/scholar?oi=bibs&hl=en&cites=14857081064529186202,6,2006
Living in stools is not as dumb as you think,S Falkow,"Journal of Bacteriology 182 (12), 3319-3322",https://scholar.google.com/scholar?oi=bibs&hl=en&cites=11720169996118088864,6,2000
The vir locus and phase-variation in Bordetella pertussis.,"S Stibitz, W Aaronson, D Monack, S Falkow","The Tokai journal of experimental and clinical medicine 13, 223-226",https://scholar.google.com/scholar?oi=bibs&hl=en&cites=5778391147476547086,6,1988
Pilus/pilin expression and homologous recombination in Neisseria gonorrhoeae,"JM Koomey, S Falkow","The pathogenic neisseriae. American Society for Microbiology, Washington, DC …",https://scholar.google.com/scholar?oi=bibs&hl=en&cites=2821181558398354454,6,1985
A GLOBOSIDE BINDING ESCHERICHIA-COLI PILUS VACCINE PREVENTS PYELONEPHRITIS,"PD OHANLEY, D Lark, S Falkow, GK Schoolnik","CLINICAL RESEARCH 31 (2), A372-A372",https://scholar.google.com/scholar?oi=bibs&hl=en&cites=8497259554549812855,6,1983
"Bacterial pathogenicity, an overview",S Falkow,"Molecular Biology, Pathogenicity, and Ecology of Bacterial Plasmids, 91-100",https://scholar.google.com/scholar?oi=bibs&hl=en&cites=17121744772633944655,6,1981
The transposition of ampicillin resistance: nature of ampicillin resistant Haemophilus influenzae and Neisseria gonorrhoeae,"S Falkow, LP Elwell, M Roberts, F Heffron, R Gill","R-Factors: Their Properties and Possible Control, 115-129",https://scholar.google.com/scholar?oi=bibs&hl=en&cites=5935116496450546841,6,1977
The lessons of Asilomar and the H5N1 “affair”,S Falkow,"MBio 3 (5), e00354-12",https://scholar.google.com/scholar?oi=bibs&hl=en&cites=6246868819405117772,5,2012
The prokaryotes: Vol. 7: Proteobacteria: delta and epsilon subclasses,"S Falkow, E Rosenberg, KH Schleifer, E Stackebrandt","New York, NY: Springer",https://scholar.google.com/scholar?oi=bibs&hl=en&cites=428226675924806400,5,2006
The Prokaryotes. A Handbook on the Biology of Bacteria.[ed.] Karl-Heinz Schleifer and Erko Stackebrandt. 3,"M Dworkin, S Falkow, E Rosenberg",Munich: Springer,https://scholar.google.com/scholar?oi=bibs&hl=en&cites=3960705697404357471,5,2006
Springer: New York,"M Dworkin, S Falkow, E Rosenberg, KKH Schleifer, E Stackebrandt","NY, USA",https://scholar.google.com/scholar?oi=bibs&hl=en&cites=10947311151893439742,5,2006
Proteobacteria: Gamma Subclass,S Falkow,Springer,https://scholar.google.com/scholar?oi=bibs&hl=en&cites=12163097853162169590,5,2006
Leukotriene A4 hydrolase from candida albicans,"BP Cormack, S Falkow","US Patent 5,529,916",https://scholar.google.com/scholar?oi=bibs&hl=en&cites=9846230467990684085,5,1996
Bacteroides and Fusobacterium,S Falkow,"Microbiology 4, 589-93",https://scholar.google.com/scholar?oi=bibs&hl=en&cites=16135425028412000064,5,1990
Genetic analysis of cell invasiveness by Yersinia pseudotuberculosis,"RR Isberg, S Falkow","Annales de l'Institut Pasteur/Microbiologie 137 (1), 308-310",https://scholar.google.com/scholar?oi=bibs&hl=en&cites=15610030901588255295,5,1986
The Pathogenic Neisseriae,"GK Schoolnik, GF Brooks, S Fatkow, CE Frasch, JS Knapp, JA McCutchan, ...","American Society for Microbiology, Washington, DC",https://scholar.google.com/scholar?oi=bibs&hl=en&cites=8349540309530876132,5,1985
"Science, biotechnology, and recombinant DNA: A personal history","SN Cohen, S Falkow, SS Hughes",Regents of the University of California,https://scholar.google.com/scholar?oi=bibs&hl=en&cites=16695027034391309027,4,2009
Proteobacteria: Gamma Subclass. The Prokaryotes: A Handbook on the Biology of Bacteria. Vol. 6,"M Dworkin, S Falkow, E Rosenberg, KH Schleifer, E Stackebrandt",New York: Springer Science,https://scholar.google.com/scholar?oi=bibs&hl=en&cites=10323442130232529896,4,2006
V2: Proteobacteria: Delta and epsilon subclasses deeply rooting bacteria,"M Dworkin, S Falkow, E Rosenberg, KH Schleifer, E Stackebrandt","The Prokaryotes: A Handbook on the Biology of Bacteria, 3rd ed.; Springer …",https://scholar.google.com/scholar?oi=bibs&hl=en&cites=17748925184438465877,4,2006
3.3. 3 The Genus Escherichia,"RA Welch, M Dworkin, S Falkow, E Rosenberg, KH Schleifer, ...","The Prokaryotes 6, 62-71",https://scholar.google.com/scholar?oi=bibs&hl=en&cites=10188033905804691554,4,2005
Isolation of hyperinvasive mutants of Salmonella,"CA Lee, S Falkow","Methods in enzymology 236, 531-545",https://scholar.google.com/scholar?oi=bibs&hl=en&cites=12528892642664745834,4,1994
Isolation and characterization of,"DB Schauer, N Ghori, S Falkow",Flexispira,https://scholar.google.com/scholar?oi=bibs&hl=en&cites=14724644463819927422,4,1993
Cloning of the Kanagawa phenomenon associated hemolysin of Vibrioparahaemolyticus,"JB Kaper, RK Campen, RJ Seidler, MM Baldini, S Falkow","Advances in research on cholera and related diarrheas 2, 229-235",https://scholar.google.com/scholar?oi=bibs&hl=en&cites=15992407993149373007,4,1985
BORDETELLA EXTRACYTOPLASMIC ADENYLATE CYCLASE (ECAC)-INTRACELLULAR LOCUS OF ACTION IN MAMMALIAN-CELLS,"EL Hewlett, HJ Anderson, GA Myers, AA Weiss, S Falkow, MJ Cronin","CLINICAL RESEARCH 32 (2), A370-A370",https://scholar.google.com/scholar?oi=bibs&hl=en&cites=15330037253397713008,4,1984
Bacterial plasmids--an overview.,"S Falkow, DA Portnoy",Clinical and investigative medicine. Medecine clinique et experimentale 6 (3 …,https://scholar.google.com/scholar?oi=bibs&hl=en&cites=3814579789420403963,4,1983
Genetic loose change,"LP Elwell, S Falkow","The Sciences 17 (7), 8-11",https://scholar.google.com/scholar?oi=bibs&hl=en&cites=9101251209744125644,4,1977
Effects of superinfection immunity on plasmid replication following conjugation,"DJ LeBlanc, S Falkow",Bacterial plasmids and antibiotic resistance. Avicenum Czechoslovak Medical …,https://scholar.google.com/scholar?oi=bibs&hl=en&cites=1501495859455630533,4,1972
"The family Actinomycetaceae: Actinomyces, Actinobaculum, Arcanobacterium, Varibaculum, and Mobiluncus","KP Schaal, AF Yassin, E Stackebrandt","Prokaryotes, 3, 430-537",https://scholar.google.com/scholar?oi=bibs&hl=en&cites=12116743157611071951,3,2006
The genera Pediococcus and Tetragenococcus,"M Dworkin, S Falkow, E Rosenberg, KH Schleifer, E Stackebrandt","The Prokaryotes. Springer, US Press, NY, USA, 229-266",https://scholar.google.com/scholar?oi=bibs&hl=en&cites=3652685804399832502,3,2006
Proteobacteria: gamma subclass,"F Grimont, PAD Grimont, M Dworkin, S Falkow, E Rosenberg","The Prokaryotes 6, 219-244",https://scholar.google.com/scholar?oi=bibs&hl=en&cites=11993909245288725698,3,2006
Science publishing and security concerns.,S Falkow,"Science 300 (5620), 737-740",https://scholar.google.com/scholar?oi=bibs&hl=en&cites=9746449923715271466,3,2003
Expression profiling in Helicobacter pylori infection,"DS Merrell, S Falkow","Perspectives in gene expression. Eaton Publishing, Westborough, United …",https://scholar.google.com/scholar?oi=bibs&hl=en&cites=5681086554899223011,3,2003
Presence of the cag pathogenicity island does not affect the level of colonization or inflammation in mice infected with Helicobacter pylori,"LJ Thompson, S Danon, J Wilson, J O'Rourke, N Salama, S Falkow, ...","Gut 49 (4), A14-A14",https://scholar.google.com/scholar?oi=bibs&hl=en&cites=417215017922622704,3,2001
Running Around in Circles: Following the “Jumping Genes” of Antibiotic Resistance,S Falkow,"Infectious Diseases in Clinical Practice 9 (3), 119-122",https://scholar.google.com/scholar?oi=bibs&hl=en&cites=15018386309126214354,3,2000
