Title,Authors,Platform,Cited_url,Cited_count,Year
Upscaling of Channel Systems in Two Dimensions,"XH Wen, LJ Durlofsky, MG Edwards",review for Transport in Porous Media,https://scholar.google.com/scholar?oi=bibs&hl=en&cites=2956817292624182155,4,2001
An MPFA-based dual continuum–discrete feature model for simulation of flow in fractured reservoirs,"C Maier, M Karimi-Fard, A Lapene, LJ Durlofsky","ECMOR XV-15th European Conference on the Mathematics of Oil Recovery, cp-494 …",https://scholar.google.com/scholar?oi=bibs&hl=en&cites=10512361367913099906,3,2016
Multiscale analysis and computation for flows in heterogeneous media,"Y Efendiev, TY Hou, LJ Durlofsky, H Tchelepi","Texas A & M Univ., College Station, TX (United States)","https://scholar.google.com/scholar?oi=bibs&hl=en&cites=13786104721061554689,13100653998536996762",3,2016
Approximate dynamic programming for optimizing oil production,"W Zheng, LJ Durlofsky, B Van Roy, K Aziz",Reinforcement Learning and Approximate Dynamic Programming for Feedback …,https://scholar.google.com/scholar?oi=bibs&hl=en&cites=3793913878411783784,3,2013
Rapid construction of ensembles of high-resolution reservoir models constrained to production data,"C Scheidt, J Caers, Y Chen, L Durlofsky",ECMOR XII-12th European Conference on the Mathematics of Oil Recovery,https://scholar.google.com/scholar?oi=bibs&hl=en&cites=1250859117125484236,3,2010
Use of linearized reduced-order modeling and pattern search methods for optimization of oil production,"J He, LJ Durlofsky",Proceedings of the 2nd International Conference on Engineering Optimization …,https://scholar.google.com/scholar?oi=bibs&hl=en&cites=3443404699594743092,3,2010
Application of a New Upscaling Technique to a Miscible Gas Injection Field Study,"MH Hui, LJ Durlofsky, XH Wen",IOR 2005-13th European Symposium on Improved Oil Recovery,https://scholar.google.com/scholar?oi=bibs&hl=en&cites=14059489116209473034,3,2005
Approximate finite difference modeling of the performance of horizontal wells in heterogeneous reservoirs,"B Yeten, C Wolfsteiner, LJ Durlofsky, K Aziz",SPE/AAPG Western Regional Meeting,https://scholar.google.com/scholar?oi=bibs&hl=en&cites=13009377740607953534,3,2000
Deep-learning-based reduced-order modeling for subsurface flow simulation,"ZL Jin, Y Liu, LJ Durlofsky",arXiv preprint arXiv:1906.03729,https://scholar.google.com/scholar?oi=bibs&hl=en&cites=16357107732851405218,2,2019
Multilevel Strategies and Geological Parameterizations for History Matching Complex Reservoir Models,"Y Liu, LJ Durlofsky",SPE Journal,https://scholar.google.com/scholar?oi=bibs&hl=en&cites=7483907567309377461,2,2019
Optimal Heat Integration in a Coal-Natural Gas Energy Park with CO2 Capture,"CA Kang, AR Brandt, LJ Durlofsky","Energy Procedia 37, 2715-2726",https://scholar.google.com/scholar?oi=bibs&hl=en&cites=17105647294536026444,2,2013
A new global upscaling technique for 3D unstructured grids,"M Karimi-Fard, LJ Durlofsky",ECMOR XIII-13th European Conference on the Mathematics of Oil Recovery,https://scholar.google.com/scholar?oi=bibs&hl=en&cites=12083687186580891037,2,2012
An expanded well model for accurate simulation of reservoir-well interactions,"M Karimi-Fard, LJ Durlofsky",ECMOR XII-12th European Conference on the Mathematics of Oil Recovery,https://scholar.google.com/scholar?oi=bibs&hl=en&cites=12709296668269537354,2,2010
Development and Application of a Compositional Wellbore Model for Thermal Recovery Processes,"S Livescu, K Aziz, LJ Durlofsky",SPE Western Regional Meeting,https://scholar.google.com/scholar?oi=bibs&hl=en&cites=14742098360302998923,2,2009
Optimization of advanced well type and performance,"LJ Durlofsky, I Aitokhuehi, V Artus, B Yeten, K Aziz",ECMOR IX-9th European Conference on the Mathematics of Oil Recovery,https://scholar.google.com/scholar?oi=bibs&hl=en&cites=10133604570870680611,2,2004
Risk Analysis Applied to Petroleum Exploration and Production,"DJ Schiozer, SB Suslick, DJ Schiozer, I Zabalza-Mezghani, E Manceau, ...","Journal of Petroleum Science and Engineering 44 (1-2), 1-192",https://scholar.google.com/scholar?oi=bibs&hl=en&cites=12142565252761508535,2,2004
Optimization of intelligent well control: Intelligent wells,"B YETEN, LJ DURLOFSKY, K AZIZ","World oil 224 (3), 35-40",https://scholar.google.com/scholar?oi=bibs&hl=en&cites=7793044358333509676,2,2003
Accurate scale up of two phase flow using nonuniform coarsening and renormalization,"TC Wallstrom, S Hou, MA Christie, LJ Durlofsky, DH Sharp",,https://scholar.google.com/scholar?oi=bibs&hl=en&cites=15807265903952227591,2,1998
A deep-learning-based surrogate model for data assimilation in dynamic subsurface flow problems,"M Tang, Y Liu, LJ Durlofsky",arXiv preprint arXiv:1908.05823,https://scholar.google.com/scholar?oi=bibs&hl=en&cites=4587139069631493339,1,2019
Well control optimization using a two-step surrogate treatment,"DU de Brito, LJ Durlofsky",arXiv preprint arXiv:1903.05065,https://scholar.google.com/scholar?oi=bibs&hl=en&cites=6257346558897737147,1,2019
Multifidelity framework for uncertainty quantification with multiple quantities of interest,"FF Kostakis, BT Mallison, LJ Durlofsky","Computational Geosciences, 1-13",https://scholar.google.com/scholar?oi=bibs&hl=en&cites=13556838962143463661,1,2019
A Data-Space Approach For Well Control Optimization Under Uncertainty,"S Jiang, W Sun, LJ Durlofsky",ECMOR XVI-16th European Conference on the Mathematics of Oil Recovery,https://scholar.google.com/scholar?oi=bibs&hl=en&cites=15897441408849081051,1,2018
Smart Oil Fields and Mining Complexes,"LJ Durlofsky, R Dimitrakopoulos","Mathematical Geosciences 49 (3), 275-276",https://scholar.google.com/scholar?oi=bibs&hl=en&cites=16973380083777411154,1,2017
Production uncertainty quantification for a naturally fractured reservoir using a new data-space inversion procedure,"W Sun, LJ Durlofsky, MH Hui",ECMOR XV-15th European Conference on the Mathematics of Oil Recovery,https://scholar.google.com/scholar?oi=bibs&hl=en&cites=3557039524125644289,1,2016
"Ensemble level upscaling for compositional flow simulation, with application to uncertainty quantification","H Li, LJ Durlofsky",ECMOR XIV-14th European Conference on the Mathematics of Oil Recovery,https://scholar.google.com/scholar?oi=bibs&hl=en&cites=6025064625999747551,1,2014
New models for heater wells in reservoir simulation,"G Aouizerate, LJ Durlofsky, P Samier",ECMOR XII-12th European Conference on the Mathematics of Oil Recovery,https://scholar.google.com/scholar?oi=bibs&hl=en&cites=18065041799212987595,1,2010
New Approaches for Generally Constrained Production Optimization with an Emphasis on Derivative-free Techniques,"DE Ciaurri, OJ Isebor, LJ Durlofsky",ECMOR XII-12th European Conference on the Mathematics of Oil Recovery,https://scholar.google.com/scholar?oi=bibs&hl=en&cites=14955318855652880981,1,2010
Ensemble level upscaling of 3D well-driven flow for efficient uncertainty quantification,"Y Chen, K Park, LJ Durlofsky",ECMOR XI-11th European Conference on the Mathematics of Oil Recovery,https://scholar.google.com/scholar?oi=bibs&hl=en&cites=7014195389280995012,1,2008
A035 UNSTRUCTURED 3D GRIDDING AND UPSCALING FOR COARSE MODELING OF GEOMETRICALLY COMPLEX RESERVOIRS,"M Prevost, F Lepage, LJ Durlofsky, JL Mallet",,https://scholar.google.com/scholar?oi=bibs&hl=en&cites=7097111637260120499,1,0
Reduced-Order Modeling of Coupled Flow and Quasistatic Geomechanics,"ZL Jin, T Garipov, O Volkov, LJ Durlofsky",SPE Journal,,0,2019
Correction to: A Deep-Learning-Based Geological Parameterization for History Matching Complex Models,"Y Liu, W Sun, LJ Durlofsky","Mathematical Geosciences 51 (6), 841-842",,0,2019
A data-space inversion procedure for well control optimization and closed-loop reservoir management,"S Jiang, W Sun, LJ Durlofsky","Computational Geosciences, 1-19",,0,2019
Gradient-based Pareto optimal history matching for noisy data of multiple types,"O Volkov, V Bukshtynov, LJ Durlofsky, K Aziz","Computational Geosciences 22 (6), 1465-1485",,0,2018
An Unstructured Dual-Grid Model For Flow In Fractured And Heterogeneous Porous Media,"M Karimi-Fard, LJ Durlofsky",ECMOR XVI-16th European Conference on the Mathematics of Oil Recovery,,0,2018
Simplified predictive models for CO2 sequestration performance assessment,"S Mishra, P Ganesh, J Schuetter, J He, Z Jin, LJ Durlofsky","Battelle Memorial Institute, Columbus, OH (United States)",,0,2015
Simplified Predictive Models for CO2 Sequestration Performance Assessment – Research Topical Report on Task# 4 Reduced-Order Method (ROM) Based Models,"S Mishra, L Jin, J He, L Durlofsky",Battelle Memorial Institute,,0,2015
Grid Optimization for Improved Monotonicity of MPFA Solutions on Unstructured Grids,"MJ Mlacnik, LJ Durlofsky",ECMOR X-10th European Conference on the Mathematics of Oil Recovery,,0,2006
Closed-loop reservoir management-Preface,"JD Jansen, L Durlofsky, K Aziz, C van Kruijsdijk","Computational Geosciences 10 (1), 1-2",,0,2006
Interaction of Mechanical and Diagenetic Processes in Fault Zones and Their Impact on Fluid Flow,"A Aydin, F Agosta, RS Ahmadov, E Flodin, M Prasad, L Durlofsky",,,0,2005
Artificial Intelligence Applications in Petroleum Exploration and Production,"D Tiab, J Hagoort, M Hui, LJ Durlofsky, WM Mabrouk, A Majdi, ...","Journal of Petroleum Science and Engineering 49, 278-279",,0,2005
Efficient closed-loop production optimization under uncertainty: Reserves/asset management,"P SARMA, LJ DURLOFSKY, K AZIZ","Journal of petroleum technology 57 (12), 51-52",,0,2005
Robust Coarse Scale Modeling of Flow and Transport in Subsurface Formations,"LJ Durlofsky, Y Chen, X Wen",AGU Fall Meeting Abstracts,,0,2004
Robust Coarse Scale Modeling of Flow and Transport in Heterogeneous Reservoirs,"LJ Durlofsky, Y Chen, XH Wen",ECMOR IX-9th European Conference on the Mathematics of Oil Recovery,,0,2004
Upscaling of Geocellular Models for Flow Simulation,LJ Durlofsky,66th EAGE Conference and Exhibition-Workshops,,0,2004
Two-Stage Upscaling of Two-Phase Flow: From Core to Simulation Scale,"L Arild, V George, L Durlofsky",SPE/DOE Symposium on Improved Oil Recovery,,0,2004
Near-Well Radial Upscaling for the Accurate Modeling of Nonconventional Wells,"W Christian, L Durlofsky, L Durlofsky",SPE Western Regional/AAPG Pacific Section Joint Meeting,,0,2002
UPSCALING OF GEOLOGICAL MODELS FOR RESERVOIR SIMULATION,LJ DURLOFSKY,"Computational Geosciences 6, 569-571",,0,2002
Advanced Techniques for Reservoir Simulation and Modeling of Non-Conventional Wells; FINAL,"LJ Durlofsky, K Aziz",National Petroleum Technology Office,,0,2001
Fault Zone Permeability Upscaling: From Field to Numerical Modeling,"H Jourde, A Aydin, L Durlofsky",2000 AAPG Annual Meeting,,0,2000
Steamflood modeling and scale up in a hetrogeneous reservoir,"K Dehghani, WM Basham, LJ Durlofsky",AAPG Bulletin 5 (CONF-960527--),,0,1996
New approach on gas lift wells optimization with limited available gas injected.,"D Saepudin, P Sukarno, E Soewono, KA Sidarto, AY Gunawan, ...","Journal of Applied Sciences 10 (16), 87-92",,0,1995
Triangle based adaptive stencils for the solution of hyperbolic conservation laws,LJ Durlofsky,"Journal of Computational Physics 94 (1), 252",,0,1991
Triangle Based TVD (Total Variation Diminishing) Schemes for Hyperbolic Conversation Laws,"LJ Durlofsky, S Osher, B Engquist",INSTITUTE FOR COMPUTER APPLICATIONS IN SCIENCE AND ENGINEERING HAMPTON VA,,0,1990
Topics in fluid mechanics,LJ Durlofsky,"Massachusetts Institute of Technology, Department of Chemical Engineering",,0,1986
Oscillatory Convective Dispersion in a Branching Tube Network,"JS Ultman, L Durlofsky",,,0,1982
FLUID FLOW THROUGH POROUS SANDSTONE WITH SUBPARALLEL AND INTERSECTING GEOLOGICAL STRUCTURES OF VARIOUS TYPES,"X Zhou, M Karimi-Fard, A Boucher, L Durlofsky, A Aydin",,,0,0
FLUID FLOW THROUGH POROUS SANDSTONE WITH OVERPRINTING AND INTERSECTING GEOLOGICAL STRUCTURES OF VARIOUS TYPES: 2D AND 3D CASES,"X Zhou, M Karimi-Fard, L Durlofsky, A Aydin",,,0,0
Part II. Coupling of the Reservoir and Non-Conventional Wells in,"C Wolfsteiner, LJ Durlofsky, K Aziz","National Petroleum Technology Office, 35",,0,0
Part III. Novel Approaches to Account for Heterogeneities in the Vicinity of,"O Mascarenhas, LJ Durlofsky",National Petroleum Technology Office,,0,0
8313 Enhanced linearized reduced-order models for subsurface flow simulation,"J He, J Sætrom, LJ Durlofsky, E Santilli, A Scotti, WK Anderson, L Wang, ...",,,0,0
"Machine-learning-based estimation of upscaling error, with application to uncertainty quantification","S Trehan, LJ Durlofsky",,,0,0
Carbon-Based Energy Systems> CO 2 Storage,"HA Tchelepi, LJ Durlofsky, K Aziz, P Jenny",,,0,0
Rapid Construction of High-Resolution Models Constrained to Dynamic Data,"C Scheidt, J Caers, Y Chen, L Durlofsky",,,0,0
Supplementary Material (SM) for ‘Optimizing heat integration in a flexible coal-natural gas power station with CO2 capture',"CA Kang, AR Brandt, LJ Durlofsky",,,0,0
"Permeability upscaling of fault zones with a focus on slip surfaces and slip bands in the Aztec Sandstone, Valley of Fire State Park, Nevada","R Ahmadov, A Aydin, M Karimi-Fard, L Durlofsky",,,0,0
Improved Upscaling of Complex Geological Models on Cartesian Grids,"XH Wen, LJ Durlofsky, MG Edwards",,,0,0
Optimal heat integration in a coal-natural gas energy park with CO,"CA Kang, AR Brandt, LJ Durlofsky",,,0,0
FROM OUTCROP TO FLOW SIMULATION: CONSTRUCTING DISCRETE FRACTURE NETWORK MODELS FROM LIDAR SURVEYS,"C Wilson, A Aydin, M Karimi-Fard, L Durlofsky, A Sagy, E Brodsky",,,0,0
