Title,Authors,Platform,Cited_url,Cited_count,Year
THE REPLICATION OF R‐FACTOR DNA IN ,"S Falkow, LS Tompkins, RP Silver, P Guerry, DJ LeBlanc","Annals of the New York Academy of Sciences 182 (1), 153-171",https://scholar.google.com/scholar?oi=bibs&hl=en&cites=8709039598105300291,56,1971
Passage of Salmonella through polarized epithelial cells: role of the host and bacterium,"BB FINLAY, J FRY, EP ROCK, S FALKOW","J Cell Sci 1989 (Supplement 11), 99-107",https://scholar.google.com/scholar?oi=bibs&hl=en&cites=5392337061168740255,55,1989
Profiling of microdissected gastric epithelial cells reveals a cell type—specific response to Helicobacter pylori infection,"A Mueller, DS Merrell, J Grimm, S Falkow","Gastroenterology 127 (5), 1446-1462",https://scholar.google.com/scholar?oi=bibs&hl=en&cites=17630675194059659133,54,2004
Flow cytometry and bacterial pathogenesis,"RH Valdivia, S Falkow","Current opinion in microbiology 1 (3), 359-363",https://scholar.google.com/scholar?oi=bibs&hl=en&cites=14752616242817686176,54,1998
A Yersinia pestis‐specific DNA fragment encodes temperature‐dependent coagulase and fibrinolysin associated phenotypes,"KA McDonough, S Falkow","Molecular microbiology 3 (6), 767-775",https://scholar.google.com/scholar?oi=bibs&hl=en&cites=11492730731342269324,54,1989
Is persistent bacterial infection good for your health?,S Falkow,"Cell 124 (4), 699-702",https://scholar.google.com/scholar?oi=bibs&hl=en&cites=18227839426698523975,53,2006
Molecular epidemiology of Haemophilus ducreyi infections,"HH HANDSFIELD, PA TOTTEN, CL FENNEL, S FALKOW, KK HOLMES","Annals of internal medicine 95 (3), 315-318",https://scholar.google.com/scholar?oi=bibs&hl=en&cites=11739691359951272276,53,1981
Colonization of germ-free transgenic mice with genotyped Helicobacter pylori strains from a case-control study of gastric cancer reveals a correlation between host responses …,"BM Björkholm, JL Guruge, JD Oh, AJ Syder, N Salama, K Guillemin, ...","Journal of Biological Chemistry 277 (37), 34191-34197",https://scholar.google.com/scholar?oi=bibs&hl=en&cites=10883817454866065073,52,2002
Genetics of hemolysin of Escherichia coli.,"SI Hull, RA Hull, BH Minshew, S Falkow","Journal of bacteriology 151 (2), 1006-1012",https://scholar.google.com/scholar?oi=bibs&hl=en&cites=16988818354618438726,52,1982
Nature of R-factor replication in the presence of chloramphenicol,"JH Crosa, LK Luttropp, S Falkow","Proceedings of the National Academy of Sciences 72 (2), 654-658",https://scholar.google.com/scholar?oi=bibs&hl=en&cites=10571456196286662145,52,1975
Delineation of upstream signaling events in the Salmonella pathogenicity island 2 transcriptional activation pathway,"CC Kim, S Falkow","Journal of bacteriology 186 (14), 4694-4704",https://scholar.google.com/scholar?oi=bibs&hl=en&cites=5438025877859334805,51,2004
Polynucleotide sequence relationships among some bacterial plasmids,"P Guerry, S Falkow","Journal of bacteriology 107 (1), 372",https://scholar.google.com/scholar?oi=bibs&hl=en&cites=10306656613680237227,51,1971
Intramolecular heterogeneity of the deoxyribonucleic acid of temperate bacteriophages,"S Falkow, DB Cowie","Journal of bacteriology 96 (3), 777-784",https://scholar.google.com/scholar?oi=bibs&hl=en&cites=10210485764549360172,51,1968
Genetic transfer of episomes from Salmonella typhosa to Vibrio cholerae,"LS Baron, S Falkow","Genetics 46, 849",https://scholar.google.com/scholar?oi=bibs&hl=en&cites=13957361216686206136,51,1961
Comparative whole genome sequence analysis of the carcinogenic bacterial model pathogen Helicobacter felis,"IC Arnold, Z Zigova, M Holden, TD Lawley, R Rad, G Dougan, S Falkow, ...","Genome biology and evolution 3, 302-308",https://scholar.google.com/scholar?oi=bibs&hl=en&cites=5460290559662516397,50,2011
Apoptosis as a common bacterial virulence strategy,"D Monack, S Falkow","International journal of medical microbiology 290 (1), 7-13",https://scholar.google.com/scholar?oi=bibs&hl=en&cites=2021066669072406804,50,2000
The frequency of expression of pyelonephritis‐associated pili is under regulatory control,"D Low, EN Robinson, ZA McGee, S Falkow","Molecular microbiology 1 (1), 335-346",https://scholar.google.com/scholar?oi=bibs&hl=en&cites=12669091046383857948,50,1987
Frequency of gene sequences necessary for pyelonephritis-associated pili expression among isolates of Enterobacteriaceae from human extraintestinal infections.,"RA Hull, SI Hull, S Falkow","Infection and immunity 43 (3), 1064-1067",https://scholar.google.com/scholar?oi=bibs&hl=en&cites=3434160294629754074,50,1984
Deoxyribonucleic acid base composition of Proteus and Providence organisms,"S Falkow, IR Ryman, O Washington","Journal of bacteriology 83 (6), 1318-1321",https://scholar.google.com/scholar?oi=bibs&hl=en&cites=14648722360925526665,50,1962
Identification and cloning of the genetic determinant that encodes for the K88ac adherence antigen.,"PL Shipley, G Dougan, S Falkow","Journal of bacteriology 145 (2), 920-925",https://scholar.google.com/scholar?oi=bibs&hl=en&cites=14507024064351900746,49,1981
Streptococcus pneumoniae nasopharyngeal colonization induces type I interferons and interferon-induced gene expression,"EA Joyce, SJ Popper, S Falkow","BMC genomics 10 (1), 404",https://scholar.google.com/scholar?oi=bibs&hl=en&cites=1333329129246599413,48,2009
Evidence for Capsule Gene Sequences among Pharyngeal Isolates of Nontypeable ,"JW St. Geme III, A Takala, E Esko, S Falkow","Journal of Infectious Diseases 169 (2), 337-342",https://scholar.google.com/scholar?oi=bibs&hl=en&cites=7713991174894675319,48,1994
"Purification, characterization, and pathogenicity of Moraxella bovis pili.","WW Ruehl, CF Marrs, R Fernandez, S Falkow, GK Schoolnik","Journal of Experimental Medicine 168 (3), 983-1002",https://scholar.google.com/scholar?oi=bibs&hl=en&cites=1458688002447172360,48,1988
A molecular perspective of microbial pathogenicity,"DA Relman, S Falkow","Mandell, Douglas, and Bennett's Principles and Practice of Infectious …",https://scholar.google.com/scholar?oi=bibs&hl=en&cites=6157161095623292871,47,2015
Plasmid-mediated properties of a heat-stable enterotoxin-producing Escherichia coli associated with infantile diarrhea.,"IK Wachsmuth, S Falkow, RW Ryder","Infection and immunity 14 (2), 403-407",https://scholar.google.com/scholar?oi=bibs&hl=en&cites=12916035558480906571,47,1976
FACS-optimized mutants of the green fluorescent protein (GFP),"BP Cormack, RH Valdivia, S Falkow","US Patent 6,090,919",https://scholar.google.com/scholar?oi=bibs&hl=en&cites=13789935631771822096,46,2000
Constitutive and inducible green fluorescent protein expression in Bartonella henselae,"AK Lee, S Falkow","Infection and immunity 66 (8), 3964-3967",https://scholar.google.com/scholar?oi=bibs&hl=en&cites=12884873687952567617,46,1998
The characterization of R plasmids and the detection of plasmid-specified genes,"LP Elwell, S Falkow","Antibiotics in laboratory medicine 2, 683-721",https://scholar.google.com/scholar?oi=bibs&hl=en&cites=1588574761306191707,46,1986
Plasmid association and nucleotide sequence relationships of two genes encoding heat-stable enterotoxin production in Escherichia coli H-10407.,"SL Moseley, M Samadpour-Motalebi, S Falkow","Journal of bacteriology 156 (1), 441-443",https://scholar.google.com/scholar?oi=bibs&hl=en&cites=3747625988460541465,46,1983
Expression of Pertussis Toxin Correlates with Pathogenesis in ,"D Monack, JJ Munoz, MG Peacock, WJ Black, S Falkow","Journal of Infectious Diseases 159 (2), 205-210",https://scholar.google.com/scholar?oi=bibs&hl=en&cites=5455138653411628904,45,1989
Behavior of coliphage lambda in hybrids between Escherichia coli and Salmonella,"LS Baron, E Penido, IR Ryman, S Falkow","Journal of bacteriology 102 (1), 221-233",https://scholar.google.com/scholar?oi=bibs&hl=en&cites=13368483816113871481,45,1970
Characterization of DNA from a Proteus strain harboring an episome,"JA Wohlhieter, S Falkow, RV Citarella, LS Baron","Journal of molecular biology 9 (2), 576-588",https://scholar.google.com/scholar?oi=bibs&hl=en&cites=1157538667505221401,44,1964
Location of the piliation factor on the chromosome of Escherichia coli,"CC Brinton Jr, P Gemski Jr, S Falkow, LS Baron","Biochemical and Biophysical Research Communications 5 (4), 293-298",https://scholar.google.com/scholar?oi=bibs&hl=en&cites=4929094788496604117,43,1961
The Prokaryotes: Vol. 6: Proteobacteria: Gamma Subclass,M Dworkin,Springer Science & Business Media,"https://scholar.google.com/scholar?oi=bibs&hl=en&cites=13198608061357873591,12624296854519612236",42,2006
Cancer surveillance in ulcerative colitis: more of the same or progress?,"R Vemulapalli, P Lance","Gastroenterology 107 (4), 1196-1199",https://scholar.google.com/scholar?oi=bibs&hl=en&cites=16192742327379052631,42,1994
Transfer of episomic elements to Proteus II. Nature of lac+ Proteus strains isolated from clinical specimens,"S Falkow, JA Wohlhieter, RV Citarella, LS Baron","Journal of bacteriology 88 (6), 1598-1601",https://scholar.google.com/scholar?oi=bibs&hl=en&cites=14298313600511110917,40,1964
Mutation in the ,"KA McDonough, AM Barnes, TJ Quan, J Montenieri, S Falkow","Journal of medical entomology 30 (4), 772-780",https://scholar.google.com/scholar?oi=bibs&hl=en&cites=14948906837093969448,39,1993
Use of nucleic acid probes for the detection of sexually transmitted infectious agents,"JE Horn, T Quinn, M Hammer, L Palmer, S Falkow","Diagnostic microbiology and infectious disease 4 (3), 101S-109S",https://scholar.google.com/scholar?oi=bibs&hl=en&cites=11001983355258962100,39,1986
Plasmids of the genus Neisseria,"LP Elwell, S Falkow","The gonococcus. John Wiley & Sons, Inc., New York, 137-154",https://scholar.google.com/scholar?oi=bibs&hl=en&cites=5725619834014536203,39,1977
Helicobacter pylori and gastric cancer: what can be learned by studying the response of gastric epithelial cells to the infection?,"A Mueller, S Falkow, MR Amieva","Cancer Epidemiology and Prevention Biomarkers 14 (8), 1859-1864",https://scholar.google.com/scholar?oi=bibs&hl=en&cites=14553055994818067079,38,2005
Significance analysis of lexical bias in microarray data,"CC Kim, S Falkow","BMC bioinformatics 4 (1), 12",https://scholar.google.com/scholar?oi=bibs&hl=en&cites=11932063007107231186,38,2003
"Nucleic acid homologies of selected bacteria, L forms, and Mycoplasma species","M Rogul, ZA McGee, RG Wittler, S Falkow","Journal of bacteriology 90 (5), 1200-1204",https://scholar.google.com/scholar?oi=bibs&hl=en&cites=615989878408348314,38,1965
Recipient ability of Salmonella typhosa in genetic crosses with Escherichia coli,"EM Johnson, S Falkow, LS Baron","Journal of bacteriology 87 (1), 54-60",https://scholar.google.com/scholar?oi=bibs&hl=en&cites=14324281641892171714,38,1964
Sequence anomalies in the Cag7 gene of the Helicobacter pylori pathogenicity island,"G Liu, TK McDaniel, S Falkow, S Karlin","Proceedings of the National Academy of Sciences 96 (12), 7011-7016",https://scholar.google.com/scholar?oi=bibs&hl=en&cites=9811915127109494715,37,1999
Phylogenetic relationship of Chlamydia pneumoniae to Chlamydia psittaci and Chlamydia trachomatis as determined by analysis of 16S ribosomal DNA sequences,"CA Gaydos, L Palmer, TC Quinn, S Falkow, JJ Eiden",International Journal of Systematic and Evolutionary Microbiology 43 (3 …,https://scholar.google.com/scholar?oi=bibs&hl=en&cites=10110971228954294051,37,1993
Relationships between extrachromosomal elements,"S Falkow, DK Haapala, RP Silver","Bacterial episomes and plasmids. JA Churchill, Ltd., London, 136-158",https://scholar.google.com/scholar?oi=bibs&hl=en&cites=4578507988065522640,37,1969
New Approaches for Validation of Lethal Phenotypes and Genetic Reversion in ,"TK McDaniel, KC DeWalt, NR Salama, S Falkow","Helicobacter 6 (1), 15-23",https://scholar.google.com/scholar?oi=bibs&hl=en&cites=4548493849238662700,36,2001
"mig-14 is a horizontally acquired, host-induced gene required for Salmonella enterica lethal infection in the murine model of typhoid fever","RH Valdivia, DM Cirillo, AK Lee, DM Bouley, S Falkow","Infection and immunity 68 (12), 7126-7131",https://scholar.google.com/scholar?oi=bibs&hl=en&cites=9846976475708085342,36,2000
Perspectives series: host/pathogen interactions. Invasion and intracellular sorting of bacteria: searching for bacterial genes expressed during host/pathogen interactions.,S Falkow,"The Journal of clinical investigation 100 (2), 239-243",https://scholar.google.com/scholar?oi=bibs&hl=en&cites=1734104594410916207,36,1997
Chromosomal map position of genes encoding P adhesins in uropathogenic Escherichia coli.,"R Hull, S Bieler, S Falkow, S Hull","Infection and immunity 51 (2), 693-695",https://scholar.google.com/scholar?oi=bibs&hl=en&cites=1551004052411907248,36,1986
Transposon insertion and subsequent donor formation promoted by Tn501 in Bordetella pertussis.,"AA Weiss, S Falkow","Journal of bacteriology 153 (1), 304-309",https://scholar.google.com/scholar?oi=bibs&hl=en&cites=2687581717631574399,36,1983
Target cell specificity of wild-type E. coli and mutants and clones with genetically defined adhesins.,"CE Svanborg, R Hull, S Falkow, H Leffler","Progress in food & nutrition science 7 (3-4), 75-89",https://scholar.google.com/scholar?oi=bibs&hl=en&cites=2713356384327464593,36,1983
"Antibiotics, animals, and people--again!","S Falkow, D Kennedy","Science 291 (5503), 397-397",https://scholar.google.com/scholar?oi=bibs&hl=en&cites=10550165675992237070,35,2001
Construction and characterization of Bordetella pertussis toxin mutants.,"WJ Black, S Falkow","Infection and immunity 55 (10), 2465-2470",https://scholar.google.com/scholar?oi=bibs&hl=en&cites=16665411483727499929,35,1987
Beta-lactamase of R factors.,"J Evans, E Galindo, J Olarte, S Falkow","Journal of bacteriology 96 (4), 1441",https://scholar.google.com/scholar?oi=bibs&hl=en&cites=5612363790231673411,35,1968
The relationship of Mycoplasma pneumoniae (Eaton agent) to Streptococcus MG: application of genetic tests to determine relatedness of L-forms and PPLO to bacteria.,"ZA McGee, M Rogul, S Falkow, RG Wittler",Proceedings of the National Academy of Sciences of the United States of …,https://scholar.google.com/scholar?oi=bibs&hl=en&cites=9359534042666203278,35,1965
Recombinant DNA risk assessment studies in humans: efficacy of poorly mobilizable plasmids in biologic containment,"MM Levine, JB Kaper, H Lockman, RE Black, ML Clements, S Falkow","Journal of Infectious Diseases 148 (4), 699-709",https://scholar.google.com/scholar?oi=bibs&hl=en&cites=16398196136482051143,34,1983
Method for the genetic labeling of cryptic plasmids.,"M So, F Heffron, S Falkow","Journal of bacteriology 133 (3), 1520",https://scholar.google.com/scholar?oi=bibs&hl=en&cites=7395592446105962418,33,1978
Spectral analysis of the intramolecular heterogeneity of λ DNA,"SZ Hirschman, M Gellert, S Falkow, G Felsenfeld","Journal of molecular biology 28 (3), 469-477",https://scholar.google.com/scholar?oi=bibs&hl=en&cites=6341474062098688239,33,1967
The Prokaryotes-A Handbook on the Biology of Bacteria,"E Rosenberg, E Stackebrandt, F Thompson, S Lory, E DeLong","Springer-Verlag New York, LLC",https://scholar.google.com/scholar?oi=bibs&hl=en&cites=9342834969537184140,32,2006
Surface structures and adherence properties of diverse strains of Haemophilus influenzae biogroup aegyptius.,"JW St Geme, JR Gilsdorf, S Falkow","Infection and immunity 59 (10), 3366-3371",https://scholar.google.com/scholar?oi=bibs&hl=en&cites=12811587531088698577,32,1991
Genetic analysis of Escherichia coli urease genes: evidence for two distinct loci.,"CM Collins, S Falkow","Journal of bacteriology 172 (12), 7138-7144",https://scholar.google.com/scholar?oi=bibs&hl=en&cites=13521866962860977299,32,1990
The enteric bacilli and vibrios,"S Falkow, J Mekalanos","Microbiology 4, 576-579",https://scholar.google.com/scholar?oi=bibs&hl=en&cites=16608608679922491168,32,1990
Electron microscope heteroduplex studies of sequence relationships among plasmids of the W incompatibility group,"AP Gorai, F Heffron, S Falkow, RW Hedges, N Datta","Plasmid 2 (3), 485-492",https://scholar.google.com/scholar?oi=bibs&hl=en&cites=18202169672413943237,32,1979
Interbacterial Transfer of R Factor in the Human Intestine: In-Vivo Acquisition of R-Factor-mediated Kanamycin Resistance by a Multiresistant Strain of ,"WE Farrar Jr, M Eidson, P Guerry, S Falkow, LM Drusin, RB Roberts","Journal of Infectious Diseases 126 (1), 27-33",https://scholar.google.com/scholar?oi=bibs&hl=en&cites=3848612106218744095,32,1972
The role of host tyrosine phosphorylation in bacterial pathogenesis,"JB Bliska, S Falkow","Trends in Genetics 9 (3), 85-89",https://scholar.google.com/scholar?oi=bibs&hl=en&cites=13674647010711827683,31,1993
"AFA‐I, a cloned afimbrial X‐type adhesin from a human pyelonephritic ","W WALZ, A SCHMIDT, AF LABIGNE‐ROUSSEL, S FALKOW, ...","European journal of biochemistry 152 (2), 315-321",https://scholar.google.com/scholar?oi=bibs&hl=en&cites=14181832851114778378,31,1985
"A Simple, Sensitive, and Specific Assay for the Heat-Stable Enterotoxin of ","SA Waldman, P Q'Hanley, S Falkow, G Schoolnik, F Murad","Journal of Infectious Diseases 149 (1), 83-89",https://scholar.google.com/scholar?oi=bibs&hl=en&cites=17634995283766761050,31,1984
Genetic studies on Neisseria gonorrhoeae from disseminated gonococcal infections.,"LW Mayer, GK Schoolnik, S Falkow","Infection and immunity 18 (1), 165-172",https://scholar.google.com/scholar?oi=bibs&hl=en&cites=14375667351141413617,31,1977
Restoration of virulence to a strain of Shigella flexneri by mating with Escherichia coli,"SB Formal, EH LaBrec, H Schneider, S Falkow","Journal of bacteriology 89 (3), 835-838",https://scholar.google.com/scholar?oi=bibs&hl=en&cites=10213924116092634557,30,1965
Characterization of an Hfr strain of Shigella flexneri,"H Schneider, S Falkow","Journal of bacteriology 88 (3), 682-689",https://scholar.google.com/scholar?oi=bibs&hl=en&cites=17502874429329994806,30,1964
An open letter to Elias Zerhouni,"S Altman, BL Bassler, J Beckwith, M Belfort, HC Berg, B Bloom, ...","Science 307 (5714), 1409-1410",https://scholar.google.com/scholar?oi=bibs&hl=en&cites=16351707009202617865,29,2005
Identification of a Yersinia pestis-specific DNA probe with potential for use in plague surveillance.,"KA McDONOUGH, TG Schwan, RE Thomas, S Falkow","Journal of clinical microbiology 26 (12), 2515-2519",https://scholar.google.com/scholar?oi=bibs&hl=en&cites=7023293693630718166,29,1988
beta-lactamases and R-plasmids of Haemophilus influenzae.,"JR Saunders, LP Elwell, S Falkow, RB Sykes, MH Richmond","Scandinavian journal of infectious diseases. Supplementum, 16-22",https://scholar.google.com/scholar?oi=bibs&hl=en&cites=7113025370140267499,29,1978
The prokaryotes: a handbook on the biology of bacteria,"JF Bernardet, JP Bowman, M Dworkin, S Falkow, E Rosenberg, ...","Proteobacteria: Delta and Epsilon Subclasses. Deeply Rooted Bacteria 7, 481-532",https://scholar.google.com/scholar?oi=bibs&hl=en&cites=5006242923372045169,28,2006
Characterization of ampicillin resistance plasmids from Haemophilus ducreyi.,"PA Totten, HH Handsfield, D Peters, KK Holmes, S Falkow","Antimicrobial agents and chemotherapy 21 (4), 622-627",https://scholar.google.com/scholar?oi=bibs&hl=en&cites=17167779289689640922,28,1982
The uses of green fluorescent protein in prokaryotes,"RH Valdivia, BP Cormack, S Falkow","Methods of biochemical analysis 47, 163",https://scholar.google.com/scholar?oi=bibs&hl=en&cites=3979775103006858857,27,2006
Bile‐induced ‘pili’ in ,"EC Gaynor, N Ghori, S Falkow","Molecular microbiology 39 (6), 1546-1549",https://scholar.google.com/scholar?oi=bibs&hl=en&cites=765147948858698819,27,2001
Bacterial epithelial cell cross talk,"B Raupach, J Mecsas, U Heczko, S Falkow, BB Finlay","Defense of Mucosal Surfaces: Pathogenesis, Immunity and Vaccines, 137-161",https://scholar.google.com/scholar?oi=bibs&hl=en&cites=13199957998031408594,27,1999
Cloning of ,"DM Monack, S Falkow","Molecular microbiology 10 (3), 545-553",https://scholar.google.com/scholar?oi=bibs&hl=en&cites=3907699269099608094,27,1993
Yersinia ail nucleic acids,"S Falkow, R Isberg, V Miller","US Patent 5,239,066",https://scholar.google.com/scholar?oi=bibs&hl=en&cites=6862375849444635353,27,1993
Pathogenesis in Bordetella Species [with Reply],"P Novotny, D Monack, S Falkow","The Journal of infectious diseases 161 (3), 581-583",https://scholar.google.com/scholar?oi=bibs&hl=en&cites=17787254229803692433,27,1990
Plasmid transfer to Bordetella pertussis: conjugation and transformation.,"AA Weiss, S Falkow","Journal of bacteriology 152 (1), 549-552",https://scholar.google.com/scholar?oi=bibs&hl=en&cites=6183268891152477891,27,1982
CHROMOSOME TRANSFER KINETICS OF SALMONELLAHfr STRAINS,"EM Johnson, S Falkow, LS Baron","Journal of bacteriology 88 (2), 395-400",https://scholar.google.com/scholar?oi=bibs&hl=en&cites=7221933100390130858,27,1964
Flourescence-based isolation of differentially induced genes,"RH Valdivia, BP Cormack, S Falkow","US Patent 5,994,077",https://scholar.google.com/scholar?oi=bibs&hl=en&cites=8309650979114428558,26,1999
A study of the dissemination of Tn1681: a bacterial transposon encoding a heat-stable toxin among enterotoxigenic Escherichia coli isolates,"M So, R Atchison, S Falkow, S Moseley, BJ McCarthy","Cold Spring Harbor symposia on quantitative biology 45, 53-58",https://scholar.google.com/scholar?oi=bibs&hl=en&cites=11494697247230935725,26,1981
In vivo transfer of an Escherichia coli enterotoxin plasmid possessing genes for drug resistance.,"C Gyles, S Falkow, L Rollins","American journal of veterinary research 39 (9), 1438-1441",https://scholar.google.com/scholar?oi=bibs&hl=en&cites=3182185345312870658,26,1978
Studies on resistance transfer factor deoxyribonucleic acid in Escherichia coli,"RP Silver, S Falkow","Journal of bacteriology 104 (1), 340-344",https://scholar.google.com/scholar?oi=bibs&hl=en&cites=74190879673654455,26,1970
Invasion and intracellular sorting of bacteria: searching for bacterial genes expressed during host/pathogen interactions,S Falkow,The Journal of clinical investigation 100 (12),https://scholar.google.com/scholar?oi=bibs&hl=en&cites=14685285316506704731,25,1997
Use of a Chlamydia trachomatis DNA probe for detection of ocular chlamydiae.,"D Dean, L Palmer, CR Pant, P Courtright, S Falkow, P O'Hanley","Journal of clinical microbiology 27 (5), 1062-1067",https://scholar.google.com/scholar?oi=bibs&hl=en&cites=37881767814025960,25,1989
Genetic analysis of an Escherichia coli urease locus: evidence of DNA rearrangement.,"CM Collins, S Falkow","Journal of bacteriology 170 (3), 1041-1045",https://scholar.google.com/scholar?oi=bibs&hl=en&cites=11896061032528707163,25,1988
Bacterial conjugation and extrachromosomal elements,"S Falkow, EM Johnson, LS Baron","Annual Review of Genetics 1 (1), 87-116",https://scholar.google.com/scholar?oi=bibs&hl=en&cites=10804789485272086535,25,1967
The Prokaryotes: A Handbook on the Biology of Bacteria-Delta and Epsilon Subclasses-Deeply Rooting Bacteria,"KH Schleifer, M Dworkin, S Falkow, E Rosenberg, KH Schleifer, ...",Springer,"https://scholar.google.com/scholar?oi=bibs&hl=en&cites=1912286314565795982,3806666973580865928",24,2006
Transposition of a plasmid DNA sequence which mediates ampicillin resistance: general description and epidemiologic considerations,"F Heffron, C Rubens, S Falkow","DNA insertion elements, plasmids, and episomes. Cold Spring Harbor …",https://scholar.google.com/scholar?oi=bibs&hl=en&cites=640435086763957185,24,1977
The production of chloramphenicol acetyltransferase by bacteriophage P1CM,"E Kondo, DK Haapala, S Falkow","Virology 40 (3), 431-440",https://scholar.google.com/scholar?oi=bibs&hl=en&cites=15062243354320878254,23,1970
The characterization of plasmids that carry antibiotic resistance genes,"LP Elwell, S Falkow","Antibiotics in laboratory medicine. The Williams & Wilkins Co., Baltimore …",https://scholar.google.com/scholar?oi=bibs&hl=en&cites=13114737136891791529,22,1980
Transposition of a plasmid deoxyribonucleic acid sequence that mediates ampicillin resistance: identity of laboratory-constructed plasmids and clinical isolates.,"F Heffron, C Rubens, S Falkow","Journal of bacteriology 129 (1), 530-533",https://scholar.google.com/scholar?oi=bibs&hl=en&cites=886083822580479885,22,1977
Extrachromosomal determinants which contribute to bacterial pathogenicity,"M So, JF Crandall, JH Crosa, S Falkow","Microbiology, 16-26",https://scholar.google.com/scholar?oi=bibs&hl=en&cites=16471888431998821399,22,1974
Invasive microorganisms,"S Falkow, R Isberg, V Miller, JWS Geme III, CA Lee","US Patent 5,662,908",https://scholar.google.com/scholar?oi=bibs&hl=en&cites=1071938675186630409,21,1997
R-factor cointegrate formation in Salmonella typhimurium bacteriophage type 201 strains.,"R Helmuth, R Stephan, E Bulling, WJ Van Leeuwen, JD Van Embden, ...","Journal of bacteriology 146 (2), 444-452",https://scholar.google.com/scholar?oi=bibs&hl=en&cites=12258616976332566127,21,1981
In vivo conjugal transfer of R plasmids in Neisseria gonorrhoeae,"M Roberts, S Falkow","Infection and immunity 24 (3), 982",https://scholar.google.com/scholar?oi=bibs&hl=en&cites=16377061077864329434,21,1979
"R62, a naturally occurring hybrid R plasmid","P Guerry, S Falkow, N Datta","Journal of bacteriology 119 (1), 144-151",https://scholar.google.com/scholar?oi=bibs&hl=en&cites=11659752507220719879,21,1974
Purification of episomal DNA with cellulose nitrate membrane filters,"JA Wohlhieter, S Falkow, RV Citarella",Biochimica et Biophysica Acta (BBA)-Nucleic Acids and Protein Synthesis 129 …,https://scholar.google.com/scholar?oi=bibs&hl=en&cites=15485317570992681156,21,1966
Who speaks for the microbes?,S Falkow,"Emerging infectious diseases 4 (3), 495",https://scholar.google.com/scholar?oi=bibs&hl=en&cites=14690538384615170770,20,1998
