Title,Authors,Platform,Cited_url,Cited_count,Year
Plasmid-associated enterotoxin production in a strain of Escherichia coli isolated from humans,"FJ Skerman, SB Formal, S Falkow","Infection and immunity 5 (4), 622",https://scholar.google.com/scholar?oi=bibs&hl=en&cites=6641686144248473992,113,1972
Analysis of expression and thermoregulation of the Yersinia pseudotuberculosis inv gene with hybrid proteins.,"RR Isberg, A Swain, S Falkow","Infection and immunity 56 (8), 2133-2138",https://scholar.google.com/scholar?oi=bibs&hl=en&cites=13879851746815929511,112,1988
Redefining bacterial populations: a post-genomic reformation,"EA Joyce, K Chan, NR Salama, S Falkow","Nature Reviews Genetics 3 (6), 462",https://scholar.google.com/scholar?oi=bibs&hl=en&cites=653745431794622502,111,2002
Characterization of Escherichia coli hemolysins conferring quantitative differences in virulence.,"RA Welch, S Falkow","Infection and immunity 43 (1), 156-160",https://scholar.google.com/scholar?oi=bibs&hl=en&cites=17407934294654955440,111,1984
Molecular analysis of R-factors from multiresistant nosocomial isolates,"LS Tompkins, JJ Plorde, S Falkow","Journal of Infectious Diseases 141 (5), 625-636",https://scholar.google.com/scholar?oi=bibs&hl=en&cites=5926386563736960695,111,1980
Structural and genetic analysis of the ,"B Arico, V Scarlato, DM Monack, S Falkow, R Rappuoli","Molecular microbiology 5 (10), 2481-2491",https://scholar.google.com/scholar?oi=bibs&hl=en&cites=5959736241400711359,110,1991
Common R-plasmids in Staphylococcus aureus and Staphylococcus epidermidis during a nosocomial Staphylococcus aureus outbreak.,"ML Cohen, ES Wong, S Falkow","Antimicrobial agents and chemotherapy 21 (2), 210-215",https://scholar.google.com/scholar?oi=bibs&hl=en&cites=10984256107416722965,110,1982
Distribution and degree of heterogeneity of the afimbrial-adhesin-encoding operon (afa) among uropathogenic Escherichia coli isolates.,"A Labigne-Roussel, S Falkow","Infection and immunity 56 (3), 640-648",https://scholar.google.com/scholar?oi=bibs&hl=en&cites=866951759025102025,109,1988
C. Molecular relationships among members of the Enterobacteriaceae,"DJ Brenner, S Falkow","Advances in genetics 16, 81-118",https://scholar.google.com/scholar?oi=bibs&hl=en&cites=2057873889857373208,109,1971
Genetic organization of the afimbrial adhesin operon and nucleotide sequence from a uropathogenic Escherichia coli gene encoding an afimbrial adhesin.,"A Labigne-Roussel, MA Schmidt, W Walz, S Falkow","Journal of bacteriology 162 (3), 1285-1292",https://scholar.google.com/scholar?oi=bibs&hl=en&cites=18434160417218333726,107,1985
Factors essential for the penetration of mammalian cells by Yersinia.,"VL Miller, BB Finlay, S Falkow","Current topics in microbiology and immunology 138, 15-39",https://scholar.google.com/scholar?oi=bibs&hl=en&cites=4012460246704534165,106,1988
"Nucleotide sequence of pilA, the gene encoding the structural component of type 1 pili in Escherichia coli.","PE Orndorff, S Falkow","Journal of bacteriology 162 (1), 454-457",https://scholar.google.com/scholar?oi=bibs&hl=en&cites=12845486026046829326,105,1985
The bvgA gene of Bordetella pertussis encodes a transcriptional activator required for coordinate regulation of several virulence genes.,"CR Roy, JF Miller, S Falkow","Journal of bacteriology 171 (11), 6338-6344",https://scholar.google.com/scholar?oi=bibs&hl=en&cites=15656587485219465908,104,1989
Genetic Analysis of Essential Plasmid Determinants of Pathogenicity in ,"DA Portnoy, HF Blank, DT Kingsbury, S Falkow","Journal of Infectious Diseases 148 (2), 297-304",https://scholar.google.com/scholar?oi=bibs&hl=en&cites=4801334046348306037,104,1983
The ,"DM Catron, MD Sylvester, Y Lange, M Kadekoppala, BD Jones, ...","Cellular microbiology 4 (6), 315-328",https://scholar.google.com/scholar?oi=bibs&hl=en&cites=14286515311366389095,102,2002
Identification and characterization of a gene product that regulates type 1 piliation in Escherichia coli.,"PE Orndorff, S Falkow","Journal of bacteriology 160 (1), 61-66",https://scholar.google.com/scholar?oi=bibs&hl=en&cites=5500543205421842727,101,1984
Use of agarose gel electrophoresis of plasmid deoxyribonucleic acid to fingerprint gram-negative bacilli.,"DR Schaberg, LS Tompkins, S Falkow","Journal of clinical microbiology 13 (6), 1105-1108",https://scholar.google.com/scholar?oi=bibs&hl=en&cites=17480847195761998496,101,1981
Sequence homologies between A subunits of Escherichia coli and Vibrio cholerae enterotoxins,"EK Spicer, WM Kavanaugh, WS Dallas, S Falkow, WH Konigsberg, ...","Proceedings of the National Academy of Sciences 78 (1), 50-54",https://scholar.google.com/scholar?oi=bibs&hl=en&cites=7774476329814946846,101,1981
The nature of intergeneric episomal infection,"J Marmur, R Rownd, S Falkow, LS Baron, C Schildkraut, P Doty",Proceedings of the National Academy of Sciences of the United States of …,https://scholar.google.com/scholar?oi=bibs&hl=en&cites=4928337612563248742,100,1961
Characterization of Interactions of Enteropathogenic ,"CL Francis, AE Jerse, JB Kaper, S Falkow","Journal of Infectious Diseases 164 (4), 693-703",https://scholar.google.com/scholar?oi=bibs&hl=en&cites=17617958242798986241,99,1991
Pilin-gene phase variation of Moraxella bovis is caused by an inversion of the pilin genes.,"CF Marrs, WW Ruehl, GK Schoolnik, S Falkow","Journal of bacteriology 170 (7), 3032-3039",https://scholar.google.com/scholar?oi=bibs&hl=en&cites=10983959612308365869,99,1988
Polynucleotide sequence relationships among plasmids of the I compatibility complex,"S Falkow, P GUERRY, RW Hedges, N DATTA","Microbiology 85 (1), 65-76",https://scholar.google.com/scholar?oi=bibs&hl=en&cites=5568287653963900389,99,1974
"Isolation and characterization of"" Flexispira rappini"" from laboratory mice.","DB Schauer, N Ghori, S Falkow","Journal of Clinical Microbiology 31 (10), 2709-2714",https://scholar.google.com/scholar?oi=bibs&hl=en&cites=6126088209183891205,98,1993
Analysis of Bordetella pertussis virulence gene regulation by use of transcriptional fusions in Escherichia coli.,"JF Miller, CR Roy, S Falkow","Journal of bacteriology 171 (11), 6345-6348",https://scholar.google.com/scholar?oi=bibs&hl=en&cites=4626423450297872111,98,1989
The molecular nature of heat-labile enterotoxin (LT) of Escherichia coli,"WS Dallas, S Falkow","Nature 277 (5695), 406",https://scholar.google.com/scholar?oi=bibs&hl=en&cites=9267799684766837568,98,1979
Molecular nature of two beta-lactamase-specifying plasmids isolated from Haemophilus influenzae type b.,"J De Graaff, LP Elwell, S Falkow","Journal of bacteriology 126 (1), 439-446",https://scholar.google.com/scholar?oi=bibs&hl=en&cites=847357150485955329,98,1976
Mode of replication of the conjugative R-plasmid RSF1040 in Escherichia coli.,"JH Crosa, LK Luttropp, S Falkow","Journal of bacteriology 126 (1), 454-466",https://scholar.google.com/scholar?oi=bibs&hl=en&cites=3740334866243931261,98,1976
Virulence of Escherichia-Shigella genetic hybrids for the guinea pig,"S Falkow, H Schneider, LS Baron, SB Formal","Journal of bacteriology 86 (6), 1251-1258",https://scholar.google.com/scholar?oi=bibs&hl=en&cites=12114507346262751286,98,1963
mig-14 is a Salmonella gene that plays a role in bacterial resistance to antimicrobial peptides,"IE Brodsky, RK Ernst, SI Miller, S Falkow","Journal of bacteriology 184 (12), 3203-3213",https://scholar.google.com/scholar?oi=bibs&hl=en&cites=1206792794161277047,97,2002
"Two modes of control of pilA, the gene encoding type 1 pilin in Escherichia coli.","PE Orndorff, PA Spears, D Schauer, S Falkow","Journal of bacteriology 164 (1), 321-330",https://scholar.google.com/scholar?oi=bibs&hl=en&cites=12799951275712378642,97,1985
Molecular cloning of an Escherichia coli plasmid determinant than encodes for the production of heat-stable enterotoxin.,"M So, HW Boyer, M Betlach, S Falkow","Journal of bacteriology 128 (1), 463-472","https://scholar.google.com/scholar?oi=bibs&hl=en&cites=10565613041429242076,13042230971686633448",97,1976
Phase variants of ,"DM Monack, B Arico, R Rappuoli, S Falkow","Molecular microbiology 3 (12), 1719-1728",https://scholar.google.com/scholar?oi=bibs&hl=en&cites=15415806819331757942,95,1989
Invasin expression in Yersinia pseudotuberculosis.,"M Simonet, S Falkow","Infection and immunity 60 (10), 4414-4417",https://scholar.google.com/scholar?oi=bibs&hl=en&cites=12289264123403685737,94,1992
Nonpathogenic isolates of Yersinia enterocolitica do not contain functional inv-homologous sequences.,"DE Pierson, S Falkow","Infection and immunity 58 (4), 1059-1064",https://scholar.google.com/scholar?oi=bibs&hl=en&cites=4015973708895695808,94,1990
A taxonomic study of Gardnerella vaginalis (Haemophilus vaginalis) Gardner and Dukes 1955,"P PIOT, E VAN DYCK, M GOODFELLOW, S FALKOW","Microbiology 119 (2), 373-396",https://scholar.google.com/scholar?oi=bibs&hl=en&cites=14590318639569697799,94,1980
Episomic element in a strain of Salmonella typhosa,"S Falkow, LS Baron","Journal of bacteriology 84 (3), 581-589",https://scholar.google.com/scholar?oi=bibs&hl=en&cites=5363075414869326830,94,1962
"The Prokaryotes, a Handbook on the Biology of Bacteria: Ecophysiology, Isolation, Identification, Applications","P Baumann, NA Moran, L Baumann","Springer, New York",https://scholar.google.com/scholar?oi=bibs&hl=en&cites=17452116902068911536,93,2000
Some Characteristics of ,"BH Minshew, J Jorgensen, M Swanstrum, GA Grootes-Reuvecamp, ...","Journal of Infectious Diseases 137 (5), 648-654",https://scholar.google.com/scholar?oi=bibs&hl=en&cites=3468045510239963981,93,1978
"Gastric MALT lymphoma B cells express polyreactive, somatically mutated immunoglobulins","VJ Craig, I Arnold, C Gerke, MQ Huynh, T Wündisch, A Neubauer, ...","Blood 115 (3), 581-591",https://scholar.google.com/scholar?oi=bibs&hl=en&cites=11734793155369120693,92,2010
Frequency among Enterobacteriaceae of the DNA sequences encoding type 1 pili.,"K Buchanan, S Falkow, RA Hull, SI Hull","Journal of bacteriology 162 (2), 799-803",https://scholar.google.com/scholar?oi=bibs&hl=en&cites=15671095342980886985,91,1985
Autogenous regulation of the Bordetella pertussis bvgABC operon.,"CR RoY, JF Miller, S Falkow","Proceedings of the National Academy of Sciences 87 (10), 3763-3767",https://scholar.google.com/scholar?oi=bibs&hl=en&cites=4855698484857727798,90,1990
Protection of monkeys against experimental shigellosis with a living attenuated oral polyvalent dysentery vaccine,"SB Formal, TH Kent, HC May, A Palmer, S Falkow, EH LaBrec","Journal of bacteriology 92 (1), 17-22",https://scholar.google.com/scholar?oi=bibs&hl=en&cites=14259895462373565603,90,1966
Chronic Helicobacter pylori infection with Sydney strain 1 and a newly identified mouse-adapted strain (Sydney strain 2000) in C57BL/6 and BALB/c mice,"LJ Thompson, SJ Danon, JE Wilson, JL O'Rourke, NR Salama, S Falkow, ...","Infection and immunity 72 (8), 4668-4679",https://scholar.google.com/scholar?oi=bibs&hl=en&cites=15049907135966079473,88,2004
ADP-ribosyltransferase activity of pertussis toxin and immunomodulation by Bordetella pertussis,"WJ Black, JJ Munoz, MG Peacock, PA Schad, JL Cowell, JJ Burchall, ...","Science 240 (4852), 656-659",https://scholar.google.com/scholar?oi=bibs&hl=en&cites=17504905135652550302,88,1988
Evolutionary genetics: CCR5 mutation and plague protection,"J Mecsas, G Franklin, WA Kuziel, RR Brubaker, S Falkow, DE Mosier","Nature 427 (6975), 606",https://scholar.google.com/scholar?oi=bibs&hl=en&cites=14083872230842916065,87,2004
Remodeling schemes of intracellular pathogens,"PLC Small, L Ramakrishnan, S Falkow","Science, 637-639",https://scholar.google.com/scholar?oi=bibs&hl=en&cites=1463936929847264,87,1994
The ecology of gonococcal plasmids,"M ROBERTS, P PIOT, S FALKOW","Microbiology 114 (2), 491-494",https://scholar.google.com/scholar?oi=bibs&hl=en&cites=10428272552031028559,87,1979
Relationships among some R plasmids found in Haemophilus influenzae.,"LP Elwell, JR Saunders, MH Richmond, S Falkow","Journal of bacteriology 131 (1), 356-362",https://scholar.google.com/scholar?oi=bibs&hl=en&cites=9619409262120199660,85,1977
Mig‐14 is an inner membrane‐associated protein that promotes ,"IE Brodsky, N Ghori, S Falkow, D Monack","Molecular microbiology 55 (3), 954-972",https://scholar.google.com/scholar?oi=bibs&hl=en&cites=18127436615481142123,84,2005
Evaluation of DNA colony hybridization and other techniques for detection of virulence in Yersinia species.,"RM Robins-Browne, MD Miliotis, S Cianciosi, VL Miller, S Falkow, ...","Journal of Clinical Microbiology 27 (4), 644-650",https://scholar.google.com/scholar?oi=bibs&hl=en&cites=8453675792459886266,84,1989
Use of an Open-Reading Frame–Specific ,"EE Leonard II, T Takata, MJ Blaser, S Falkow, LS Tompkins, EC Gaynor","The Journal of infectious diseases 187 (4), 691-694",https://scholar.google.com/scholar?oi=bibs&hl=en&cites=18132016738419354207,83,2003
"Sequence, localization and function of the invasin protein of ","VB Young, VL Miller, S Falkow, GK Schoolnik","Molecular microbiology 4 (7), 1119-1128",https://scholar.google.com/scholar?oi=bibs&hl=en&cites=11507212371774165614,83,1990
The ,"JK MacKichan, EC Gaynor, C Chang, S Cawthraw, DG Newell, JF Miller, ...","Molecular microbiology 54 (5), 1269-1286",https://scholar.google.com/scholar?oi=bibs&hl=en&cites=12192251632636000791,82,2004
"Pyrazinamidase, CR-MOX agar, salicin fermentation-esculin hydrolysis, and D-xylose fermentation for identifying pathogenic serotypes of Yersinia enterocolitica.","JJ Farmer, GP Carter, VL Miller, S Falkow, IK Wachsmuth","Journal of clinical microbiology 30 (10), 2589-2594",https://scholar.google.com/scholar?oi=bibs&hl=en&cites=14254384059655833377,82,1992
Identification of Legionella pneumophilagenes important for infection of amoebas by signature-tagged mutagenesis,"AH Polesky, JTD Ross, S Falkow, LS Tompkins","Infection and immunity 69 (2), 977-987",https://scholar.google.com/scholar?oi=bibs&hl=en&cites=8970472340873513852,81,2001
TRANSFER OF EPISOMIC ELEMENTS TO PROTEUS I.: Transfer of F-Linked Chromosomal Determinants,"S Falkow, JA Wohlhieter, RV Citarella, LS Baron","Journal of bacteriology 87 (1), 209-219",https://scholar.google.com/scholar?oi=bibs&hl=en&cites=8478489795102364387,81,1964
Comparison of Campylobacter jejuni isolates implicated in Guillain-Barre syndrome and strains that cause enteritis by a DNA microarray,"EE Leonard, LS Tompkins, S Falkow, I Nachamkin","Infection and immunity 72 (2), 1199-1203",https://scholar.google.com/scholar?oi=bibs&hl=en&cites=3248494318651414599,80,2004
Relationship between colicin V activity and virulence in Escherichia coli,"RL Quackenbush, S Falkow","Infection and immunity 24 (2), 562",https://scholar.google.com/scholar?oi=bibs&hl=en&cites=4410469094815566452,79,1979
Protection of monkeys against experimental shigellosis with attenuated vaccines,"SB Formal, EH LaBrec, A Palmer, S Falkow","Journal of bacteriology 90 (1), 63-68",https://scholar.google.com/scholar?oi=bibs&hl=en&cites=5928118709585307265,79,1965
The adaptor molecules LAT and SLP-76 are specifically targeted by Yersinia to inhibit T cell activation,"C Gerke, S Falkow, Y Chien","Journal of Experimental Medicine 201 (3), 361-371",https://scholar.google.com/scholar?oi=bibs&hl=en&cites=502690960215055420,77,2005
Characterization of plasmids that encode for the K88 colonization antigen.,"PL Shipley, CL Gyles, S Falkow","Infection and immunity 20 (2), 559-566",https://scholar.google.com/scholar?oi=bibs&hl=en&cites=8696433982319330111,77,1978
Phosphorylation-Independent Effects of CagA during Interaction between ,"SH El-Etr, A Mueller, LS Tompkins, S Falkow, DS Merrell","The Journal of infectious diseases 190 (8), 1516-1523",https://scholar.google.com/scholar?oi=bibs&hl=en&cites=10562418332797960672,75,2004
LuxS is required for persistent pneumococcal carriage and expression of virulence and biosynthesis genes,"EA Joyce, A Kawale, S Censini, CC Kim, A Covacci, S Falkow","Infection and immunity 72 (5), 2964-2975",https://scholar.google.com/scholar?oi=bibs&hl=en&cites=7918895660193000480,75,2004
"Nucleotide sequence homology between the immunoglobulin A1 protease genes of Neisseria gonorrhoeae, Neisseria meningitidis, and Haemophilus influenzae.","JM Koomey, S Falkow","Infection and immunity 43 (1), 101-107",https://scholar.google.com/scholar?oi=bibs&hl=en&cites=7639838602829735813,75,1984
Entry of microbes into the host: using M cells to break the mucosal barrier,"B Jones, L Pascopella, S Falkow","Current opinion in immunology 7 (4), 474-478",https://scholar.google.com/scholar?oi=bibs&hl=en&cites=3528684097405938759,74,1995
A soluble 60 ,"P Bavoil, RS Stephens, S Falkow","Molecular microbiology 4 (3), 461-469",https://scholar.google.com/scholar?oi=bibs&hl=en&cites=1944197148620736301,74,1990
The ,"J Mecsas, B Raupach, S Falkow","Molecular microbiology 28 (6), 1269-1281",https://scholar.google.com/scholar?oi=bibs&hl=en&cites=4895088206512751845,73,1998
Characterization of plasmid deoxyribonucleic acid from Neisseria gonorrhoeae,"LW Mayer, KK Holmes, S Falkow","Infection and immunity 10 (4), 712-717",https://scholar.google.com/scholar?oi=bibs&hl=en&cites=9754305384461895042,73,1974
Specific labeling and physical characterization of R-factor deoxyribonucleic acid in Escherichia coli,"RP Silver, S Falkow","Journal of bacteriology 104 (1), 331-339",https://scholar.google.com/scholar?oi=bibs&hl=en&cites=3527732914828783054,73,1970
"The evolution of pathogenicity in Escherichia, Shigella, and Salmonella",S Falkow,Escherichia coli and Salmonella: cellular and molecular biology 2,https://scholar.google.com/scholar?oi=bibs&hl=en&cites=13237132998228503624,72,1996
An Edwardsiella tarda strain containing a mutation in a gene with homology to shlB and hpmB is defective for entry into epithelial cells in culture.,"EJ Strauss, N Ghori, S Falkow","Infection and immunity 65 (9), 3924-3932",https://scholar.google.com/scholar?oi=bibs&hl=en&cites=12935930901837122510,71,1997
Isolation of a temperature-sensitive derivative of RP1,"MK Robinson, PM Bennett, S Falkow, HM Dodd","Plasmid 3 (3), 343-347",https://scholar.google.com/scholar?oi=bibs&hl=en&cites=7918864298447242508,70,1980
Molecular homology of F-merogenote DNA,"S Falkow, RV Citarella","Journal of molecular biology 12 (1), 138-151",https://scholar.google.com/scholar?oi=bibs&hl=en&cites=18206845370311751019,70,1965
Genetic homology between Escherichia coli K-12 and Salmonella,"S Falkow, R Rownd, LS Baron","Journal of bacteriology 84 (6), 1303-1312",https://scholar.google.com/scholar?oi=bibs&hl=en&cites=3981996554879150940,70,1962
"The prokaryotes: vol. 4: bacteria: firmicutes, cyanobacteria",M Dworkin,Springer Science & Business Media,"https://scholar.google.com/scholar?oi=bibs&hl=en&cites=5181229502999666169,8398229156471639207,12346368455021934066",69,2006
Pertussis toxin is required for pertussis vaccine encephalopathy,"L Steinman, A Weiss, N Adelman, M Lim, R Zuniga, J Oehlert, E Hewlett, ...","Proceedings of the National Academy of Sciences 82 (24), 8733-8736",https://scholar.google.com/scholar?oi=bibs&hl=en&cites=3086430125242785367,69,1985
Cloning of the thermostable direct or Kanagawa phenomenon-associated hemolysin of Vibrio parahaemolyticus.,"JB Kaper, RK Campen, RJ Seidler, MM Baldini, S Falkow","Infection and immunity 45 (1), 290-292",https://scholar.google.com/scholar?oi=bibs&hl=en&cites=8153833054562854388,69,1984
Breaking into the epithelial apical–junctional complex—news from pathogen hackers,"R Vogelmann, MR Amieva, S Falkow, WJ Nelson","Current opinion in cell biology 16 (1), 86-93",https://scholar.google.com/scholar?oi=bibs&hl=en&cites=11586073427526448353,68,2004
Protective immunity against Helicobacter is characterized by a unique transcriptional signature,"A Mueller, J O'Rourke, P Chu, CC Kim, P Sutton, A Lee, S Falkow","Proceedings of the National Academy of Sciences 100 (21), 12289-12294",https://scholar.google.com/scholar?oi=bibs&hl=en&cites=4048762622776220973,68,2003
Transfer of the virulence plasmid of Yersinia pestis to Yersinia pseudotuberculosis.,"H Wolf-Watz, DA Portnoy, I Bölin, S Falkow","Infection and immunity 48 (1), 241-243",https://scholar.google.com/scholar?oi=bibs&hl=en&cites=4628042126749125796,68,1985
Protein antigens from Staphylococcus aureus strains associated with toxic-shock syndrome,"ML Cohen, S Falkow","Science 211 (4484), 842-844",https://scholar.google.com/scholar?oi=bibs&hl=en&cites=1351198445419804186,68,1981
Two replication initiation sites on R-plasmid DNA,"JH Crosa, LK Luttropp, F Heffron, S Falkow","Molecular and General Genetics MGG 140 (1), 39-50",https://scholar.google.com/scholar?oi=bibs&hl=en&cites=14215095695710338185,68,1975
Probing bacterial gene expression within host cells,"RH Valdivia, S Falkow","Trends in microbiology 5 (9), 360-363",https://scholar.google.com/scholar?oi=bibs&hl=en&cites=13698787398075457191,67,1997
A molecular strategy for the study of bacterial invasion,"S Falkow, P Small, R Isberg, SF Hayes, D Corwin","Reviews of infectious diseases 9 (Supplement_5), S450-S455",https://scholar.google.com/scholar?oi=bibs&hl=en&cites=1777116437678941682,67,1987
"A crtB homolog essential for photochromogenicity in Mycobacterium marinum: isolation, characterization, and gene disruption via homologous recombination.","L Ramakrishnan, HT Tran, NA Federspiel, S Falkow","Journal of Bacteriology 179 (18), 5862-5868",https://scholar.google.com/scholar?oi=bibs&hl=en&cites=7493578647701300063,66,1997
Detection of Chlamydia trachomatis in tissue culture and cervical scrapings by in situ DNA hybridization,"JE Horn, ML Hammer, S Falkow, TC Quinn","The Journal of infectious diseases 153 (6), 1155-1159",https://scholar.google.com/scholar?oi=bibs&hl=en&cites=10206244195999652255,66,1986
Transcriptional response in the peripheral blood of patients infected with Salmonella enterica serovar Typhi,"LJ Thompson, SJ Dunstan, C Dolecek, T Perkins, D House, G Dougan, ...","Proceedings of the National Academy of Sciences 106 (52), 22433-22438",https://scholar.google.com/scholar?oi=bibs&hl=en&cites=4059251520886350722,65,2009
Method for determining virulence of Yersinia,"RR Isberg, V Miller, S Falkow","US Patent 5,310,654",https://scholar.google.com/scholar?oi=bibs&hl=en&cites=9773903922028747809,65,1994
Replication of the nonconjugative plasmid RSF1010 in Escherichia coli K-12.,"J De Graaff, JH Crosa, F Heffron, S Falkow","Journal of bacteriology 134 (3), 1117-1122",https://scholar.google.com/scholar?oi=bibs&hl=en&cites=13988330536889577333,63,1978
Identification of regions on a 230-kilobase plasmid from enteroinvasive Escherichia coli that are required for entry into HEp-2 cells.,"PL Small, S Falkow","Infection and immunity 56 (1), 225-229",https://scholar.google.com/scholar?oi=bibs&hl=en&cites=10265897036430275084,61,1988
Molecular cloning of replication and incompatibility regions from the R-plasmid R6K,"JH Crosa, LK Luttropp, S Falkow","Journal of molecular biology 124 (3), 443-468",https://scholar.google.com/scholar?oi=bibs&hl=en&cites=1169819499224689110,61,1978
Episomic transfer between Salmonella typhosa and Serratia marcescens,"S Falkow, J Marmur, WF Carey, WM Spilman, LS Baron","Genetics 46 (7), 703",https://scholar.google.com/scholar?oi=bibs&hl=en&cites=178176845785427561,61,1961
Identification of uncultured microorganisms: expanding the spectrum of characterized microbial pathogens.,"DA Relman, S Falkow","Infectious agents and disease 1 (5), 245-253",https://scholar.google.com/scholar?oi=bibs&hl=en&cites=5572544699811338428,60,1992
Virulence factors associated with Salmonella species.,"BB Finlay, S Falkow","Microbiological sciences 5 (11), 324-328",https://scholar.google.com/scholar?oi=bibs&hl=en&cites=6258212308717630179,60,1988
Modulation of virulence by two acidified nitrite-responsive loci of Salmonella enterica serovar Typhimurium,"CC Kim, D Monack, S Falkow","Infection and immunity 71 (6), 3196-3205",https://scholar.google.com/scholar?oi=bibs&hl=en&cites=12463721126679137532,59,2003
Development of a DNA probe for the virulence plasmid of Shigella spp. and enteroinvasive Escherichia coli,PLC Small,"Microbiology-1986, 121-125",https://scholar.google.com/scholar?oi=bibs&hl=en&cites=18333414990372515004,59,1984
"Mannose-sensitive and Gal-Gal binding Escherichia coli pili from recombinant strains. Chemical, functional, and serological properties.","P O'hanley, D Lark, S Normark, S Falkow, GK Schoolnik","Journal of Experimental Medicine 158 (5), 1713-1719",https://scholar.google.com/scholar?oi=bibs&hl=en&cites=9707869759460884529,59,1983
"A comparison of microbial invasion strategies of Salmonella, Shigella and Yersinia species","BB Finlay, S Falkow","UCLA Symp. Mol. Cell. Biol 64, 227-243",https://scholar.google.com/scholar?oi=bibs&hl=en&cites=2479767947891848185,58,1988
The role of antigenic drive and tumor-infiltrating accessory cells in the pathogenesis of helicobacter-induced mucosa-associated lymphoid tissue lymphoma,"A Mueller, J O'Rourke, P Chu, A Chu, MF Dixon, DM Bouley, A Lee, ...","The American journal of pathology 167 (3), 797-812",https://scholar.google.com/scholar?oi=bibs&hl=en&cites=8921658568209708695,57,2005
Polynucleotide sequence relationships among Ent plasmids and the relationship between Ent and other plasmids.,"M So, JH Crosa, S Falkow","Journal of bacteriology 121 (1), 234-238",https://scholar.google.com/scholar?oi=bibs&hl=en&cites=13790621046716752451,57,1975
The new paths to preventing ulcers,"LS Tompkins, S Falkow","Science 267 (5204), 1621-1623",https://scholar.google.com/scholar?oi=bibs&hl=en&cites=16071322173459328070,56,1995
Isolation of enterotoxin structural gene deletion mutations in Vibrio cholerae induced by two mutagenic vibriophages,"JJ Mekalanos, SL Moseley, JR Murphy, S Falkow","Proceedings of the National Academy of Sciences 79 (1), 151-155",https://scholar.google.com/scholar?oi=bibs&hl=en&cites=2359307821097052897,56,1982
