Title,Authors,Platform,Cited_url,Cited_count,Year
Abnormal auditory mismatch negativity (MMNm) in behavioural variant frontotemporal dementia.,"JB Rowe, L Hughes, PJ Nestor","NeuroImage, S90",https://scholar.google.com/scholar?oi=bibs&hl=en&cites=15766299626325505074,1,2009
Neuroimaging,"JB Rowe, RSJ Frackowiak",Encyclopedia of Cognitive Science,https://scholar.google.com/scholar?oi=bibs&hl=en&cites=6701396127160826579,1,2006
Specific Activations Underline Aesthetic Judgment of Affective Pictures,"M Skov, MS Christensen, JB Rowe, OB Paulson",Neuroimage,https://scholar.google.com/scholar?oi=bibs&hl=en&cites=252858395879560383,1,2005
Prefrontal cortex and attention to action,"RE Passingham, JB Rowe, K Sakai","Attention in Action, 279-302",https://scholar.google.com/scholar?oi=bibs&hl=en&cites=13454608308025780636,1,2004
Enhanced metabolic suppression of frontal motor areas after inhibitory repetitive TMS of the lateral premotor cortex in primary dystonia,"HR Siebner, JB Rowe, S Filipovic, C Cordivari, JC Rothwell, K Bhatia","MOVEMENT DISORDERS 17, S287-S287",https://scholar.google.com/scholar?oi=bibs&hl=en&cites=10980998055849978611,1,2002
Attention tea action in Parkinson's disease,"JB Rowe, K Stephan, R Frackowiak, A Lees, R Passingham","NeuroImage 13 (6), S830-S830",https://scholar.google.com/scholar?oi=bibs&hl=en&cites=12313267421791870881,1,2001
In vivo tracing of anatomical fibre tracts in the Macaque monkey brain by diffusion tenser imaging (DTI),"KE Stephan, GJM Parker, GJ Barker, JB Rowe, DG MacManus, ...","NeuroImage 13 (6), S258-S258",https://scholar.google.com/scholar?oi=bibs&hl=en&cites=4654478599322550135,1,2001
Separating vascular and neuronal effects of age on fMRI BOLD signals,"KA Tsvetanov, RNA Henson, JB Rowe",arXiv preprint arXiv:1912.02899,,0,2019
Asymmetrical atrophy of thalamic subnuclei in Alzheimer's disease and amyloid-positive mild cognitive impairment is associated with key clinical features,"A Low, E Mak, M Malpetti, L Chouliaras, N Nicastro, L Su, N Holland, ...","Alzheimer's & Dementia: Diagnosis, Assessment & Disease Monitoring 11, 690-699",,0,2019
European Ultrahigh-Field Imaging Network for Neurodegenerative Diseases (EUFIND),"E Düzel, J Acosta-Cabronero, D Berron, GJ Biessels, ...","Alzheimer's & Dementia: Diagnosis, Assessment & Disease Monitoring 11, 538-549",,0,2019
Biomagnetic biomarkers for dementia: A pilot multicentre study with a recommended methodological framework for magnetoencephalography,"LE Hughes, RN Henson, E Pereda, R Bruña, D López-Sanz, AJ Quinn, ...","Alzheimer's & Dementia: Diagnosis, Assessment & Disease Monitoring 11, 450-462",,0,2019
Falls in Progressive Supranuclear Palsy,"FS Brown, JB Rowe, L Passamonti, T Rittman",Movement Disorders Clinical Practice,,0,2019
Parkinsonism in frontotemporal dementias.,JB Rowe,"International review of neurobiology 149, 249-275",,0,2019
Improving diagnosis across the spectrum of progressive supranuclear palsy and corticobasal syndrome in a prospective cohort (PROSPECT) study.,"J Rowe, E Jabbari, N Holland, V Chelban, S Jones, R Lamb, C Rawlinson, ...",American Medical Association,,0,2019
Ventricular volume expansion in presymptomatic genetic frontotemporal dementia,"TP Tavares, DGV Mitchell, K Coleman, C Shoesmith, R Bartha, DM Cash, ...","Neurology 93 (18), e1699-e1706",,0,2019
F-AV1451 PET imaging and multimodal MRI changes in progressive supranuclear palsy,"N Nicastro, PV Rodriguez, M Malpetti, WR Bevan-Jones, PS Jones, ...","Journal of neurology, 1-9",,0,2019
Cognitive Diversity in a Healthy Aging Cohort: Cross-Domain Cognition in the Cam-CAN Project,"MA Shafto, RN Henson, FE Matthews, JR Taylor, T Emery, S Erzinclioglu, ...","Journal of aging and health, 0898264319878095",,0,2019
18F-AV1451 PET imaging and multimodal MRI changes in progressive supranuclear palsy,J Rowe,Dietrich Steinkopff Verlag,,0,2019
Cortical and subcortical atrophy in typical and variant Parkinson-plus syndromes: PROSPECT-M-UK study: 1897,"N Holland, S Jones, J Woodside, E Jabbari, V Chelban, A Costantini, ...",Movement Disorders 34,,0,2019
"Baseline analysis of PROSPECT-M-UK: a longitudinal study of PSP, CBS and MSA: 909","E Jabbari, J Woodside, V Chelban, A Costantini, N Holland, N Leigh, ...",Movement Disorders 34,,0,2019
Molecular correlates of survival and clinical severity in Progressive Supranuclear Palsy: 1927,"M Malpetti, L Passamonti, T Rittman, PV Rodríguez, W Bevan-Jones, ...",Movement Disorders 34,,0,2019
11C‐PK11195 PET imaging and white matter changes in Parkinson’s disease dementia,"N Nicastro, A Surendranathan, E Mak, JB Rowe, JT O’Brien",Annals of clinical and translational neurology,,0,2019
Atomoxetine and citalopram alter brain network organization in Parkinson’s disease,"RJ Borchert, T Rittman, CL Rae, L Passamonti, SP Jones, D Vatansever, ...","Brain Communications 1 (1), fcz013",,0,2019
Language impairment in progressive supranuclear palsy and corticobasal syndrome: a review,"K Peterson, K Patterson, J Rowe",Dr. Dietrich Steinkopff Verlag,,0,2019
LONGITUDINAL ASSOCIATION BETWEEN APATHY AND COGNITIVE DECLINE IN PRE-AND POST-SYMPTOMATIC GENETIC FRONTOTEMPORAL DEMENTIA,"M Malpetti, RA Kievit, PS Jones, T Rittman, KA Tsvetanov, JC van Swieten, ...","Alzheimer's & Dementia: The Journal of the Alzheimer's Association 15 (7), P1237",,0,2019
ASYMMETRICAL THALAMIC SUBNUCLEI IN ALZHEIMER’S DISEASE ASSOCIATED WITH GREATER DISEASE SEVERITY,"A Low, E Mak, M Malpetti, L Chouliaras, N Nicastro, L Su, N Holland, ...",Alzheimer's & Dementia: The Journal of the Alzheimer's Association 15 (7 …,,0,2019
"QUANTIFYING MITOCHONDRIAL AND SYNAPTIC FUNCTION IN ALZHEIMER’S DISEASE USING [18F] BCPP-EF,[11C] SA4503 AND [11C] UCB-J PET IMAGING","AV Venkataraman, A Mansur, Y Lewis, E Kocagoncu, A Lingford-Hughes, ...",Alzheimer's & Dementia: The Journal of the Alzheimer's Association 15 (7 …,,0,2019
THE MINI LINGUISTIC STATE EXAMINATION (MLSE)–A STANDARDISED TOOL TO CLASSIFY AND MONITOR PRIMARY PROGRESSIVE APHASIA,"N Patel, KA Peterson, ML Ralph, K Patterson, JB Rowe, SF Cappa, ...","Alzheimer's & Dementia: The Journal of the Alzheimer's Association 15 (7), P357",,0,2019
GENFI IGNITE: A NOVEL COGNITIVE ASSESSMENT APP FOR TESTING PRESYMPTOMATIC FRONTOTEMPORAL DEMENTIA,"KM Moore, JM Nicholas, RS Convery, CV Greaves, M Bocchetta, ...",Alzheimer's & Dementia: The Journal of the Alzheimer's Association 15 (7 …,,0,2019
EARLY REGIONAL HYPOMETABOLISM IN PRE-SYMPTOMATIC CARRIERS OF MAPT: A GENFI SUB-STUDY,"F St-Onge, P Karteek, MF Beg, JM Beauregard, M Bocchetta, M Masellis, ...",Alzheimer's & Dementia: The Journal of the Alzheimer's Association 15 (7 …,,0,2019
"Evaluation of mitochondrial and synaptic function in Alzheimer's disease (AD): a [F-18] BCPP-EF,[C-11] SA4503 and [C-11] UCB-J PET study","AV Venkataraman, A Mansur, M Huiban, J Passchier, JB Rowe, ...","JOURNAL OF CEREBRAL BLOOD FLOW AND METABOLISM 39, 121-122",,0,2019
Connectomics and molecular imaging in neurodegeneration,"GN Bischof, M Ewers, N Franzmeier, MJ Grothe, M Hoenig, E Kocagoncu, ...","European journal of nuclear medicine and molecular imaging, 1-12",,0,2019
"Minett T, Su L, Mak E, Williams G, Firbank M, Lawson RA, Yarnall AJ, Duncan","OAM GW, TK Khoo, DJ Brooks, JB Rowe, RA Barker, D Burn, JT O'Brien",,,0,2019
Disease-informed brain mapping teaches important lessons about the human brain.,"A Dagher, S Lehéricy, JB Rowe, HR Siebner","NeuroImage 190, 1",,0,2019
Quantification of neurons in the inferior frontal gyrus in frontotemporal lobar degeneration,"SS Kaalund, KSJ Allinson, MG Spillantini, JB Rowe","NEUROPATHOLOGY AND APPLIED NEUROBIOLOGY 45, 18-18",,0,2019
Deep and Frequent Phenotyping study protocol: an observational study in prodromal Alzheimer’s disease,"I Koychev, J Lawson, T Chessell, C Mackay, R Gunn, B Sahakian, ...","BMJ open 9 (3), e024498",,0,2019
Data-driven algorithm for the diagnosis of behavioral variant frontotemporal dementia,"A Manera, M Dadar, J van Swieten, B Borroni, R Sanchez-Valle, ...",bioRxiv,,0,2019
Analysis of brain atrophy and local gene expression implicates astrocytes in Frontotemporal dementia,"A Altmann, DM Cash, M Bocchetta, C Heller, RH Reynolds, K Moore, ...",BioRxiv,,0,2019
Alien limb in the corticobasal syndrome: phenomenological characteristics and relationship to apraxia,"DJ Lewis-Smith, N Wolpe, BCP Ghosh, JB Rowe","medRxiv, 19013607",,0,2019
Cortical complexity analyses and their cognitive correlate in Alzheimer's disease and frontotemporal dementia,"N Nicastro, M Malpetti, TE Cope, WR Bevan-Jones, E Mak, L Passamonti, ...","medRxiv, 19013466",,0,2019
Redefining the multidimensional clinical phenotypes of frontotemporal lobar degeneration syndromes,"AG Murley, I Coyle-Gilchrist, M Rouse, PS Jones, W Li, J Wiggins, ...","medRxiv, 19012260",,0,2019
Brain functional network integrity sustains cognitive function despite atrophy in presymptomatic genetic frontotemporal dementia,"KA Tsvetanov, S Gazzina, SP Jones, J van Swieten, B Borroni, ...","medRxiv, 19012203",,0,2019
Incidence and Prevalence of Hidradenitis Suppurativa: A Systematic Review and Meta-analysis,"N Gill, R Gniadecki","medRxiv, 19012559",,0,2019
The effects of age on resting-state BOLD signal variability is explained by cardiovascular and neurovascular factors,"KA Tsvetanov, RNA Henson, PS Jones, HJ Mutsaerts, D Fuhrmann, ...","bioRxiv, 836619",,0,2019
White matter hyperintensities in progranulin-associated frontotemporal dementia: A longitudinal GENFI study,"CH Sudre, M Bocchetta, C Heller, R Convery, M Neason, KM Moore, ...","NeuroImage: Clinical 24, 102077",,0,2019
PET markers of tau and neuroinflammation are co-localized in progressive supranuclear palsy,"M Malpetti, L Passamonti, T Rittman, PS Jones, P Vasquez-Rodriguez, ...","medRxiv, 19010702",,0,2019
Microglial activation and tau burden predict cognitive decline in Alzheimer's Disease,"M Malpetti, RA Kievit, L Passamonti, PS Jones, KA Tsvetanov, T Rittman, ...","medRxiv, 19011189",,0,2019
GABA-ergic dynamics in human frontotemporal networks confirmed by pharmaco-magnetoencephalography.,"NE Adams, LE Hughes, HN Phillips, AD Shaw, AG Murley, D Nesbitt, ...","bioRxiv, 803924",,0,2019
On the evolution of neural decisions from uncertain visual input to uncertain actions,"A Tomassini, D Price, J Zhang, JB Rowe","bioRxiv, 803049",,0,2019
European Ultrahigh-Field Imaging Network for Neurodegenerative Diseases (EUFIND),"J Acosta-Cabronero, D Berron, GJ Biessels, I Bj, M Bottlaender, R Bowtell, ...",Elsevier Inc.,,0,2019
"Towards accurate and unbiased imaging based differentiation of Parkinson's Disease, Progressive Supranuclear Palsy and Corticobasal Syndrome","MM Correia, T Rittman, CL Barnes, I Coyle-Gilchrist, B Ghosh, LE Hughes, ...","medRxiv, 19007575",,0,2019
Testing the antagonistic pleiotropy hypothesis of ApoE with cognitive and brain data from a healthy cohort,"R Henson, S Suri, R Kievit, J Rowe, D Chan, L Tyler, E Eising, SE Fisher",the BNA (British Neuroscience Association) 2019: Festival of Neuroscience,,0,2019
HY5 is not integral to light mediated stomatal development in Arabidopsis,"N Zoulias, J Brown, J Rowe, S Casson","bioRxiv, 756221",,0,2019
18F-AV1451 PET imaging and white matter changes in progressive supranuclear palsy,"N Nicastro, PV Rodriguez, M Malpetti, WR Bevan-Jones, PS Jones, ...","medRxiv, 19000596",,0,2019
Tackling gaps in developing life-changing treatments for dementia,"R Mauricio, C Benn, J Davis, G Dawson, LA Dawson, A Evans, N Fox, ...",Alzheimer's & Dementia: Translational Research & Clinical Interventions 5 …,,0,2019
Apathy is Associated with Reduced Precision of Prior Beliefs about Action Outcomes,"FH Hezemans, N Wolpe, JB Rowe","bioRxiv, 672113",,0,2019
Evidence of a Causal Association Between Cancer and Alzheimer's Disease: a Mendelian Randomization Analysis,"S Seddighi, AL Houck, JB Rowe, PDP Pharoah","bioRxiv, 653352",,0,2019
Correlation of Microglial Activation with White Matter Changes in Dementia with Lewy Bodies,"N Nicastro, E Mak, GB Williams, A Surendranathan, WR Bevan-Jones, ...","bioRxiv, 599241",,0,2019
Neuroinflammation and protein aggregation co-localize across the frontotemporal dementia spectrum.,"WR Bevan-Jones, TE Cope, PS Jones, L Passamonti, Y Hong, T Fryer, ...","bioRxiv, 525642",,0,2019
Tau pathology in early Alzheimer's disease disrupts selective neurophysiological networks dynamics,"E Kocagoncu, A Quinn, A Firouzian, E Cooper, A Greve, R Gunn, G Green, ...","bioRxiv, 524355",,0,2019
"Imaging tau, neuroinflammation and Aβ in dementia with Lewy bodies: a deep-phenotyping case-report","E Mak, A Surendranathan, N Nicastro, F Aigbirhio, J Rowe, J O’Brien","Movement disorders clinical practice 6 (1), 77",,0,2019
Publisher Correction: Sensory attenuation in Parkinson’s disease is related to disease severity and dopamine dose,"N Wolpe, J Zhang, C Nombela, JN Ingram, DM Wolpert, JB Rowe","Scientific reports 8 (1), 17429",,0,2018
Aβ₄₂/Aβ₄₀ and Aβ₄₂/Aβ₃₈ Ratios Are Associated with Measures of Gait Variability and Activities of Daily Living in Mild Alzheimer’s Disease: A Pilot Study,"I Koychev, B Galna, H Zetterberg, J Lawson, G Zamboni, BH Ridha, ...","Journal of Alzheimer's Disease 65 (4), 1377-1383",,0,2018
"Reply: Brain oscillations, inhibition and social inappropriateness in frontotemporal degeneration","LE Hughes, T Rittman, TW Robbins, JB Rowe","Brain 141 (10), e74-e74",,0,2018
Strong and specific associations between cardiovascular risk factors and brain white matter micro-and macro-structure in health ageing,"D Fuhrmann, D Nesbitt, M Shafto, JB Rowe, D Price, A Gadie, RA Kievit",BioRxiv,,0,2018
"DEVELOPMENT OF THE STANDARDISED, MULTILINGUAL MINI LINGUISTIC STATE EXAMINATION (MLSE) TO CLASSIFY AND MONITOR PRIMARY PROGRESSIVE APHASIA","KA Peterson, N Patel, TR Barrick, SF Cappa, E Catricala, ML Ralph, ...","Alzheimer's & Dementia: The Journal of the Alzheimer's Association 14 (7), P1483",,0,2018
Monitoring the past and choosing the future: the prefrontal cortical influences on voluntary action,"HN Phillips, TE Cope, LE Hughes, J Zhang, JB Rowe","Scientific reports 8 (1), 7247",,0,2018
Patterns of gray matter atrophy in genetic frontotemporal dementia: results from the GENFI study.,"JB Rowe, DM Cash, M Boccetta, DL Thomas, KM Dick, JC van Swieten, ...",Elsevier,,0,2018
Uncorrected Author Proof,"GZ Lawson, B Ridha, BJ Sahakian, JB Rowe, A Thomas, H Zetterberg","Journal of Alzheimer’s Disease 63 (1), 331-341",,0,2018
Cardiovascular risk factors for micro-and macro-structural brain changes in healthy ageing,"D Fuhrmann, D Nesbitt, M Shafto, JB Rowe, D Price, A Gadie, RA Kievit","bioRxiv, 264770",,0,2018
Predict disease progression with reaction rate equation modelling of multimodal MRI and PET,"L Su, Y Huang, Y Wang, J Rowe, J O'brien","Frontiers in Aging Neuroscience 10, 306",,0,2018
In vivo assay of cortical microcircuitry in frontotemporal dementia: a platform for experimental medicine studies,"AD Shaw, LE Hughes, RJ Moran, I Coyle-Gilchrist, T Rittman, JB Rowe","bioRxiv, 416388",,0,2018
Brain correlates of action word memory,"Z Shebani, F Carota, O Hauk, JB Rowe, LB Barsalou, R Tomasello, ...","BioRxiv, 412676",,0,2018
"PET Tau and Amyloid-ß Burden in Mild Alzheimer’s Disease: Divergent Relationship with Age, Cognition, and Cerebrospinal Fluid Biomarkers","I Koychev, RN Gunn, A Firouzian, J Lawson, G Zamboni, B Ridha, ...","Journal of Alzheimer’s Disease 63, 407",,0,2018
MODELLING MISMATCH NEGATIVITY CONNECTIVITY IN DEMENTIA,"H Phillips, L Hughes, A Shaw, J Rowe","PSYCHOPHYSIOLOGY 54, S9-S9",,0,2017
Parsing the roles of the frontal lobes and basal ganglia in task control using multivoxel pattern analysis,"AA Kehagia, R Ye, DW Joyce, OM Doyle, JB Rowe, TW Robbins","Journal of cognitive neuroscience 29 (8), 1390-1401",,0,2017
LONGITUDINAL DIFFUSION TENSOR IMAGING AS A PREDICTOR OF COGNITIVE DOMAIN DECLINE IN EARLY-STAGE PARKINSON’S DISEASE: ICICLE-PD STUDY,"T Minett, L Su, E Mak, MJ Firbank, RA Lawson, AJ Yarnall, GW Duncan, ...","Alzheimer's & Dementia: The Journal of the Alzheimer's Association 13 (7), P1353",,0,2017
"[18F] AV-1451 PET IMAGING OF TAU PATHOLOGY PREDICTS WHITE MATTER HYPERINTENSITIES IN HEALTHY AGING, MILD COGNITIVE IMPAIRMENT AND ALZHEIMER'S DISEASE: THE NIMROD STUDY","S Gabel, E Mak, S Cervenka, PS Jones, A Surendranathan, ...",Alzheimer's & Dementia: The Journal of the Alzheimer's Association 13 (7 …,,0,2017
[18F] AV1451 POSITRON EMISSION TOMOGRAPHY IN SEMANTIC VARIANT PRIMARY PROGRESSIVE APHASIA,"WR Bevan-Jones, PS Jones, R Arnold, TE Cope, YT Hong, JT O'Brien, ...","Alzheimer's & Dementia: The Journal of the Alzheimer's Association 13 (7), P1080",,0,2017
INVESTIGATION OF THE RELATIONSHIP BETWEEN TAU AND NEUROINFLAMMATION IN ALZHEIMER’S DISEASE USING PET AND REACTION MODELLING,"L Su, Y Wang, A Surendranathan, WR Bevan-Jones, L Passamonti, ...",Alzheimer's & Dementia: The Journal of the Alzheimer's Association 13 (7 …,,0,2017
THE EFFECT OF TAU BURDEN ON FUNCTIONAL CONNECTIVITY IN ALZHEIMER'S DISEASE AND PROGRESSIVE SUPRANUCLEAR PALSY,"TE Cope, R Borchert, T Rittman, S Jones, L Passamonti, PV Rodriguez, ...",Alzheimer's & Dementia: The Journal of the Alzheimer's Association 13 (7 …,,0,2017
"FRONTO-SUBCORTICAL HYPOPERFUSION IN PRESYMPTOMATIC FTD IS ASSOCIATED WITH BEHAVIORAL MEASURES, BUT NOT COGNITIVE DEFICITS: THE GENFI STUDY","SS Mirza, HJMM Mutsaerts, DM Cash, M Bocchetta, DL Thomas, KM Dick, ...","Alzheimer's & Dementia: The Journal of the Alzheimer's Association 13 (7), P551",,0,2017
"PRESYMPTOMATIC WHITE MATTER INTEGRITY LOSS IN FAMILIAL FRONTOTEMPORAL DEMENTIA IN THE GENETIC FRONTOTEMPORAL DEMENTIA INITIATIVE (GENFI) COHORT: A MULTI-CENTRE, CROSS-SECTIONAL …","LC Jiskoot, M Bocchetta, JM Papma, JM Nicholas, DM Cash, M Modat, ...",Alzheimer's & Dementia: The Journal of the Alzheimer's Association 13 (7 …,,0,2017
"IN VIVO MAPPING OF TAU DEPOSITION, PERFUSION, AND CORTICAL THINNING IN MILD COGNITIVE IMPAIRMENT AND ALZHEIMER'S DISEASE","E Mak, S Gabel, S Cervenka, L Su, A Surendranathan, WR Bevan-Jones, ...",Alzheimer's & Dementia: The Journal of the Alzheimer's Association 13 (7 …,,0,2017
INVESTIGATE THE RELATIONSHIP BETWEEN TAU AND NEUROINFLAMMATION IN ALZHEIMER’S DISEASE USING PET AND REACTION RATE MODELLING,"L Su, Y Wang, A Surendranathan, WR Bevan-Jones, L Passamonti, ...","Alzheimer's & Dementia: The Journal of the Alzheimer's Association 13 (7), P147",,0,2017
WHITE MATTER HYPERINTENSITIES IN GENETIC FRONTOTEMPORAL DEMENTIA: A GENFI STUDY,"CH Sudre, M Bocchetta, DM Cash, DL Thomas, IOC Woollacott, KM Dick, ...",Alzheimer's & Dementia: The Journal of the Alzheimer's Association 13 (7 …,,0,2017
LONGITUDINAL DIFFUSION TENSOR IMAGING AS A PREDICTOR OF COGNITIVE DOMAINS DECLINE IN EARLY STAGE PARKINSON’S DISEASE: ICICLE-PD STUDY,"T Minett, L Su, E Mak, GB Williams, MJ Firbank, RA Lawson, AJ Yarnall, ...","Alzheimer's & Dementia: The Journal of the Alzheimer's Association 13 (7), P61",,0,2017
"PET TAU AND AMYLOID-BETA DIFFER IN THEIR RELATIONSHIP TO AGE, COGNITION AND CSF BIOMARKERS IN MILD ALZHEIMER’S DISEASE: AN OBSERVATIONAL STUDY","IG Koychev, RN Gunn, A Firouzian, J Lawson, G Zamboni, BH Ridha, ...","Alzheimer's & Dementia: The Journal of the Alzheimer's Association 13 (7), P243",,0,2017
"IN GENETIC FRONTOTEMPORAL DEMENTIA, FUNCTIONAL NETWORK EFFICIENCY IS MAINTAINED UNTIL THE ONSET OF SYMPTOMS: EVIDENCE FOR FUNCTIONAL RESILIENCE TO STRUCTURAL CHANGE","T Rittman, R Borchert, PS Jones, JC van Swieten, B Borroni, D Galimberti, ...","Alzheimer's & Dementia: The Journal of the Alzheimer's Association 13 (7), P436",,0,2017
[11C] PK11195 PET IN ALZHEIMER’S DISEASE AND PROGRESSIVE SUPRANUCLEAR PALSY: THE NIMROD STUDY,"PV Rodriguez, L Passamonti, YT Hong, WR Bevan-Jones, S Jones, ...",Alzheimer's & Dementia: The Journal of the Alzheimer's Association 13 (7 …,,0,2017
Genetic screening in sporadic ALS and FTD,"MC Kiernan, JD Rohrer, J Rowe, W Seeley, K Talbot",,,0,2017
Anatomical predictors of survival in PSP: thalamic collapse towards the end of life,"W Bevan-Jones, S Jones, B Ghosh, T Rittman, I Coyle-Gilchrist, J Rowe",MOVEMENT DISORDERS 32,,0,2017
An evaluation of the diagnostic utility of radiological biomarkers in PSP,"J Whitwell, G Hoglinger, A Antonini, Y Bordelon, A Boxer, C Colosima, ...",MOVEMENT DISORDERS 32,,0,2017
[11C] PK11195 PET Imaging Reveals Neuroinflammation in Dementia with Lewy Bodies: NIMROD Study,"A Surendranathan, L Su, L Passamonti, Y Hong, W Bevan-Jones, ...",MOVEMENT DISORDERS 32,,0,2017
Effects of Modafinil on Emotional Processing in Patients with Remitted Depression,"M Kaser, A Bland, JB Deakin, A Michael, C Zapata, R Bansal, D Ryan, ...",,,0,2017
NEUROINFLAMMATORY CHANGES IN LATE-LIFE DEPRESSION: THE NIMROD STUDY,"J O'Brien, L Su, Y Faluyi, T Fryer, Y Hong, G Williams, R Arnold, ...","AUSTRALIAN AND NEW ZEALAND JOURNAL OF PSYCHIATRY 51, 64-65",,0,2017
Cognitive reserve and TMEM106B genotype modulate brain damage in pre-symptomatic monogenic FTD: results from the GENFI study (P2. 085),"E Premi, M Grassi, J van Sweeten, D Galimberti, C Graff, M Masellis, ...","Neurology 88 (16 Supplement), P2. 085",,0,2017
Serotonergic modulation of cognition; An acute challenge,"N Skandali, J Rowe, J Deakin, T Robbins, B Sahakian","European Psychiatry 41, S350",,0,2017
"Mak E, Su L, Williams GB, Firbank MJ, Lawson RA, Yarnall AJ, Duncan GW, Mollenhauer B, Owen AM, Khoo TK, Brooks DJ","JB Rowe, RA Barker, DJ Burn, JT O'Brien",,,0,2017
"Cope TE, Wilson B, Robson H, Drinkall R, Dean L, Grube M, Jones PS","K Patterson, TD Griffiths, JB Rowe, CI Petkov",,,0,2017
"Cope TE, Sohoglu E, Sedley W, Patterson K, Jones PS, Wiggins J, Dawson C","M Grube, RP Carlyon, TD Griffiths, MH Davis, JB Rowe","perception 8, 2154",,0,2017
Immune-related genetic enrichment in frontotemporal dementia,"I Broce, CM Karch, N Wen, CC Fan, Y Wang, CH Tan, N Kouri, OA Ross, ...","BioRxiv, 157875",,0,2017
Sensory attenuation is related to dopamine dose in Parkinson's disease,"N Wolpe, J Zhang, C Nombela, JN Ingram, DM Wolpert, JB Rowe","bioRxiv, 221317",,0,2017
Designer Drugs 2.0,"G Savulich, T Piercy, A Brhl, C Fox, J Suckling, J Rowe, J O'Brien, ...","CLINICAL PHARMACOLOGY AND THERAPEUTICS-ST LOUIS- 101 (2), 170-172",,0,2017
Parsing the Roles of the Frontal Lobes and BG in Task Control Using Multivoxel Pattern Analysis,"A Kehagia, R Ye, DW Joyce, OM Doyle, J Rowe, T Robbins",Massachusetts Institute of Technology Press,,0,2017
Serotonergic modulation of cognition; a dissociate effect of escitalopram on distinct cognitive mechanisms,"N Skandali, J Rowe, V Voon, J Deakin, TW Robbins, BJ Sahakian","European Neuropsychopharmacology 1 (27), S24-S25",,0,2017
Imaging In Dementia,"WR Bevan-Jones, F Aigbirhio, L Passamonti, T Fryer, Y Hong, J Coles, ...","J Neurol Neurosurg Psychiatry 87 (12), e1-e1",,0,2016
BIBLIOGRAFÍA Y REFERENCIAS ACERCA DE LA PRUEBA (ACE-‐III y Mini-‐ACE) Versión original,"S Hsieh, S McGrory, F Leslie, K Dawson, S Ahmed, CR Butler, JB Rowe",,,0,2016
Apathy and impulsivity in frontotemporal lobar degeneration syndromes: P77,"C Lansdall, I Coyle-Gilchrist, V Rodríguez, E Wehmann, A Wilcox, K Dick, ...",Journal of Neurochemistry 138,,0,2016
Apathy and impulsivity in frontotemporal lobar degeneration syndromes,"C Lansdall, ITS Coyle-Gilchrist, PV Rodriguez, E Wehmann, A Wilcox, ...",10th International Conference on Frontotemporal Dementias,,0,2016
Cross frequency coupling during response inhibition in behavioural variant frontotemporal dementia: P52,"L Hughes, J Rowe","Journal of Neurochemistry 138, 263-264",,0,2016
Moral judgments in frontotemporal dementia: P51,"I Uttner, L Petersdorff, S Anderl-Straub, E Semler, S Böhm, D Lulé, ...",Journal of Neurochemistry 138,,0,2016
Computational modelling of combined M/EEG in FTD: layer specific insights into altered neurobiology during the auditory mismatch negativity,"A Shaw, L Hughes, J Rowe","Journal of Neurochemistry 138, 398-399",,0,2016
[18F] AV1451 PET in frontotemporal dementia from a MAPT mutation: P405,"W Bevan-Jones, T Cope, L Passamonti, T Fryer, Y Hong, S Jones, J Coles, ...",Journal of Neurochemistry 138,,0,2016
Distinct patterns of brain atrophy in genetic frontotemporal dementia: visual rating scales in the GENFI cohort,"GG Fumagalli, P Basilico, S Harding, A Arighi, M Bocchetta, M Mercurio, ...",10th International Conference on Frontotemporal Dementias,,0,2016
Neuropsychiatric symptoms in the genetic frontotemporal dementia initiative (GENFI) cohort,"L Sellami, M Bocchetta, J van Swieten, B Borroni, D Galimberti, ...",10th International Conference on Frontotemporal Dementias,,0,2016
Presymptomatic cerebral perfusion biomarker changes in genetic frontotemporal dementia: results from the GENetic Frontotemporal dementia Initiative (GENFI),"H Mutsaerts, SS Mirza, J Rohrer, D Thomas, D Cash, E De Vita, K Dick, ...",10th International Conference on Frontotemporal Dementias,,0,2016
"In genetic frontotemporal dementia, functional network efficiency is maintained until the onset of symptoms: evidence for functional resilience to structural change: P345","T Rittman, R Borchert, S Jones, J Van Swieten, B Borroni, D Galimberta, ...",Journal of Neurochemistry 138,,0,2016
On the clinical overlap between progressive supranuclear palsy and corticobasal syndrome: evidence from the PiPPIN epidemiology study,"J Rowe, I Gilchrist",Journal of Neurochemistry 138,,0,2016
Nature and nurture in modulating brain damage in presymptomatic monogenic FTD: results from the GENFI study: P455,"E Premi, J Rohrer, M Grassi, J van Swieten, D Galimberti, C Graff, ...","Journal of Neurochemistry 138, 419-420",,0,2016
