Title,Authors,Platform,Cited_url,Cited_count,Year
New organic and polymeric materials for thin-film luminescent devices,"AB Holmes, BS Chuah, XC Li, F Cacialli, J Morgado, H Sirringhaus, ...","Organic Light-Emitting Materials and Devices II 3476, 24-31",https://scholar.google.com/scholar?oi=bibs&hl=en&cites=16261187780000259699,1,1998
"SURFACE-STRUCTURE OF ULTRATHIN, EPITAXIAL COSI2 FILMS ON SI (100) OBSERVED BY SCANNING TUNNELING MICROSCOPY","H Sirringhaus, R Stalder, C Schwarz, H VONKANEL","HELVETICA PHYSICA ACTA 65 (1), 113-114",https://scholar.google.com/scholar?oi=bibs&hl=en&cites=18380035631158578371,1,1992
Synthesis and characterization of a semiconducting and solution-processable ruthenium-based polymetallayne,"PY Ho, H Komber, K Horatz, T Tsuda, SCB Mannsfeld, E Dmitrieva, ...",Polymer Chemistry,,0,2020
Modification of Indacenodithiophene-Based Polymers and its Impact on Charge Carrier Mobility in Organic Thin-Film Transistors,"A Wadsworth, H Chen, KJ Thorley, C Cendra, M Nikolka, H Bristow, ...",Journal of the American Chemical Society,,0,2019
"Chain Coupling and Luminescence in High-Mobility, Low Disorder Conjugated Polymers","TH Thomas, JPH Rivett, Q Gu, DJ Harkin, JM Richter, A Sadhanala, ...",ACS nano,,0,2019
Research data supporting Photo-doping through local charge carrier accumulation in alloyed hybrid perovskites for highly efficient luminescence,"S Feldmann, S Macpherson, S Senanayak, M Abdi-Jalebi, J Rivett, G Nan, ...",,,0,2019
Fragment Graphical Variational AutoEncoding for Screening Molecules with Small Data,"J Armitage, LJ Spalek, M Nguyen, M Nikolka, I Jacobs, L Marañón, ...",arXiv preprint arXiv:1910.13325,,0,2019
Selective UV‐Gating Organic Memtransistors with Modulable Levels of Synaptic Plasticity,"YN Zhong, X Gao, JL Xu, H Sirringhaus, SD Wang",Advanced Electronic Materials,,0,2019
"Research data supporting"" Chasing the “Killer” Phonon Mode for the Rational Design of Low-Disorder, High-Mobility Molecular Semiconductors""","G Schweicher, G D’Avino, MT Ruggiero, DJ Harkin, K Broch, ...",,,0,2019
"Research data supporting"" Investigation of the effect of microstructural changes on thermal transport in semicrystalline polymer semiconductors""","E Selezneva, R Di Pietro, X Jiao, C McNeill, H Sirringhaus",,,0,2019
Investigation of the effect of microstructural changes on thermal transport in semicrystalline polymer semiconductors,"E Selezneva, R Di Pietro, X Jiao, CR McNeill, H Sirringhaus","APL Materials 7 (8), 081118",,0,2019
Resilience to conformational fluctuations controls energetic disorder in conjugated polymer materials: Insights from atomistic simulations,"V Lemaur, J Cornil, R Lazzaroni, H Sirringhaus, D Beljonne, Y Olivier","Chemistry of Materials 31 (17), 6889-6899",,0,2019
Investigation of Electrode Electrochemical Reactions in CH3NH3PbBr3 Perovskite Single‐Crystal Field‐Effect Transistors,"J Wang, SP Senanayak, J Liu, Y Hu, Y Shi, Z Li, C Zhang, B Yang, L Jiang, ...",Advanced Materials,,0,2019
Inverted perovskite solar cells with air stable diketopyrrolopyrrole-based electron transport layer,"S Sharma, N Sakai, S Ray, SP Senanayak, H Sirringhaus, HJ Snaith, ...","Solar Energy 186, 9-16",,0,2019
Annealing Behavior with Thickness Hindered Nucleation in Small-Molecule Organic Semiconductor Thin Films,"J Rozboril, K Broch, R Resel, O Caha, F Munz, P Mikulik, JE Anthony, ...",Crystal Growth & Design,,0,2019
"Research data supporting"" Polaron spin dynamics in high-mobility polymeric semiconductors""","S Schott, U Chopra, V Lemaur, A Melnyk, Y Olivier, R DiPietro, R Carey, ...",,,0,2019
Publisher Correction: Long spin diffusion lengths in doped conjugated polymers due to enhanced exchange coupling,"SJ Wang, D Venkateshvaran, MR Mahani, U Chopra, ER McNellis, ...","Nature Electronics, 1",,0,2019
Short contacts between chains enhancing luminescence quantum yields and carrier mobilities in conjugated copolymers,"H Sirringhaus, T Thomas, D Harkin, A Gillett, V Lemaur, M Nikolka, ...",Nature Publishing Group,,0,2019
: Hydrogen Doping Oxide Transistors: Analysis of Ultrahigh Apparent Mobility in Oxide Field‐Effect Transistors (Adv. Sci. 7/2019),"C Chen, BR Yang, G Li, H Zhou, B Huang, Q Wu, R Zhan, YY Noh, ...","Advanced Science 6 (7), 1970040",,0,2019
"Research data supporting"" Investigation of the Thermoelectric Response in Conducting Polymers Doped by Solid-State Diffusion""","K Kang, S Schott, D Venkateshvaran, K Broch, G Schweicher, D Harkin, ...",,,0,2019
"High-mobility, trap-free space charge limited currents in low-disorder conjugated polymers enabled by molecular additives","M Nikolka, K Broch, J Armitage, D Hanifi, P Nowack, D Venkateshvaran, ...",Nature Publishing Group,,0,2019
Investigation of the Thermoelectric Response in Conducting Polymers Doped by Solid-State Diffusion,"S Schott, K Kang, D Venkateshvaran, K Broch, G Schweicher, D Harkin, ...",,,0,2019
Organic Field‐Effect Transistors: Enhanced Charge Injection Properties of Organic Field‐Effect Transistor by Molecular Implantation Doping (Adv. Mater. 10/2019),"Y Kim, S Chung, K Cho, D Harkin, WT Hwang, D Yoo, JK Kim, W Lee, ...","Advanced Materials 31 (10), 1970073",,0,2019
"Solution-processed perovskite light emitting diodes with efficiency exceeding 15% through additive-controlled nanostructure tailoring (vol 9, 3892, 2018)","M Ban, Y Zou, JPH Rivett, Y Yang, TH Thomas, Y Tan, T Song, X Gao, ...",NATURE COMMUNICATIONS 10,,0,2019
Author Correction: Solution-processed perovskite light emitting diodes with efficiency exceeding 15% through additive-controlled nanostructure tailoring,"M Ban, Y Zou, JPH Rivett, Y Yang, TH Thomas, Y Tan, T Song, X Gao, ...","Nature communications 10 (1), 962",,0,2019
Symmetry based molecular design for triplet excitation and optical spin injection,"AA Szumska, H Sirringhaus, J Nelson","Physical Chemistry Chemical Physics 21 (35), 19521-19528",,0,2019
Detection of X‐Rays by Solution‐Processed Cesium‐Containing Mixed Triple Cation Perovskite Thin Films,"L Basiricò, SP Senanayak, A Ciavatti, M Abdi‐Jalebi, B Fraboni, ...","Advanced Functional Materials, 1902346",,0,2019
ELEMENTS IN FLEXIBLE AND LARGE-AREA ELECTRONICS.,"SN GAO, A Nathan, X Huang, CG Núñez, F Liu, S Xu, R Dahiya, ...",CAMBRIDGE University Press,,0,2019
Transistor devices,"H Sirringhaus, K Banger, V Pecunia","US Patent App. 15/520,574",,0,2018
Electronic devices,"H Sirringhaus, K Ando, E Saitoh, S Mooser, S Watanabe","US Patent App. 10/018,689",,0,2018
Performance Improvements in Conjugated Polymer,"M Nikolka, G Schweicher, J Armitage, C Jellett, Z Guo, M Hurhangee, ...",,,0,2018
Organic electronic/optoelectronic devices,"H Sirringhaus, M Nikolka, I Nasrallah, J Jongman","US Patent App. 15/740,611",,0,2018
Electronic devices,"C Hayton, H Sirringhaus, T Von Werne, S Norval","US Patent 9,985,207",,0,2018
Organic and Amorphous-Metal-Oxide Flexible Analogue Electronics,"V Pecunia, M Fattori, S Abdinia, H Sirringhaus, E Cantatore",Cambridge University Press,,0,2018
"Research data supporting the paper"" On the manifestation of electron-electron interactions in the thermoelectric response of semicrystalline conjugated polymers with low …","M Statz, D Venkateshvaran, X Jiao, S Schott, CR McNeill, D Emin, ...",,,0,2018
Accurate resolution of the electron-phonon coupling maps of molecular semiconductors: towards high performing electronics through engineered reduced dynamic disorder,"G Schweicher, MT Ruggiero, G D'Avino, S Fratini, A Zeitler, H Sirringhaus",,,0,2018
Tuning spin injection efficiency through molecular design of organic semiconductors,"G Schweicher, A Wittmann, K Broch, ER McNellis, J Sinova, H Sirringhaus",,,0,2018
Printed Nanophotonics: Inkjet‐Printed Nanocavities on a Photonic Crystal Template (Adv. Mater. 47/2017),"FSF Brossard, V Pecunia, AJ Ramsay, JP Griffiths, M Hugues, ...","Advanced Materials 29 (47), 1770335",,0,2017
Dithiopheneindenofluorene (TIF) Semiconducting Polymers with Very High Mobility in Field-Effect Transistors,"H Sirringhaus, W Zhang, M Nikolka, M Hurhangee, M Abdi-Jalebi, ...",,,0,2017
"Research data supporting"" Organic diode rectifiers based on high performance conjugated polymer for near-field energy harvesting circuit""","SG Higgins, T Agostinelli, S Markham, R Whiteman, H Sirringhaus",,,0,2017
Synthesis and Characterization of Semiconducting Polymers Composed of All Electron-Accepting Monomer Units for Organic Thin Film Transistors,"SH Jung, M Gruber, DH Kim, HY Kwon, MJ Lee, H Sirringhaus, JK Lee","Journal of Nanoscience and Nanotechnology 17 (8), 5759-5763",,0,2017
Spin transport in organic semiconductors: From spin pumping by ferromagnetic resonance to lateral spin-valves,"S Wang, A Wittmann, K Kang, S Schott, G Schweicher, R Di Pietro, ...","2017 IEEE International Magnetics Conference (INTERMAG), 1-1",,0,2017
Research data supporting: The Entangled Triplet Pair State in Acene and Heteroacene Materials,"H Sirringhaus, CK Yong, AJ Musser, SL Bayliss, S Lukman, H Tamura, ...",,,0,2017
"Research data supporting the paper"" Tuning the effective spin-orbit coupling in molecular semiconductors""","S Schott, E McNellis, CB Nielsen, HY Chen, S Watanabe, H Tanaka, ...",,,0,2017
Charge Accumulation Spectroscopy for Investigating Organic Photovoltaic Stability,"O Pachoumi, I Nasrallah, H Sirringhaus","Small Methods 1 (1-2), 1600007",,0,2017
New developments in surface-enhanced solid-state NMR spectroscopy and their applications,"SR Chaudhari, JM Griffin, M Lelli, K Broch, V Lemaur, Y Olivier, ...","Foundations of Crystallography 70, C321",,0,2017
Direct observation of entangled multiexciton states in organic semiconductors (Conference Presentation),"CK Yong, AJ Musser, J Clark, JE Anthony, D Beljonne, RH Friend, ...","Physical Chemistry of Interfaces and Nanomaterials XV 9923, 992304",,0,2016
Towards highly stable polymer electronics (Conference Presentation),"M Nikolka, I Nasrallah, K Broch, A Sadhanala, M Hurhangee, I McCulloch, ...","Organic Field-Effect Transistors XV 9943, 99430J",,0,2016
Naphthacenodithiophene Based Polymers—New Members of the Acenodithiophene Family Exhibiting High Mobility and Power Conversion Efficiency,"A Sadhanala, RS Ashraf, B Purushothaman, K Broch, H Sirringhaus, ...",,,0,2016
Research data supporting “High operational and environmental stability of high-mobility conjugated polymer field-effect transistors achieved through the use of molecular additives”,"M Nikolka, I Nasrallah, B Rose, MK Ravva, K Broch, D Harkin, J Charmet, ...",University of Cambridge,,0,2016
Low-Temperature Organic and oxide Transistors For Printable electronics,H Sirringhaus,"NIP & Digital Fabrication Conference 2016 (1), 3-3",,0,2016
Printed electronic device,"H Sirringhaus, M Carioni, E Gili","US Patent 9,343,680",,0,2016
"Research data supporting"" 2D coherent charge transport in highly ordered conducting polymers doped by solid state diffusion"".","K Kang, S Watanabe, K Broch, A Sepe, A Brown, I Nasrallah, M Nikola, ...",University of Cambridge,,0,2016
"Research data supporting"" Decoupling Charge Transport and Electroluminescence in a High Mobility Polymer Semiconductor""","DJ Harkin, K Broch, M Schreck, H Ceymann, A Stoy, CK Yong, M Nikolka, ...",University of Cambridge,,0,2016
"Research data supporting"" Scanning Kelvin Probe Microscopy Investigation of the Role of Minority Carriers on the Switching Characteristics of Organic Field-Effect Transistors""","Y Hu, V Pecunia, L Jiang, C Di, X Gao, H Sirringhaus",University of Cambridge,,0,2016
Optoelectronic devices,"H Sirringhaus, MC Gwinner, H Giessen, HC Schweizer","US Patent 9,257,666",,0,2016
"CCDC 1483575: Experimental Crystal Structure Determination: 6-bromo-3-(6-bromo-1-(hex-5-en-1-yl)-2-oxo-1, 2-dihydro-3H-pyrrolo [2, 3-b] pyridin-3-ylidene)-1-(hex-5-en-1-yl)-1 …","W Yue, M Nikolka, M Xiao, A Sadhanala, CB Nielsen, AJP White, ...",Cambridge Crystallographic Data Centre,,0,2016
"Research data supporting"" Temperature Dependence of Charge Localization in High-Mobility, Solution-Crystallized Small Molecule Semiconductors Studied by Charge Modulation …","AYB Meneau, Y Olivier, T Backlund, M James, DW Breiby, JW Andreasen, ...",University of Cambridge,,0,2015
"Research data supporting:"" Local Versus Long-Range Diffusion Effects of Photoexcited States on Radiative Recombination in Organic–Inorganic Lead Halide Perovskites""","M Vrućinić, C Matthiesen, A Sadhanala, G Divitini, S Cacovich, SE Dutton, ...",University of Cambridge,,0,2015
"Research data supporting"" Charge transport anisotropy in a uniaxially aligned diketopyrrolopyrrole-based copolymer""","S Schott, E Gann, L Thomsen, SH Jung, JK Lee, CR McNeill, ...",University of Cambridge,,0,2015
"Ambipolar, light-emitting field-effect transistors","J Zaumseil, H Sirringhaus, LL Chua, PKH Ho, RH Friend","US Patent App. 14/616,803",,0,2015
Production of electronic devices,"P Cain, A Menon, H Sirringhaus, JD Watts, T Von Werne, TM Brown","US Patent 8,986,793",,0,2015
Thin film transistor with accurately aligned electrode patterns and electronic device (s) that include same,"PA Cain, YY Noh, H Sirringhaus","US Patent 8,987,808",,0,2015
Probing charge delocalization in a semi-crystalline supramolecular polymer,"K Kang, S Watanabe, K Broch, D Matsumoto, K Marumoto, H Tanaka, ...",APS Meeting Abstracts,,0,2015
Theory and Experiment Defects in topological insulators,MRS TV,"Energy 2014 (2013), 2012",,0,2015
A Vertical C60 Transistor with a Permeable Base Electrode,H Sirringhaus,,,0,2014
Thin film transistor device with accurately aligned electrode patterns,"PA Cain, YY Noh, H Sirringhaus","US Patent 8,900,955",,0,2014
Fabrication of highly stable alkaline earth doped transparent InZnO semiconductors for thin film transistors via molecular alkoxide based chemistries,"KK Banger, J Socratous, RL Peterson, K Mori, Y Yamashita, T Leedham, ...",ABSTRACTS OF PAPERS OF THE AMERICAN CHEMICAL SOCIETY 248,,0,2014
Eﬀect of Molecular Asymmetry on the Charge Transport Physics of High Mobility n‑Type Molecular Semiconductors Investigated by Scanning Kelvin Probe Microscopy,"Y Hu, N Berdunov, C Di, I Nandhakumar, F Zhang, X Gao, D Zhu, ...",American Chemical Society,,0,2014
Eﬀect of Ozone on the Stability of Solution-Processed Anthradithiophene-Based Organic Field-Eﬀect Transistors,"I Nasrallah, K Banger, Y Vaynzof, MM Payne, P Too, J Jongman, ...",American Chemical Society,,0,2014
Improving solution-processed n-type organic field-effect,"C Liu, Y Xu, Z Liu, HN Tsao, K Müllen, T Minari, YY Noh, H Sirringhaus",,,0,2014
Introduction: Theo Murphy International Scientific Meeting between the UK and China on the chemistry and physics of functional materials,"H Sirringhaus, W Hu, D Zhang, A Cheetham","Philosophical Transactions: Mathematical, Physical and Engineering Sciences …",,0,2014
Theo Murphy International Scientific Meeting between the UK and China on the chemistry and physics of functional materials,"H Sirringhaus, W Hu, D Zhang, A Cheetham","Philosophical Transactions of the Royal Society A: Mathematical, Physical …",,0,2014
Novel tellurophene containing diketopyrrolopyrrole semiconducting polymers,"BC Schroeder, RS Ashraf, H Sirringhaus, I McCulloch",ABSTRACTS OF PAPERS OF THE AMERICAN CHEMICAL SOCIETY 247,,0,2014
Stability investigations of inverted organic solar cells with a sol-gel processed ZnSrO or ZnBaO electron extraction layer,"O Pachoumi, C Li, Y Vaynzof, KK Banger, H Sirringhaus","Organic Photovoltaics XIV 8830, 88300E",,0,2013
Semiconductor material,"K Mori, H Sirringhaus","US Patent 8,362,479",,0,2013
"Charge and Spin Transport in Organic Semiconductor Materials: April 1-5, 2013, San Francisco, California, USA","H Sirringhaus, J Takeya, A Facchetti, M Wohlgennant",Cambridge University Press,,0,2013
High-mobility ambipolar polymer transistors: properties and function,"AJ Kronemeijer, E Gili, M Shahid, J Rivnay, A Salleo, M Heeney, ...","Organic Field-Effect Transistors XI 8478, 847809",,0,2012
Evidence for spin injection and transport in solution-processed TIPS-pentacene at room temperature,"S Mooser, JFK Cooper, KK Banger, J Wunderlich, H Sirringhaus","Spintronics V 8461, 84611J",,0,2012
Electooptic Study of Charge Carriers in Aligned Liquid Crystalline Polymers Transistors via Polarized Charge Modulation Spectroscopy,"M Lee, Z Chen, JS Lee, H Sirringhaus","Meeting Abstracts, 243-243",,0,2012
Optoelectronic devices,"R Friend, W Huck, G Tu, H Sirringhaus, N Greenham, M Heeney","US Patent App. 13/383,159",,0,2012
Patterning techniques,H Sirringhaus,"US Patent 8,153,512",,0,2012
Realization to reduced temperature high performance transparent metal oxide semiconductors via a solution processed materials chemistry approach,"KK Banger, RL Peterson, K Mori, Y Yamashita, T Leedham, H Sirringhaus",ABSTRACTS OF PAPERS OF THE AMERICAN CHEMICAL SOCIETY 243,,0,2012
High performance ambipolar organic transistors,"MJ Lee, Z Chen, H Sirringhaus","Proceedings of the Materials Research Society of Korea Conference, 54.1-54.1",,0,2012
N-Type Polymer from Suzuki Polycondensation,"JK Lee, MC Gwinner, R Berger, C Newby, R Zentel, RH Friend, ...","Synfacts 2011 (09), 0955-0955",,0,2011
Novel synthesis of high-performance electron-transporting polymers employing a heteroaryl bis (trifluoroborate),"JK Lee, MC Gwinner, RH Friend, H Sirringhaus, CK Ober",ABSTRACTS OF PAPERS OF THE AMERICAN CHEMICAL SOCIETY 242,,0,2011
"Low-temperature, solution-processed organic transistors for flexible electronics",H Sirringhaus,"2011 IEEE Technology Time Machine Symposium on Technologies Beyond 2020, 1-1",,0,2011
Charge Transport in Uniaxially Aligned Liquid-crystalline Polymer Transistors,"MJ Lee, Z Chen, H Sirringhaus, JS Lee","Proceedings of the Materials Research Society of Korea Conference, 27.2-27.2",,0,2011
Direct Observation of Electron Transit in Ambipolar Polymer-Based Light-Emitting Transistor by Optical Second Harmonic Generation Measurement,"Y Ohshima, N Hirako, H Kohn, T Manaka, M Iwamoto, E Lim, ...","Physics Procedia 14, 226-230",,0,2011
Development of a materials chemistry process for solution fabricated amorphous metal oxide thin film transistors,"KK Banger, RL Peterson, K Mori, Y Yamashita, T Leedham, H Sirringhaus",ABSTRACTS OF PAPERS OF THE AMERICAN CHEMICAL SOCIETY 240,,0,2010
Rectifying diodes with self-aligned electrodes,"PA Cain, H Sirringhaus, A Menon, C Ramsdale, T Von Werne","US Patent 7,696,090",,0,2010
"High Performance Organic Field Effect Transistors, Textured by Self-assembly.","JW Andreasen, CM Duffy, HN Tsao, DW Breiby, W Pisula, M Ando, ...","ACTA CRYSTALLOGRAPHICA A-FOUNDATION AND ADVANCES 65, S260-S260",,0,2009
Field-Induced Disorder and Carrier Localization in Molecular Organic Transistors,"M Ando, T Minakata, C Duffy, H Sirringhaus",Foundations Of Quantum Mechanics In The Light Of New Technology: ISQM—Tokyo …,,0,2009
Field-induced polymorphous disorder and bias-stress instability of pentacene organic thin-film transistors,"M Ando, C Duffy, J Winfield, T Minakata, H Sirringhaus",APS Meeting Abstracts,,0,2008
Defect Site Functionalization: An Approach for Promoting Adhesion in Carbon Nanoparticle/Epoxy Nanocomposites,"ES Park, M Richardson, JH Kim, CM Guttman, NA D'Souza, GA Holmes",31st Annual meeting of the Adhesion Society,,0,2008
Layered Double Hydroxide-Epoxy Nanocomposites: The Role of Interfacial Adhesion and Anion Exchange Capacity on Nanocomposite Performance,"M Richardson, JH Kim, ES Park, GA Holmes, NA D'Souza, CM Guttman, ...",31st Annual meeting of the Adhesion Society,,0,2008
Blended polymer semiconductors,"H Sirringhaus, S Goffri, RAJ Janssen, CP Radano, P Smith, C Muller, ...",,,0,2008
Downscaling of self-aligned inkjet printed polymer thin film transistors,"YY Noh, H Sirringhaus","한국정보디스플레이학회: 학술대회논문집, 1564-1567",,0,2008
Terahertz probe of carrier trapping in polymer transistors,"J Lloyd-Hughes, T Richards, H Sirringhaus, E Castro-Camus, LM Herz, ...","Optical Terahertz Science and Technology, TuA2",,0,2007
Introduction to Printed Organic Thin-Film Transistors,"H Sirringhaus, CW Sele, T von Werne, C Ramsdale","Semiconducting Polymers: Chemistry, Physics and Engineering 1",,0,2007
Solution-based Printing,"H Sirringhaus, CW Sele, T von Werne, C Ramsdale","Organic Electronics: Materials, Manufacturing, and Applications",,0,2006
Self-aligned printing of high-performance polymer thin-film transistors,"YY Noh, N Zhao, X Cheng, H Sirringhaus","2006 International Electron Devices Meeting, 1-4",,0,2006
"Inside Front Cover: Efficient Top‐Gate, Ambipolar, Light‐Emitting Field‐Effect Transistors Based on a Green‐Light‐Emitting Polyfluorene (Adv. Mater. 20/2006)","J Zaumseil, CL Donley, JS Kim, RH Friend, H Sirringhaus",Advanced Materials 18 (20),,0,2006
Light Induced Recovery of Polymer Field Effect Transistors,"J Lloyd-Hughes, T Richards, E Castro-Camus, H Sirringhaus, ...",2006 Joint 31st International Conference on Infrared Millimeter Waves and …,,0,2006
Carbon Nanotubes/Side-Chain Liquid Crystalline Polymer Composites: Patterned Electrodes for Plastic Transistors,"W Song, J Chang, J Wang, H Sirringhaus, A Windle",1st International Symposium on “Nanostructureed and Functional Polymer-based …,,0,2005
Polymer electronics-printing going submicron,H Sirringhaus,"2004 The Third International Seminar on Advances in Carbon Electronics, 44-60",,0,2004
Printing of polymer field-effect transistors,H Sirringhaus,Conference Digest [Includes' Late News Papers' volume] Device Research …,,0,2004
39.3: Recent Advances in Printed Active Matrix Displays,"SE Burns, C Ramsdale, K Jacobs, J Watts, M Etchells, A Menon, P Cain, ...","SID Symposium Digest of Technical Papers 35 (1), 1195-1197",,0,2004
Printed Active-Matrix Displays,"SE Burns, C Kuhn, K Jacobs, C Ramsdale, AC Arias, J Watts, M Etchells, ...","한국정보디스플레이학회: 학술대회논문집, 227-229",,0,2003
"Inkjet Printed Polymer Transistors for Low-Cost, Flexible Electronics","H Sirringhaus, J Mills, C Lamble, SM Evans","MST NEWS, 22-22",,0,2003
Direct printing of polymer transistor circuits.,H Sirringhaus,"ABSTRACTS OF PAPERS OF THE AMERICAN CHEMICAL SOCIETY 223, C30-C30",,0,2002
Investigating the microstructure of solution-processed conjugated polymers at buried interfaces: The gate-insulator/semiconductor interface of FET devices,"MM Nielsen, O Bunk, M Nielsen, K Bechgaard",5. International symposium on functional pi-electron systems,,0,2002
6. 1: Invited Paper All-Polymer TFTs Fabricated by High-Resolution Ink-Jet Printing (Session6: New AMLCDs)(Report on 2001 SID),"T Kawase, H Sirringhaus, F RH, T Shimoda","映像情報メディア学会技術報告 25.46, 18",,0,2001
High-mobility conjugated polymer thin-film transistors.,H Sirringhaus,"ABSTRACTS OF PAPERS OF THE AMERICAN CHEMICAL SOCIETY 221, U627-U628",,0,2001
Ultrathin organic films for field effect transistors [4466-09],"HG Sandberg, O Henze, H Sirringhaus, AFM Kilbinger, WJ Feast, ...","PROCEEDINGS-SPIE THE INTERNATIONAL SOCIETY FOR OPTICAL ENGINEERING, 35-43",,0,2001
Probing the depths: Investigating the distribution and orientation of self-organized domains of solution-processed conjugated polymer films at buried interfaces,"MM Nielsen, M Nielsen, R Feidenhans, C Kumpf, K Bechgaard, ...",2001 MRS Spring Meeting & Exhibit,,0,2001
"Two-dimensional charge transport in self-organised, conjugated polymers",H Sirringhaus,APS March Meeting Abstracts,,0,2000
"Detectors, sensors and displays-Si thin film transistors","K Baert, H Sirringhaus","Technical Digest-International Electron Devices Meeting, 195",,0,2000
Building better plastic transistors: Orientation effects of self-organised domains in polymer films,"MM Nielsen, K Bechgaard, H Sirringhaus, RH Friend",SMARTON 3,,0,2000
ELECTRONIC TRANSPORT AND SEMICONDUCTORS-Mobility enhancement in conjugated polymer field-effect transistors through chain alignment in a liquid-crystalline phase,"H Sirringhaus, RJ Wilson, RH Friend, M Inbasekaran, W Wu, EP Woo, ...","Applied Physics Letters 77 (3), 406-408",,0,2000
CONJUGATED MOLECULES FOR OPTOELECTRONIC DEVICES,"BS Chuah, XC Li, F Cacialli, JE Davies, N Feeder, RH Friend, F Garnier, ...","Proceedings of the Materials Research Society of Korea Conference, 69.4-69",,0,1998
New organic and polymeric materials for thin film optical devices,"BS Chuah, XC Li, F Cacialli, JE Davies, N Feeder, RH Friend, F Garnier, ...","SOC PLASTICS ENGINEERS 44, 1321-1324",,0,1998
Hot carrier scattering in CoS~ 2/Si films observed by BEEM,"H Von Kaenel, H Sirringhaus, EY Lee, U Kafader","VUOTO SCIENZA E TECNOLOGIA 25, 43-46",,0,1996
Ballistic-electron-emission Microscopy on Epitaxial CoSi2,H Sirringhaus,Eidgenössische Technische Hochschule Zürich,,0,1995
DC-plasma cleaning of epitaxial CoSi~ 2/Si (111)-layers,"U Kafader, H Sirringhaus, H Von Kanel","VIDE-PARIS- 51, 264-267",,0,1995
Ballistic-electron-emission microscopy on epitaxial CoSi₂/Si interfaces,H Sirringhaus,ETH Zurich,,0,1995
IN SITU STUDY OF EPITAXIAL COSI2,"H SIRRINGHAUS, EY LEE, H VON KANEL",Journal of vacuum science & technology. B. Microelectronics and nanometer …,,0,1994
Structural and electronic properties of pseudomorphic FeSi [sub 1+ x] films on Si (111),"N Onda, H Sirringhaus, E Mueller, H Kaenel",,,0,1993
Study of Hall Effect and Magnetoresistance on a Novel Epitaxial FeSi Phase on Si (lll),"N Onda, H Sirringhaus, P Steiner",MRS Online Proceedings Library Archive 280,,0,1992
Surface Reconstructions of Strained Epitaxial CoSi,"R Stalder, C Schwarz, H Sirringhaus, HVON Känel",MRS Online Proceedings Library Archive 237,,0,1991
