Title,Authors,Platform,Cited_url,Cited_count,Year
Gait in mild Alzheimer’s disease: Feasibility of multi-center measurement in the clinic and home with body-worn sensors: A pilot study,"R Mc Ardle, R Morris, A Hickey, S Del Din, I Koychev, RN Gunn, J Lawson, ...","Journal of Alzheimer's disease 63 (1), 331-341",https://scholar.google.com/scholar?oi=bibs&hl=en&cites=15211039715998120495,11,2018
Longitudinal whole-brain atrophy and ventricular enlargement in nondemented Parkinson's disease,"E Mak, L Su, GB Williams, MJ Firbank, RA Lawson, AJ Yarnall, ...","Neurobiology of aging 55, 78-90",https://scholar.google.com/scholar?oi=bibs&hl=en&cites=16014136490293659637,11,2017
Distinct patterns of brain atrophy in Genetic Frontotemporal Dementia Initiative (GENFI) cohort revealed by visual rating scales,"GG Fumagalli, P Basilico, A Arighi, M Bocchetta, KM Dick, DM Cash, ...","Alzheimer's research & therapy 10 (1), 46",https://scholar.google.com/scholar?oi=bibs&hl=en&cites=5760459050881507378,10,2018
A ,"M Zhang, R Ferrari, MC Tartaglia, J Keith, EI Surace, U Wolf, C Sato, ...","Brain 141 (10), 2895-2907",https://scholar.google.com/scholar?oi=bibs&hl=en&cites=11029434107514600266,10,2018
White matter change with apathy and impulsivity in frontotemporal lobar degeneration syndromes,"CJ Lansdall, ITS Coyle-Gilchrist, PS Jones, PV Rodríguez, A Wilcox, ...","Neurology 90 (12), e1066-e1076",https://scholar.google.com/scholar?oi=bibs&hl=en&cites=5244864776331309743,10,2018
Age-related increases in verbal knowledge are not associated with word finding problems in the Cam-CAN cohort: What you know won’t hurt you,"MA Shafto, LE James, L Abrams, LK Tyler","The Journals of Gerontology: Series B 72 (1), 100-106",https://scholar.google.com/scholar?oi=bibs&hl=en&cites=5491689426926101164,10,2017
A short guide to brain imaging: The neuroscience of human cognition,"RE Passingham, JB Rowe","Oxford University Press, USA",https://scholar.google.com/scholar?oi=bibs&hl=en&cites=1326809472782080261,10,2016
Role of brain imaging in early parkinsonism,"DP Breen, JB Rowe, RA Barker","BMJ 342, d638",https://scholar.google.com/scholar?oi=bibs&hl=en&cites=9013441811818623047,10,2011
Modulation of cortical activity by repetitive transcranial magnetic stimulation (rTMS): a review of functional imaging studies and the potential use in dystonia.,"SR Filipović, HR Siebner, JB Rowe, C Cordivari, W Gerschlager, ...","Advances in neurology 94, 45-52",https://scholar.google.com/scholar?oi=bibs&hl=en&cites=4407989591177846885,10,2004
Reorganization of cortical oscillatory dynamics underlying disinhibition in frontotemporal dementia,"LE Hughes, T Rittman, TW Robbins, JB Rowe","Brain 141 (8), 2486-2499",https://scholar.google.com/scholar?oi=bibs&hl=en&cites=15133543456286428893,9,2018
Time on timing: Dissociating premature responding from interval sensitivity in Parkinson's disease,"J Zhang, C Nombela, N Wolpe, RA Barker, JB Rowe","Movement Disorders 31 (8), 1163-1172",https://scholar.google.com/scholar?oi=bibs&hl=en&cites=2714303051042213792,9,2016
Dopaminergic modulation of positive expectations for goal-directed action: evidence from Parkinson’s disease,"N Wolpe, C Nombela, JB Rowe","Frontiers in psychology 6, 1514",https://scholar.google.com/scholar?oi=bibs&hl=en&cites=2551216438890536027,9,2015
Neural correlates of passive and active encoding and retrieval: a 3T fMRI study,"A Dove, JB Rowe, M Brett, AM Owen","Neuroimage 6 (13), 660",https://scholar.google.com/scholar?oi=bibs&hl=en&cites=2245882046574793442,9,2001
Early microglial activation and peripheral inflammation in dementia with Lewy bodies,"A Surendranathan, L Su, E Mak, L Passamonti, YT Hong, R Arnold, ...","Brain 141 (12), 3415-3427",https://scholar.google.com/scholar?oi=bibs&hl=en&cites=1112654603307366887,8,2018
Activity and connectivity differences underlying inhibitory control across the adult life span,"KA Tsvetanov, Z Ye, L Hughes, D Samu, MS Treder, N Wolpe, LK Tyler, ...","Journal of Neuroscience 38 (36), 7887-7900",https://scholar.google.com/scholar?oi=bibs&hl=en&cites=3766167523616592863,8,2018
Downregulation of exosomal miR-204-5p and miR-632 as a biomarker for FTD: a GENFI study,"R Schneider, P McKeever, TH Kim, C Graff, JC Van Swieten, A Karydas, ...","J Neurol Neurosurg Psychiatry 89 (8), 851-858",https://scholar.google.com/scholar?oi=bibs&hl=en&cites=17773980084991718069,8,2018
A winding road: Alzheimer’s disease increases circuitous functional connectivity pathways,"J Suckling, T Simas, S Chattopadhyay, R Tait, L Su, G Williams, JB Rowe, ...","Frontiers in computational neuroscience 9, 140",https://scholar.google.com/scholar?oi=bibs&hl=en&cites=6783131007924544513,8,2015
The evolving role of diffusion magnetic resonance imaging in movement disorders,"CW Hess, E Ofori, U Akbar, MS Okun, DE Vaillancourt","Current neurology and neuroscience reports 13 (11), 400",https://scholar.google.com/scholar?oi=bibs&hl=en&cites=15720177520249063082,8,2013
Research paper does not show causal link between benzodiazepine use and diagnosis of dementia,"ITS Coyle-Gilchrist, LF Peck, JB Rowe","Bmj 345, e7984",https://scholar.google.com/scholar?oi=bibs&hl=en&cites=8553831692974444160,8,2012
Locus coeruleus imaging as a biomarker for noradrenergic dysfunction in neurodegenerative diseases,"MJ Betts, E Kirilina, MCG Otaduy, D Ivanov, J Acosta-Cabronero, ...","Brain 142 (9), 2558-2571",https://scholar.google.com/scholar?oi=bibs&hl=en&cites=12805880130914635474,7,2019
Strong and specific associations between cardiovascular risk factors and white matter micro-and macrostructure in healthy aging,"D Fuhrmann, D Nesbitt, M Shafto, JB Rowe, D Price, A Gadie, LK Tyler, ...","Neurobiology of aging 74, 46-55",https://scholar.google.com/scholar?oi=bibs&hl=en&cites=12864056069854814473,7,2019
The behavioural variant frontotemporal dementia phenocopy syndrome is a distinct entity-evidence from a longitudinal study,"E Devenney, T Swinn, E Mioshi, M Hornberger, KE Dawson, S Mead, ...","BMC neurology 18 (1), 56",https://scholar.google.com/scholar?oi=bibs&hl=en&cites=17168923953237813602,7,2018
[,"RW Bevan‐Jones, TE Cope, SP Jones, L Passamonti, YT Hong, T Fryer, ...","Annals of Clinical and Translational Neurology 5 (10), 1292-1296",https://scholar.google.com/scholar?oi=bibs&hl=en&cites=15763976911075917681,7,2018
Presymptomatic white matter integrity loss in familial frontotemporal dementia in the GENFI cohort: A cross‐sectional diffusion tensor imaging study,"LC Jiskoot, M Bocchetta, JM Nicholas, DM Cash, D Thomas, M Modat, ...","Annals of clinical and translational neurology 5 (9), 1025-1036",https://scholar.google.com/scholar?oi=bibs&hl=en&cites=9296498085364756582,7,2018
The neuroanatomical and neurochemical basis of apathy and impulsivity in frontotemporal lobar degeneration,"L Passamonti, CJ Lansdall, JB Rowe","Current opinion in behavioral sciences 22, 14-20",https://scholar.google.com/scholar?oi=bibs&hl=en&cites=3324936905229108610,7,2018
An open-label study to assess the feasibility and tolerability of rilmenidine for the treatment of Huntington’s disease,"BR Underwood, ZW Green-Thompson, PJ Pugh, SE Lazic, SL Mason, ...","Journal of neurology 264 (12), 2457-2463",https://scholar.google.com/scholar?oi=bibs&hl=en&cites=12131755887299594623,7,2017
The neural signature of information regularity in temporally extended event sequences,"J Zhang, JB Rowe","Neuroimage 107, 266-276",https://scholar.google.com/scholar?oi=bibs&hl=en&cites=14906081305120937555,7,2015
Coactivation sign in fixed dystonia,"AR Mehta, JB Rowe, MR Trimble, MJ Edwards, KP Bhatia, AE Schrag","Parkinsonism & related disorders 19 (4), 474-476",https://scholar.google.com/scholar?oi=bibs&hl=en&cites=7999373165810893858,7,2013
Longitudinal diffusion tensor imaging changes in early Parkinson’s disease: ICICLE-PD study,"T Minett, L Su, E Mak, G Williams, M Firbank, RA Lawson, AJ Yarnall, ...","Journal of neurology 265 (7), 1528-1539","https://scholar.google.com/scholar?oi=bibs&hl=en&cites=12539188371231266162,14365830754797887036",6,2018
Distinct neuroanatomical correlates of neuropsychiatric symptoms in the three main forms of genetic frontotemporal dementia in the GENFI cohort,"L Sellami, M Bocchetta, M Masellis, DM Cash, KM Dick, J Van Swieten, ...","Journal of Alzheimer's Disease, 1-16",https://scholar.google.com/scholar?oi=bibs&hl=en&cites=71750245566982399,6,2018
"Hippocampal stratum radiatum, lacunosum, and moleculare sparing in mild cognitive impairment","L Su, L Hayes, S Soteriades, G Williams, SAE Brain, MJ Firbank, ...","Journal of Alzheimer's Disease 61 (1), 415-424","https://scholar.google.com/scholar?oi=bibs&hl=en&cites=142251218686749101,10745972984782912184",6,2018
The basal ganglia in cognitive disorders,"J Rowe, T Rittman","Oxford textbook of cognitive neurology and dementia, 69-80",https://scholar.google.com/scholar?oi=bibs&hl=en&cites=15353901790378950786,6,2016
"Dissociable effects of acute SSRI (escitalopram) on executive, learning and emotional functions in healthy humans","N Skandali, JB Rowe, V Voon, JB Deakin, RN Cardinal, F Cormack, ...","Neuropsychopharmacology 43 (13), 2645",https://scholar.google.com/scholar?oi=bibs&hl=en&cites=5150103741746033245,5,2018
Predictors for a dementia gene mutation based on gene-panel next-generation sequencing of a large dementia referral series,"C Koriath, J Kenny, G Adamson, R Druyeh, W Taylor, J Beck, L Quinn, ...","Molecular psychiatry, 1-14",https://scholar.google.com/scholar?oi=bibs&hl=en&cites=2193502078732844850,5,2018
"The white elephant revived: a new marriage between PET and MRI: comment to Cumming:"" PET neuroimaging: the white elephant packs his trunk?"".","HR Siebner, AP Strafella, JB Rowe","NeuroImage 84, 1104-1106",https://scholar.google.com/scholar?oi=bibs&hl=en&cites=2147889003543887229,5,2014
PAW20 Saccadic correlates of cognition in progressive supranuclear palsy,"B Ghosh, JB Rowe, RHS Carpenter, AJ Calder, PV Peers, AD Lawrence, ...","Journal of Neurology, Neurosurgery & Psychiatry 81 (11), e29-e29",https://scholar.google.com/scholar?oi=bibs&hl=en&cites=4226299958829337828,5,2010
Studies of the efficacy and cost-effectiveness of social work services in aging: A report commissioned by the National Leadership Coalition,"VM Rizzo, J Rowe",New York: New York Academy of Medicine,https://scholar.google.com/scholar?oi=bibs&hl=en&cites=5933977823110980745,5,2003
ApoE4 lowers age at onset in patients with frontotemporal dementia and tauopathy independent of amyloid-β copathology,"C Koriath, T Lashley, W Taylor, R Druyeh, A Dimitriadis, N Denning, ...","Alzheimer's & Dementia: Diagnosis, Assessment & Disease Monitoring 11, 277-280",https://scholar.google.com/scholar?oi=bibs&hl=en&cites=8651296727673424410,4,2019
Inflammation and cerebral small vessel disease: A systematic review,"A Low, E Mak, JB Rowe, HS Markus, JT O’Brien","Ageing research reviews, 100916",https://scholar.google.com/scholar?oi=bibs&hl=en&cites=8926324079831880242,4,2019
Functional network resilience to pathology in presymptomatic genetic frontotemporal dementia,"T Rittman, R Borchert, S Jones, J van Swieten, B Borroni, D Galimberti, ...","Neurobiology of aging 77, 169-177",https://scholar.google.com/scholar?oi=bibs&hl=en&cites=5736265500186315351,4,2019
Cerebral perfusion changes in presymptomatic genetic frontotemporal dementia: a GENFI study,"HJMM Mutsaerts, SS Mirza, J Petr, DL Thomas, DM Cash, M Bocchetta, ...","Brain 142 (4), 1108-1120",https://scholar.google.com/scholar?oi=bibs&hl=en&cites=3626197434442714504,4,2019
Neuroinflammation and functional connectivity in Alzheimer's disease: interactive influences on cognitive performance,"L Passamonti, K Tsvetanov, PS Jones, WR Bevan-Jones, R Arnold, ...","bioRxiv, 532291",https://scholar.google.com/scholar?oi=bibs&hl=en&cites=3507528830264630071,4,2019
"The effects of modafinil on'cold'cognition, creativity, and motivation in healthy volunteers",AD Mohamed,"International Journal of Neuropsychopharmacology 15, 239-240",https://scholar.google.com/scholar?oi=bibs&hl=en&cites=11127760598893021305,4,2012
Selection and updating–two different core operations within working memory,"C Bledowski, B Rahm, JB Rowe","NeuroImage, S144",https://scholar.google.com/scholar?oi=bibs&hl=en&cites=15641578142261073434,4,2009
Neuroimaging biomarkers for clinical trials in atypical parkinsonian disorders: Proposal for a Neuroimaging Biomarker Utility System,"T van Eimeren, A Antonini, D Berg, N Bohnen, R Ceravolo, A Drzezga, ...","Alzheimer's & Dementia: Diagnosis, Assessment & Disease Monitoring 11, 301-309",https://scholar.google.com/scholar?oi=bibs&hl=en&cites=11560839554081815480,3,2019
The inner fluctuations of the brain in presymptomatic Frontotemporal Dementia: The chronnectome fingerprint,"E Premi, VD Calhoun, M Diano, S Gazzina, M Cosseddu, A Alberici, ...","NeuroImage 189, 645-654",https://scholar.google.com/scholar?oi=bibs&hl=en&cites=7673371216363338212,3,2019
In vivo evidence for pre‐symptomatic neuroinflammation in a MAPT mutation carrier,"WR Bevan‐Jones, TE Cope, PS Jones, L Passamonti, YT Hong, T Fryer, ...","Annals of clinical and translational neurology 6 (2), 373-378",https://scholar.google.com/scholar?oi=bibs&hl=en&cites=14237418129211748713,3,2019
Sensory attenuation in Parkinson’s disease is related to disease severity and dopamine dose,"N Wolpe, J Zhang, C Nombela, JN Ingram, DM Wolpert, JB Rowe","Scientific reports 8 (1), 15643",https://scholar.google.com/scholar?oi=bibs&hl=en&cites=16599829775318470945,3,2018
The Test Your Memory for mild cognitive impairment (TYM-MCI),"JM Brown, CJ Lansdall, J Wiggins, KE Dawson, K Hunter, JB Rowe, ...","J Neurol Neurosurg Psychiatry 88 (12), 1045-1051",https://scholar.google.com/scholar?oi=bibs&hl=en&cites=12956681901609873311,3,2017
Symptom onset in genetic frontotemporal dementia,"KM Dick, JC van Swieten, A Gerhard, I Le Ber, GB Frisoni, BC Dickerson, ...","Alzheimer's & Dementia: The Journal of the Alzheimer's Association 13 (7), P1337","https://scholar.google.com/scholar?oi=bibs&hl=en&cites=3365178586334089267,13661952034834073846",3,2017
"PROSPECT: a UK-based longitudinal observational study of PSP, CBD, MSA and atypical Parkinsonism syndromes","J Woodside, R Lamb, V Chelban, D Burn, A Church, A Gerhard, M Hu, ...",20th International Congress of Parkinson's Disease and Movement Disorders,https://scholar.google.com/scholar?oi=bibs&hl=en&cites=8230389571440739388,3,2016
Adult Lifespan Cognitive Variability in the Cross-Sectional Cam-CAN Cohort,"E Green, M Shafto, F Matthews, S White",International journal of environmental research and public health 12 (12 …,https://scholar.google.com/scholar?oi=bibs&hl=en&cites=16037783254274276484,3,2015
What’s New in Progressive Supranuclear Palsy?,"T Rittman, J Rowe","Advances in Clinical Neuroscience and Rehabilitation 11 (6), 8-10",https://scholar.google.com/scholar?oi=bibs&hl=en&cites=12074203684403337654,3,2012
THE EFFECT OF ATOMOXETINE ON IMPULSIVITY IN PARKINSON'S DISEASE,"CR Housden, AA Kehagia, RA Barker, T Rittman, Y Faluyi, U Mueller, ...","JOURNAL OF PSYCHOPHARMACOLOGY 25 (8), A29-A29",https://scholar.google.com/scholar?oi=bibs&hl=en&cites=6724993691180748593,3,2011
Proximity extension assay testing reveals novel diagnostic biomarkers of atypical parkinsonian syndromes,"E Jabbari, J Woodside, T Guo, NK Magdalinou, V Chelban, D Athauda, ...","Journal of Neurology, Neurosurgery & Psychiatry 90 (7), 768-773",https://scholar.google.com/scholar?oi=bibs&hl=en&cites=17662675805653072702,2,2019
Prognostic importance of apathy in syndromes associated with frontotemporal lobar degeneration,"CJ Lansdall, ITS Coyle-Gilchrist, PV Rodríguez, A Wilcox, E Wehmann, ...","Neurology 92 (14), e1547-e1557",https://scholar.google.com/scholar?oi=bibs&hl=en&cites=2128571168708598436,2,2019
Spatiotemporal analysis for detection of pre-symptomatic shape changes in neurodegenerative diseases: Initial application to the GENFI cohort,"C Cury, S Durrleman, DM Cash, M Lorenzi, JM Nicholas, M Bocchetta, ...","NeuroImage 188, 282-290",https://scholar.google.com/scholar?oi=bibs&hl=en&cites=10759581901903021031,2,2019
Data Resource Profile: The Dementias Platform UK (DPUK) Data Portal,"S Bauermeister, C Orton, S Thompson, R Barker, J Bauermeister, ...","BioRxiv, 582155",https://scholar.google.com/scholar?oi=bibs&hl=en&cites=3805922852577336618,2,2019
Neuropathological validation of the MDS-PSP criteria with PSP and other frontotemporal lobar degeneration,"S Gazzina, G Respondek, Y Compta, KSJ Allinson, MG Spillantini, ...","bioRxiv, 520510",https://scholar.google.com/scholar?oi=bibs&hl=en&cites=16093075756255055016,2,2019
Neuroticism predicts the impact of serotonin challenges on fear processing in subgenual anterior cingulate cortex,"B Hornboll, J Macoveanu, A Nejad, J Rowe, R Elliott, GM Knudsen, ...","Scientific reports 8 (1), 17889",https://scholar.google.com/scholar?oi=bibs&hl=en&cites=8607681099482337561,2,2018
In vivo coupling of tau pathology and cortical thinning in Alzheimer's disease,"E Mak, RAI Bethlehem, R Romero-Garcia, S Cervenka, T Rittman, ...","Alzheimer's & Dementia: Diagnosis, Assessment & Disease Monitoring 10, 678-687",https://scholar.google.com/scholar?oi=bibs&hl=en&cites=12946692153226696893,2,2018
A β 42/A β 40 and A β 42/A β 38 Ratios Are Associated with Measures of Gait Variability and Activities of Daily Living in Mild Alzheimer’s Disease: A Pilot Study,"I Koychev, B Galna, H Zetterberg, J Lawson, G Zamboni, BH Ridha, ...","Journal of Alzheimer's Disease, 1-7",https://scholar.google.com/scholar?oi=bibs&hl=en&cites=14695886581812442528,2,2018
Motor learning decline with age is related to differences in the explicit memory system,"N Wolpe, JN Ingram, KA Tsvetanov, RN Henson, RA Kievit, DM Wolpert, ...","BioRxiv, 353870",https://scholar.google.com/scholar?oi=bibs&hl=en&cites=17291430817457821451,2,2018
Trem2 variants increase risk of typical early-onset Alzheimer's disease but not of prion or frontotemporal dementia,"CF Slattery, J Beck, L Harper, G Adamson, Z Abdi, J Uphill, T Campbell, ...","J Neurol Neurosurg Psychiatry 85 (8), e3-e3",https://scholar.google.com/scholar?oi=bibs&hl=en&cites=4708825763475423925,2,2014
Structure and function changes in the medial frontal cortex underlie impairments in voluntary control in Corticobasal degeneration,"N Wolpe, JW Moore, C Rae, E Altena, T Rittman, P Haggard, JB Rowe",,https://scholar.google.com/scholar?oi=bibs&hl=en&cites=17254075209773077448,2,2012
"Associations between regional brain atrophy, executive control, and saccadic latency in Parkinson's disease and healthy ageing","R Perneczky, BCP Gosh, L Hughes, RHS Carpenter, RA Barker, JB Rowe",Alzheimer's & Dementia: The Journal of the Alzheimer's Association 6 (4 …,https://scholar.google.com/scholar?oi=bibs&hl=en&cites=17133813083498117092,2,2010
Pharmacological blockade of 5-HT2A receptors reduces orbitofrontal activation during processing of fearful and angry faces in healthy subjects,"B Hornbøll, J Macoveanu, J Rove, J Wegener, OB Paulson, GM Knudsen",Human Brain Mapping,https://scholar.google.com/scholar?oi=bibs&hl=en&cites=17399177365992271318,2,2009
Age at symptom onset and death and disease duration in genetic frontotemporal dementia: an international retrospective cohort study,"KM Moore, J Nicholas, M Grossman, CT McMillan, DJ Irwin, L Massimo, ...",The Lancet Neurology,https://scholar.google.com/scholar?oi=bibs&hl=en&cites=15171676303467509314,1,2019
"Serum neurofilament light chain in genetic frontotemporal dementia: a longitudinal, multicentre cohort study","EL van der Ende, LH Meeter, JM Poos, JL Panman, LC Jiskoot, ...","The Lancet Neurology 18 (12), 1103-1111",https://scholar.google.com/scholar?oi=bibs&hl=en&cites=414864084913363873,1,2019
Test Your Memory (TYM test): diagnostic evaluation of patients with non-Alzheimer dementias,"J Brown, J Wiggins, CJ Lansdall, K Dawson, T Rittman, JB Rowe","Journal of neurology 266 (10), 2546-2553",https://scholar.google.com/scholar?oi=bibs&hl=en&cites=12050679749939938054,1,2019
Test Your Memory (TYM) and Test Your Memory for Mild Cognitive Impairment (TYM-MCI): A review and update including results of using the TYM Test in a general neurology clinic …,"JM Brown, J Wiggins, K Dawson, T Rittman, JB Rowe","Diagnostics 9 (3), 116",https://scholar.google.com/scholar?oi=bibs&hl=en&cites=14172611219070846891,1,2019
Language impairment in progressive supranuclear palsy and corticobasal syndrome,"KA Peterson, K Patterson, JB Rowe","Journal of neurology, 1-14",https://scholar.google.com/scholar?oi=bibs&hl=en&cites=9455725491573960864,1,2019
Education modulates brain maintenance in presymptomatic frontotemporal dementia,"S Gazzina, M Grassi, E Premi, M Cosseddu, A Alberici, S Archetti, ...","Journal of Neurology, Neurosurgery & Psychiatry, jnnp-2019-320439",https://scholar.google.com/scholar?oi=bibs&hl=en&cites=16133417065232558773,1,2019
Meta-analytic evidence for the plurality of mechanisms in transdiagnostic structural MRI studies of hallucination status,"CPE Rollins, JR Garrison, JS Simons, JB Rowe, C O'Callaghan, ...","EClinicalMedicine 8, 57-71",https://scholar.google.com/scholar?oi=bibs&hl=en&cites=4925543546113218482,1,2019
Left anterior temporal lobe is necessary for efficient lateralised processing of spoken word identity,"T Cope, Y Shtyrov, L MacGregor, R Holland, F Pulvermuller, JB Rowe, ...","bioRxiv, 510347",https://scholar.google.com/scholar?oi=bibs&hl=en&cites=8306423319855079302,1,2019
DEEP AND FREQUENT PHENOTYPING: A FEASIBILITY STUDY FOR EXPERIMENTAL MEDICINE IN DEMENTIA,"J Lawson, M Murray, G Zamboni, IG Koychev, CW Ritchie, BH Ridha, ...",Alzheimer's & Dementia: The Journal of the Alzheimer's Association 13 (7 …,https://scholar.google.com/scholar?oi=bibs&hl=en&cites=16543496344058777844,1,2017
MULTIPLE DISTINCT ATROPHY PATTERNS FOUND IN GENETIC FRONTOTEMPORAL DEMENTIA USING SUBTYPE AND STAGE INFERENCE (SUSTAIN),"AL Young, RV Marinescu, NP Oxtoby, M Bocchetta, DM Cash, DL Thomas, ...",Alzheimer's & Dementia: The Journal of the Alzheimer's Association 13 (7 …,https://scholar.google.com/scholar?oi=bibs&hl=en&cites=11479929520729790069,1,2017
[11C] PK11195 PET IMAGING REVEALS NEUROINFLAMMATION IN DEMENTIA WITH LEWY BODIES IS NEGATIVELY ASSOCIATED WITH DISEASE SEVERITY: NIMROD STUDY,"A Surendranathan, L Su, L Passamonti, YT Hong, WR Bevan-Jones, ...",Alzheimer's & Dementia: The Journal of the Alzheimer's Association 13 (7 …,https://scholar.google.com/scholar?oi=bibs&hl=en&cites=7710931884492768528,1,2017
"THE PROSPECT STUDY: DEVELOPMENT OF A UK-BASED LONGITUDINAL OBSERVATIONAL STUDY OF PSP, CBD, MSA AND ATYPICAL PARKINSONISM SYNDROMES","J Woodside, R Lamb, E Jabbari, V Chelban, D Burn, A Church, A Gerhard, ...","Alzheimer's & Dementia: The Journal of the Alzheimer's Association 13 (7), P348",https://scholar.google.com/scholar?oi=bibs&hl=en&cites=414741220831243158,1,2017
MEG reveals speech processing delay in progressive non fluent aphasia,"T Cope, E Sohoglu, K Patterson, C Dawson, M Grube, W Sedley, M Davis, ...","J Neurol Neurosurg Psychiatry 87 (12), e1-e1",https://scholar.google.com/scholar?oi=bibs&hl=en&cites=16323794973302352406,1,2016
[18F] AV1451 PET imaging in semantic dementia: P409,"W Bevan-Jones, T Cope, L Passamonti, V Rodriguez, A Surendranathan, ...",Journal of Neurochemistry 138,https://scholar.google.com/scholar?oi=bibs&hl=en&cites=11286343237652622910,1,2016
"HIPPOCAMPAL CA1 INVOLVEMENT IN DEMENTIA WITH LEWY BODIES, ALZHEIMER'S DISEASE AND MILD COGNITIVE IMPAIRMENT: THE NIMROD STUDY","E Mak, S Gabel, L Su, GB Williams, R Arnold, L Passamonti, P Rodríguezi, ...","Alzheimer's & Dementia: The Journal of the Alzheimer's Association 12 (7), P708",https://scholar.google.com/scholar?oi=bibs&hl=en&cites=13679873579663391688,1,2016
[18F] AV-1451 PET imaging of tau in progressive supranuclear palsy and Alzheimer's disease,"J Rowe, V Rodríguez, Y Hong, R Borchert, S Sami, W Bevan-Jones, ...",Movement Disorders 31,https://scholar.google.com/scholar?oi=bibs&hl=en&cites=3108304513026232277,1,2016
Genetic neuroimaging studies of basal ganglia disorders,"TW Robbins, JB Rowe, RA Barker","Neuroimaging Genetics: Principles and Practices, 241",https://scholar.google.com/scholar?oi=bibs&hl=en&cites=8007458989085965142,1,2016
Disorders of volition from neurological disease,"JB ROWE, N WOLPE","The Sense of Agency, 389",https://scholar.google.com/scholar?oi=bibs&hl=en&cites=14872634729391755934,1,2015
Dopamine Transporter (DAT) imaging can be normal with neuropathologically confirmed Cortiobasal Degeneration,"S Chaal, J Rowe","J Neurol Neurosurg Psychiatry 84 (11), e2-e2",https://scholar.google.com/scholar?oi=bibs&hl=en&cites=10759970586598266398,1,2013
Exploration of functional brain networks in neurodegenerative disease,"T Rittman, B Ghosh, J Rowe","The Lancet 381, S92",https://scholar.google.com/scholar?oi=bibs&hl=en&cites=11573168041910255176,1,2013
1154 The utility of the Addenbrooke's Cognitive Examination-Revised (ACE-R) in Parkinson's disease,"P McColgan, J Evans, DP Breen, SL Mason, B Ghosh, T Rittman, J Rowe, ...","J Neurol Neurosurg Psychiatry 83 (3), e1-e1",https://scholar.google.com/scholar?oi=bibs&hl=en&cites=9406596332432448328,1,2012
Response patterns in human Superior Temporal Sulcus discriminate the direction of observed head turns,"JD Carlin, R Thompson, N Kriegeskorte, J Rowe, AJ Calder","Journal of Vision 10 (7), 681-681",https://scholar.google.com/scholar?oi=bibs&hl=en&cites=7946782266965952360,1,2010
Seperate Neural Systems for evaluating Risks and Reward in Decision making,"J Macoveanu, JS Wegener, A Skimminge, B Hornbøll, R Elliot, H Siebner, ...","Proc. Intl. Soc. Mag. Reson. Med 17, 3709",https://scholar.google.com/scholar?oi=bibs&hl=en&cites=13191118949050135148,1,2009
