Title,Authors,Platform,Cited_url,Cited_count,Year
The effect of tuning the microstructure of TIPS-tetraazapentacene on the performance of solution processed thin film transistors,"F Paulus, JU Engelhart, PE Hopkinson, C Schimpf, A Leineweber, ...","Journal of Materials Chemistry C 4 (6), 1194-1200",https://scholar.google.com/scholar?oi=bibs&hl=en&cites=11156707319746579076,34,2016
Spin injection and transport in a solution-processed organic semiconductor at room temperature,"S Mooser, JFK Cooper, KK Banger, J Wunderlich, H Sirringhaus","Physical Review B 85 (23), 235202",https://scholar.google.com/scholar?oi=bibs&hl=en&cites=10736782276158670348,34,2012
Organic integrated complementary inverters with ink-jet printed source/drain electrodes and sub-micron channels,"E Gili, M Caironi, H Sirringhaus","Applied Physics Letters 100 (12), 77",https://scholar.google.com/scholar?oi=bibs&hl=en&cites=3961806890836105776,34,2012
Improved performance of ZnO/polymer hybrid photovoltaic devices by combining metal oxide doping and interfacial modification,"O Pachoumi, AA Bakulin, A Sadhanala, H Sirringhaus, RH Friend, ...","The Journal of Physical Chemistry C 118 (33), 18945-18950",https://scholar.google.com/scholar?oi=bibs&hl=en&cites=2241779142061120098,33,2014
Simultaneous extraction of charge density dependent mobility and variable contact resistance from thin film transistors,"R Di Pietro, D Venkateshvaran, A Klug, EJW List-Kratochvil, A Facchetti, ...","Applied Physics Letters 104 (19), 193501",https://scholar.google.com/scholar?oi=bibs&hl=en&cites=2270121429993745201,33,2014
Embossing of microfluidic sensors,H Sirringhaus,"US Patent 8,080,152",https://scholar.google.com/scholar?oi=bibs&hl=en&cites=1070914895974645506,33,2011
Low-voltage control of ferromagnetism in a semiconductor p–n junction,"MHS Owen, J Wunderlich, V Novák, K Olejník, J Zemen, K Výborný, ...","New journal of Physics 11 (2), 023008",https://scholar.google.com/scholar?oi=bibs&hl=en&cites=2128477012795052296,33,2009
Ballistic-electron-emission-microscopy investigation of hot-carrier transport in epitaxial CoSi 2 films on Si (100) and Si (111),"EY Lee, H Sirringhaus, U Kafader, H Von Kaenel","Physical Review B 52 (3), 1816",https://scholar.google.com/scholar?oi=bibs&hl=en&cites=3162672585824477967,33,1995
study of epitaxial CoSi,"H Sirringhaus, EY Lee, H Von Kaenel",Journal of Vacuum Science & Technology B: Microelectronics and Nanometer …,https://scholar.google.com/scholar?oi=bibs&hl=en&cites=197240758751806895,33,1994
Strain-induced (2× 1) reconstruction on epitaxial CoSi2/Si (111) observed by scanning tunneling microscopy: structure model and electrical properties,"R Stalder, H Sirringhaus, N Onda, H von Känel","Surface science 258 (1-3), 153-165",https://scholar.google.com/scholar?oi=bibs&hl=en&cites=649529262133394925,33,1991
Surface and interface structure of epitaxial CoSi,"R Stalder, N Onda, H Sirringhaus, H von Känel, CWT Bulle‐Lieuwma",Journal of Vacuum Science & Technology B: Microelectronics and Nanometer …,https://scholar.google.com/scholar?oi=bibs&hl=en&cites=12497824892109612580,33,1991
In‐Situ Switching from Barrier‐Limited to Ohmic Anodes for Efficient Organic Optoelectronics,"ZK Tan, Y Vaynzof, D Credgington, C Li, MTL Casford, A Sepe, S Huettner, ...","Advanced Functional Materials 24 (20), 3051-3058",https://scholar.google.com/scholar?oi=bibs&hl=en&cites=9718688590494339085,32,2014
"R. a. J. Janssen, EW Meijer, P. Herwig and DM de Leeuw","H Sirringhaus, PJ Brown, RH Friend, MM Nielsen, K Bechgaard, ...","Nature 401, 685-688",https://scholar.google.com/scholar?oi=bibs&hl=en&cites=354916904508286701,32,1999
Aligned polymer organic TFT,"H Sirringhaus, RH Friend, RJ Wilson","US Patent 8,071,180",https://scholar.google.com/scholar?oi=bibs&hl=en&cites=12449049752955085634,30,2011
Nanorod thin-film transitors,"H Sirringhaus, B Sun","US Patent App. 12/063,345",https://scholar.google.com/scholar?oi=bibs&hl=en&cites=12369068011985935438,30,2010
Self-aligned printing,"H Sirringhaus, MJ Banach, NJ Stone, DWJ Wilson, JD Mackenzie, ...","US Patent 7,407,849",https://scholar.google.com/scholar?oi=bibs&hl=en&cites=7184417458409780146,30,2008
Stability of polymeric thin film transistors for x-ray imaging applications,"CR Newman, H Sirringhaus, JC Blakesley, R Speller","Applied Physics Letters 91 (14), 142105",https://scholar.google.com/scholar?oi=bibs&hl=en&cites=6131660999762391756,30,2007
Epitaxial Semiconducting and Metallic Iron Silicides,"H Von Känel, U Kafader, P Sutter, N Onda, H Sirringhaus, E Müller, ...",MRS Online Proceedings Library Archive 320,https://scholar.google.com/scholar?oi=bibs&hl=en&cites=7045853182780665889,30,1993
"Multifunctional materials for OFETs, LEFETs and NIR PLEDs","TT Steckler, MJ Lee, Z Chen, O Fenwick, MR Andersson, F Cacialli, ...","Journal of Materials Chemistry C 2 (26), 5133-5141",https://scholar.google.com/scholar?oi=bibs&hl=en&cites=13145871838234336634,29,2014
Electroluminescence in ion-gel gated conjugated polymer field-effect transistors,"SN Bhat, RD Pietro, H Sirringhaus","Chemistry of Materials 24 (21), 4060-4067",https://scholar.google.com/scholar?oi=bibs&hl=en&cites=7517694822615357267,29,2012
The influence of surface chemical dynamics on electrical and optical properties of ZnO nanowire field effect transistors,"JI Sohn, WK Hong, MJ Lee, T Lee, H Sirringhaus, DJ Kang, ME Welland","Nanotechnology 20 (50), 505202",https://scholar.google.com/scholar?oi=bibs&hl=en&cites=9188605495220722172,29,2009
Temperature-and density-dependent channel potentials in high-mobility organic field-effect transistors,"M Kemerink, T Hallam, MJ Lee, N Zhao, M Caironi, H Sirringhaus","Physical Review B 80 (11), 115325",https://scholar.google.com/scholar?oi=bibs&hl=en&cites=5159530772207391775,29,2009
Control of roughness at interfaces and the impact on charge mobility in all-polymer field-effect transistors,"SS Chang, AB Rodríguez, AM Higgins, C Liu, M Geoghegan, ...","Soft Matter 4 (11), 2220-2224",https://scholar.google.com/scholar?oi=bibs&hl=en&cites=8199382430809097130,29,2008
Ultrathin organic films for field effect transistors,"HGO Sandberg, O Henze, H Sirringhaus, A Kilbinger, WJ Feast, ...","Organic Field Effect Transistors 4466, 35-43",https://scholar.google.com/scholar?oi=bibs&hl=en&cites=6383571807548541542,29,2001
Electro-optical characterisation of field effect devices with regioregular poly-hexylthiophene active layers,"PJ Brown, H Sirringhaus, RH Friend","Synthetic metals 101 (1-3), 557-560",https://scholar.google.com/scholar?oi=bibs&hl=en&cites=2659079655783439490,29,1999
Compositional and morphological studies of polythiophene/polyflorene blends in inverted architecture hybrid solar cells,"Y Vaynzof, TJK Brenner, D Kabra, H Sirringhaus, RH Friend","Advanced Functional Materials 22 (11), 2418-2424",https://scholar.google.com/scholar?oi=bibs&hl=en&cites=17180741836452814347,28,2012
Microcutting materials on polymer substrates,"N Stutzmann, TA Tervoort, DJ Broer, H Sirringhaus, RH Friend, P Smith","Advanced Functional Materials 12 (2), 105-109",https://scholar.google.com/scholar?oi=bibs&hl=en&cites=1893096478984090382,28,2002
A vertical organic transistor architecture for fast nonvolatile memory,"XJ She, D Gustafsson, H Sirringhaus","Advanced Materials 29 (8), 1604769",https://scholar.google.com/scholar?oi=bibs&hl=en&cites=2157865550292871125,27,2017
Field-effect modulated Seebeck coefficient measurements in an organic polymer using a microfabricated on-chip architecture,"D Venkateshvaran, AJ Kronemeijer, J Moriarty, D Emin, H Sirringhaus","APL Materials 2 (3), 032102",https://scholar.google.com/scholar?oi=bibs&hl=en&cites=7069558122656420205,27,2014
Sodium and potassium ion selective conjugated polymers for optical ion detection in solution and solid state,"A Giovannitti, CB Nielsen, J Rivnay, M Kirkus, DJ Harkin, AJP White, ...","Advanced Functional Materials 26 (4), 514-523",https://scholar.google.com/scholar?oi=bibs&hl=en&cites=1315818021327430358,26,2016
Downscaling of n-channel organic field-effect transistors with inkjet-printed electrodes,"X Cheng, M Caironi, YY Noh, C Newman, J Wang, MJ Lee, K Banger, ...","Organic Electronics 13 (2), 320-328",https://scholar.google.com/scholar?oi=bibs&hl=en&cites=9850849459095840853,26,2012
Organic semiconductor devices for X-ray imaging,"JC Blakesley, PE Keivanidis, M Campoy-Quiles, CR Newman, Y Jin, ...",Nuclear Instruments and Methods in Physics Research Section A: Accelerators …,https://scholar.google.com/scholar?oi=bibs&hl=en&cites=11991537343318369844,25,2007
Oligoethyleneoxide functionalised sexithiophene organic field effect transistors,"H Sandberg, O Henze, AF Kilbinger, H Sirringhaus, WJ Feast, RH Friend","Synthetic metals 137 (1-3), 885-886",https://scholar.google.com/scholar?oi=bibs&hl=en&cites=5403794921818874118,25,2003
Polyfluorenes as organic semiconductors for polymeric field effect transistors,"DJ Brennan, PH Townsend, DM Welsh, MG Dibbs, JM Shaw, JL Miklovich, ...",MRS Online Proceedings Library Archive 771,https://scholar.google.com/scholar?oi=bibs&hl=en&cites=10404761710570846960,25,2003
Organic field-effect transistors and solar cells using novel high electron-affinity conjugated copolymers based on alkylbenzotriazole and benzothiadiazole,"MC Gwinner, TJK Brenner, JK Lee, C Newby, CK Ober, CR McNeill, ...","Journal of Materials Chemistry 22 (10), 4436-4439",https://scholar.google.com/scholar?oi=bibs&hl=en&cites=12162192294260494360,24,2012
Compounds for electronic devices,"AB Holmes, SC Moratti, XC Li, H Sirringhaus, A Kraft, MM Murray","US Patent 6,403,809",https://scholar.google.com/scholar?oi=bibs&hl=en&cites=13287751907221398266,24,2002
"Charge carrier mobilities in mesomorphic α, ω-dihexylquaterthiophene: a comparative microwave conductivity and thin film transistor study","B Wegewijs, MP De Haas, DM De Leeuw, R Wilson, H Sirringhaus","Synthetic metals 101 (1-3), 534-535",https://scholar.google.com/scholar?oi=bibs&hl=en&cites=8708108735136613388,24,1999
"A Thieno[2,3-","HY Chen, M Nikolka, A Wadsworth, W Yue, A Onwubiko, M Xiao, ...","Macromolecules 51 (1), 71-79",https://scholar.google.com/scholar?oi=bibs&hl=en&cites=14816958334474719231,23,2017
"N, N′-Dihydrotetraazapentacenes (DHTA) in thin film transistors","F Paulus, BD Lindner, H Reiß, F Rominger, A Leineweber, Y Vaynzof, ...","Journal of Materials Chemistry C 3 (7), 1604-1609",https://scholar.google.com/scholar?oi=bibs&hl=en&cites=9915427984415582927,23,2015
"Fabrication of ultra-flexible, ultra-thin organic field-effect transistors and circuits by a peeling-off method","Y Hu, C Warwick, A Sou, L Jiang, H Sirringhaus","Journal of Materials Chemistry C 2 (7), 1260-1263",https://scholar.google.com/scholar?oi=bibs&hl=en&cites=7524684360855103573,23,2014
"A nanoimprinted, optically tuneable organic laser","BH Wallikewitz, GO Nikiforov, H Sirringhaus, RH Friend","Applied Physics Letters 100 (17), 95",https://scholar.google.com/scholar?oi=bibs&hl=en&cites=10972409148955617715,23,2012
Enhanced charge transport by incorporating additional thiophene units in the poly (fluorene-thienyl-benzothiadiazole) polymer,"Z Chen, J Fang, F Gao, TJK Brenner, KK Banger, X Wang, WTS Huck, ...","Organic electronics 12 (3), 461-471",https://scholar.google.com/scholar?oi=bibs&hl=en&cites=17935362997987634011,23,2011
"Frequency operation of low-voltage, solution-processed organic field-effect transistors","M Caironi, YY Noh, H Sirringhaus","Semiconductor Science and Technology 26 (3), 034006",https://scholar.google.com/scholar?oi=bibs&hl=en&cites=12974350717116810385,23,2011
Doping of source-drain contacts,"H Sirringhaus, RH Friend","US Patent 7,105,854",https://scholar.google.com/scholar?oi=bibs&hl=en&cites=4848387415753081708,23,2006
Progressive aligned deposition,"H Sirringhaus, A Arias, J Mackenzie","US Patent App. 10/483,237",https://scholar.google.com/scholar?oi=bibs&hl=en&cites=10275765816926733646,23,2004
The light‐induced field‐effect solar cell concept–perovskite nanoparticle coating introduces polarization enhancing silicon cell efficiency,"Y Wang, Z Xia, L Liu, W Xu, Z Yuan, Y Zhang, H Sirringhaus, Y Lifshitz, ...","Advanced Materials 29 (18), 1606370",https://scholar.google.com/scholar?oi=bibs&hl=en&cites=18303536372286452426,22,2017
Near-edge X-ray absorption fine-structure spectroscopy of naphthalene diimide-thiophene co-polymers,"E Gann, CR McNeill, M Szumilo, H Sirringhaus, M Sommer, S Maniam, ...","The Journal of chemical physics 140 (16), 164710",https://scholar.google.com/scholar?oi=bibs&hl=en&cites=12584812401459907007,22,2014
Solution influenced alignment,"H Sirringhaus, C Arias, J Mackenzie, W Huck","US Patent App. 10/483,231",https://scholar.google.com/scholar?oi=bibs&hl=en&cites=9372416581211877620,22,2004
Tuning the effective spin-orbit coupling in molecular semiconductors,"S Schott, ER McNellis, CB Nielsen, HY Chen, S Watanabe, H Tanaka, ...","Nature communications 8, 15200",https://scholar.google.com/scholar?oi=bibs&hl=en&cites=2830799193022969343,21,2017
Polymer waste as fused deposition modeling feed stock filament for industrial applications,"R Singh, R Kumar, S Kumar",Elsevier,"https://scholar.google.com/scholar?oi=bibs&hl=en&cites=6013373918842367460,15987728183492659068,11621653017050978726,11718964854351007655",21,2017
Scanning Kelvin probe microscopy investigation of the role of minority carriers on the switching characteristics of organic field‐effect transistors,"Y Hu, V Pecunia, L Jiang, CA Di, X Gao, H Sirringhaus","Advanced Materials 28 (23), 4713-4719",https://scholar.google.com/scholar?oi=bibs&hl=en&cites=2599568250607829393,21,2016
Controlling contact resistance in top-gate polythiophene-based field-effect transistors by molecular engineering,"YY Noh, X Cheng, M Tello, MJ Lee, H Sirringhaus","Semiconductor Science and Technology 26 (3), 034003",https://scholar.google.com/scholar?oi=bibs&hl=en&cites=14686625205156003987,21,2011
In situ DC-plasma cleaning of silicon surfaces,"U Kafader, H Sirringhaus, H Von kÄnel","Applied surface science 90 (3), 297-302",https://scholar.google.com/scholar?oi=bibs&hl=en&cites=8033085684728646079,21,1995
Surface effects in ballistic-electron-emission microscopy,"H Sirringhaus, EY Lee, H Von Känel","Surface science 331, 1277-1282",https://scholar.google.com/scholar?oi=bibs&hl=en&cites=18039073452882552525,21,1995
Bottom-up growth of n-type monolayer molecular crystals on polymeric substrate for optoelectronic device applications,"Y Shi, L Jiang, J Liu, Z Tu, Y Hu, Q Wu, Y Yi, E Gann, CR McNeill, H Li, ...",Nature communications 9,https://scholar.google.com/scholar?oi=bibs&hl=en&cites=8482577746712177318,20,2018
Identification of dipole disorder in low temperature solution processed oxides: Its utility and suppression for transparent high performance solution-processed hybrid electronics,"K Banger, C Warwick, J Lang, K Broch, JE Halpert, J Socratous, A Brown, ...","Chemical science 7 (10), 6337-6346",https://scholar.google.com/scholar?oi=bibs&hl=en&cites=7473471560240385913,20,2016
Electrooptical Spectroscopy of Uniaxially Aligned Polythiophene Films in Field-Effect Transistors,"MJ Lee, Z Chen, R Pietro, M Heeney, H Sirringhaus","Chemistry of Materials 25 (10), 2075-2082",https://scholar.google.com/scholar?oi=bibs&hl=en&cites=5746954432471986488,20,2013
Active layer island,"H Sirringhaus, C Ramsdale","US Patent 7,709,306",https://scholar.google.com/scholar?oi=bibs&hl=en&cites=9507609237776410818,20,2010
Charge trapping in polymer transistors probed by terahertz spectroscopy and scanning probe potentiometry,"J Lloyd-Hughes, T Richards, H Sirringhaus, E Castro-Camus, LM Herz, ...","Applied physics letters 89 (11), 112101",https://scholar.google.com/scholar?oi=bibs&hl=en&cites=8045063873313360134,20,2006
Contact effects of solution-processed polymer electrodes: Limited conductivity and interfacial doping,"JZ Wang, JF Chang, H Sirringhaus","Applied Physics Letters 87 (8), 083503",https://scholar.google.com/scholar?oi=bibs&hl=en&cites=3248542699247699249,20,2005
Scanning-tunneling-microscopy investigation of the quantum-size effect in epitaxial CoSi 2/Si (111),"EY Lee, H Sirringhaus, H Von Kaenel","Physical Review B 50 (8), 5807",https://scholar.google.com/scholar?oi=bibs&hl=en&cites=15696711221020853829,20,1994
Evidence for Charge‐Trapping Inducing Polymorphic Structural‐Phase Transition in Pentacene,"M Ando, TB Kehoe, M Yoneya, H Ishii, M Kawasaki, CM Duffy, T Minakata, ...","Advanced Materials 27 (1), 122-129",https://scholar.google.com/scholar?oi=bibs&hl=en&cites=13463744482788694797,19,2015
3.4: Flexible Active‐Matrix Displays,"SE Burns, K Reynolds, W Reeves, M Banach, T Brown, K Chalmers, ...","SID Symposium Digest of Technical Papers 36 (1), 19-21",https://scholar.google.com/scholar?oi=bibs&hl=en&cites=10871084517344746044,19,2005
6.1: ,"T Kawase, H Sirringhaus, RH Friend, T Shimoda","SID Symposium Digest of Technical Papers 32 (1), 40-43",https://scholar.google.com/scholar?oi=bibs&hl=en&cites=8315671719983111517,19,2001
Fused electron deficient semiconducting polymers for air stable electron transport,"A Onwubiko, W Yue, C Jellett, M Xiao, HY Chen, MK Ravva, DA Hanifi, ...","Nature communications 9 (1), 416",https://scholar.google.com/scholar?oi=bibs&hl=en&cites=10496983127421974600,18,2018
Donor–acceptor stacking arrangements in bulk and thin-film high-mobility conjugated polymers characterized using molecular modelling and MAS and surface-enhanced solid-state …,"SR Chaudhari, JM Griffin, K Broch, A Lesage, V Lemaur, D Dudenko, ...","Chemical science 8 (4), 3126-3136",https://scholar.google.com/scholar?oi=bibs&hl=en&cites=11520558614508382409,18,2017
Transistor-controlled display devices,"S Burns, H Sirringhaus","US Patent 8,400,576",https://scholar.google.com/scholar?oi=bibs&hl=en&cites=17289665479038707747,18,2013
Electronic document reader system,"C Bandel, H Hauser, C Hayton, S Jones, J Mills, H Sirringhaus","US Patent 8,228,323",https://scholar.google.com/scholar?oi=bibs&hl=en&cites=17903841186501300239,18,2012
Observation of electron behavior in ambipolar polymer-based light-emitting transistor by optical second harmonic generation,"Y Ohshima, E Lim, T Manaka, M Iwamoto, H Sirringhaus","Journal of Applied Physics 110 (1), 013715",https://scholar.google.com/scholar?oi=bibs&hl=en&cites=14443194555543483715,18,2011
34.1: Active Matrix Displays Made with Printed Polymer Thin Film Transistors,"H Sirringhaus, SE Burns, C Kuhn, K Jacobs, JD MacKenzie, M Etchells, ...","SID Symposium Digest of Technical Papers 34 (1), 1084-1087",https://scholar.google.com/scholar?oi=bibs&hl=en&cites=8283519370309854551,18,2003
 ,"H Sirringhaus, EY Lee, U Kafader, H von Känel",Journal of Vacuum Science & Technology B: Microelectronics and Nanometer …,https://scholar.google.com/scholar?oi=bibs&hl=en&cites=7734430957078086135,18,1995
Recent advances in hybrid optoelectronics,"Y Vaynzof, D Kabra, TJK Brenner, H Sirringhaus, RH Friend","Israel Journal of Chemistry 52 (6), 496-517",https://scholar.google.com/scholar?oi=bibs&hl=en&cites=7100218142281396571,17,2012
Electron transport along semiconducting polymer heterojunctions,"C Liu, H Sirringhaus","Organic Electronics 11 (4), 558-563",https://scholar.google.com/scholar?oi=bibs&hl=en&cites=14158120640059482656,17,2010
43.1: ,"S Burns, C Kuhn, N Stone, D Wilson, AC Arias, T Brown, P Cain, P Devine, ...","SID Symposium Digest of Technical Papers 33 (1), 1193-1195",https://scholar.google.com/scholar?oi=bibs&hl=en&cites=9967399164214514725,17,2002
L‐4: ,"T Kawase, C Newsome, S Inoue, T Saeki, H Kawai, S Kanbe, T Shimoda, ...","SID Symposium Digest of Technical Papers 33 (1), 1017-1019",https://scholar.google.com/scholar?oi=bibs&hl=en&cites=8389549043934568883,17,2002
Interfacial dislocations detected by scanning tunneling microscopy,"R Stalder, H Sirringhaus, N Onda, H von Känel","Ultramicroscopy 42, 781-787",https://scholar.google.com/scholar?oi=bibs&hl=en&cites=13184368154028261668,17,1992
Performance Improvements in Conjugated Polymer Devices by Removal of Water‐Induced Traps,"M Nikolka, G Schweicher, J Armitage, I Nasrallah, C Jellett, Z Guo, ...","Advanced Materials 30 (36), 1801874",https://scholar.google.com/scholar?oi=bibs&hl=en&cites=8003437199921540570,16,2018
Manufacturing of Organic Transistor Circuits by Solution‐based Printing,"H Sirringhaus, CW Sele, T von Werne, C Ramsdale","Organic Electronics: Materials, Manufacturing and Applications, 294-322",https://scholar.google.com/scholar?oi=bibs&hl=en&cites=17258681939576592770,16,2006
Direct mapping of the CoSi 2/Si (111) interface by ballistic-electron-emission microscopy and modulation spectroscopy,"EY Lee, H Sirringhaus, H Von Kaenel","Physical Review B 50 (19), 14714",https://scholar.google.com/scholar?oi=bibs&hl=en&cites=9029769450152279401,16,1994
Effect of molecular asymmetry on the charge transport physics of high mobility n-type molecular semiconductors investigated by scanning Kelvin probe microscopy,"Y Hu, N Berdunov, C Di, I Nandhakumar, F Zhang, X Gao, D Zhu, ...","ACS nano 8 (7), 6778-6787",https://scholar.google.com/scholar?oi=bibs&hl=en&cites=8396809811303799497,15,2014
Oxide semiconductor,"K Mori, H Sirringhaus, KK Banger, RL Peterson","US Patent App. 13/265,254",https://scholar.google.com/scholar?oi=bibs&hl=en&cites=2366312959951324996,15,2012
Solid-state physics: Electrons in the fast lane,H Sirringhaus,"Nature 457 (7230), 667",https://scholar.google.com/scholar?oi=bibs&hl=en&cites=5570668298608589023,15,2009
"Adv. Mater.(Weinheim, Ger.)",H Sirringhaus,,https://scholar.google.com/scholar?oi=bibs&hl=en&cites=13675208368470480943,15,2005
Electron transmission probability across CoSi2/n-Si (111) interfaces measured with a scanning tunneling microscope,"EY Lee, H Sirringhaus, H Von Kaenel","Surface science 314 (1), L823-L828",https://scholar.google.com/scholar?oi=bibs&hl=en&cites=14996640170082875883,15,1994
Structural and electronic properties of pseudomorphic FeSi1+ x films on Si (111),"N Onda, H Sirringhaus, E Müller, H Von Kaenel","Journal of crystal growth 127 (1-4), 634-637",https://scholar.google.com/scholar?oi=bibs&hl=en&cites=12144466204196253850,15,1993
Trap Healing for High‐Performance Low‐Voltage Polymer Transistors and Solution‐Based Analog Amplifiers on Foil,"V Pecunia, M Nikolka, A Sou, I Nasrallah, AY Amin, I McCulloch, ...","Advanced Materials 29 (23), 1606938",https://scholar.google.com/scholar?oi=bibs&hl=en&cites=5002942257242687217,14,2017
Decoupling Charge Transport and Electroluminescence in a High Mobility Polymer Semiconductor,"DJ Harkin, K Broch, M Schreck, H Ceymann, A Stoy, CK Yong, M Nikolka, ...","Advanced Materials 28 (30), 6378-6385",https://scholar.google.com/scholar?oi=bibs&hl=en&cites=1868752842183840616,14,2016
Accurate on-chip measurement of the Seebeck coefficient of high mobility small molecule organic semiconductors,"CN Warwick, D Venkateshvaran, H Sirringhaus","APL Materials 3 (9), 096104",https://scholar.google.com/scholar?oi=bibs&hl=en&cites=5620813646989960064,14,2015
The effect of thiadiazole out-backbone displacement in indacenodithiophene semiconductor polymers,"M Planells, M Nikolka, M Hurhangee, PS Tuladhar, AJP White, JR Durrant, ...","Journal of Materials Chemistry C 2 (41), 8789-8795",https://scholar.google.com/scholar?oi=bibs&hl=en&cites=13312230332769443999,14,2014
"Ambipolar, Light-Emitting Field-Effect Transistors","J Zaumseil, H Sirringhaus, LL Chua, P Ho, R Friend","US Patent App. 10/586,244",https://scholar.google.com/scholar?oi=bibs&hl=en&cites=787944223782373462,14,2007
Ion channeling studies of epitaxial Fe and Co silicides on Si,"C Schwarz, N Onda, S Goncalves‐Conto, H Sirringhaus, H Von Känel, ...","Journal of applied physics 76 (11), 7256-7264",https://scholar.google.com/scholar?oi=bibs&hl=en&cites=356471591457305803,14,1994
Coulomb enhanced charge transport in semicrystalline polymer semiconductors,"R Di Pietro, I Nasrallah, J Carpenter, E Gann, LS Kölln, L Thomsen, ...","Advanced Functional Materials 26 (44), 8011-8022",https://scholar.google.com/scholar?oi=bibs&hl=en&cites=5088150046891096792,13,2016
"Temperature Dependence of Charge Localization in High‐Mobility, Solution‐Crystallized Small Molecule Semiconductors Studied by Charge Modulation Spectroscopy","AYB Meneau, Y Olivier, T Backlund, M James, DW Breiby, JW Andreasen, ...","Advanced Functional Materials 26 (14), 2326-2333",https://scholar.google.com/scholar?oi=bibs&hl=en&cites=4964771173587286996,13,2016
Blended polymer FETs,"H Sirringhaus, S Goffri, RAJ Janssen, CP Radano, P Smith, C Muller, ...","US Patent 8,518,738",https://scholar.google.com/scholar?oi=bibs&hl=en&cites=729740556139122873,13,2013
Alignment tolerant patterning on flexible substrates,"H Sirringhaus, S Burns","US Patent 8,174,634","https://scholar.google.com/scholar?oi=bibs&hl=en&cites=16344604940473927137,1049561654575040003",13,2012
Printing of polymer thin‐film transistors for active‐matrix‐display applications,"SE Burns, C Kuhn, K Jacobs, JD MacKenzie, C Ramsdale, AC Arias, ...","Journal of the Society for Information Display 11 (4), 599-604",https://scholar.google.com/scholar?oi=bibs&hl=en&cites=153523632302037648,13,2003
Distortion compensation for printing,"H Sirringhaus, JD Watts","US Patent 8,256,859",https://scholar.google.com/scholar?oi=bibs&hl=en&cites=9776646666671819199,12,2012
Organic electronics–new physical chemistry insight,"W Hu, YT Tao, H Sirringhaus","Physical Chemistry Chemical Physics 14 (41), 14097-14098",https://scholar.google.com/scholar?oi=bibs&hl=en&cites=15094746862194151889,12,2012
