Title,Authors,Platform,Cited_url,Cited_count,Year
The prefrontal cortex: response selection or maintenance within working memory?,"JB Rowe, I Toni, O Josephs, RSJ Frackowiak, RE Passingham","Science 288 (5471), 1656-1660",https://scholar.google.com/scholar?oi=bibs&hl=en&cites=13846268713197311315,930,2000
Activations related to “mirror” and “canonical” neurones in the human brain: an fMRI study,"J Grèzes, JL Armony, J Rowe, RE Passingham","Neuroimage 18 (4), 928-937",https://scholar.google.com/scholar?oi=bibs&hl=en&cites=8138516912525583899,797,2003
Inpatient general medicine is evidence based,"DL Sackett, J Ellis, I Mulligan, J Rowe","The Lancet 346 (8972), 407-410","https://scholar.google.com/scholar?oi=bibs&hl=en&cites=5648558127828928542,11005920002795270075",636,1995
Feeling the beat: premotor and striatal interactions in musicians and nonmusicians during beat perception,"JA Grahn, JB Rowe","Journal of Neuroscience 29 (23), 7540-7548",https://scholar.google.com/scholar?oi=bibs&hl=en&cites=13900985656460120411,446,2009
Active maintenance in prefrontal area 46 creates distractor-resistant memory,"K Sakai, JB Rowe, RE Passingham","Nature neuroscience 5 (5), 479",https://scholar.google.com/scholar?oi=bibs&hl=en&cites=8296902069940764569,409,2002
Clinical diagnosis of progressive supranuclear palsy: the movement disorder society criteria,"GU Höglinger, G Respondek, M Stamelou, C Kurz, KA Josephs, AE Lang, ...","Movement Disorders 32 (6), 853-864","https://scholar.google.com/scholar?oi=bibs&hl=en&cites=2269719980462436344,17589634070981994023",357,2017
Lateralized cognitive processes and lateralized task control in the human brain,"KE Stephan, JC Marshall, KJ Friston, JB Rowe, A Ritzl, K Zilles, GR Fink","Science 301 (5631), 384-386",https://scholar.google.com/scholar?oi=bibs&hl=en&cites=10624915046840808900,344,2003
Attention to action in Parkinson’s disease: impaired effective connectivity among frontal cortical regions,"J Rowe, KE Stephan, K Friston, R Frackowiak, A Lees, R Passingham","Brain 125 (2), 276-289",https://scholar.google.com/scholar?oi=bibs&hl=en&cites=13119007758999329645,309,2002
Acute remapping within the motor system induced by low-frequency repetitive transcranial magnetic stimulation,"L Lee, HR Siebner, JB Rowe, V Rizzo, JC Rothwell, RSJ Frackowiak, ...","Journal of Neuroscience 23 (12), 5308-5318",https://scholar.google.com/scholar?oi=bibs&hl=en&cites=15489538562162150945,290,2003
Characterizing mild cognitive impairment in incident Parkinson disease: the ICICLE-PD study,"AJ Yarnall, DP Breen, GW Duncan, TK Khoo, SY Coleman, MJ Firbank, ...","Neurology 82 (4), 308-316","https://scholar.google.com/scholar?oi=bibs&hl=en&cites=16232974847798962898,13457935833811867620",279,2014
Large C9orf72 hexanucleotide repeat expansions are seen in multiple neurodegenerative syndromes and are more frequent than expected in the UK population,"J Beck, M Poulter, D Hensman, JD Rohrer, CJ Mahoney, G Adamson, ...","The American Journal of Human Genetics 92 (3), 345-353",https://scholar.google.com/scholar?oi=bibs&hl=en&cites=11234796034940909331,248,2013
Presymptomatic cognitive and neuroanatomical changes in genetic frontotemporal dementia in the Genetic Frontotemporal dementia Initiative (GENFI) study: a cross-sectional analysis,"JD Rohrer, JM Nicholas, DM Cash, J van Swieten, E Dopper, L Jiskoot, ...","The Lancet Neurology 14 (3), 253-262",https://scholar.google.com/scholar?oi=bibs&hl=en&cites=9392937194379660508,241,2015
Motor imagery after stroke: relating outcome to motor network connectivity,"N Sharma, JC Baron, JB Rowe",Annals of Neurology: Official Journal of the American Neurological …,https://scholar.google.com/scholar?oi=bibs&hl=en&cites=11657248365186384092,236,2009
Attention to action: specific modulation of corticocortical interactions in humans,"J Rowe, K Friston, R Frackowiak, R Passingham","Neuroimage 17 (2), 988-998",https://scholar.google.com/scholar?oi=bibs&hl=en&cites=11831308672954178169,227,2002
Working memory for location and time: activity in prefrontal area 46 relates to selection rather than maintenance in memory,"JB Rowe, RE Passingham","Neuroimage 14 (1), 77-86",https://scholar.google.com/scholar?oi=bibs&hl=en&cites=3940994837221320395,222,2001
Initial demonstration of in vivo tracing of axonal projections in the macaque brain and comparison with the human brain using diffusion tensor imaging and fast marching …,"GJM Parker, KE Stephan, GJ Barker, JB Rowe, DG MacManus, ...","Neuroimage 15 (4), 797-809",https://scholar.google.com/scholar?oi=bibs&hl=en&cites=16142152295794058783,217,2002
Neural activity associated with monitoring the oscillating threat value of a tarantula,"D Mobbs, R Yu, JB Rowe, H Eich, O FeldmanHall, T Dalgleish","Proceedings of the National Academy of Sciences 107 (47), 20582-20586",https://scholar.google.com/scholar?oi=bibs&hl=en&cites=8307180738759302219,215,2010
Motion or activity: their role in intra-and inter-subject variation in fMRI,"TE Lund, MD Nørgaard, E Rostrup, JB Rowe, OB Paulson","Neuroimage 26 (3), 960-964",https://scholar.google.com/scholar?oi=bibs&hl=en&cites=6220063204757667587,205,2005
Patients with focal arm dystonia have increased sensitivity to slow‐frequency repetitive TMS of the dorsal premotor cortex,"HR Siebner, SR Filipovic, JB Rowe, C Cordivari, W Gerschlager, ...","Brain 126 (12), 2710-2725",https://scholar.google.com/scholar?oi=bibs&hl=en&cites=16219371916490098898,195,2003
"Parkinson's disease and dopaminergic therapy—differential effects on movement, reward and cognition","JB Rowe, L Hughes, BCP Ghosh, D Eckstein, CH Williams-Gray, S Fallon, ...","Brain 131 (8), 2094-2105",https://scholar.google.com/scholar?oi=bibs&hl=en&cites=8974131252942091928,188,2008
Neural abnormalities in early-onset and adolescence-onset conduct disorder,"L Passamonti, G Fairchild, IM Goodyer, G Hurford, CC Hagan, JB Rowe, ...","Archives of general psychiatry 67 (7), 729-738",https://scholar.google.com/scholar?oi=bibs&hl=en&cites=17762066158155392895,186,2010
Finding and feeling the musical beat: striatal dissociations between detection and prediction of regularity,"JA Grahn, JB Rowe","Cerebral cortex 23 (4), 913-921",https://scholar.google.com/scholar?oi=bibs&hl=en&cites=951811736288712125,183,2012
Frontotemporal dementia and its subtypes: a genome-wide association study,"R Ferrari, DG Hernandez, MA Nalls, JD Rohrer, A Ramasamy, JBJ Kwok, ...","The Lancet Neurology 13 (7), 686-699",https://scholar.google.com/scholar?oi=bibs&hl=en&cites=7902226754366443799,170,2014
Imaging the mental components of a planning task,"JB Rowe, AM Owen, IS Johnsrude, RE Passingham","Neuropsychologia 39 (3), 315-327",https://scholar.google.com/scholar?oi=bibs&hl=en&cites=8632850950024812515,166,2001
Personality predicts the brain's response to viewing appetizing foods: the neural basis of a risk factor for overeating,"L Passamonti, JB Rowe, C Schwarzbauer, MP Ewbank, ...","Journal of Neuroscience 29 (1), 43-51",https://scholar.google.com/scholar?oi=bibs&hl=en&cites=11119613262267562795,160,2009
Changes of cortico-striatal effective connectivity during visuomotor learning,"I Toni, J Rowe, KE Stephan, RE Passingham","Cerebral Cortex 12 (10), 1040-1047",https://scholar.google.com/scholar?oi=bibs&hl=en&cites=7885451216691680631,153,2002
"The Cambridge Centre for Ageing and Neuroscience (Cam-CAN) study protocol: a cross-sectional, lifespan, multidisciplinary examination of healthy cognitive ageing","MA Shafto, LK Tyler, M Dixon, JR Taylor, JB Rowe, R Cusack, AJ Calder, ...","BMC neurology 14 (1), 204",https://scholar.google.com/scholar?oi=bibs&hl=en&cites=9107985534118948554,139,2014
"Prevalence, characteristics, and survival of frontotemporal lobar degeneration syndromes","ITS Coyle-Gilchrist, KM Dick, K Patterson, PV Rodríquez, E Wehmann, ...","Neurology 86 (18), 1736-1743",https://scholar.google.com/scholar?oi=bibs&hl=en&cites=12312067577239471006,134,2016
"The size, burden and cost of disorders of the brain in the UK","NA Fineberg, PM Haddad, L Carpenter, B Gannon, R Sharpe, AH Young, ...","Journal of Psychopharmacology 27 (9), 761-770",https://scholar.google.com/scholar?oi=bibs&hl=en&cites=10458830672825935893,128,2013
"The Cambridge Centre for Ageing and Neuroscience (Cam-CAN) data repository: structural and functional MRI, MEG, and cognitive data from a cross-sectional adult lifespan sample","JR Taylor, N Williams, R Cusack, T Auer, MA Shafto, M Dixon, LK Tyler, ...","Neuroimage 144, 262-269",https://scholar.google.com/scholar?oi=bibs&hl=en&cites=14622252878903391009,123,2017
Frequency specific changes in regional cerebral blood flow and motor system connectivity following rTMS to the primary motor cortex,"E Rounis, L Lee, HR Siebner, JB Rowe, KJ Friston, JC Rothwell, ...","Neuroimage 26 (1), 164-176","https://scholar.google.com/scholar?oi=bibs&hl=en&cites=2142423981138450539,18176565962366725105",122,2005
Effects of acute tryptophan depletion on prefrontal-amygdala connectivity while viewing facial signals of aggression,"L Passamonti, MJ Crockett, AM Apergis-Schoute, L Clark, JB Rowe, ...","Biological psychiatry 71 (1), 36-43",https://scholar.google.com/scholar?oi=bibs&hl=en&cites=15066746325015888099,118,2012
The prefrontal cortex shows context-specific changes in effective connectivity to motor or visual cortex during the selection of action or colour,"JB Rowe, KE Stephan, K Friston, RSJ Frackowiak, RE Passingham","Cerebral Cortex 15 (1), 85-95",https://scholar.google.com/scholar?oi=bibs&hl=en&cites=15871589253737653263,118,2004
State and trait components of functional connectivity: individual differences vary with mental state,"L Geerligs, M Rubinov, RN Henson","Journal of Neuroscience 35 (41), 13949-13961",https://scholar.google.com/scholar?oi=bibs&hl=en&cites=17542550010052558864,117,2015
"Effects of modafinil on non-verbal cognition, task enjoyment and creative thinking in healthy volunteers","U Müller, JB Rowe, T Rittman, C Lewis, TW Robbins, BJ Sahakian","Neuropharmacology 64, 490-495",https://scholar.google.com/scholar?oi=bibs&hl=en&cites=11010670485963327614,116,2013
What “works” in working memory? Separate systems for selection and updating of critical information,"C Bledowski, B Rahm, JB Rowe","Journal of Neuroscience 29 (43), 13735-13741",https://scholar.google.com/scholar?oi=bibs&hl=en&cites=507980307510441293,116,2009
Baseline and longitudinal grey matter changes in newly diagnosed Parkinson’s disease: ICICLE-PD study,"E Mak, L Su, GB Williams, MJ Firbank, RA Lawson, AJ Yarnall, ...","Brain 138 (10), 2974-2986",https://scholar.google.com/scholar?oi=bibs&hl=en&cites=2537978057731199236,113,2015
Genetic impact on cognition and brain function in newly diagnosed Parkinson’s disease: ICICLE-PD study,"C Nombela, JB Rowe, SE Winder-Rhodes, A Hampshire, AM Owen, ...","Brain 137 (10), 2743-2758",https://scholar.google.com/scholar?oi=bibs&hl=en&cites=6427206514981033036,113,2014
Dynamic causal modelling of effective connectivity from fMRI: Are results reproducible and sensitive to Parkinson's disease and its treatment?,"JB Rowe, LE Hughes, RA Barker, AM Owen","Neuroimage 52 (3), 1015-1026",https://scholar.google.com/scholar?oi=bibs&hl=en&cites=7247397819386915464,112,2010
F-AV-1451 positron emission tomography in Alzheimer’s disease and progressive supranuclear palsy,"L Passamonti, P Vázquez Rodríguez, YT Hong, KSJ Allinson, ...","Brain 140 (3), 781-791",https://scholar.google.com/scholar?oi=bibs&hl=en&cites=1897430677659321267,109,2017
The Mini-Addenbrooke's Cognitive Examination: a new assessment tool for dementia,"S Hsieh, S McGrory, F Leslie, K Dawson, S Ahmed, CR Butler, JB Rowe, ...","Dementia and geriatric cognitive disorders 39 (1-2), 1-11",https://scholar.google.com/scholar?oi=bibs&hl=en&cites=15642226635965217380,109,2015
The prefrontal cortex achieves inhibitory control by facilitating subcortical motor pathway connectivity,"CL Rae, LE Hughes, MC Anderson, JB Rowe","Journal of neuroscience 35 (2), 786-794",https://scholar.google.com/scholar?oi=bibs&hl=en&cites=1104434941800853230,108,2015
White matter pathology in Parkinson's disease: the effect of imaging protocol differences and relevance to executive function,"CL Rae, MM Correia, E Altena, LE Hughes, RA Barker, JB Rowe","Neuroimage 62 (3), 1675-1684",https://scholar.google.com/scholar?oi=bibs&hl=en&cites=5779545281776032174,102,2012
Connectivity from the ventral anterior cingulate to the amygdala is modulated by appetitive motivation in response to facial signals of aggression,"L Passamonti, JB Rowe, M Ewbank, A Hampshire, J Keane, AJ Calder","Neuroimage 43 (3), 562-570",https://scholar.google.com/scholar?oi=bibs&hl=en&cites=18205438763759586767,100,2008
Generating animal and tool names: An fMRI study of effective connectivity,"P Vitali, J Abutalebi, M Tettamanti, J Rowe, P Scifo, F Fazio, SF Cappa, ...","Brain and language 93 (1), 32-45",https://scholar.google.com/scholar?oi=bibs&hl=en&cites=31921130674487660,93,2005
A head view-invariant representation of gaze direction in anterior superior temporal sulcus,"JD Carlin, AJ Calder, N Kriegeskorte, H Nili, JB Rowe","Current Biology 21 (21), 1817-1821",https://scholar.google.com/scholar?oi=bibs&hl=en&cites=13975077663002327307,89,2011
Obesity associated with increased brain age from midlife,"L Ronan, AF Alexander-Bloch, K Wagstyl, S Farooqi, C Brayne, LK Tyler, ...","Neurobiology of aging 47, 63-70",https://scholar.google.com/scholar?oi=bibs&hl=en&cites=2220838664982134937,88,2016
Cognition in corticobasal syndrome and progressive supranuclear palsy: a review,"JR Burrell, JR Hodges, JB Rowe","Movement Disorders 29 (5), 684-693",https://scholar.google.com/scholar?oi=bibs&hl=en&cites=931250030082224988,88,2014
Targeting impulsivity in Parkinson’s disease using atomoxetine,"AA Kehagia, CR Housden, R Regenthal, RA Barker, U Müller, J Rowe, ...","Brain 137 (7), 1986-1997",https://scholar.google.com/scholar?oi=bibs&hl=en&cites=6960005794685959462,86,2014
Connectivity analysis is essential to understand neurological disorders,J Rowe,"Frontiers in Systems Neuroscience 4, 144",https://scholar.google.com/scholar?oi=bibs&hl=en&cites=12360921849319712101,83,2010
Cognitive decline and quality of life in incident Parkinson's disease: the role of attention,"RA Lawson, AJ Yarnall, GW Duncan, DP Breen, TK Khoo, ...","Parkinsonism & related disorders 27, 47-53",https://scholar.google.com/scholar?oi=bibs&hl=en&cites=8770308945726640350,81,2016
Validation of the new consensus criteria for the diagnosis of corticobasal degeneration,"SK Alexander, T Rittman, JH Xuereb, TH Bak, JR Hodges, JB Rowe","J Neurol Neurosurg Psychiatry 85 (8), 925-929",https://scholar.google.com/scholar?oi=bibs&hl=en&cites=2631853316694653475,81,2014
Aging is associated with contrasting changes in local and distant cortical connectivity in the human motor system,"JB Rowe, H Siebner, SR Filipovic, C Cordivari, W Gerschlager, J Rothwell, ...","Neuroimage 32 (2), 747-760",https://scholar.google.com/scholar?oi=bibs&hl=en&cites=3191681408051494411,81,2006
The default mode network is disrupted in Parkinson's disease with visual hallucinations,"N Yao, R Shek‐Kwan Chang, C Cheung, S Pang, KK Lau, J Suckling, ...","Human brain mapping 35 (11), 5658-5666",https://scholar.google.com/scholar?oi=bibs&hl=en&cites=15515058699227575259,80,2014
Changes in “top-down” connectivity underlie repetition suppression in the ventral visual pathway,"MP Ewbank, RP Lawson, RN Henson, JB Rowe, L Passamonti, AJ Calder","Journal of Neuroscience 31 (15), 5635-5642",https://scholar.google.com/scholar?oi=bibs&hl=en&cites=6467888163958807335,80,2011
Connectivity analysis reveals a cortical network for eye gaze perception,"L Nummenmaa, L Passamonti, J Rowe, AD Engell, AJ Calder","Cerebral cortex 20 (8), 1780-1787",https://scholar.google.com/scholar?oi=bibs&hl=en&cites=14591318814393192497,78,2009
The effect of ageing on f MRI: Correction for the confounding effects of vascular reactivity evaluated by joint f MRI and MEG in 335 adults,"KA Tsvetanov, RNA Henson, LK Tyler, SW Davis, MA Shafto, JR Taylor, ...","Human brain mapping 36 (6), 2248-2269",https://scholar.google.com/scholar?oi=bibs&hl=en&cites=14147297709070652224,77,2015
The Addenbrooke's Cognitive Examination for the differential diagnosis and longitudinal assessment of patients with parkinsonian disorders,"T Rittman, BC Ghosh, P McColgan, DP Breen, J Evans, CH Williams-Gray, ...","J Neurol Neurosurg Psychiatry 84 (5), 544-551",https://scholar.google.com/scholar?oi=bibs&hl=en&cites=17439845303268873383,77,2013
Distinct aspects of frontal lobe structure mediate age-related differences in fluid intelligence and multitasking,"RA Kievit, SW Davis, DJ Mitchell, JR Taylor, J Duncan, LK Tyler, C Brayne, ...","Nature communications 5, 5658",https://scholar.google.com/scholar?oi=bibs&hl=en&cites=4384424904085784123,75,2014
Direct gaze elicits atypical activation of the theory-of-mind network in autism spectrum conditions,"EAH von dem Hagen, RS Stoyanova, JB Rowe, S Baron-Cohen, ...","Cerebral cortex 24 (6), 1485-1492",https://scholar.google.com/scholar?oi=bibs&hl=en&cites=15328225594846679612,74,2013
The neural basis of effective memory therapy in a patient with limbic encephalitis,"E Berry, A Hampshire, J Rowe, S Hodges, N Kapur, P Watson, G Browne, ...","Journal of Neurology, Neurosurgery & Psychiatry 80 (11), 1202-1205",https://scholar.google.com/scholar?oi=bibs&hl=en&cites=3892341718385394479,74,2009
Selective serotonin reuptake inhibition modulates response inhibition in Parkinson’s disease,"Z Ye, E Altena, C Nombela, CR Housden, H Maxwell, T Rittman, ...","Brain 137 (4), 1145-1155",https://scholar.google.com/scholar?oi=bibs&hl=en&cites=13644678580251634260,73,2014
Social cognitive deficits and their neural correlates in progressive supranuclear palsy,"BCP Ghosh, AJ Calder, PV Peers, AD Lawrence, J Acosta-Cabronero, ...","Brain 135 (7), 2089-2102",https://scholar.google.com/scholar?oi=bibs&hl=en&cites=7507281751196479134,72,2012
Radiological biomarkers for diagnosis in PSP: where are we and where do we need to be?,"JL Whitwell, GU Höglinger, A Antonini, Y Bordelon, AL Boxer, C Colosimo, ...","Movement Disorders 32 (7), 955-971",https://scholar.google.com/scholar?oi=bibs&hl=en&cites=3504421474577342045,71,2017
Multiple modes of impulsivity in Parkinson's disease,"C Nombela, T Rittman, TW Robbins, JB Rowe","PloS one 9 (1), e85747",https://scholar.google.com/scholar?oi=bibs&hl=en&cites=2805052293345034733,71,2014
Cue integration and the perception of action in intentional binding,"N Wolpe, P Haggard, HR Siebner, JB Rowe","Experimental brain research 229 (3), 467-474",https://scholar.google.com/scholar?oi=bibs&hl=en&cites=11580925775015175888,71,2013
Selection and stopping in voluntary action: a meta-analysis and combined fMRI study,"CL Rae, LE Hughes, C Weaver, MC Anderson, JB Rowe","Neuroimage 86, 381-391",https://scholar.google.com/scholar?oi=bibs&hl=en&cites=12320865294541119895,67,2014
The functional neuroimaging correlates of psychogenic versus organic dystonia,"AE Schrag, AR Mehta, KP Bhatia, RJ Brown, RSJ Frackowiak, MR Trimble, ...","Brain 136 (3), 770-781",https://scholar.google.com/scholar?oi=bibs&hl=en&cites=15697634059709674414,67,2013
Rule-selection and action-selection have a shared neuroanatomical basis in the human prefrontal and parietal cortex,"J Rowe, L Hughes, D Eckstein, AM Owen","Cerebral cortex 18 (10), 2275-2285",https://scholar.google.com/scholar?oi=bibs&hl=en&cites=5386334273602477678,67,2008
Linking neuroscience with modern concepts of impulse control disorders in Parkinson's disease,"TC Napier, JC Corvol, AA Grace, JD Roitman, J Rowe, V Voon, ...","Movement Disorders 30 (2), 141-149",https://scholar.google.com/scholar?oi=bibs&hl=en&cites=9367038732358758167,66,2015
Improving response inhibition in Parkinson’s disease with atomoxetine,"Z Ye, E Altena, C Nombela, CR Housden, H Maxwell, T Rittman, ...","Biological psychiatry 77 (8), 740-748",https://scholar.google.com/scholar?oi=bibs&hl=en&cites=4261891623083538579,65,2015
Tau burden and the functional connectome in Alzheimer’s disease and progressive supranuclear palsy,"TE Cope, T Rittman, RJ Borchert, PS Jones, D Vatansever, K Allinson, ...","Brain 141 (2), 550-567",https://scholar.google.com/scholar?oi=bibs&hl=en&cites=13220702593028649847,63,2018
S erum immune markers and disease progression in an incident P arkinson's disease cohort (ICICLE‐PD),"CH Williams‐Gray, R Wijeyekoon, AJ Yarnall, RA Lawson, DP Breen, ...","Movement Disorders 31 (7), 995-1003",https://scholar.google.com/scholar?oi=bibs&hl=en&cites=17532366992016450852,63,2016
Dissociable mechanisms of speed-accuracy tradeoff during visual perceptual learning are revealed by a hierarchical drift-diffusion model,"J Zhang, JB Rowe","Frontiers in neuroscience 8, 69",https://scholar.google.com/scholar?oi=bibs&hl=en&cites=7004973314392087357,63,2014
Is the prefrontal cortex necessary for establishing cognitive sets?,"JB Rowe, K Sakai, TE Lund, T Ramsøy, MS Christensen, WFC Baare, ...","Journal of Neuroscience 27 (48), 13303-13310",https://scholar.google.com/scholar?oi=bibs&hl=en&cites=17486283781274313212,63,2007
Extrinsic and intrinsic brain network connectivity maintains cognition across the lifespan despite accelerated decay of regional brain activation,"KA Tsvetanov, RNA Henson, LK Tyler, A Razi, L Geerligs, TE Ham, ...","Journal of Neuroscience 36 (11), 3115-3126",https://scholar.google.com/scholar?oi=bibs&hl=en&cites=9362920274248327900,62,2016
The medial frontal-prefrontal network for altered awareness and control of action in corticobasal syndrome,"N Wolpe, JW Moore, CL Rae, T Rittman, E Altena, P Haggard, JB Rowe","Brain 137 (1), 208-220",https://scholar.google.com/scholar?oi=bibs&hl=en&cites=112859538474847737,62,2013
Which ante mortem clinical features predict progressive supranuclear palsy pathology?,"G Respondek, C Kurz, T Arzberger, Y Compta, E Englund, LW Ferguson, ...","Movement Disorders 32 (7), 995-1005",https://scholar.google.com/scholar?oi=bibs&hl=en&cites=11637321531162256777,61,2017
The motor system and its disorders,"JB Rowe, HR Siebner","Neuroimage 61 (2), 464-477",https://scholar.google.com/scholar?oi=bibs&hl=en&cites=15334519682897253459,60,2012
Action selection: a race model for selected and non-selected actions distinguishes the contribution of premotor and prefrontal areas,"JB Rowe, L Hughes, I Nimmo-Smith","Neuroimage 51 (2), 888-896",https://scholar.google.com/scholar?oi=bibs&hl=en&cites=14292837923569679105,60,2010
R47H TREM2 variant increases risk of typical early-onset Alzheimer's disease but not of prion or frontotemporal dementia,"CF Slattery, JA Beck, L Harper, G Adamson, Z Abdi, J Uphill, T Campbell, ...","Alzheimer's & dementia 10 (6), 602-608. e4",https://scholar.google.com/scholar?oi=bibs&hl=en&cites=18101572422155498686,59,2014
A watershed model of individual differences in fluid intelligence,"RA Kievit, SW Davis, J Griffiths, MM Correia, RN Henson","Neuropsychologia 91, 186-198",https://scholar.google.com/scholar?oi=bibs&hl=en&cites=5838727931112548876,57,2016
"In vivo tau PET imaging in dementia: pathophysiology, radiotracer quantification, and a systematic review of clinical findings","B Hall, E Mak, S Cervenka, FI Aigbirhio, JB Rowe, JT O’Brien","Ageing research reviews 36, 50-63",https://scholar.google.com/scholar?oi=bibs&hl=en&cites=15760452203966000295,56,2017
Emotion recognition in progressive supranuclear palsy,"BCP Ghosh, JB Rowe, AJ Calder, JR Hodges, TH Bak","Journal of Neurology, Neurosurgery & Psychiatry 80 (10), 1143-1145",https://scholar.google.com/scholar?oi=bibs&hl=en&cites=8231366459760827615,55,2009
Parahippocampal reactivation signal at retrieval after interruption of rehearsal,"K Sakai, JB Rowe, RE Passingham","Journal of Neuroscience 22 (15), 6315-6320",https://scholar.google.com/scholar?oi=bibs&hl=en&cites=13890009088191661119,55,2002
"Saccadic latency in Parkinson's disease correlates with executive function and brain atrophy, but not motor severity","R Perneczky, BCP Ghosh, L Hughes, RHS Carpenter, RA Barker, ...","Neurobiology of disease 43 (1), 79-85",https://scholar.google.com/scholar?oi=bibs&hl=en&cites=872867982004003716,54,2011
An fMRI study of the neural correlates of graded visual perception,"MS Christensen, TZ Ramsøy, TE Lund, KH Madsen, JB Rowe","Neuroimage 31 (4), 1711-1725",https://scholar.google.com/scholar?oi=bibs&hl=en&cites=14411350749354032692,52,2006
How are age-related differences in sleep quality associated with health outcomes? An epidemiological investigation in a UK cohort of 2406 adults,"A Gadie, M Shafto, Y Leng, RA Kievit","BMJ open 7 (7), e014920",https://scholar.google.com/scholar?oi=bibs&hl=en&cites=14857798657724454788,51,2017
The neural signature of escalating frustration in humans,"R Yu, D Mobbs, B Seymour, JB Rowe, AJ Calder","Cortex 54, 165-178",https://scholar.google.com/scholar?oi=bibs&hl=en&cites=10406529311470648261,51,2014
Patterns of gray matter atrophy in genetic frontotemporal dementia: results from the GENFI study,"DM Cash, M Bocchetta, DL Thomas, KM Dick, JC van Swieten, B Borroni, ...","Neurobiology of aging 62, 191-196",https://scholar.google.com/scholar?oi=bibs&hl=en&cites=9384631142936814763,49,2018
Selection and inhibition mechanisms for human voluntary action decisions,"J Zhang, LE Hughes, JB Rowe","Neuroimage 63 (1), 392-402",https://scholar.google.com/scholar?oi=bibs&hl=en&cites=16593462123581488195,49,2012
Challenges in measuring individual differences in functional connectivity using fMRI: the case of healthy aging,"L Geerligs, KA Tsvetanov, RN Henson","Human brain mapping 38 (8), 4125-4156",https://scholar.google.com/scholar?oi=bibs&hl=en&cites=3946988091860478467,48,2017
