Title,Authors,Platform,Cited_url,Cited_count,Year
Discovery of high-amplitude X-ray variability in the Seyfert–LINER transition galaxy NGC 7589,"W Yuan, S Komossa, D Xu, JP Osborne, MG Watson, RG McMahon","Monthly Notices of the Royal Astronomical Society 353 (3), L29-L33",https://scholar.google.com/scholar?oi=bibs&hl=en&cites=10558009700939136718,12,2004
Clustering of very red galaxies in the las campanas ir survey,"P McCarthy, R Carlberg, R Marzke, HW Chen, A Firth, R McMahon, ...","Deep Fields, 247-251",https://scholar.google.com/scholar?oi=bibs&hl=en&cites=6708702742142892723,12,2001
Three new VHS–DES quasars at 6.7 < ,"SL Reed, M Banerji, GD Becker, PC Hewett, P Martini, RG McMahon, ...","Monthly Notices of the Royal Astronomical Society 487 (2), 1874-1885",https://scholar.google.com/scholar?oi=bibs&hl=en&cites=17249247146484063169,11,2019
TYPE Ia SNe ALONG REDSHIFT: THE (Si II) RATIO AND THE EXPANSION VELOCITIES IN INTERMEDIATE-z SUPERNOVAE,"G Altavilla, P Ruiz-Lapuente, A Balastegui, J Méndez, M Irwin, ...","The Astrophysical Journal 695 (1), 135",https://scholar.google.com/scholar?oi=bibs&hl=en&cites=67103927825289773,11,2009
CO and Dust in PSS 2322+ 1944 at a redshift of 4.12,"P Cox, A Omont, SG Djorgovski, F Bertoldi, J Pety, CL Carilli, KG Isaak, ...","Astronomy & Astrophysics 387 (2), 406-411",https://scholar.google.com/scholar?oi=bibs&hl=en&cites=231456557143373214,11,2002
Predicting the peculiar velocities of nearby PSCz galaxies using the Least Action Principle,"J Sharpe, M Rowan-Robinson, A Canavezes, W Saunders, E Branchini, ...","Monthly Notices of the Royal Astronomical Society 322 (1), 121-130",https://scholar.google.com/scholar?oi=bibs&hl=en&cites=4782063868363100193,11,2001
"VizieR Online Data Catalog: The APM-North Catalogue (McMahon+, 2000)","RG McMahon, MJ Irwin, SJ Maddox",VizieR Online Data Catalog 1267,https://scholar.google.com/scholar?oi=bibs&hl=en&cites=3430754182763861928,11,2000
Firback source counts and cosmological implications,"H Dole, R Gispert, G Lagache, JL Puget, H Aussel, FR Bouchet, P Ciliegi, ...","ISO Surveys of a Dusty Universe, 54-61",https://scholar.google.com/scholar?oi=bibs&hl=en&cites=13796144493272585988,11,2000
"FIRBACK far infrared survey with ISO: Data reduction, analysis and first results","H Dole, G Lagache, JL Puget, R Gispert, H Aussel, FR Bouchet, C Ciliegi, ...",arXiv preprint astro-ph/9902122,https://scholar.google.com/scholar?oi=bibs&hl=en&cites=9042388556328774851,11,1999
Towards completing a large-area ultraluminous infrared galaxy survey,"DL Clements, WJ Saunders, RG McMahon","Monthly Notices of the Royal Astronomical Society 302 (2), 391-398",https://scholar.google.com/scholar?oi=bibs&hl=en&cites=6858925197914553145,11,1999
The second detection of CO at redshift larger than 4,"S Guilloteau, A Omont, RG Mcmahon, P Cox, P Petitjean",arXiv preprint astro-ph/9711082,https://scholar.google.com/scholar?oi=bibs&hl=en&cites=16422560555665934714,11,1997
A radio-quiet galaxy at redshift Z= 3.409,"DA Turnshek, F Macchetto, MV Bencke, C Hazard, WB Sparks, ...","The Astrophysical Journal 382, 26-31",https://scholar.google.com/scholar?oi=bibs&hl=en&cites=12641321896298465618,11,1991
A new L dwarf member of the moderately metal poor triple system HD 221356,"B Gauza, VJS Béjar, R Rebolo, K Peña Ramírez, MR Zapatero Osorio, ...","Monthly Notices of the Royal Astronomical Society 427 (3), 2457-2463",https://scholar.google.com/scholar?oi=bibs&hl=en&cites=483811711650159334,10,2012
The Evolution and Space Density of Damped Lyman-α Galaxies,"C Péroux, MJ Irwin, RG McMahon, LJ Storrie-Lombardi","Astrophysics and Space Science 277 (1), 551-554",https://scholar.google.com/scholar?oi=bibs&hl=en&cites=5094548883943374726,10,2001
A deep radio survey in the ISO-ELAIS fields: optical identification with the APM catalogue/atl,"P Ciliegi, C Gruppioni, R McMahon, M Rowan-Robinson","Astrophysics and Space Science 276 (2-4), 957-964",https://scholar.google.com/scholar?oi=bibs&hl=en&cites=9692626764561653613,10,2001
Finding charts for southern IRAS galaxies,"WJ Sutherland, RG McMahon, SJ Maddox, J Loveday, W Saunders","Monthly Notices of the Royal Astronomical Society 248 (3), 483-486",https://scholar.google.com/scholar?oi=bibs&hl=en&cites=14872329435996330980,10,1991
High resolution CASPEC observations of the Z= 4.11 QSO 0000-26,"JK Webb, HC Parnell, RF Carswell, RG McMahon, MJ Irwin, C Hazard, ...","The Messenger 51, 15-18",https://scholar.google.com/scholar?oi=bibs&hl=en&cites=5667419155226249536,10,1988
Spectrum of a QSO with redshift 3.8,"WLW Sargent, AV Filippenko, CC Steidel, C Hazard, RG McMahon","Nature 322 (6074), 40",https://scholar.google.com/scholar?oi=bibs&hl=en&cites=5883211824316278078,10,1986
A complete multiwavelength characterization of faint chandra x-ray sources seen in the spitzer wide-area infrared extragalactic (swire) survey,"A Franceschini, J Manners, M del Carmen Polletta, C Lonsdale, ...","The Astronomical Journal 129 (5), 2074",https://scholar.google.com/scholar?oi=bibs&hl=en&cites=1769459533562111714,9,2005
The FIRST Unbiased Survey for Radio Stars,"DJ Helfand, S Schnee, RH Becker, RL White, RG McMahon","The Astronomical Journal 117 (3), 1568",https://scholar.google.com/scholar?oi=bibs&hl=en&cites=10424286832319046410,9,1999
Infrared imaging and spectroscopy with HAWAII and PICNIC arrays,"CD Mackay, MG Beckett, RG McMahon, IR Parry, F Piche, KA Ennico, ...","Infrared Astronomical Instrumentation 3354, 14-23",https://scholar.google.com/scholar?oi=bibs&hl=en&cites=17419928987972137149,9,1998
Cosmological time dilation using type Ia supernovae as clocks,"G Goldhaber, B Boyle, P Bunclark, D Carter, W Couch, S Deustua, ...","Nuclear Physics B-Proceedings Supplements 51 (2), 123-127",https://scholar.google.com/scholar?oi=bibs&hl=en&cites=7470431477451547284,9,1996
Supernova 1992bi in Anonymous Galaxy,"C Pennypacker, S Perlmutter, G Goldhaber, A Goobar, J Desai, A Kim, ...",International Astronomical Union Circular 5652,https://scholar.google.com/scholar?oi=bibs&hl=en&cites=8665797804884654640,9,1992
Yet more z> 4 QSOs discovered using the INT.,"M Irwin, R McMahon","GEMINI Newsletter Royal Greenwich Observatory 30, 6-8",https://scholar.google.com/scholar?oi=bibs&hl=en&cites=4737550655319145032,9,1990
"The Races of Europe: Construction of National Identities in the Social Sciences, 1839-1939",R McMahon,Springer,https://scholar.google.com/scholar?oi=bibs&hl=en&cites=2279452433132355034,8,2016
Heavily reddened ,"S Alaghband-Zadeh, M Banerji, PC Hewett, RG McMahon","Monthly Notices of the Royal Astronomical Society 459 (1), 999-1017",https://scholar.google.com/scholar?oi=bibs&hl=en&cites=5178823848675630260,8,2016
The 4MOST instrument concept overview,"R Haynes, S Barden, R de Jong, O Schnurr, O Bellido, J Walcher, ...","Ground-based and Airborne Instrumentation for Astronomy V 9147, 91476I",https://scholar.google.com/scholar?oi=bibs&hl=en&cites=8329344245243553118,8,2014
A 1.2 mm MAMBO/IRAM–30 m study of dust emission from optically luminous 2 quasars,"A Omont, A Beelen, F Bertoldi, P Cox, CL Carilli, RS Priddey, ...","Astronomy & Astrophysics 398 (3), 857-865",https://scholar.google.com/scholar?oi=bibs&hl=en&cites=15817500166024764351,8,2003
UVES observations of a damped Lyα system at towards the quasar APM BR J0307-4945,"M Dessauges-Zavadsky, S D'Odorico, RG McMahon, P Molaro, C Ledoux, ...","Astronomy & Astrophysics 370 (2), 426-435",https://scholar.google.com/scholar?oi=bibs&hl=en&cites=8408082927945545307,8,2001
Long-term optical variability of radio-selected quasars from the first survey,"DJ Helfand, RPS Stone, B Willman, RL White, RH Becker, T Price, ...","The Astronomical Journal 121 (4), 1872",https://scholar.google.com/scholar?oi=bibs&hl=en&cites=863277146297471335,8,2001
Cirsi: The Cambridge Infrared Survey Instrument,"MG Beckett, CD Mackay, RG McMahon, IR Parry, F Piche, RS Ellis","Optical Telescopes of Today and Tomorrow 2871, 1152-1159",https://scholar.google.com/scholar?oi=bibs&hl=en&cites=16940792118186587944,8,1997
High-redshift supernova discoveries on demand: first results from a new tool for cosmology and bounds on q0,"S Perlmutter, B Boyle, P Bunclark, D Carter, W Couch, S Deustua, ...","Nuclear Physics B-Proceedings Supplements 51 (2), 20-29",https://scholar.google.com/scholar?oi=bibs&hl=en&cites=15507231234015374479,8,1996
"Supernovae 1994F, 1994G, 1994H","H Pack, M Cronin, JB Oke, J Cohen, T Bida, M Turrato, M Turatto",International Astronomical Union Circular 5958,https://scholar.google.com/scholar?oi=bibs&hl=en&cites=9704678246978025299,8,1994
Deep CCD photometry of the Sextans dwarf spheroidal galaxy,"M Mateo, J Nemec, M Irwin, R McMahon","The Astronomical Journal 101, 892-910",https://scholar.google.com/scholar?oi=bibs&hl=en&cites=16649003079338117653,8,1991
1159+ 123: a bright high-redshift QSO selected from a UK Schmidt IIIaF plate,"C Hazard, R Terlevich, R McMahon, D Turnshek, C Foltz, J Stocke, ...","Monthly Notices of the Royal Astronomical Society 211 (1), 45P-50P",https://scholar.google.com/scholar?oi=bibs&hl=en&cites=14113826740344934759,8,1984
4MOST: science operations for a large spectroscopic survey program with multiple science cases executed in parallel,"CJ Walcher, RS de Jong, T Dwelly, O Bellido, T Boller, C Chiappini, ...","Observatory Operations: Strategies, Processes, and Systems VI 9910, 99101N",https://scholar.google.com/scholar?oi=bibs&hl=en&cites=7924426326018085070,7,2016
Cosmology from cosmic shear with DES science verification data,"T Abbott, FB Abdalla, S Allam, A Amara, J Annis, R Armstrong, D Bacon, ...",arXiv preprint arXiv:1507.05552,https://scholar.google.com/scholar?oi=bibs&hl=en&cites=13195394335687295938,7,2015
Design and manufacture of high temperature superconducting magnets for an electron cyclotron resonance ion source,"R McMahon, S Harrison, S Milward, J Ross, RS Allen, C Bieth, S Kantas, ...","IEEE transactions on applied superconductivity 14 (2), 608-611",https://scholar.google.com/scholar?oi=bibs&hl=en&cites=12793977716886396351,7,2004
Statistical properties of dlas and sub-dlas,"C Peroux, MJ Irwin, RG McMahon, LJ Storrie-Lombardi",arXiv preprint astro-ph/0107125,https://scholar.google.com/scholar?oi=bibs&hl=en&cites=4823043047176689935,7,2001
Absorption Systems in the Spectra of 66 z≳ 4 Quasars,"C Péroux, LJ Storrie-Lombardi, RG McMahon, M Irwin, IM Hook","The Astronomical Journal 121 (4), 1799",https://scholar.google.com/scholar?oi=bibs&hl=en&cites=18272304579647172803,7,2001
The one-point PDF of the initial conditions of our local Universe from the ,"P Monaco, G Efstathiou, SJ Maddox, E Branchini, CS Frenk, ...","Monthly Notices of the Royal Astronomical Society 318 (3), 681-692",https://scholar.google.com/scholar?oi=bibs&hl=en&cites=12975396729889094051,7,2000
Star–galaxy classification in the Dark Energy Survey Y1 data set,"I Sevilla-Noarbe, B Hoyle, MJ Marchã, MT Soumagnac, K Bechtol, ...","Monthly Notices of the Royal Astronomical Society 481 (4), 5451-5469",https://scholar.google.com/scholar?oi=bibs&hl=en&cites=16667719951391665415,6,2018
Discovery of a ,"D Mudd, P Martini, SS Tie, C Lidman, R McMahon, M Banerji, T Davis, ...","Monthly Notices of the Royal Astronomical Society 468 (3), 3682-3688",https://scholar.google.com/scholar?oi=bibs&hl=en&cites=17302219448189289419,6,2017
From space to specs: requirements for 4MOST,"O Schnurr, CJ Walcher, C Chiappini, AD Schwope, O Bellido-Tirado, ...","Modeling, Systems Engineering, and Project Management for Astronomy VI 9150 …",https://scholar.google.com/scholar?oi=bibs&hl=en&cites=788066318550114250,6,2014
First SN Discoveries from the Dark Energy Survey,"T Abbott, F Abdalla, I Achitouv, E Ahn, G Aldering, S Allam, D Alonso, ...",The Astronomer's Telegram 4668,https://scholar.google.com/scholar?oi=bibs&hl=en&cites=2537933306033565668,6,2012
Evolution of the observed Lyα luminosity function from z= 6.5 to z= 7.7: evidence for the epoch of reionization?,"B Clément, JG Cuby, F Courbin, A Fontana, W Freudling, J Fynbo, ...","Astronomy & Astrophysics 538, A66","https://scholar.google.com/scholar?oi=bibs&hl=en&cites=3908703233130514018,11670854969569965231",6,2012
"Networks, narratives and territory in anthropological race classification: towards a more comprehensive historical geography of Europe’s culture",R McMahon,"History of the human sciences 24 (1), 70-94",https://scholar.google.com/scholar?oi=bibs&hl=en&cites=11220429032660347978,6,2011
Early Science Results from the UKIDSS ESO Public Survey,"S Warren, A Lawrence, O Almaini, M Cirasuolo, S Foucaud, N Hambly, ...","The Messenger 126, 7-10",https://scholar.google.com/scholar?oi=bibs&hl=en&cites=9442501312944951117,6,2006
"SNLS: Measurement of Omega M, Omega Lambda and w from the First Year Data Set","P Astier, J Guy, N Regnault, R Pain, E Aubourg, D Balam, S Basa, ...","Bulletin of the American Astronomical Society 37, 1176",https://scholar.google.com/scholar?oi=bibs&hl=en&cites=13961262381730690501,6,2005
A survey for low-luminosity quasars at redshift ,"RG Sharp, D Crampton, IM Hook, RG McMahon","Monthly Notices of the Royal Astronomical Society 350 (2), 449-455",https://scholar.google.com/scholar?oi=bibs&hl=en&cites=13387868511313055757,6,2004
Photometric redshifts for an optical/near-infrared catalogue in the Chandra Deep Field South,"ER Stanway, A Bunker, RG McMahon","The Evolution of Galaxies, 87-90",https://scholar.google.com/scholar?oi=bibs&hl=en&cites=6462061566315799799,6,2003
CO (,"I Iwata, K Ohta, K Nakanishi, K Kohno, RG McMahon","Publications of the Astronomical Society of Japan 53 (5), 871-874",https://scholar.google.com/scholar?oi=bibs&hl=en&cites=2683598105375202461,6,2001
AstroGrid,"P Allan, B Bentley, C Davenhall, S Garrington, D Giaretta, L Harra, M Irwin, ...","Technical report, Available at: www. astrogrid. org",https://scholar.google.com/scholar?oi=bibs&hl=en&cites=13722587474935574364,6,2001
VLBI imaging of extremely high redshift quasars at 5 GHz,"Z Paragi, S Frey, LI Gurvits, KI Kellermann, RT Schilizzi, RG McMahon, ...",arXiv preprint astro-ph/9901396,https://scholar.google.com/scholar?oi=bibs&hl=en&cites=7972476871718926666,6,1999
The Gravitationally-Lensed Radio Source MG0751+ 2716,"J Lehar, BF Burke, SR Conner, EE Falco, AB Fletcher, M Irwin, ...",arXiv preprint astro-ph/9702191,https://scholar.google.com/scholar?oi=bibs&hl=en&cites=9561357183905083829,6,1997
Discovery of the most distant supernovae and the quest for Ω,"G Goldhaber, B Boyle, P Bunclark, D Carter, R Ellis, S Gabi, A Goobar, ...","Nuclear Physics B-Proceedings Supplements 38 (1-3), 435-439",https://scholar.google.com/scholar?oi=bibs&hl=en&cites=522126529839693301,6,1995
A Four-Image Gravitational Lens in MG0751+ 2716,"J Lehar, RG McMahon, M Irwin, SR Conner, BF Burke","Bulletin of the American Astronomical Society 25, 1343",https://scholar.google.com/scholar?oi=bibs&hl=en&cites=2162679083610728930,6,1993
New z> 4 QSOs discovered with the INT.,"R McMahon, M Irwin","GEMINI Newsletter Royal Greenwich Observatory 25, 6-8",https://scholar.google.com/scholar?oi=bibs&hl=en&cites=7279384545844891944,6,1989
4MOST Consortium Survey 6: Active Galactic Nuclei,"A Merloni, DA Alexander, M Banerji, T Boller, J Comparat, T Dwelly, ...",arXiv preprint arXiv:1903.02472,https://scholar.google.com/scholar?oi=bibs&hl=en&cites=17157940020022651130,5,2019
A national power infrastructure for Charge-on-the-Move,"D Nicolaides, R McMahon, D Cebon, J Miles",2016 IEEE PELS Workshop on Emerging Technologies: Wireless Power Transfer …,https://scholar.google.com/scholar?oi=bibs&hl=en&cites=3344543377166849289,5,2016
Post-identity?: culture and European integration,R McMahon,Routledge,https://scholar.google.com/scholar?oi=bibs&hl=en&cites=4100389671289636443,5,2013
The Herschel-SPIRE Legacy Survey (HSLS): the scientific goals of a shallow and wide submillimeter imaging survey with SPIRE,"A Cooray, S Eales, S Chapman, DL Clements, O Dore, D Farrah, ...",arXiv preprint arXiv:1007.3519,https://scholar.google.com/scholar?oi=bibs&hl=en&cites=8094992748539804203,5,2010
The WFCAM/UKIDSS data archive: problems and opportunities,"A Lawrence, N Hambly, B Mann, M Irwin, RG McMahon, JR Lewis, ...","Survey and Other Telescope Technologies and Discoveries 4836, 418-425",https://scholar.google.com/scholar?oi=bibs&hl=en&cites=17777252169732383488,5,2002
The xmm-newton bright serendipitous source sample (xmm-newton bss),"R Della Ceca, T Maccacaro, A Caccianiga, P Severgnini, X Barcons, ...",Arxiv preprint astro-ph/0202150,https://scholar.google.com/scholar?oi=bibs&hl=en&cites=1210172866225669104,5,2002
The Wide Field Survey on the Isaac Newton Telescope,"JR Lewis, PS Bunclark, MJ Irwin, RG McMahon, NA Walton","Astronomical Data Analysis Software and Systems IX 216, 415",https://scholar.google.com/scholar?oi=bibs&hl=en&cites=16146821590957211060,5,2000
FIRBACK Cosmological Survey With ISO: Observing the Cosmic Infrared Background at 170 microns,"H Dole, R Gispert, G Lagache, JL Puget, H Aussel, FR Bouchet, P Ciliegi, ...","ISO Beyond Point Sources: Studies of Extended Infrared Emission 455, 167",https://scholar.google.com/scholar?oi=bibs&hl=en&cites=12779449096712458096,5,2000
K corrections for type ia supernovae and a test for spatial variation of the hubble constant,"A Kim, S Deustua, S Gabi, G Goldhaber, D Groom, I Hook, M Kim, J Lee, ...",arXiv preprint astro-ph/9602123,https://scholar.google.com/scholar?oi=bibs&hl=en&cites=10324088024579273728,5,1996
A BAL QSO with ,"C Hazard, RG McMahon, DC Morton","Monthly Notices of the Royal Astronomical Society 229 (3), 371-377",https://scholar.google.com/scholar?oi=bibs&hl=en&cites=16430753081607370068,5,1987
4MOST Consortium Survey 8: Cosmology Redshift Survey (CRS),"J Richard, JP Kneib, C Blake, A Raichoor, J Comparat, T Shanks, J Sorce, ...",arXiv preprint arXiv:1903.02474,https://scholar.google.com/scholar?oi=bibs&hl=en&cites=11644568361498842330,4,2019
"UV-luminous, star-forming hosts of ","CF Wethers, M Banerji, PC Hewett, CA Lemon, RG McMahon, SL Reed, ...","Monthly Notices of the Royal Astronomical Society 475 (3), 3682-3699",https://scholar.google.com/scholar?oi=bibs&hl=en&cites=5215880549524867123,4,2018
COSMOGRAIL XVI: Time delays for the quadruply imaged quasar DES J0408-5354 with high-cadence photometric monitoring,"F Courbin, V Bonvin, E Buckley-Geer, CD Fassnacht, J Frieman, H Lin, ...",arXiv preprint arXiv:1706.09424,https://scholar.google.com/scholar?oi=bibs&hl=en&cites=11622729120240007558,4,2017
Near-Earth Object Orbit Linking with the Large Synoptic Survey Telescope,"P Vereš, SR Chesley","The Astronomical Journal 154 (1), 13",https://scholar.google.com/scholar?oi=bibs&hl=en&cites=15679262764898441285,4,2017
"Progress, democracy, efficiency: normative narratives in political science EU studies",R McMahon,"National Identities 19 (2), 231-249",https://scholar.google.com/scholar?oi=bibs&hl=en&cites=15608827759221541681,4,2017
Wood and pulping properties of Eucalyptus urophylla and its hybrid grown by silvopastoral and conventional forest production models,"FML Souza, CA Sansígolo, CH Pupo, GC Sereghetti","Cellulose Chemistry and Technology 51, 347-353",https://scholar.google.com/scholar?oi=bibs&hl=en&cites=2883353741423369878,4,2017
NEW CONSTRAINTS ON THE MOLECULAR GAS IN THE PROTOTYPICAL HyLIRGs BRI 1202–0725 AND BRI 1335–0417,"GC Jones, CL Carilli, E Momjian, J Wagg, DA Riechers, F Walter, ...","The Astrophysical Journal 830 (2), 63",https://scholar.google.com/scholar?oi=bibs&hl=en&cites=14376202920458900407,4,2016
First T dwarfs in the VISTA Hemisphere Survey,"N Lodieu, B Burningham, A Day-Jones, RD Scholz, F Marocco, ...","Astronomy & Astrophysics 548, A53",https://scholar.google.com/scholar?oi=bibs&hl=en&cites=13690648282215803254,4,2012
The XMM-Newton bright serendipitous survey-Identification and optical spectral properties,"A Caccianiga, P Severgnini, R Della Ceca, T Maccacaro, F Cocchia, ...","Astronomy & Astrophysics 477 (3), 735-746",https://scholar.google.com/scholar?oi=bibs&hl=en&cites=6518015647367601546,4,2008
The Races of Europe: Anthropological Race Classification of Europeans 1839-1939,R McMahon,EUI PhD theses,https://scholar.google.com/scholar?oi=bibs&hl=en&cites=15946713576950376264,4,2007
VISTA Data Flow System: Pipeline Processing for WFCAM and VISTA,"JR Lewis, MJ Irwin, ST Hodgkin, PS Bunclark, DW Evans, RG McMahon","Astronomical Data Analysis Software and Systems XIV 347, 599",https://scholar.google.com/scholar?oi=bibs&hl=en&cites=16305694654532525993,4,2005
Unlocking the potential of the XMM Serendipitous Survey via multi-colour broad band imaging,"W Yuan, RG McMahon, M Watson, J Tedds, C Motch, A Schwope","Astronomische Nachrichten: Astronomical Notes 324 (1‐2), 178-178",https://scholar.google.com/scholar?oi=bibs&hl=en&cites=5304255874979205117,4,2003
AstroGrid: the UK's Virtual Observatory Initiative,"RG Mann, A Lawrence, C Davenhall, B Mann, R McMahon, M Irwin, ...","Astronomical Data Analysis Software and Systems XI 281, 3",https://scholar.google.com/scholar?oi=bibs&hl=en&cites=1956669851179117712,4,2002
First Results from the ISO-IRAS Faint Galaxy Survey,"DA Levine, CJ Lonsdale, RL Hurt, HE Smith, G Helou, C Beichman, ...","The Astrophysical Journal 504 (1), 64",https://scholar.google.com/scholar?oi=bibs&hl=en&cites=16057295549528743779,4,1998
Apm surveys for high redshift quasars,"RG McMahon, MJ Irwin","Digitised Optical Sky Surveys, 417-424",https://scholar.google.com/scholar?oi=bibs&hl=en&cites=13543521555544390668,4,1992
"VizieR Online Data Catalog: SDSS quasar catalog: twelfth data release (Paris+, 2017)","I Pâris, P Petitjean, NP Ross, AD Myers, E Aubourg, A Streblyanska, ...",Vizier online data catalog 7278,https://scholar.google.com/scholar?oi=bibs&hl=en&cites=15396739952063032233,3,2017
Observations of the Lyman series forest towards the redshift 7.1 quasar ULAS J1120+ 0641,"R Barnett, SJ Warren, GD Becker, DJ Mortlock, PC Hewett, RG McMahon, ...","Astronomy & Astrophysics 601, A16",https://scholar.google.com/scholar?oi=bibs&hl=en&cites=16656933839433221528,3,2017
Narrating European integration: transnational actors and stories,"W Kaiser, R McMahon","National Identities 19 (2), 149-160",https://scholar.google.com/scholar?oi=bibs&hl=en&cites=1863926890945615380,3,2017
"Eight new luminous z> 6 quasars selected via SED model fitting of VISTA, WISE and Dark Energy Survey Year 1 Observations","SL Reed, RG McMahon, P Martini, M Banerji, M Auger, PC Hewett, ...",arXiv preprint arXiv:1701.04852,https://scholar.google.com/scholar?oi=bibs&hl=en&cites=11422922167551577398,3,2017
Near-infrared colors of minor planets recovered from VISTA-VHS survey (MOVIS),"M Popescu, J Licandro, D Morate, J de León, DA Nedelcu, R Rebolo, ...","Astronomy & Astrophysics 591, A115",https://scholar.google.com/scholar?oi=bibs&hl=en&cites=1988895554833727499,3,2016
Euroscepticism and neighbourhood peace: how transnational spatial patterns shape Europe,R McMahon,"European Societies 14 (4), 562-585",https://scholar.google.com/scholar?oi=bibs&hl=en&cites=6297150288307879099,3,2012
On the margins of international science and national discourse: national identity narratives in Romanian race anthropology,R McMahon,"European Review of History—Revue européenne d'histoire 16 (1), 101-123",https://scholar.google.com/scholar?oi=bibs&hl=en&cites=6213501642198451285,3,2009
Dawn after the dark age,R McMahon,"Nature 443 (7108), 151",https://scholar.google.com/scholar?oi=bibs&hl=en&cites=10961718742966152747,3,2006
Optical and near-infrared observations of the peculiar type Ia supernova 1999ac,"MM Phillips, K Krisciunas, NB Suntzeff, RG Abraham, MG Beckett, ...","The Astronomical Journal 131 (5), 2615",https://scholar.google.com/scholar?oi=bibs&hl=en&cites=3334601210856168687,3,2006
The cryogenic system of the superconducting magnet for the Alpha Magnetic Spectrometer,"SM Harrison, RH McMahon, SR Milward, RC Stafford Allen, ...","AIP Conference Proceedings 823 (1), 1315-1322",https://scholar.google.com/scholar?oi=bibs&hl=en&cites=2126045364211417945,3,2006
Testing the coils of the superconducting magnet for the Alpha Magnetic Spectrometer,"R McMahon, S Harrison, S Milward, RS Allen, H Hofer, J Ulbricht, ...",Proceedings of the Twentieth International Cryogenic Engineering Conference …,https://scholar.google.com/scholar?oi=bibs&hl=en&cites=7719003531469451074,3,2005
Sub-DLAs Abundances: Implications for the Cosmological Evolution of Metals,"C Péroux, M Dessauges-Zavadsky, TS Kim, S D'Odorico, RG McMahon","Memorie della Societa Astronomica Italiana Supplementi 3, 261",https://scholar.google.com/scholar?oi=bibs&hl=en&cites=16188196003264966948,3,2003
Radio observations of infrared-luminous high-redshift quasi-stellar objects,"CL Carilli, F Bertoldi, A Omont, P Cox, RG McMahon, KG Isaak","The Astronomical Journal 122 (4), 1679",https://scholar.google.com/scholar?oi=bibs&hl=en&cites=16079462949845381024,3,2001
The Isaac Newton Group's Wide Field Survey. Status of the Survey and Associated Data Pipeline,"NA Walton, M Irwin, R McMahon, JR Lewis","The Newsletter of the Isaac Newton Group of Telescopes 1, 3-5",https://scholar.google.com/scholar?oi=bibs&hl=en&cites=16180458122758609115,3,1999
Dust and CO lines in high redshift quasars,"S Guilloteau, A Omont, P Cox, RG McMahon, P Petitjean","Astronomy and Astrophysics 349, 363-368",https://scholar.google.com/scholar?oi=bibs&hl=en&cites=8099554355601890639,3,1999
The Las Campanas Infrared Survey,"R Marzke, PJ McCarthy, E Persson, A Oemler, A Dressler, MBL Yan, ...","Photometric Redshifts and the Detection of High Redshift Galaxies 191, 148",https://scholar.google.com/scholar?oi=bibs&hl=en&cites=4484997839175296684,3,1999
