Title,Authors,Platform,Cited_url,Cited_count,Year
First Results from the PSC-z Survey,"W Saunders, A Taylor, W Ballinger, A Heavens, S Oliver, O Keeble, ...","Extragalactic Astronomy in the Infrared, Ed. G.. A. Mamon, TX Thuan, & JTT …",https://scholar.google.com/scholar?oi=bibs&hl=en&cites=1538236437869791326,3,1997
The variability of a large sample of quasars,"IM Hook, RG McMahon, BJ Boyle, MJ Irwin","The Space Distribution of Quasars 21, 67-75",https://scholar.google.com/scholar?oi=bibs&hl=en&cites=2700100449359868639,3,1991
An extragalactic constraint on local galactic reddening,"WB Sparks, RS Ellis, RG McMahon, RJ Terlevich, J Melnick","Monthly Notices of the Royal Astronomical Society 225 (4), 769-776",https://scholar.google.com/scholar?oi=bibs&hl=en&cites=12125948308265157176,3,1987
Brown dwarf census with the Dark Energy Survey year 3 data and the thin disk scale height of early L types,"AC Rosell, B Santiago, M Ponte, B Burningham, LN da Costa, DJ James, ...",arXiv preprint arXiv:1903.10806,https://scholar.google.com/scholar?oi=bibs&hl=en&cites=9993490133754334841,2,2019
4MOST Survey Strategy Plan,"G Guiglion, C Battistini, CPM Bell, T Bensby, T Boller, C Chiappini, ...",arXiv preprint arXiv:1903.02466,https://scholar.google.com/scholar?oi=bibs&hl=en&cites=5417043697244913918,2,2019
COSMOGRAIL: the COSmological MOnitoring of GRAvItational Lenses-XVI. Time delays for the quadruply imaged quasar DES J0408− 5354 with high-cadence photometric monitoring,"F Courbin, V Bonvin, E Buckley-Geer, CD Fassnacht, J Frieman, H Lin, ...","Astronomy & Astrophysics 609, A71",https://scholar.google.com/scholar?oi=bibs&hl=en&cites=2422121510597639827,2,2018
"The compact,~ 1 kpc host galaxy of a quasar at z= 7.1","B Venemans, F Walter, R Decarli, E Banados, J Hodge, P Hewett, ...",arXiv preprint arXiv:1702.03852,https://scholar.google.com/scholar?oi=bibs&hl=en&cites=12879900679720398783,2,2017
"Introduction: after the failure of identity, what links European integration politics and culture?",R McMahon,"Post-identity?, 17-30",https://scholar.google.com/scholar?oi=bibs&hl=en&cites=10750317278272648245,2,2013
[O ,"KD Bayliss, RG McMahon, BP Venemans, M Banerji, JR Lewis","Monthly Notices of the Royal Astronomical Society 426 (3), 2178-2188",https://scholar.google.com/scholar?oi=bibs&hl=en&cites=9102819076692029212,2,2012
SpIES: The Spitzer-IRAC Equatorial Survey,"G Richards, M Lacy, M Strauss, D Spergel, S Anderson, F Bauer, ...",Spitzer Proposal,https://scholar.google.com/scholar?oi=bibs&hl=en&cites=13186267133349286764,2,2012
New technologies for exoplanet detection with mid-IR interferometers,"PR Lawson, OP Lay, SR Martin, RD Peters, AJ Booth, RO Gappinger, ...","EPJ Web of Conferences 16, 07001","https://scholar.google.com/scholar?oi=bibs&hl=en&cites=15810436386678043929,14527531267915579054",2,2011
Galaxies at high redshift and reionization,"A Bunker, E Stanway, R Ellis, M Lacy, R McMahon, L Eyles, D Stark, ...",arXiv preprint arXiv:0909.1565,"https://scholar.google.com/scholar?oi=bibs&hl=en&cites=10433779612464235967,4350200815806206326",2,2009
Cultures of communication: new historical perspectives,R McMahon,"European Review of History—Revue européenne d'histoire 16 (1), 1-14",https://scholar.google.com/scholar?oi=bibs&hl=en&cites=3578350287827978662,2,2009
"The Supernova Legacy Survey: measurement of Ωm, Ω∧ and w from the first year data set. Commentary","P ASTIER, J GUY, N REGNAULT, R PAIN, E AUBOURG, D BALAM, ...","Astronomy and astrophysics 500 (1), 597-616",https://scholar.google.com/scholar?oi=bibs&hl=en&cites=16988106861166756440,2,2009
The XMM-SSC survey of hard-spectrum ,"MJ Page, I Lehmann, T Boller, MG Watson, T Dwelly, S Hess, I Matute, ...","Monthly Notices of the Royal Astronomical Society 378 (4), 1335-1355",https://scholar.google.com/scholar?oi=bibs&hl=en&cites=16531915254625287224,2,2007
"Erratum:“A Redshift z= 6.56 Galaxy behind the Cluster Abell 370”(ApJ, 568, L75 [2002])","EM Hu, LL Cowie, RG McMahon, P Capak, F Iwamuro, JP Kneib, ...","The Astrophysical Journal Letters 576 (1), L99",https://scholar.google.com/scholar?oi=bibs&hl=en&cites=505867915790093369,2,2002
Discovery of radio-loud quasars with redshifts above 4 from the PMN sample,"IM Hook, RG McMahon, PA Shaver, IAG Snellen","Astronomy & Astrophysics 391 (2), 509-517",https://scholar.google.com/scholar?oi=bibs&hl=en&cites=18337284232167278779,2,2002
"PSCz catalog (Saunders+, 2000)","W Saunders, WJ Sutherland, SJ Maddox, O Keeble, SJ Oliver, ...",VizieR On-line Data Catalog: VII/221. Originally published in: 2000MNRAS …,https://scholar.google.com/scholar?oi=bibs&hl=en&cites=14735027592421168554,2,2000
The IRAS Point Source Catalog Redshift (PSCz) Survey,"W Saunders, S Oliver, O Keeble, M Rowan-Robinson, S Maddox, ...","Cosmic Flows Workshop 201, 223",https://scholar.google.com/scholar?oi=bibs&hl=en&cites=12036132697092832792,2,2000
Galaxies at z> 5: The View from Hawaii,"EM Hu, LL Cowie, RG McMahon",arXiv preprint astro-ph/9911477,https://scholar.google.com/scholar?oi=bibs&hl=en&cites=15315353944185614923,2,1999
The european large area iso survey: Elais,"S Oliver, M Rowan-Robinson, C Cesarsky, L Danese, A Franceschini, ...","Symposium-International Astronomical Union 179, 112-114",https://scholar.google.com/scholar?oi=bibs&hl=en&cites=18346836217478409330,2,1998
Millimetre emission from high redshift radioquiet quasars,"A Omont, RG McMahon, J Bergeron, P Cox, S Guilloteau, E Kreysa, ...","The Early Universe with the VLT, 357-360",https://scholar.google.com/scholar?oi=bibs&hl=en&cites=502573339279269844,2,1997
Large-Scale Structure at Z approximately 2.5,"GM Williger, C Hazard, JA Baldwin, RG McMahon","The Astrophysical Journal Supplement Series 104, 145","https://scholar.google.com/scholar?oi=bibs&hl=en&cites=5086054649311734556,13608495392847616965",2,1996
Stellar Results from the FIRST Survey,"RH Becker, RL White, DJ Helfand, MD Gregg, R McMahon","Radio Emission from the Stars and the Sun 93, 422",https://scholar.google.com/scholar?oi=bibs&hl=en&cites=16022599413409838491,2,1996
Cosmology from 7 High-Redshift Supernovae: Type IA Homogeneity at Z~ 0.4 and the Measurement of q_0,"S Perlmutter, S Deustua, S Gabi, G Goldhaber, D Groom, I Hook, A Kim, ...","Bulletin of the American Astronomical Society 27, 1413",https://scholar.google.com/scholar?oi=bibs&hl=en&cites=10415142647845097109,2,1995
The IRAS PSC redshift survey.,"W Saunders, W Sutherland, S Maddox, S Oliver, O Keeble, ...","IEEE Spectrum 7, 14-17",https://scholar.google.com/scholar?oi=bibs&hl=en&cites=12421292661499506276,2,1995
The point source catalog redshift survey,"W SAUNDERS, W SUTHERLAND, G EFSTATHIOU, H TADROS, ...","Wide Field Spectroscopy and the Distant Universe, 88",https://scholar.google.com/scholar?oi=bibs&hl=en&cites=6020511612476355193,2,1995
Quantifying Large-Scale Structure behind the Milky Way Using the IRAS Point Source Catalogue,"W Saunders, WJ Sutherland, C Efstathiou, H Tadros, S Maddox, ...","Unveiling Large-Scale Structures Behind the Milky Way 67, 257",https://scholar.google.com/scholar?oi=bibs&hl=en&cites=6302420961046062147,2,1994
Optically selected quasars with Z greater than 4,"RG McMahon, MJ Irwin, C Hazard",X-ray Emission from Active Galactic Nuclei and the Cosmic X-ray Background,https://scholar.google.com/scholar?oi=bibs&hl=en&cites=11119793047477171219,2,1992
Automatic Analysis of Objective Prism Spectra,"P Hewett, M Irwin, P Bunclark, M Bridgeland, E Kibblewhite, R McMahon","International Astronomical Union Colloquium 78, 137-140",https://scholar.google.com/scholar?oi=bibs&hl=en&cites=14387275735352496294,2,1984
4MOST Scientific Operations,"CJ Walcher, M Banerji, C Battistini, CPM Bell, O Bellido-Tirado, T Bensby, ...",arXiv preprint arXiv:1903.02465,https://scholar.google.com/scholar?oi=bibs&hl=en&cites=10873261455103443760,1,2019
4MOST Consortium Survey 5: eROSITA Galaxy Cluster Redshift Survey,"A Finoguenov, A Merloni, J Comparat, K Nandra, M Salvato, E Tempel, ...",arXiv preprint arXiv:1903.02471,https://scholar.google.com/scholar?oi=bibs&hl=en&cites=3054899781559731265,1,2019
"The history of transdisciplinary race classification: methods, politics and institutions, 1840s–1940s",R McMahon,"The British Journal for the History of Science 51 (1), 41-67",https://scholar.google.com/scholar?oi=bibs&hl=en&cites=17718627214659781701,1,2018
Fall and Rise: Normativity in Political Science Writing on the EU,R Mcmahon,"JCMS: Journal of Common Market Studies 56 (2), 462-479",https://scholar.google.com/scholar?oi=bibs&hl=en&cites=8572994127688206552,1,2018
A national power infrastructure for charge-on-the-move: An appraisal for Great Britain,"D Nicolaides, R McMahon, D Cebon, J Miles","IEEE Systems Journal 13 (1), 720-728",https://scholar.google.com/scholar?oi=bibs&hl=en&cites=241512713181543712,1,2018
"Religion, civilisation, geography: normative EU studies and eastern enlargement",R McMahon,"Journal of Contemporary European Studies 25 (3), 307-324",https://scholar.google.com/scholar?oi=bibs&hl=en&cites=3918308128306855792,1,2017
"Supplement:"" Localization and Broadband Follow-Up of the Gravitational-Wave Transient GW150914”(2016, ApJL, 826, L13)","BP Abbot, L Galbany, A Razza",IOP,https://scholar.google.com/scholar?oi=bibs&hl=en&cites=8286330197855098052,1,2016
11 How culture and history shape Europe’s differentiated integration,R McMahon,"Post-identity?: culture and European Integration, 191",https://scholar.google.com/scholar?oi=bibs&hl=en&cites=5169334913755498722,1,2013
Cultures of defining culture: EU cultural policy in the context of the study of culture,"A Littoz-Monnet, R McMahon","Post-identity, 212-234",https://scholar.google.com/scholar?oi=bibs&hl=en&cites=5128883694060608682,1,2013
The VISTA Hemisphere Survey (VHS) Science Goals and Status,R McMahon,Science from the Next Generation Imaging and Spectroscopic Surveys,https://scholar.google.com/scholar?oi=bibs&hl=en&cites=9598547470909497648,1,2012
Illuminating the Dark Ages: Very high redshift quasars in VIKING+ KiDS,"B Venemans, J Findlay, R McMahon, W Sutherland, G Verdoes Kleijn, ...",Science from the Next Generation Imaging and Spectroscopic Surveys,https://scholar.google.com/scholar?oi=bibs&hl=en&cites=3106477437711862460,1,2012
"VizieR Online Data Catalog: SDSS Quasar Catalog, DR9Q (Paris+, 2012)","I Paris, P Petitjean, E Aubourg, S Bailey, NP Ross, AD Myers, MA Strauss, ...",VizieR Online Data Catalog 354,https://scholar.google.com/scholar?oi=bibs&hl=en&cites=3251818318993560406,1,2012
"INTRODUCTION: If identity doesn't connect culture with European integration politics, what does?",R McMahon,"European Societies 14 (4), 473-483",https://scholar.google.com/scholar?oi=bibs&hl=en&cites=5175840495519224237,1,2012
Photometry of the z= 7.08 quasar ULAS J1120+ 0641,"S Warren, D Mortlock, B Venemans, C Simpson, P Hewett, R McMahon",Spitzer Proposal,https://scholar.google.com/scholar?oi=bibs&hl=en&cites=5313915016145761388,1,2011
Letter to Nature,"DJ Mortlock, SJ Warren, BP Venemans, M Patel, PC Hewett, ...",June,https://scholar.google.com/scholar?oi=bibs&hl=en&cites=7159114939764009327,1,2011
Narrow Band Surveys and the Epoch of Reionization,"BP Venemans, RG McMahon, IR Parry, DJ King, J Bland-Hawthorn, ...","Science with the VLT in the ELT Era, 187-191",https://scholar.google.com/scholar?oi=bibs&hl=en&cites=6802578987472379266,1,2009
The UKIRT Infrared Deep Sky Survey and the search for the most distant quasars,"DJ Mortlock, M Patel, SJ Warren, BP Venemans, RG McMahon, P Hewett, ...",arXiv preprint arXiv:0810.3859,https://scholar.google.com/scholar?oi=bibs&hl=en&cites=16950226456037812972,1,2008
"VizieR Online Data Catalog: XMM-Newton serendipitous Survey. V.(Watson+, 2009)","MG Watson, AC Schroder, D Fyfe, CG Page, G Lamer, S Mateos, J Pye, ...",VizieR Online Data Catalog 349,https://scholar.google.com/scholar?oi=bibs&hl=en&cites=3492278335464799519,1,2008
DAZLE on the VLT,"R McMahon, I Parry, B Venemans, D King, E Ryan-Weber, ...","The Messenger 131, 11-13",https://scholar.google.com/scholar?oi=bibs&hl=en&cites=10984150934226595422,1,2008
Star Forming Galaxies at z [unknown] 6 and Reionization,"A Bunker, E Stanway, R Ellis, R McMahon, L Eyles, M Lacy, D Stark, ...","Astronomical Society of the Pacific Conference Series 380, 27",https://scholar.google.com/scholar?oi=bibs&hl=en&cites=13594366475573953991,1,2007
First Results From the VISTA Data Flow System and WFCAM,"JR Lewis, MJ Irwin, EA Gonzalez-Solares, PS Bunclark, ST Hodgkin, ...","Astronomical Data Analysis Software and Systems XV 351, 255",https://scholar.google.com/scholar?oi=bibs&hl=en&cites=3497832593443176191,1,2006
Spectroscopy of twelve type Ia supernovae at intermediate redshift,"C Balland, M Mouchet, R Pain, NA Walton, R Amanullah, P Astier, ...","Astronomy & Astrophysics 445 (2), 387-402",https://scholar.google.com/scholar?oi=bibs&hl=en&cites=5053115929041884107,1,2006
High-temperature superconducting magnets for use in electron cyclotron resonance ion sources,"S Harrison, S Milward, R McMahon, C Bieth, S Kantas, P Sortais","IEEE transactions on applied superconductivity 15 (2), 1473-1476",https://scholar.google.com/scholar?oi=bibs&hl=en&cites=4235398378412214261,1,2005
Status of the superconducting magnet for the Alpha Magnetic Spectrometer,"S Harrison, S Milward, RS Allen, R McMahon, H Hofer, J Ulbricht, ...","IEEE transactions on applied superconductivity 15 (2), 1244-1247",https://scholar.google.com/scholar?oi=bibs&hl=en&cites=17824134124859629126,1,2005
Wide Field Survey: Final Data Products,"M Irwin, R McMahon, N Walton, E Gonzalez-Solares, S Hodgkin, J Irwin, ...","The Newsletter of the Isaac Newton Group of Telescopes 9, 8-11",https://scholar.google.com/scholar?oi=bibs&hl=en&cites=1710152571051248978,1,2005
Optical Spectroscopy of High-Redshift Supernovae Used in Determination of Cosmological Parameters,"E Smith, G Aldering, R Amanullah, P Antilogus, P Astier, G Blanc, ...","Bulletin of the American Astronomical Society 35, 1277",https://scholar.google.com/scholar?oi=bibs&hl=en&cites=16818622368332401630,1,2003
"A Homogeneous Sample of Sub-DLAs II: Statistical, Kinematic and Chemical Properties","C Péroux, M Dessauges-Zavadsky, S D'Odorico, TS Kim, RG McMahon",arXiv preprint astro-ph/0307050,https://scholar.google.com/scholar?oi=bibs&hl=en&cites=21797409690275735,1,2003
Discovery of az˜ 6 Galaxy in the Chandra Deep Field South,"AJ Bunker, ER Stanway, RS Ellis, RG McMahon, PJ McCarthy","Bulletin of the American Astronomical Society 35, 716",https://scholar.google.com/scholar?oi=bibs&hl=en&cites=1136308994020408179,1,2003
Submillimetre observations of a sample of high redshift quasars,"I Robson, R Priddey, TJ Pearson, MC Fox, K Isaak, R McMahon, R Ivison","Active Galactic Nuclei: From Central Engine to Host Galaxy 290, 617",https://scholar.google.com/scholar?oi=bibs&hl=en&cites=1446888200050778297,1,2003
Interpretation of High-z SN Spectra,"P Nugent, G Aldering, R Amanullah, P Antilogus, P Astier, C Balland, ...","Bulletin of the American Astronomical Society 33, 1427",https://scholar.google.com/scholar?oi=bibs&hl=en&cites=13429927711090710831,1,2001
Verifying the Use of Type Ia Supernovae as Probes of the Cosmic Expansion,"RS Ellis, M Sullivan, G Aldering, R Amanullah, P Antilogus, P Astier, ...","Bulletin of the American Astronomical Society 33, 1347",https://scholar.google.com/scholar?oi=bibs&hl=en&cites=8204983791208919644,1,2001
The z~ 1.2 Galaxy Luminosity Function from The LCIR Survey,"HW Chen, PJ McCarthy, RO Marzke, RG Carlberg, AE Firth, SE Persson, ...",arXiv preprint astro-ph/0110120,https://scholar.google.com/scholar?oi=bibs&hl=en&cites=17429559751783688970,1,2001
ESO Observations of the Hubble Deep Field South,M Dennefeld,"Deep Fields, 43-48","https://scholar.google.com/scholar?oi=bibs&hl=en&cites=17625860575521909848,5158447106642553297",1,2001
Reddening-Independent Quasar Selection from a Wide Field Optical and Near-IR Imaging Survey,"CN Sabbey, RG Sharp, AK Vivas, ST Hodgkin, PS Coppi, RG McMahon","The New Era of Wide Field Astronomy 232, 26",https://scholar.google.com/scholar?oi=bibs&hl=en&cites=17030219994746962300,1,2001
CIRPASS Near-Infrared Integral Field Spectroscopy of Damped Lyman-alpha Systems,"AJ Bunker, AMN Ferguson, RA Johnson, RG McMahon, IR Parry, ...","Bulletin of the American Astronomical Society 197, 1386",https://scholar.google.com/scholar?oi=bibs&hl=en&cites=15928813864904519156,1,2000
Near-Infrared Integral Field Spectroscopy of Damped Lyman-,"A Bunker, A Ferguson, R Johnson, R McMahon, I Parry, M Pettini, ...","Mining the Sky, 214-217",https://scholar.google.com/scholar?oi=bibs&hl=en&cites=984851597069735705,1,2000
An Optical/Near-IR Survey of Evolved Galaxies at 1< z< 2,"P McCarthy, R Marzke, HW Chen, E Persson, A Oemler, A Dressler, ...","Bulletin of the American Astronomical Society 31, 1459",https://scholar.google.com/scholar?oi=bibs&hl=en&cites=6118760930304212572,1,1999
The FIRST Efficient Gravitational Lens Survey,"J Lehar, A Buchalter, R McMahon, C Kochanek, D Helfand, R Becker, ...",arXiv preprint astro-ph/9908353,https://scholar.google.com/scholar?oi=bibs&hl=en&cites=16054295416181380271,1,1999
Predicting the peculiar velocities of nearby galaxies,"J Sharpe, M Rowan-Robinson, A Canavezes, W Saunders, G Efstathiou, ...","Observational Cosmology: The Development of Galaxy Systems 176, 280",https://scholar.google.com/scholar?oi=bibs&hl=en&cites=13837826313523268314,1,1999
CIRSI Data Reduction System--CIRDR,"SJ Chan, SE Persson, RG McMahon, CD Mackay, R Ellis, MG Beckett, ...","Astronomical Data Analysis Software and Systems VIII 172, 502",https://scholar.google.com/scholar?oi=bibs&hl=en&cites=10979618865413200003,1,1999
The ISO Survey of the Hubble Deep Field,"M Rowan-Robinson, SJ Oliver, RG Mann, S Serjeant, P Goldschmidt, ...","The Hubble Deep Field 112, 68",https://scholar.google.com/scholar?oi=bibs&hl=en&cites=5106286550595635631,1,1998
CIRSI: progress with the Cambridge infrared survey instrument,"MG Beckett, CD Mackay, RG McMahon, IR Parry, RS Ellis, SJ Chan, ...","Infrared Astronomical Instrumentation 3354, 431-435",https://scholar.google.com/scholar?oi=bibs&hl=en&cites=2834463091286147391,1,1998
Deep surveys and cosmology,"SJ Oliver, S Sergeant, P Goldschmidt, RG Mann, M Rowan-Robinson, ...","Highlights of Astronomy 11 (2), 1122-1124",https://scholar.google.com/scholar?oi=bibs&hl=en&cites=13599269152142370810,1,1998
The FIRST Unbiased Survey for Radio Sources,"DJ Helfand, S Schnee, RH Becker, RL White, RG McMahon","Bulletin of the American Astronomical Society 29, 1231",https://scholar.google.com/scholar?oi=bibs&hl=en&cites=1250996301329119368,1,1997
Measurements of the Cosmological Parameters Omega and Lambda from High-Redshift Supernovae,"RA Knop, G Aldering, S Deustua, S Fabbro, G Goldhaber, DE Groom, ...","Bulletin of the American Astronomical Society 29, 1363",https://scholar.google.com/scholar?oi=bibs&hl=en&cites=12159899953562471474,1,1997
Implications For The Hubble Constant from the First Seven Supernovae at,"AG Kim, S Gabi, G Goldhaber, DE Groom, IM Hook, MY Kim, JC Lee, ...","To appear in ApJ 476, L63",https://scholar.google.com/scholar?oi=bibs&hl=en&cites=789435558402651941,1,1997
Star-Forming Galaxies at Z> 4 in the Field of BR1202-0725,"A Fontana, S D'Odorico, E Giallongo, S Cristiani, E Egami, E Hu, ...","Dark and Visible Matter in Galaxies and Cosmological Implications 117, 477",https://scholar.google.com/scholar?oi=bibs&hl=en&cites=5031579996802868417,1,1997
CO detection in the quasar BR1202-0725 at Z= 4.69,"A Omont, P Petitjean, S Guilloteau, RG McMahon, PM Solomon, ...","Symposium-International Astronomical Union 178, 501-504",https://scholar.google.com/scholar?oi=bibs&hl=en&cites=14758527667843554478,1,1997
"Institut d’Astrophysique de Paris (CNRS), 98 bis Bd Arago","P Petitjean, S GUILLOTEAU, RG MCMAHON, PM SOLOMON, ...",F-75014 Paris (France) and UA CNRS,https://scholar.google.com/scholar?oi=bibs&hl=en&cites=13745296351654342676,1,1997
Deuterium and ionic abundances at high redshift,"EJ Wampler, GM Williger, JA Baldwin, RF Carswell, RG McMahon, ...","Origin of Matter and Evolution of Galaxies in the Universe'96, 64",https://scholar.google.com/scholar?oi=bibs&hl=en&cites=1448607465352408405,1,1997
VizieR Online Data Catalog: ROSAT detected quasars. I.(Brinkmann+ 1997),"W Brinkmann, W Yuan",VizieR Online Data Catalog 331,"https://scholar.google.com/scholar?oi=bibs&hl=en&cites=8585956877252303861,1064597526473267773",1,1996
Keck spectroscopy and high resolution HST/UH 2.2 m imaging of redshift z> 4.5 galaxies around two distant quasars.,"EM Hu, RG McMahon, E Egami","Bulletin of the American Astronomical Society 28, 853-854",https://scholar.google.com/scholar?oi=bibs&hl=en&cites=13140532088792232760,1,1996
Rapid Variability in Faint Extragalactic Radio Sources,"DJ Helfand, SR Das, RH Becker, RL White, RG McMahon","Blazar Continuum Variability 110, 214",https://scholar.google.com/scholar?oi=bibs&hl=en&cites=12658630083353490262,1,1996
"High-Redshift Supernova Searching to Study q_0, Lambda, Omega_0, and H_0: First Results from 7 Supernovae at Redshifts Z~ 0.35--0.5","A Kim, S Deustua, S Gabi, G Goldhaber, D Groom, I Hook, M Kim, ...","Bulletin of the American Astronomical Society 27, 1292",https://scholar.google.com/scholar?oi=bibs&hl=en&cites=12128617248531355324,1,1995
Evolution of faint IRAS galaxies,"S Oliver, TOM BROADHURST, M ROWAN-ROBINSON, W SAUNDERS, ...","Wide Field Spectroscopy and the Distant Universe, 274",https://scholar.google.com/scholar?oi=bibs&hl=en&cites=8144749991576964205,1,1995
Batch Discovery of Six High-Redshift Supernovae: Developing a New Tool for Cosmology,"S Perlmutter, C Pennypacker, G Goldhaber, S Gabi, A Goobar, B Grossan, ...","Bulletin of the American Astronomical Society 26, 965",https://scholar.google.com/scholar?oi=bibs&hl=en&cites=8192132709202552727,1,1994
A Deep BRX Survey for High Redshift Quasars,"RG McMahon, M Irwin","The Space Distribution of Quasars 21, 391",https://scholar.google.com/scholar?oi=bibs&hl=en&cites=9315094353450670859,1,1991
A Search for “Young Galaxies”,"R McMahon, R Terlevich, C Hazard, M Irwin, J Melnick","Astronomy with Schmidt-Type Telescopes, 395-396",https://scholar.google.com/scholar?oi=bibs&hl=en&cites=9014310070466033273,1,1984
The STRong lensing Insights into the Dark Energy Survey (STRIDES) 2017/2018 follow-up campaign: Discovery of 10 lensed quasars and 10 quasar pairs,"C Lemon, MW Auger, R McMahon, T Anguita, Y Apostolovski, GCF Chen, ...",arXiv preprint arXiv:1912.09133,,0,2019
X-ray properties of z≳ 6.5 quasars,"E Pons, RG McMahon, M Banerji, SL Reed","Monthly Notices of the Royal Astronomical Society 491 (3), 3884-3890",,0,2019
Catalogues of active galactic nuclei from ,"Y Shu, SE Koposov, NW Evans, V Belokurov, RG McMahon, MW Auger, ...","Monthly Notices of the Royal Astronomical Society 489 (4), 4741-4759",,0,2019
"VizieR Online Data Catalog: griz light curves of 15 DES quasars (Mudd+, 2018)","D Mudd, P Martini, Y Zu, C Kochanek, BM Peterson, R Kessler, TM Davis, ...",VizieR Online Data Catalog 186,,0,2019
"National Races: Transnational Power Struggles in the Sciences and Politics of Human Diversity, 1840-1945",R McMahon,Critical Studies in the Histor,,0,2019
Transnational Actors and Stories of European Integration: Clash of Narratives,"W Kaiser, R McMahon",Routledge,,0,2019
"VizieR Online Data Catalog: SDSS and DES long-term extreme variability QSOs (Rumbaugh+, 2018)","N Rumbaugh, Y Shen, E Morganson, X Liu, M Banerji, RG McMahon, ...",VizieR Online Data Catalog 185,,0,2018
Gravitationally lensed quasars in ,"CA Lemon, MW Auger, RG McMahon",arXiv preprint arXiv:1810.04480,,0,2018
"VizieR Online Data Catalog: CUBA-2 Cosmology Legacy Survey (Geach+, 2017)","JE Geach, JS Dunlop, M Halpern, I Smail, P van der Werf, DM Alexander, ...",VizieR Online Data Catalog 746,,0,2018
4MOST: the 4-metre multi-object spectroscopic telescope project at final design review (Conference Presentation),"RS de Jong, SC Barden, O Bellido-Tirado, JG Brynnel, S Frey, ...","Ground-based and Airborne Instrumentation for Astronomy VII 10702, 107021D",,0,2018
"VizieR Online Data Catalog: Counterpart of GW170817. I. DECam obs.(Soares-Santos+, 2017)","M Soares-Santos, DE Holz, J Annis, R Chornock, K Herner, E Berger, ...",VizieR Online Data Catalog 184,,0,2018
VizieR Online Data Catalog: R-band light curves of DES J0408-5359 (Courbin+ 2018),"F Courbin, V Bonvin, E Buckley-Geer, CD Fassnacht, J Frieman, H Lin, ...",VizieR Online Data Catalog 360,,0,2017
A gravitational-wave standard siren measurement of the Hubble constant,"P Ajith, B Allen, G Allen, A Allocca, PA Altin, A Amato, A Ananyeva, ...",Nature Publishing Group,,0,2017
"VizieR Online Data Catalog: OzDES DR1 (Childress+, 2017)","MJ Childress, C Lidman, TM Davis, BE Tucker, J Asorey, F Yuan, ...",VizieR Online Data Catalog 747,,0,2017
BRI1202–0725 & BRI1335–0417,"GC Jones, CL Carilli, E Momjian, J Wagg, DA Riechers, F Walter, ...",arXiv preprint arXiv:1607.06755,,0,2016
"VizieR Online Data Catalog: VISTA-VHS (MOVIS) minor planets NIR photometry (Popescu+, 2016)","M Popescu, J Licandro, D Morate, DA Nedelcu, R Rebolo, RG McMahon, ...",VizieR Online Data Catalog 359,,0,2016
Race Classifiers and Anthropologists,R McMahon,"The Races of Europe, 19-92",,0,2016
The Irish Dilemma: Nineteenth-Century Science and Celtic Identity,R McMahon,"The Races of Europe, 247-285",,0,2016
Poland: Scientific Independence and Nordicism,R McMahon,"The Races of Europe, 287-324",,0,2016
"European Race Classifications: Anthropology, Ethnicity and Politics",R McMahon,"The Races of Europe, 169-242",,0,2016
Introduction: Rediscovering a Lost Science,R McMahon,"The Races of Europe, 1-16",,0,2016
Between International Science and Nationalism: Interwar Romanian Race Science,R McMahon,"The Races of Europe, 325-361",,0,2016
