Title,Authors,Platform,Cited_url,Cited_count,Year
Effects of a one-year physical activity program on serum C-terminal Agrin Fragment (CAF) concentrations among mobility-limited older adults,"I Bondoc, SK Cochrane, TS Church, P Dahinden, S Hettwer, FC Hsu, ...","The journal of nutrition, health & aging 19 (9), 922-927",https://scholar.google.com/scholar?oi=bibs&hl=en&cites=14423012203164548504,6,2015
Antiviral prescribing by office-based physicians during the 2009 H1N1 pandemic,"AL Hersh, RS Stafford","Annals of internal medicine 154 (1), 74",https://scholar.google.com/scholar?oi=bibs&hl=en&cites=3567999665860274376,6,2011
Importance of distinguishing supported and unsupported off-label drug use,"SM Walton, GT Schumock, GC Alexander, D Meltzer, RS Stafford","Archives of internal medicine 170 (7), 657-658",https://scholar.google.com/scholar?oi=bibs&hl=en&cites=9759183117137276635,6,2010
Is it a Pest?: Introduced and Naturalised Marine Animal Species of Torres Strait Northern Australia,"H Stafford, RC Willan",Queensland Department of Primary Industries and Fisheries,https://scholar.google.com/scholar?oi=bibs&hl=en&cites=12461882354147363011,6,2007
Efficacy of treatments against internal biofouling in small vessels,"KM Neil, H Stafford",Queensland Department of Primary Industries and Fisheries and CRC Reef …,https://scholar.google.com/scholar?oi=bibs&hl=en&cites=11156451157401503694,6,2005
Port surveys for non-indigenous species- the benefits of taxonomic networks,"KM Neil, H Stafford, PA Hutchings","Proceedings of the Institute of Marine Engineering, Science and technology …",https://scholar.google.com/scholar?oi=bibs&hl=en&cites=4250357372008225086,6,2004
Life expectancy in hemophilia,"RS Stafford, M Hegewald, C Haag, L Wolff, E Lovrien","Clinical Research 28 (1), A103-A103",https://scholar.google.com/scholar?oi=bibs&hl=en&cites=7093892343352538600,6,1980
"& Fullerton, HJ (2014)","AS Go, D Mozaffarian, VL Roger, EJ Benjamin, JD Berry, MJ Blaha","Heart disease and stroke statistics-2014 update. Circulation 129 (3), 143-152",https://scholar.google.com/scholar?oi=bibs&hl=en&cites=3455670310778849352,6,0
Social participation modifies the effect of a structured physical activity program on major mobility disability among older adults: Results from the LIFE study,"DB Corbett, WJ Rejeski, C Tudor-Locke, NW Glynn, SB Kritchevsky, ...","The Journals of Gerontology: Series B 73 (8), 1501-1513",https://scholar.google.com/scholar?oi=bibs&hl=en&cites=940058064463987100,5,2017
Effect of structured physical activity on respiratory outcomes in sedentary elderly adults with mobility limitations,"CA Vaz Fragoso, DP Beavers, SD Anton, CK Liu, MM McDermott, ...","Journal of the American Geriatrics Society 64 (3), 501-509",https://scholar.google.com/scholar?oi=bibs&hl=en&cites=18280682967265634965,5,2016
Developing evidence-based research priorities for off-label drug use,"SM Walton, GT Schumock, KV Lee, GC Alexander, D Meltzer, RS Stafford",Effective Health Care Research Report 12,https://scholar.google.com/scholar?oi=bibs&hl=en&cites=3913282891357084365,5,2009
Modelling the ability of risk adjusters to reduce adverse selection in managed care,"RS Stafford, D Li, RB Davis, LI Iezzoni","Applied health economics and health policy 3 (2), 107-114",https://scholar.google.com/scholar?oi=bibs&hl=en&cites=11922240635484831866,5,2004
Flora and fauna survey: Cairns Port Authority ocean disposal site,"KM Neil, H Stafford, C Rose, R Thomas",CRC Reef Research Centre and Queensland Department of Primary Industries …,https://scholar.google.com/scholar?oi=bibs&hl=en&cites=9242835883661084991,5,2003
Port Baseline Surveys for Introduced Marine Pests: the Port of Cairns,"KM Neil, H Stafford, MA Rasheed, RC Coles, A Weibkin","CRC-Reef Research Centre, Queensland Department of Primary Industries, and …",https://scholar.google.com/scholar?oi=bibs&hl=en&cites=15675211559494047673,5,2003
Erythromycin-resistant group A streptococci,"ST Shulman, R Tanz, W Kabat","The New England journal of medicine 347 (8), 614-615",https://scholar.google.com/scholar?oi=bibs&hl=en&cites=2133461419784742977,5,2002
Antibiotic Treatment of Adults With Sore Throat—Reply,"JA Linder, RS Stafford","JAMA 286 (23), 2942-2943",https://scholar.google.com/scholar?oi=bibs&hl=en&cites=14380153277986983160,5,2001
"Stafford RS, O'Leary MP, Barry MJ",MM Collins,"How common is prostatitis, 1224-1228",https://scholar.google.com/scholar?oi=bibs&hl=en&cites=2041566821587897727,5,0
A trial of inpatient indication based prescribing during computerized order entry with medications commonly used off-label. Appl Clin Inform. 2011; 2 (1): 94–103. doi: 10.4338,"SM Walton, WL Galanter, H Rosencranz, D Meltzer, RS Stafford, F Tiryaki, ...",A trial of inpatient indication based prescribing during comput-erized order …,https://scholar.google.com/scholar?oi=bibs&hl=en&cites=5395616468723897272,4,2017
"de FS, Despres JP, Fullerton HJ, Howard VJ, Huffman MD, Isasi CR, Jimenez MC, Judd SE, Kissela BM, Lichtman JH, Lisabeth LD, Liu S, Mackey RH, Magid DJ, McGuire DK, Mohler ER …","D Mozaffarian, EJ Benjamin, AS Go, DK Arnett, MJ Blaha, M Cushman, ...",Heart disease and stroke statistics-2016 update: a report from the American …,https://scholar.google.com/scholar?oi=bibs&hl=en&cites=7802538471345752125,4,2016
Off-Label Use of Recombinant Factor VIIa in United States Hospitals: 2000–2008,"AC Logan, V Yank, RS Stafford","Annals of internal medicine 154 (8), 516",https://scholar.google.com/scholar?oi=bibs&hl=en&cites=14588128922105214793,4,2011
Coffee intake and glucose homeostasis: is there a role for body iron?,"TP Tuomainen, A Lagundoye, S Voutilainen","Archives of internal medicine 170 (15), 1400-1401",https://scholar.google.com/scholar?oi=bibs&hl=en&cites=2045544028461846964,4,2010
On “new cardiovascular drugs: patterns of use and association with non-drug health expenditures”,FR Lichtenberg,"INQUIRY: The Journal of Health Care Organization, Provision, and Financing …",https://scholar.google.com/scholar?oi=bibs&hl=en&cites=17281393631262683476,4,2006
"National trends in antihypertensive prescribing patterns, 1990-2002","RS Stafford, SN Finkelstein, IM Cockburn, CD Furberg, T Alehegn","JOURNAL OF GENERAL INTERNAL MEDICINE 18, 157-157",https://scholar.google.com/scholar?oi=bibs&hl=en&cites=13513219996285559214,4,2003
Symptoms and chronic prostatitis: Results of a national survey of physician visits.,"MM Collins, RS Stafford, MP O'Leary, MJ Barry","JOURNAL OF UROLOGY 159 (5), 270-270",https://scholar.google.com/scholar?oi=bibs&hl=en&cites=8673799842036880246,4,1998
"Leary MP, et a1","MM Collins, RS Stafford","How common is prostatitis, 1224-1228",https://scholar.google.com/scholar?oi=bibs&hl=en&cites=14034753191521560234,4,0
A practical approach to low-dose aspirin for primary prevention,"KF Chiang, SJ Shah, RS Stafford","Jama 322 (4), 301-302",https://scholar.google.com/scholar?oi=bibs&hl=en&cites=16843087794603422026,3,2019
"Biomarkers, menopausal hormone therapy and risk of venous thrombosis: The Women's Health Initiative","M Cushman, JC Larson, FR Rosendaal, SR Heckbert, JD Curb, ...","Research and practice in thrombosis and haemostasis 2 (2), 310-319",https://scholar.google.com/scholar?oi=bibs&hl=en&cites=10246645211365693616,3,2018
The association between insulin resistance and atrial fibrillation: A cross‐sectional analysis from SPRINT (Systolic Blood Pressure Intervention Trial),"ME Cho, TE Craven, AK Cheung, SP Glasser, M Rahman, EZ Soliman, ...","The Journal of Clinical Hypertension 19 (11), 1152-1161",https://scholar.google.com/scholar?oi=bibs&hl=en&cites=1547684642656019995,3,2017
Antihypertensive use and the effect of a physical activity intervention in the prevention of major mobility disability among older adults: The LIFE study,"TW Buford, ME Miller, TS Church, TM Gill, R Henderson, FC Hsu, ...",Journals of Gerontology Series A: Biomedical Sciences and Medical Sciences …,https://scholar.google.com/scholar?oi=bibs&hl=en&cites=5802589117041892168,3,2016
Quality of medical management in coronary artery disease,"O Al Shammeri, RS Stafford, A Alzenaidi, B Al-Hutaly, A Abdulmonem","Annals of Saudi medicine 34 (6), 488-493",https://scholar.google.com/scholar?oi=bibs&hl=en&cites=5948990698009175823,3,2014
Combined reduced forced expiratory volume in 1 second (FEV1) and peripheral artery disease in sedentary elders with functional limitations,"CAV Fragoso, FC Hsu, T Brinkley, T Church, CK Liu, T Manini, ...","Journal of the American Medical Directors Association 15 (9), 665-670",https://scholar.google.com/scholar?oi=bibs&hl=en&cites=3647604618701781739,3,2014
Promoting culturally targeted chronic disease prevention research through an adapted participatory research approach: The Qassim-Stanford Universities project,"SJ Winter, AC King, RS Stafford, MA Winkleby, WL Haskell, JW Farquhar","Translational behavioral medicine 1 (2), 289-298",https://scholar.google.com/scholar?oi=bibs&hl=en&cites=17087356747230715943,3,2011
Continued suboptimal use of aspirin in patients at high and moderate risk for CHD events,"R Stafford, J Ma",Journal of General Internal Medicine 19,https://scholar.google.com/scholar?oi=bibs&hl=en&cites=2783455154030770317,3,2004
The potential of pill splitting to achieve cost savings-In reply,"RS Stafford, DC Radley","American Journal of Managed Care 8 (11), 925-926",https://scholar.google.com/scholar?oi=bibs&hl=en&cites=8520295539720806035,3,2002
Secondary prevention of coronary artery disease: lipid management as a priority for improvement,"JL Schnipper, RS Stafford","management 2, 3",https://scholar.google.com/scholar?oi=bibs&hl=en&cites=7818755587500696416,3,2002
"Source of hospital payment as a determinant of cesarean section use, California, 1986",RS Stafford,,https://scholar.google.com/scholar?oi=bibs&hl=en&cites=5657523013024461262,3,1988
"Patterns of systolic blood pressure control in the United States, 2016","SJ Shah, RS Stafford","Journal of general internal medicine 33 (8), 1224-1226",https://scholar.google.com/scholar?oi=bibs&hl=en&cites=9892088347728617117,2,2018
Is Clinical Decision Support the Missing Link in Prevention?: Comment on “Shared Electronic Vascular Risk Decision Support in Primary Care”,"RS Stafford, MJ Romano","Archives of internal medicine 171 (19), 1745-1746",https://scholar.google.com/scholar?oi=bibs&hl=en&cites=10178259466238581399,2,2011
"National trends in outpatient asthma treatment, 1997-2009","A Higashi, S Zhu, R Stafford, GC Alexander","PHARMACOEPIDEMIOLOGY AND DRUG SAFETY 20, S99-S99","https://scholar.google.com/scholar?oi=bibs&hl=en&cites=10507574902117992488,15046292758579642474",2,2011
The Feasibility and Value of New Measures Showing Patterns of Quality for Patients With 3 Chronic Conditions,"SM Davidson, M Shwartz, RS Stafford","The Journal of ambulatory care management 31 (1), 37-51",https://scholar.google.com/scholar?oi=bibs&hl=en&cites=9449315530695996552,2,2008
IARC Monographs programme on the evaluation of carcinogenic risks to humans,"M Arbyn, X Bosch, J Cuzick, L Denny, D Galloway, AR Giuliano, ...","IARC Monographs on the Evaluation of Carcinogenic Risks to Humans 90, 9-31",https://scholar.google.com/scholar?oi=bibs&hl=en&cites=6648545445865700332,2,2007
"Case-Management for Multiple CHD Risk Factors is Effective in a Low-Income, Ethnically Diverse Population","RS Stafford, J Ma, KV Lee, K Berra","Circulation 114 (suppl_18), II_425-II_425",https://scholar.google.com/scholar?oi=bibs&hl=en&cites=12136079402762109461,2,2006
Are evidence-based cardiovascular prevention therapies being used? A review of aspirin and statin therapies,"J Ma, V Monti, RS Stafford","Prevention and Control 1 (4), 285-295",https://scholar.google.com/scholar?oi=bibs&hl=en&cites=9149604694914569924,2,2005
Port of Thursday Island–Baseline Surveys For Introduced Marine Pests,"KM Neil, H Stafford",Preliminary Report of the March,https://scholar.google.com/scholar?oi=bibs&hl=en&cites=6821783907333716611,2,2004
Adherence to evidence-based therapy: some practical problems,AK Ghosh,"Archives of internal medicine 162 (11), 1310-1311",https://scholar.google.com/scholar?oi=bibs&hl=en&cites=12955255569418538507,2,2002
National trends in depression diagnosis and antidepressant use in primary care.,"P Pirraglia, R Stafford, D Singer",Journal of General Internal Medicine 17,https://scholar.google.com/scholar?oi=bibs&hl=en&cites=669660435227087843,2,2002
The diagnosis and treatment of cough.,"HA Thiadens, MP Springer, DS Postma","The New England journal of medicine 344 (14), 1097; author reply 1098","https://scholar.google.com/scholar?oi=bibs&hl=en&cites=9055659065561301613,3643798674166727450",2,2001
Certain cardiac risk factors predict risk factor interventions and influence communication between physicians and patients,"S Mora, RS Stafford, RC Pasternak","American Journal of Cardiology 86 (7), 783-785",https://scholar.google.com/scholar?oi=bibs&hl=en&cites=6392507891674839429,2,2000
The duration of ambulatory visits to physicians,"M David Blumenthal, L Culpepper, R Stafford, B Starfield",The Journal of family practice 48 (4),https://scholar.google.com/scholar?oi=bibs&hl=en&cites=3148581942400529448,2,1999
Low rates of warfarin use in atrial fibrillation among US physicians,"RS Stafford, D Singer","Circulation 93 (3), P61-P61",https://scholar.google.com/scholar?oi=bibs&hl=en&cites=5135479936719890853,2,1996
Tectonic Shifts in the Health Information Economy,"D Radley, S Finkelstein, R Stafford, G Alexopoulos, J Streim, D Carpenter, ...","Sci Med 39, 39-52",https://scholar.google.com/scholar?oi=bibs&hl=en&cites=5578126163286324351,2,1994
LOCALIZATION OF THE GENE FOR I-CELL DISEASE (MUCOLIPIDOSIS-II),"J Vidgoff, S Rowe, R Stafford, NRM Buist, EW Lovrien","AMERICAN JOURNAL OF HUMAN GENETICS 34 (6), A64-A64",https://scholar.google.com/scholar?oi=bibs&hl=en&cites=8170477860753245592,2,1982
Heart Disease and Stroke Statistics–2009,D Lloyd-Jones,Update. ahajournals. org [accessed,https://scholar.google.com/scholar?oi=bibs&hl=en&cites=4582012254298443241,2,0
"Employment Cost Index, Historical Listing–Volume V: Continuous Occupational and Industry Series: September 1975-December 2017. Table 4: employment cost index for total …","EJ Benjamin, P Muntner, A Alonso, MS Bittencourt, CW Callaway, ...","Circulation 139 (10), e56-e528",https://scholar.google.com/scholar?oi=bibs&hl=en&cites=11540067286585277315,1,2019
The Effect of a Behavioral Weight-Loss Intervention on Depressive Symptoms Among Latino Immigrants in a Randomized Controlled Trial,"SC Figueroa, RS Stafford, CA Heaney, LG Rosas","Journal of immigrant and minority health 20 (5), 1182-1189",https://scholar.google.com/scholar?oi=bibs&hl=en&cites=7264726952374456066,1,2018
"New high blood pressure guidelines: back on track with lower treatment goals, but implementation challenges abound",RS Stafford,American journal of preventive medicine,https://scholar.google.com/scholar?oi=bibs&hl=en&cites=3057459095137225393,1,2018
"The Effect of Chronic Kidney Disease on a Physical Activity Intervention: Impact on Physical Function, Adherence, and Safety","CK Liu, J Milton, FC Hsu, KM Beavers, V Yank, T Church, JD Shegog, ...",Journal of clinical nephrology and renal care 3 (1),https://scholar.google.com/scholar?oi=bibs&hl=en&cites=4970208665330522486,1,2017
National use of testosterone replacement therapy: annual trends and response to recent evidence,"E Lucas, M Daubresse, S Singh, R Stafford, C Alexander","Pharmacoepidemiology and Drug Safety 24, 113-114",https://scholar.google.com/scholar?oi=bibs&hl=en&cites=16517491432443174117,1,2015
Association of age and packed red blood cell transfusion to 1‐year survival–an observational study of ICU patients,"SC Mudumbai, R Cronkite, KU Hu, PA Heidenreich, C Gonzalez, ...","Transfusion Medicine 23 (4), 231-237",https://scholar.google.com/scholar?oi=bibs&hl=en&cites=11162825389683532217,1,2013
"Trends in buprenorphine and methadone sales and utilization in the United States, 1997-2012","LW Turner, S Kruszewski, R Mojtabai, D Webster, S Nesbit, RS Stafford, ...","Value in Health 16 (3), A56",https://scholar.google.com/scholar?oi=bibs&hl=en&cites=6785333630240226189,1,2013
"National trends in oral anticoagulant use in the United States, 2007-2011","R Kornfield, K Kirley, DM Qato, RS Stafford, GC Alexander","Journal of General Internal Medicine 27, S252-S252",https://scholar.google.com/scholar?oi=bibs&hl=en&cites=4393336210475016277,1,2012
Translating the Diabetes Prevention Program (DPP) into primary care: a randomized trial,"V Yank, L Xiao, RS Stafford, LG Rosas, SR Wilson, J Ma","Diabetes 61, A515-A515",https://scholar.google.com/scholar?oi=bibs&hl=en&cites=9864579397411422479,1,2012
Computerized interventions to obtain indication information for inpatient prescriptions: a pilot study in drugs frequently used off-label,"S Walton, W Galanter, F Tiryaki, R Stafford",Value in Health 13 (3),https://scholar.google.com/scholar?oi=bibs&hl=en&cites=4980318543292182509,1,2010
Combined estrogen-progestogen menopausal therapy,"GL Anderson, P Autier, V Beral, MC Bosland, E Fernández, SZ Haslam, ...","IARC Monographs on the Evaluation of Carcinogenic Risks to Humans, 205-372",https://scholar.google.com/scholar?oi=bibs&hl=en&cites=15040055242017674332,1,2007
Is it a Pest,"H Stafford, RC Willan",Introduced and naturalised marine animal species of Torres Strait Northern …,https://scholar.google.com/scholar?oi=bibs&hl=en&cites=9957487680107663042,1,2007
National trends in statin use by CHD risk category.,"J Ma, RS Stafford, NL Sehgal","CIRCULATION 109 (7), E111-E111",https://scholar.google.com/scholar?oi=bibs&hl=en&cites=7137632102703434842,1,2004
Racial/ethnic differences in diabetes outcomes: the role of socioeconomic status and medical care,"R STAFFORD, K CHOUDHRY, S LAUFER",Diabetes 51,https://scholar.google.com/scholar?oi=bibs&hl=en&cites=8379785710519757617,1,2002
Antibiotic Treatment of Adults With Sore Throat,"K Iwata, CM Blum","JAMA 286 (23), 2942-2943",https://scholar.google.com/scholar?oi=bibs&hl=en&cites=1384588945182954744,1,2001
Cancer among spouses: review of 195 couples,TW Beer,Cancer: Interdisciplinary International Journal of the American Cancer …,https://scholar.google.com/scholar?oi=bibs&hl=en&cites=15977305703258153877,1,1998
"Trends in antihypertensive drug advertising, 1985-1995","TJ Wang, JC Ausiello, RS Stafford","Circulation 97 (8), 825-825",https://scholar.google.com/scholar?oi=bibs&hl=en&cites=8197902798975600178,1,1998
Cholesterol management practices in the United States,"RS Stafford, D Blumenthal, RC Pasternak","CARDIOLOGY REVIEW-NEW YORK- 15, 29-36",https://scholar.google.com/scholar?oi=bibs&hl=en&cites=18367941182077031210,1,1998
"Treadmill testing: Impact of gender, race, and insurance on test ordering","MC Cohen, RS Stafford","CIRCULATION 96 (8), 2574-2574",https://scholar.google.com/scholar?oi=bibs&hl=en&cites=17274186481365001375,1,1997
Underuse of warfarin in atrial fibrillation-a persistent national pattern,"RS Stafford, DE Singer","CARDIOLOGY REVIEW-NEW YORK- 14, 32-35",https://scholar.google.com/scholar?oi=bibs&hl=en&cites=8793897383770962885,1,1997
NATIONAL ESTIMATES OF CARDIOVASCULAR-DISEASE PREVENTION PRACTICES IN THE UNITED-STATES,"R STAFFORD, D Blumenthal","Circulation 90 (4), 100-100",https://scholar.google.com/scholar?oi=bibs&hl=en&cites=10349839930286619040,1,1994
HIV Infection Among Patients in US Acute Care Hospitals,"RS JANSSEN, MEST LOUIS, GA SATTEN, SE CRITCHLEY, ...","Survey of Anesthesiology 37 (1), 46",https://scholar.google.com/scholar?oi=bibs&hl=en&cites=2461453142332818046,1,1993
Cesarean Section Rates,CA Peach,"JAMA 265 (5), 595-595",https://scholar.google.com/scholar?oi=bibs&hl=en&cites=5426029411799124292,1,1991
Antidiabetic medication use in patients with type 2 diabetes and chronic kidney disease,"JJ Rhee, J Han, ME Montez-Rath, SH Kim, MR Cullen, RS Stafford, ...","Journal of Diabetes and its Complications 33 (11), 107423",,0,2019
"A Practical Approach to Low-Dose Aspirin for Primary Prevention (vol 322, pg 301, 2019)","KF Chiang, SJ Shah, RS Stafford","JAMA-JOURNAL OF THE AMERICAN MEDICAL ASSOCIATION 322 (8), 785-785",,0,2019
Visual impairment associated with myopia among school children in China,"C Jan, R Xu, D Luo, X Xiong, Y Song, J Ma, R Stafford","Investigative Ophthalmology & Visual Science 60 (9), 6456-6456",,0,2019
Perioperative Opioid Prescribing Patterns and Readmissions After Total Knee Arthroplasty in a National Cohort of Veterans Health Administration Patients,"SC Mudumbai, P Chung, N Nguyen, B Harris, JD Clark, TH Wagner, ...",Pain Medicine,,0,2019
Association of Visual Impairment With Economic Development Among Chinese Schoolchildren,"C Jan, R Xu, D Luo, X Xiong, Y Song, J Ma, RS Stafford","JAMA pediatrics, e190914-e190914",,0,2019
Off-label prescription: experience is a gloomy lantern that does not even illuminate its bearer. Author response,A Ladanie,"Journal of clinical epidemiology 101, 127",,0,2018
"2017 ACC/AHA/AAPA/ABC/ACPM/AGS/APhA/ASH/ASPC/NMA/PCNA Guideline for the Prevention, Detection, Evaluation, and Management of High Blood Pressure in Adults: Executive Summary: A …","PK Whelton, RM Carey, WS Aronow, DE Casey Jr, KJ Collins, ...","JOURNAL OF THE AMERICAN COLLEGE OF CARDIOLOGY 71 (19), 2273-2275",,0,2018
UNDERSTANDING HISTORICAL TRAUMA AMONG INDIGENOUS ADULTS AT RISK FOR DIABETES TO INFORM BEHAVIORAL INTERVENTIONS,"LC Garcia, JJ Vasquez, RS Stafford, I Sallas, AE Kendrick, L Rosas","ANNALS OF BEHAVIORAL MEDICINE 52, S219-S219",,0,2018
"Quality of Pharmacologic Care by Physicians, Nurse Practitioners and Physician Assistants in the United States","IB Murimi, S Jiao, RS Stafford, R Mojtabai, GC Alexander","PHARMACOEPIDEMIOLOGY AND DRUG SAFETY 26, 18-18",,0,2017
"QUALITY OF PHARMACOLOGIC CARE BY PHYSICIANS, NURSE PRACTITIONERS AND PHYSICIAN ASSISTANTS IN THE UNITED STATES","S Jiao, I Murimi, RS Stafford, R Mojtabai, GC Alexander","JOURNAL OF GENERAL INTERNAL MEDICINE 32, S296-S296",,0,2017
What are Archives?,RE Bryan,,,0,2017
US Dietary Recommendations,RS Stafford,"Jama 316 (2), 224-225",,0,2016
Forecasting the future of cardiovascular disease in the United States: a policy statement from the American Heart Association.,"D Mozaffarian, EJ Benjamin, AS Go, DK Arnett, MJ Blaha, M Cushman, ...","Circulation 133 (4), e38-e360",,0,2016
A Physical Activity Intervention Improves 400-Meter Walking Velocity as Compared to a Successful Aging Intervention in Patients with Peripheral Artery Disease: The LIFE Study …,"M McDermott, D Bonds, T Buford, T Church, J Dodson, R Fielding, ...","Circulation 130 (suppl_2), A19294-A19294",,0,2014
Abstract 11744,"M McDermott, M Criqui, K Domanchuk, J Guralnik, M Kibbe, K Liu, Y Liao, ...",Circulation 130 (Suppl_2),,0,2014
Abstract 20440,"A Newman, J Dodson, T Church, D Bonds, T Buford, R Fielding, ...",Circulation 130 (Suppl_2),,0,2014
EFFECTIVENESS OF PHYSICAL ACTIVITY ON IMPROVING A PHYSICAL PERFORMANCE MEASURE IN ELDERS WITH CHRONIC KIDNEY DISEASE: THE LIFESTYLE INTERVENTIONS AND INDEPENDENCE ELDERS PILOT …,"C Liu, F Hsu, KM Beavers, V Yank, RS Stafford, B Nicklas, D Weiner, ...","GERONTOLOGIST 53, 328-328",,0,2013
"TRENDS IN THE AMBULATORY DIAGNOSIS AND TREATMENT OF NON-MALIGNANT PAIN IN THE UNITED STATES, 2000-2010","GC Alexander, D Matthew, HY Chang, Y Yu, S Viswanathan, N Shah, ...","JOURNAL OF GENERAL INTERNAL MEDICINE 28, S228-S229",,0,2013
Abstract P311: Antihypertensive Medication Prescribing Varies by Race/Ethnicity Among US Patients with Chronic Kidney Disease,"V Yank, RS Stafford","Circulation 127 (suppl_12), AP311-AP311",,0,2013
Summary and Discussion,X Ying,"A Study of the Stability of Contemporary Rural Chinese Society, 185-192",,0,2013
"The Availability of Free Samples of Acne Medications Increases the Prescription of more Expensive, Branded Drugs in Lieu of Generic Alternatives","M Hurley, R Stafford, A Lane",Pediatric Dermatology 29 (5),,0,2012
Ace Inhibitor Use by Older Adults is Associated with Improved Functional Responses to Exercise,"TW Buford, TM Manini, FC Hsu, M Cesari, SD Anton, S Nayfield, ...","Circulation 125 (suppl_10), A037-A037",,0,2012
Abstract P374: Short-term Weight Loss Patterns and Physical and Psychological Predictors within a Randomized Trial,"V Yank, L Xiao, L Goldman Rosas, RS Stafford, S Wilson, Q Huang, J Ma","Circulation 125 (suppl_10), AP374-AP374",,0,2012
Abstract P374,"V Yank, L Xiao, LG Rosas, R Stafford, S Wilson, Q Huang, J Ma",Circulation 125 (10_MeetingAbstracts),,0,2012
Abstract 037,"T Buford, T Manini, FC Hsu, M Cesari, S Anton, S Nayfield, R Stafford, ...",Circulation 125 (10_MeetingAbstracts),,0,2012
An employer-Based Online Tool for providing Appropriate Aspirin Use Advice,"RS Stafford, S Thiyagarajan, AK Fields, LG Rosas","Primary Prevention Insights 3, 1",,0,2012
Off-Label Use of Recombinant Factor VIIa,"V Yank, AC Logan, RS Stafford","Annals of Internal Medicine 155 (5), 338-339",,0,2011
"Electronic Health Records, the PINNACLE Registry, and Quality Care—Reply","M Romano, R Stafford","Archives of Internal Medicine 171 (10), 941-954",,0,2011
"NATIONAL TRENDS IN OUTPATIENT ASTHMA TREATMENT, 1997-2009","GC Alexander, A Higashi, S Zhu, R Stafford","JOURNAL OF GENERAL INTERNAL MEDICINE 26, S254-S254",,0,2011
COMMUNITY HEALTH CENTERS OUTPERFORM PRIVATE PHYSICIAN OFFICES ON AMBULATORY CARE PERFORMANCE MEASURES,"LE Goldman, PW Chu, MJ Romano, RS Stafford","JOURNAL OF GENERAL INTERNAL MEDICINE 26, S179-S180",,0,2011
"Electronic Health Records, the PINNACLE Registry, and Quality Care","M Romano, R Stafford","Archives of Internal Medicine 171 (10), 949",,0,2011
Outpatient Disparities in Recommended Therapy for Congestive Heart Failure,"D Banerjee, RS Stafford","Journal of Cardiac Failure 16 (8), S79",,0,2010
PHP13 MEDICARE PART D AND ITS IMPACT ON PRESCRIPTION DRUG USE,"N Khan, R Kaestner","Value in Health 13 (3), A83",,0,2010
