Title,Authors,Platform,Cited_url,Cited_count,Year
PHP31 COMPUTERIZED INTERVENTIONS TO OBTAIN INDICATION INFORMATION FOR INPATIENT PRESCRIPTIONS: A PILOT STUDY IN DRUGS FREQUENTLY USED OFF-LABEL,"S Walton, W Galanter, F Tiryaki, RS Stafford","Value in Health 13 (3), A87",,0,2010
Study Abstraction Forms,"V Yank, CV Tuohy, AC Logan, DM Bravata, K Staudenmayer, R Eisenhut, ...",Agency for Healthcare Research and Quality (US),,0,2010
Strength of Evidence and Applicability Assessment Forms,"V Yank, CV Tuohy, AC Logan, DM Bravata, K Staudenmayer, R Eisenhut, ...",Agency for Healthcare Research and Quality (US),,0,2010
Search Strategies,"V Yank, CV Tuohy, AC Logan, DM Bravata, K Staudenmayer, R Eisenhut, ...",Agency for Healthcare Research and Quality (US),,0,2010
Future Research,"V Yank, CV Tuohy, AC Logan, DM Bravata, K Staudenmayer, R Eisenhut, ...",Agency for Healthcare Research and Quality (US),,0,2010
"Additional Analyses, Tables, and Figures","V Yank, CV Tuohy, AC Logan, DM Bravata, K Staudenmayer, R Eisenhut, ...",Agency for Healthcare Research and Quality (US),,0,2010
Appendixes,"V Yank, CV Tuohy, AC Logan, DM Bravata, K Staudenmayer, R Eisenhut, ...",Agency for Healthcare Research and Quality (US),,0,2010
List of Excluded Studies,"TJ Wilt, A Shaukat, T Shamliyan, BC Taylor, R MacDonald, J Tacklind, ...",Lactose Intolerance and Health,,0,2010
www. archinternmed. com/instructions,"PM Ho, C Zeng, HM Tavel, JV Selby, PJ O’Connor, KL Margolis, DJ Magid, ...",,,0,2010
www. archinternmed. com/instructions,"MW Rabow, AK Smith, JL Braun, DE Weissman, BA Golomb, R Yaghmai, ...",,,0,2010
Off-Label Use of Recombinant Factor VIIa in United States Hospitals: 2000-2008.,"AC Logan, V Yank, RS Stafford","Blood 114 (22), 67-67",,0,2009
Comparison of Thromboembolic Event Rates in Randomized Controlled Trials and Observational Studies of Recombinant Factor VIIa for Off-Label Indications.,"V Yank, AC Logan, CV Tuohy, DM Bravata, K Staudenmayer, R Eisenhut, ...","Blood 114 (22), 1403-1403",,0,2009
"PMH8 GROWTH AND DIFFUSION OF ANTIPSYCHOTIC MEDICINES FOR LABELED AND OFF-LABELED USES, 1994–2007","GC Alexander, SA Gallagher, A Mascola, R Moloney, R Stafford","Value in Health 12 (3), A173-A174",,0,2009
"NATIONAL TRENDS IN TREATMENT FOR TYPE 2 DIABETES MELLITUS, 1994-2007","G Alexander, NL Sehgal, RM Moloney, RS Stafford","JOURNAL OF INVESTIGATIVE MEDICINE 57 (3), 554-555",,0,2009
RS3PE.,"SS Stalling, JR Vu, JC English III","J Med 360 (18), 1839-1850",,0,2009
MEDICATIONS OF PROVEN BENEFIT IN CORONARY ARTERY DISEASE: A COMPARISON OF PRACTICE PATTERNS IN WESTERN EUROPE AND THE UNITED STATES,"RS Stafford, GC Alexander, YR Wang","Atherosclerosis Supplements 9 (1), 79",,0,2008
Hypertension Treatment and Control,"J Ma, RS Stafford",,,0,2008
"Coagulation Factors, Postmenopausal Hormone Replacement Therapy and the Risk of Venous Thrombosis: The WHI Clinical Trials of Postmenopausal Hormone Therapy.","M Cushman, J Larson, FR Rosendaal, LS Phillips, BV Howard, JD Curb, ...","Blood 110 (11), 127-127",,0,2007
Comparison of Weight-Loss Diets—Reply,"CD Gardner, RS Stafford, AC King","JAMA 298 (2), 173-175",,0,2007
"Development of a web-based intervention to reduce women's risk for osteoporotic fractures through risk assessment, education, and behavior change","RL Drieling, J Ma, RS Stafford","OSTEOPOROSIS INTERNATIONAL 18, S242-S243",,0,2007
Response to target blood pressure level before antihypertensive class to improve outcomes more quickly in uncomplicated hypertension,"J Ma, KV Lee, RS Stafford","Hypertension 49 (3), e17-e17",,0,2007
"HL086703). Role of the Sponsors: No sponsor or funding source had a role in the design or conduct of the study; collection, management, analysis, or interpretation of the data …","J Ma, L Xiao, RS Stafford","Arch Intern Med 167 (2), 141-147",,0,2007
General remarks,"GL Anderson, P Autier, V Beral, MC Bosland, E Fernández, SZ Haslam, ...","IARC Monographs on the Evaluation of Carcinogenic Risks to Humans, 33-35",,0,2007
Combined estrogen-progestogen contraceptives,"GL Anderson, P Autier, V Beral, MC Bosland, E Fernández, SZ Haslam, ...","IARC Monographs on the Evaluation of Carcinogenic Risks to Humans, 41-202",,0,2007
"as Risk Factors for Heart Disease Mortality in Older Men Robert Clarke, FRCP; Jonathan R. Emberson, PhD; Sarah Parish, DPhil; Alison Palmer, MSc","M Shipley, P Linksted, ED Peterson, OJ Wang, Y Wang, JH Lichtman, ...",,,0,2007
Positive Outcomes Through the Appropriate Use of Off-Label Prescribing—Reply,"RS Stafford, DC Radley, SN Finkelstein","Archives of Internal Medicine 166 (22), 2554-2555",,0,2006
Positive Outcomes Through the Appropriate Use of Off-Label Prescribing—Reply,"RS Stafford, DC Radley, SN Finkelstein","Archives of Internal Medicine 166 (22), 2554-2555",,0,2006
Metabolic Syndrome: Does Definition Determine Prevalence?,"S Alhassan, A Kiazand, RR Balise, RS Stafford, AC King, CD Gardner","Circulation 114 (suppl_18), II_873-II_873",,0,2006
Outpatient treatment and control of hypertension in five European countries and the United States,"Y Wang, G Alexander, RS Stafford","JOURNAL OF GENERAL INTERNAL MEDICINE 21, 93-94",,0,2006
Electronic health record use and the quality of ambulatory care in the United States,"JA Linder, J Ma, DW Bates, B Middleton, RS Stafford","JOURNAL OF GENERAL INTERNAL MEDICINE 21, 49-49",,0,2006
"On"" New cardiovascular drugs: Patterns of use and association with non-drug health expenditures""-Authors' response","GE Miller, JF Moeller, RS Stafford",INQUIRY-THE JOURNAL OF HEALTH CARE ORGANIZATION PROVISION AND FINANCING 43 …,,0,2006
Other studies show aspirin use is high-Authors reply,"RS Stafford, V Monti, J Ma","PLOS MEDICINE 3 (2), 270-270",,0,2006
"Jennifer L. Bright, MPA","RS Stafford, DC Radley, SN Finkelstein",,,0,2006
Changes in antihypertensive prescribing during US outpatient visits for uncomplicated hypertension between 1993 and 2004. Commentary,"BL CARTER, MA JUN, KV LEE, RS STAFFORD",Hypertension 48 (5),,0,2006
Long-term and short-term changes in antihypertensive prescribing by office-based physicians in the United States. Commentary,"TA KOTCHEN, RS STAFFORD, V MONTI, CD FURBERG, MA JUN",Hypertension 48 (2),,0,2006
How well have the diffusion of Cox-2 inhibitors been limited to settings of maximal benefit?,"G Alexander, C Dai, R Stafford","Journal of General Internal Medicine 20, 135-136",,0,2005
"Warfarin Users Treated With Nonselective NSAIDs or COX-2 Inhibitors Marisa Battistella, BScPhm, PharmD; Muhammad M. Mamdami, PharmD, MA, MPH","DN Juurlink, MT Streppel, LR Arends, P van’t Veer, DE Grobbee, ...",,,0,2005
"Depending on Body Mass Index William S. Yancy, Jr, MD, MHS; Maren K. Olsen, PhD; Lesley H. Curtis, PhD; Kevin A. Schulman, MD; Michael S. Cuffe, MD; Eugene Z. Oddone, MD, MHS …","J Plank, A Siebenhofer, A Berghold, K Jeitler, K Horvath, P Mrak, ...",,,0,2005
Traitement estro-progestatif et risque de thrombose veineuse,"M Cushman, LH Kuller, R Prentice, RJ Rodabough, BM Psaty, RS Stafford, ...","JAMA-français 292 (4), 531",,0,2004
Promotion et prescription des traitements hormonaux apres les rapports de l'existence d'un risque par la Women's Health Initiative,"SR Majumdar, EA Almasi, RS Stafford","JAMA-français 292 (4), a17",,0,2004
HEALTH CARE COSTS BEFORE AND AFTER ANTIDEPRESSANT INITIATION,"R Stafford, K O'Leary, S Finkelstein, J Weilburg",Journal of General Internal Medicine 19,,0,2004
PREDICTORS OF THE IMPACT OF CLINICAL TRIAL PUBLICATION ON PHYSICIAN PRESCRIBING PRACTICES,R Stafford,Journal of General Internal Medicine 19,,0,2004
"CHANGES IN NATIONAL PATTERNS OF TREATMENT FOR DIABETES MELLITUS, 1992–2001","N Sehgal, J Ma, R Stafford",Journal of General Internal Medicine 19,,0,2004
National trends in visits and treatment for diabetes mellitus (1990-2002).,"NL Sehgal, S Finkelstein, RS Stafford","CIRCULATION 109 (7), E119-E119",,0,2004
"The cost impact of changing anti-hypertensive medication prescribing, 1990-2002.","RS Stafford, T Alehegn","CIRCULATION 109 (7), E112-E112",,0,2004
Prise d'un traitement hormonal substitutif de la menopause aux Etats-Unis: Tendances annuelles et reactions aux donnees scientifiques recentes,"AL Hersh, ML Stefanick, RS Stafford","JAMA-français 291 (2), 87",,0,2004
"Impact des resultats des essais cliniques sur les profils nationaux de prescription des {alpha}-bloquants, 1996-2002","RS Stafford, CD Furberg, SN Finkelstein, IM Cockburn, T Alehegn, J Ma","JAMA-français 291 (2), a8",,0,2004
ease. Prevention research has covered a lot of distance; we still have a long way to go.,B Stanton,"Health 34 (1), 3-26",,0,2004
Hormone therapy and venous thrombosis: Final results of the Women's Health Initiative trial of estrogen plus progestin.,"M Cushman, LH Kuller, R Prentice, BM Psaty, S Sidney, R Stafford, ...","BLOOD 102 (11), 208A-208A",,0,2003
Mediators of change in a cardiovascular risk factor reduction intervention,"NL Sehgal, B Oliviera, W Haskell, RS Stafford",The 131st Annual Meeting,,0,2003
Antiobesity medication use increasing in the US,RS Stafford,"PharmacoEconomics & Outcomes News 414, 31",,0,2003
"Fluoroquinolone prescribing in the United States, 1995 to 2000.","JA Linder, ES Huang, MA Steinman, R Gonzales, RS Stafford","JOURNAL OF GENERAL INTERNAL MEDICINE 18, 209-210",,0,2003
"National trends in osteoporosis visits and osteoporosis treatment, 1988-2002.","RS Stafford, RL Drieling, AL Hersh","JOURNAL OF GENERAL INTERNAL MEDICINE 18, 305-305",,0,2003
National trends in hormone therapy.,"AL Hersh, RS Stafford","JOURNAL OF GENERAL INTERNAL MEDICINE 18, 301-301",,0,2003
The national impact of ALLHAT results on alpha-blocker prescribing,"RS Stafford, CD Furberg, T Alehegn","CIRCULATION 107 (7), E7031-E7032",,0,2003
Introduced Marine Pests: Pre-and Post-Border Detection and Management Mechanisms,"H Stafford, KM Neil",Coasts & Ports 2003 Australasian Conference: Proceedings of the 16th …,,0,2003
Curriculum in Cardiology,"AD Patel, AE Iskandrian, RS Stafford, IBA Menown, TP Mathew, ...",,,0,2003
Adherence to Evidence-Based Therapy: Some Practical Problems—Reply,"ES Huang, RS Stafford","Archives of Internal Medicine 162 (11), 1310-1311",,0,2002
Socioeconomic and Health Care Access Disparities Affect Glycemic Severity in Urban Diabetes Patients,"M RHEE, C COOK, B BOYD, R PANAYIOTO, K BERKOWITZ, ...","Diabetes 51 (2), A536",,0,2002
SOCIOECONOMIC STATUS AND RACIAL/ETHNIC DIFFERENCES IN DIABETES OUTCOMES,"R Stafford, K Choudhry, S Laufer",Journal of General Internal Medicine 17,,0,2002
National trends in antiarrhythmic and antithrombotic medication use in atrial fibrillation.,"M Fang, R Stafford, J Ruskin, D Singer","Journal of General Internal Medicine 17, 191-192",,0,2002
Is antibiotic use associated with shorter primary care visits for adults with respiratory illnesses?,"J Linder, D Singer, R Stafford",Journal of General Internal Medicine 17,,0,2002
National trends in antiobesity medication use.,"R Stafford, D Radley",Journal of General Internal Medicine 17,,0,2002
PSA testing by age-Reply,"MM Collins, RS Stafford, MJ Barry","JOURNAL OF FAMILY PRACTICE 49 (7), 659-659",,0,2000
PSA TESTING BY AGE,"M Collins, R Stafford, M Barry",The Journal of Family Practice 49 (7),,0,2000
Patterns and variations of hypertension treatment in a capitated insurance plan.,"B Misra, RS Stafford","JOURNAL OF GENERAL INTERNAL MEDICINE 15, 136-136",,0,2000
Secondary prevention of coronary artery disease at a large teaching hospital.,"JL Schinpper, RS Stafford","JOURNAL OF GENERAL INTERNAL MEDICINE 15, 144-145",,0,2000
Examination of antihypertensive polypharmacy predictors from claims data.,"B Misra, RS Stafford","JOURNAL OF GENERAL INTERNAL MEDICINE 15, 136-136",,0,2000
"Clinical Pharmacoeconomics-Patterns and Costs for Hypertension Treatment in the United States Clinical, Lifestyle and Socioeconomic Predictors from the 1987 National Medical …","C Huttin, JF Moeller, RS Stafford","Clinical Drug Investigation 20 (3), 181-196",,0,2000
Physicians vary widely in providing heart disease prevention services to their patients,"RS Stafford, D Blumenthal","Home Healthcare Now 17 (8), 494-495",,0,1999
Problems With Measuring the Use of β-Blockers in Ambulatory Settings for Secondary Prevention in Patients With Coronary Artery Disease,"TJ Wang, RS Stafford","Archives of internal medicine 159 (7), 755-756",,0,1999
Current Perspective,"TJ Wang, JC Ausiello, RS Stafford","hypertension 99, 2055-2057",,0,1999
The impact of cancer on the physical function of the elderly and their utilization of health care-Reply,"RS Stafford, P Cyr","CANCER 83 (3), 590-591",,0,1998
"ACE Inhibitors, Congestive Heart Failure, and ICD-9-CM Codes","RS Stafford, D Saglam, D Blumenthal","Archives of internal medicine 158 (14), 1575-1576",,0,1998
"Not enough physicians identify smokers, advise cessation",RS Stafford,Am J Health-Syst Pharm 55,,0,1998
Cardiovascular disease prevention practices by US physicians for patients with diabetes,"RS STAFFORD, JB MEIGS",Diabetes 47 (1S),,0,1998
Many physicians have not fully adopted recommended cholesterol management practices,"RS Stafford, D Blumenthal, RC Pasternak","Home Healthcare Now 16 (5), 340-341",,0,1998
NATIONAL CLINICAL MANAGEMENT PRACTICE PATTERNS FOR OBESITY,"R Stafford, B Misra",Journal of General Internal Medicine 13,,0,1998
TEMPORAL CORRELATES OF THE USE OF CALCIUM CHANNEL BLOCKERS FOR HYPERTENSION TREATMENT,"T Wang, R Stafford",Journal of General Internal Medicine 13,,0,1998
PROSTATE-SPECIFIC ANTIGEN (PSA) TESTING IN THE UNITED STATES IN 1995-96: MEN AGED 70 AND OVER ARE STILL A TARGET,"MMN Collins, R Stafford, M Barry",Journal of General Internal Medicine 13,,0,1998
ELECTROCARDIOGRAM TESTING IN PRIMARY CARE: PRACTICE VARIATIONS AND THEIR COST IMPLICATIONS,"R Stafford, R Murray, B Misra",Journal of General Internal Medicine 13,,0,1998
National Use of Warfarin in Atrial Fibrillation,"RS Stafford, DE Singer",Circulation 97 (8),,0,1998
Does the presence of certain cardiac risk factors positively influence risk factor interventions?,"S Mora, RS Stafford, RE Chaput, T Bishop, RC Pasternak","Journal of the American College of Cardiology 31 (Supplement 1), 89",,0,1998
"In Reply-ACE Inhibitors, Congestive Heart Failure, and ICD-9-CM Codes","RS Stafford, D Saglam, D Blumenthal","Archives of Internal Medicine 158 (14), 1576-1576",,0,1998
Patient-physician-medical record disagreement on cardiovascular risk factor management,"S Mora, RS Stafford, RE Chaput, T Bishop, RC Pastemak","Journal of the American College of Cardiology 31 (2SA), 215A-215A",,0,1998
Rate Control And Sinus Rhythm Maintenance In Atrial Fibrillation,"RS Stafford, DE Singer",Circulation 96 (8S),,0,1997
National patterns of medication treatment in hypertension,"RS Stafford, D Saglam, D Blumenthal","CIRCULATION 94 (8), 4198-4198",,0,1996
"Chronic disease, quality of life, and health care utilization in the elderly.","PL Cyr, RS Stafford","JOURNAL OF INVESTIGATIVE MEDICINE 44 (7), A413-A413",,0,1996
Genitourinary symptoms in mem: How common is prostatitis?,"MFM Collins, RS Stafford, MJ Barry","JOURNAL OF INVESTIGATIVE MEDICINE 44 (7), A406-A406",,0,1996
Equal Partners: A Physician's Call for a New Spirit of Medicine,RS Stafford,"Social Science & Medicine 4 (43), 570-571",,0,1996
"[BOOK REVIEW] Equal partners, a physician's call for a new spirit of medicine",J Heymann,"Social Science & Medicine 43 (4), 570-571",,0,1996
PATTERNS OF LIPID-LOWERING MEDICATION USE BY PATIENTS VISITING US PHYSICIANS,"RS STAFFORD, D BLUMENTHAL","CIRCULATION 92 (8), 3409-3409",,0,1995
Primary Care Specialties Differ in Cardiovascular Disease Prevention Practices,"RS Stafford, D Blumenthal","JOURNAL OF GENERAL INTERNAL MEDICINE 10, 104-104",,0,1995
PREDICTORS OF CHOLESTEROL SCREENING AND COUNSELING BY UNITED-STATES INTERNISTS,"R STAFFORD, D BLUMENTHAL","CIRCULATION 90 (4), 101-101",,0,1994
Nonclinical Factors and Repeat C-Section-Reply,RS Stafford,"JAMA 265 (18), 2339-2339",,0,1991
Cesarean Section Rates-Reply,RS Stafford,"JAMA 265 (5), 595-596",,0,1991
Health care organization as a determinant of repeat cesarean section utilization: A multivariate analysis of 1986 California hospital discharge data.,RS Stafford,,,0,1991
The Cesarean Section Rate-Reply,RS Stafford,"JAMA 264 (8), 971-971",,0,1990
Socioeconomic Differences in Rates of Cesarean Section,H Bass,The New England Journal of Medicine 322 (4),,0,1990
A TEST OF HARDY WEINBERG EQUILIBRIUM IN 18 SEROLOGICAL POLYMORPHISMS,RS STAFFORD,"CLINICAL RESEARCH 29 (1), A36-A36",,0,1981
"LIFE EXPECTANCY IN HEMOPHILIA-OREGON, 1930-1975",RS STAFFORD,"CLINICAL RESEARCH 29 (1), A37-A37",,0,1981
AN ANALYSIS OF 119-CASES OF DISPUTED PATERNITY SUBMITTED FOR SEROLOGICAL TESTING,RS STAFFORD,"CLINICAL RESEARCH 29 (1), A37-A37",,0,1981
ABO BLOOD-GROUP DISTRIBUTION IN HEMOPHILIA-A,"M HEGEWALD, R STAFFORD, S GOODNIGHT, L WOLFF, E LOVRIEN","CLINICAL RESEARCH 28 (1), A104-A104",,0,1980
"Report and discussion on"" The doctor in industry. Factory medical services""","GD Pryor, W Core, LE Glover, WS Hollis, AR Cooper, CF Rose, H Stafford, ...","Production Engineer 40 (1), 8",,0,1961
Subcommittee XI (Resins),"R Stafford, C Pickett",Fifty Years of Paint Testing,,0,1953
"Керівництво з попередження, виявлення, оцінки та управління високим кров'яним тиском у дорослих* 10.2. 2. Вагітність. Загальний опис","PK Whelton, RM Carey, WS Aronow, DE Casey Jr, KJ Collins, ...",,,0,0
Trajectories of Opioid Use in Veterans Health Administration Patients Using Buprenorphine-naloxone,"S Mudumbai, F Wu, P Chung, A Kapoor, E Mariano, TK Harrison, DJ Clark, ...",,,0,0
Flying in the Face of the Evidence; Low Aspirin Use in the US Outpatient Setting,"RS Stafford, V Monti, J Ma",,,0,0
"Akinroye, KK 263 Alderson, H. 261","N Azad, G Baltopoulos, P Baltopoulos, J Barnoya, E Bianco, E Bolton, ...","Emr 1000, 237",,0,0
ContentsAnnals of Internal Medicine®,MATS Organ,,,0,0
Time to Cessation of Postoperative Opioids: A National-level Cross-sectional Analysis of the Veterans Affairs Healthcare System,"S Mudumbai, K Unger-Hu, E Oliva, E Lewis, J Trafton, E Mariano, ...",,,0,0
Implementation of Case Management to Reduce Cardiovascular Disease Risk in Stanford and San Mateo Heart to Heart Trial: Study Protocol and Baseline Characteristics [NCT00128687],"J Ma, KV Lee, K Berra, RS Stafford",,,0,0
ACADEMIC HISTORY: Education,RS Stafford,,,0,0
您所在位置: 首页> 期刊> 过刊浏览> 推荐与其他>《 科学公立图书馆医学》> 2006 年 2 月 3 卷 2 期>> 文章详情,"RS Stafford, V Monti, J Ma",,,0,0
Physicians miss opportunities to aid smoking cessation,"AN Thorndike, NA Rigoni, RS Stafford, DE Singer",,,0,0
Calcium antagonist advertising parallels prescribing?,"WTJA JC, RS Stafford",,,0,0
您所在位置: 首页> 期刊> 过刊浏览> 推荐与其他>《 科学公立图书馆医学》> 2006 年 2 月 3 卷 2 期>> 文章详情,"RS Stafford, V Monti, J Ma",,,0,0
Missed opportunities for estrogen replacement therapy,"RS Stafford, D Saglam, N Causino, D Blumenthal",,,0,0
"Final–Jun. 29, 2009","SM Walton, KV Lee, GC Alexander, D Meltzer, RS Stafford",,,0,0
