Title,Authors,Platform,Cited_url,Cited_count,Year
Toxicology of daily administration to mice of the radiation potentiator SR 4233 (WIN 59075),"JF Spiegel, MA Spear, JM Brown","Radiotherapy and Oncology 26 (1), 79-81",https://scholar.google.com/scholar?oi=bibs&hl=en&cites=13129752332155777418,14,1993
Thoracocardiography: Part 2: Noninvasive measurement of changes in stroke volume; comparisons to impedance cardiograph,"MA Sackner, RA Hoffman, BP Krieger, M Shaukat, D Stroh, JD Sackner, ...","Chest 99 (4), 896-903",https://scholar.google.com/scholar?oi=bibs&hl=en&cites=16759377932651450844,14,1991
"Interstitial Water and Hydrothermal Water Chemistry, Guaymas Basin, Gulf of California: Chapter 36: Part VI. Hydrothermal Processes","JM Gieskes, T Shaw, T Brown, A Sturz, AC Campbell","AAPG Special Volumes 114, 753-779",https://scholar.google.com/scholar?oi=bibs&hl=en&cites=15666536827739600533,14,1991
In vitro and in vivo radiation sensitization by the halogenated pyrimidine 5-chloro-2′-deoxycytidine,"KJ Russell, GC Rice, JM Brown","Cancer research 46 (6), 2883-2887",https://scholar.google.com/scholar?oi=bibs&hl=en&cites=15624577444530950562,14,1986
Changes in the response of the RIF-1 tumour to melphalan ,"MR Horsman, DM Brown, DG Hirst, JM Brown","British journal of cancer 53 (2), 247",https://scholar.google.com/scholar?oi=bibs&hl=en&cites=9694545203378321493,14,1986
"naming as a function of intensity, degradation, SR compatibility, and practice","BL Everett, L Hochhaus, JR Brown","Perception & Psychophysics 37 (5), 467-470",https://scholar.google.com/scholar?oi=bibs&hl=en&cites=6337794921205885396,14,1985
Misonidazole neurotoxicity in mice decreased by administration with pyridoxine,"PJ Eifel, DM Brown, WW Lee, JM Brown","International Journal of Radiation Oncology* Biology* Physics 9 (10), 1513-1519",https://scholar.google.com/scholar?oi=bibs&hl=en&cites=4113130320168995505,14,1983
Cytotoxicity of misonidazole in vivo under conditions of prolonged contact of drug with the tumour cells,"JM Brown, NY Yu","The British journal of radiology 52 (623), 893-896",https://scholar.google.com/scholar?oi=bibs&hl=en&cites=3369510784347992836,14,1979
Early and late response of the mouse limb to multifractionated X-irradiation,"AE Howes, JM Brown","International Journal of Radiation Oncology* Biology* Physics 5 (1), 13-21",https://scholar.google.com/scholar?oi=bibs&hl=en&cites=15068576946225194755,14,1979
Ac analog to digital converter,"J Buchanan, J Brown","US Patent 3,849,775",https://scholar.google.com/scholar?oi=bibs&hl=en&cites=5797817054179705267,14,1974
Comparison of tumour growth delay with cell survival,"JM Brown, AE Howes","The British journal of radiology 47 (560), 509-510",https://scholar.google.com/scholar?oi=bibs&hl=en&cites=7669386891752624716,14,1974
The neurological complications of pertussis.,"JM Celermajer, J Brown","Medical Journal of Australia 1 (25), 1066-9",https://scholar.google.com/scholar?oi=bibs&hl=en&cites=2192514397997539964,14,1966
"How does self stigma differ across people with psychiatric diagnoses and rheumatoid arthritis, and how does it impact on self-esteem and empowerment?","E Corker, J Brown, C Henderson","Psychology, health & medicine 21 (8), 993-1005",https://scholar.google.com/scholar?oi=bibs&hl=en&cites=3439776186377904613,13,2016
High Kellgren-Lawrence grade and bone marrow lesions predict worsening rates of radiographic joint space narrowing; the SEKOIA study,"MH Edwards, C Parsons, O Bruyère, FP Dop, R Chapurlat, FW Roemer, ...","The Journal of rheumatology 43 (3), 657-665",https://scholar.google.com/scholar?oi=bibs&hl=en&cites=9066442557788810812,13,2016
Responding to acute care needs of patients with cancer: recent trends across continents,"A Young, E Marshall, M Krzyzanowska, B Robinson, S Brown, F Collinson, ...","The oncologist 21 (3), 301-307",https://scholar.google.com/scholar?oi=bibs&hl=en&cites=5471106727249614527,13,2016
Efficacy of using career and self-construction to help learners manage career-related transitions,"A Cook, JG Maree",South African Journal of Education 36 (1),https://scholar.google.com/scholar?oi=bibs&hl=en&cites=16612830967786665602,13,2016
Magnetic resonance diffusion and relaxation characterization of water in the unfrozen vein network in polycrystalline ice and its response to microbial metabolic products,"JR Brown, TI Brox, SJ Vogt, JD Seymour, ML Skidmore, SL Codd","Journal of Magnetic Resonance 225, 17-24",https://scholar.google.com/scholar?oi=bibs&hl=en&cites=11310720624339787781,13,2012
IL-3 and oncogenic Abl regulate the myeloblast transcriptome by altering mRNA stability,"J Ernst, L Ghanem, Z Bar-Joseph, M McNamara, J Brown, RA Steinman","PLoS One 4 (10), e7469",https://scholar.google.com/scholar?oi=bibs&hl=en&cites=14758285228903267891,13,2009
Systemic therapeutic approaches with sexual minorities and their families,"JK Long, J Bonomo, BV Andrews, JM Brown","Journal of GLBT Family Studies 2 (3-4), 7-37",https://scholar.google.com/scholar?oi=bibs&hl=en&cites=12404340800837251339,13,2006
The EXPURT model for calculating external γ doses from deposited material in inhabited areas,"JA Jones, LN Singer, J Brown","Journal of environmental radioactivity 85 (2-3), 314-329",https://scholar.google.com/scholar?oi=bibs&hl=en&cites=5041458960046519791,13,2006
"Resilient Leadership and Why"" At Risk"" Is At Risk","JH Brown, D Brown","The Education Digest 71 (5), 24",https://scholar.google.com/scholar?oi=bibs&hl=en&cites=17605491872003343028,13,2006
Patient-Centred Collaborative Practice,J Brown,Ottawa: Health Canada,https://scholar.google.com/scholar?oi=bibs&hl=en&cites=3035823571130152156,13,2004
Studies of salt tolerance of landscape plant species and California native grasses for recycled water irrigation,"L Wu, X Guo, K Hunter, E Zagory, R Waters, J Brown","Slosson report, 1-14",https://scholar.google.com/scholar?oi=bibs&hl=en&cites=14609860513431482940,13,2001
Maintenance treatment with interferon for advanced ovarian cancer,"G Hall, R Coleman, M Stead, E Gurney, A Phillips, J Brown, D Dassu, ...","BRITISH JOURNAL OF CANCER 83, 28-28",https://scholar.google.com/scholar?oi=bibs&hl=en&cites=17849467389571962344,13,2000
Studies of recycled water irrigation and performance of landscape plants under urban landscape conditions,"L Wu, X Guo, J Brown",Slosson Report (www. ucce. ucdavis. edu/freeform/slosson/documents/1999 …,https://scholar.google.com/scholar?oi=bibs&hl=en&cites=16559790018178040475,13,2000
Elevation of intracellular glutathione levels following depletion and its relationship to protection against radiation and alkylating agents,"YC Taylor, JM Brown","Pharmacology & therapeutics 39 (1-3), 293-299",https://scholar.google.com/scholar?oi=bibs&hl=en&cites=4820998212884572475,13,1988
Enhancement of melphalan cytotoxicity in vivo and in vitro by inhibitors of poly (ADP-ribose) polymerase,"DM Brown, MR Horsman, DG Hirst, JM Brown","International Journal of Radiation Oncology* Biology* Physics 10 (9), 1665-1668",https://scholar.google.com/scholar?oi=bibs&hl=en&cites=6510905115914361939,13,1984
Role of the adenylate energy charge in the response of Chinese hamster ovary cells to radiation,"EA Bump, SK Calderwood, JM Sawyer, JM Brown","International Journal of Radiation Oncology* Biology* Physics 10 (8), 1411-1414",https://scholar.google.com/scholar?oi=bibs&hl=en&cites=16324210145370154908,13,1984
The effect of time between X-irradiation and chemotherapy on the growth of three solid mouse tumors. VI. BCNU,"P Lelieveld, PR Twentyman, RF Kallman, JM Brown","International Journal of Radiation Oncology* Biology* Physics 5 (9), 1549-1552",https://scholar.google.com/scholar?oi=bibs&hl=en&cites=12226504477290688459,13,1979
Systems releasing action therapy with alcoholics: An experimental evaluation,"M Moran, CG Watson, J Brown, C White, L Jacobs","Journal of clinical psychology 34 (3), 769-774",https://scholar.google.com/scholar?oi=bibs&hl=en&cites=15993642471484922063,13,1978
Combination Chemotherapy and Radiotherapy in Smalt-Cell Carcinoma of the Lung,"GA King, R Comis, S Ginsberg, J Goldberg, HT Dale, J Brown, P Dalai, ...","Radiology 125 (2), 529-530",https://scholar.google.com/scholar?oi=bibs&hl=en&cites=4495981393566795744,13,1977
Complementary FET digital to analog converter,"JE Buchanan, JE Brown","US Patent 3,984,830",https://scholar.google.com/scholar?oi=bibs&hl=en&cites=16643754236737372128,13,1976
Carcinogenicity of heated fats and fat fractions,"RW O'Gara, L Stewart, J Brown, WC Hueper","Journal of the National Cancer Institute 42 (2), 275-287",https://scholar.google.com/scholar?oi=bibs&hl=en&cites=12431613962486365693,13,1969
Effects of x-irradiation on cell proliferation in normal epithelium and in tumours of the hamster cheek pouch,"JM Brown, RJ Berry",Effects of Radiation on Cellular Proliferation and Differentiation …,https://scholar.google.com/scholar?oi=bibs&hl=en&cites=8706051045442723863,13,1968
Integrated analysis: outcomes of ibrutinib‐treated patients with chronic lymphocytic leukemia/small lymphocytic leukemia (cll/sll) with high‐risk prognostic factors,"TJ Kipps, G Fraser, SE Coutre, JR Brown, JC Barrientos, PM Barr, JC Byrd, ...","Hematological Oncology 35, 109-111",https://scholar.google.com/scholar?oi=bibs&hl=en&cites=742087228760214919,12,2017
"Preparation, surface characterization and performance of a Fischer-Tropsch catalyst of cobalt supported on silica nanosprings","BAF Kengne, AM Alayat, G Luo, AG McDonald, J Brown, H Smotherman, ...","Applied Surface Science 359, 508-514",https://scholar.google.com/scholar?oi=bibs&hl=en&cites=8759807925302507316,12,2015
Co-ordinating responses to domestic violence,N Westmarland,"Handbook of Sexual Violence. London: Routledge-Willan, 287-307",https://scholar.google.com/scholar?oi=bibs&hl=en&cites=1797718230728355765,12,2011
"Design, operation, and maintenance for sustainable underground storage facilities","H Bouwer, R Pyne, J Brown, D St Germain, TM Morris, CJ Brown, P Dillon, ...",Water Environment Research Foundation,https://scholar.google.com/scholar?oi=bibs&hl=en&cites=14752587302377073156,12,2009
Frozen dough and baked products,"J Brown, T Aurand, D Zhang","US Patent App. 10/353,979",https://scholar.google.com/scholar?oi=bibs&hl=en&cites=7220490830725514216,12,2003
Liver Tumors Study Group of the International Society of Pediatric Oncology Hepatocellular carcinoma in children: results of the first prospective study of the International …,"P Czauderna, G Mackinlay, G Perilongo, J Brown, E Shafford, D Aronson, ...","J Clin Oncol 20, 2798-2804",https://scholar.google.com/scholar?oi=bibs&hl=en&cites=16778570274316178579,12,2002
Bristles employing particulates and brushes including same,"JM Brown, TR Huskey, D Prawdzik, JM Collins","US Patent 6,174,600",https://scholar.google.com/scholar?oi=bibs&hl=en&cites=9759248313906890287,12,2001
Comparison of the effectiveness of tirapazamine and carbogen with nicotinamide in enhancing the response of a human tumor xenograft to fractionated irradiation,"A El‐Said, D Menke, MJ Dorie, JM Brown","Radiation Oncology Investigations: Clinical and Basic Research 7 (3), 163-169",https://scholar.google.com/scholar?oi=bibs&hl=en&cites=1297534644456948446,12,1999
Method of tumor treatment,JM Brown,"US Patent 5,670,502",https://scholar.google.com/scholar?oi=bibs&hl=en&cites=2572206164685105690,12,1997
"A multicenter phase II study of navelbine and doxorubicin as first line, chemotherapy of metastatic breast cancer","H Hochster, C Vogel, M Blumenreich, JG Brown, H Davis, H Ozer","Proc Am Soc Clin Oncol 13, 100",https://scholar.google.com/scholar?oi=bibs&hl=en&cites=17595764635804679276,12,1994
Comment on the Nottingham prognostic index,"J Brown, M Jones, EA Benson","Breast cancer research and treatment 25, 283-283",https://scholar.google.com/scholar?oi=bibs&hl=en&cites=760184554705011061,12,1993
Fluorescence in situ hybridization: an improved method of quantitating chromosome damage and repair,"JM Brown, JW Evans","British journal of radiology 66 (782, suppl. 24), 61-64",https://scholar.google.com/scholar?oi=bibs&hl=en&cites=16701815880921583446,12,1993
Carbogen and nicotinamide: expectations too high?,JM Brown,"Radiotherapy and Oncology 24 (2), 75-76",https://scholar.google.com/scholar?oi=bibs&hl=en&cites=15313565412751596952,12,1992
The frequency of translocations after treatment for Hodgkin's disease,"LM Smith, JW Evans, M Mori, JM Brown, D Phil","International Journal of Radiation Oncology* Biology* Physics 24 (4), 737-742",https://scholar.google.com/scholar?oi=bibs&hl=en&cites=5624561876195048219,12,1992
Computerized histographic oxygen tension measurements of murine tumors,"DJ Terris, AI Minchinton, EP Dunphy, JM Brown","Oxygen transport to tissue XIV, 153-159",https://scholar.google.com/scholar?oi=bibs&hl=en&cites=1579011553883724748,12,1992
Aerobic radiosensitization by SR 4233 in rodent and human cells: mechanistic and therapeutic implications,"EM Zeman, JM Brown","International journal of radiation biology 59 (1), 117-131",https://scholar.google.com/scholar?oi=bibs&hl=en&cites=5458267084758553385,12,1991
Targeting bioreductive drugs to tumours: is it necessary to manipulate blood flow,JM Brown,"International journal of radiation biology 60 (1-2), 231-236",https://scholar.google.com/scholar?oi=bibs&hl=en&cites=5319588927257842429,12,1991
Use of fluorescent in situ hybridization to detect chromosomal rearrangements in somatic cell hybrids,"AJ Giaccia, JW Evans, JM Brown","Genes, Chromosomes and Cancer 2 (3), 248-251",https://scholar.google.com/scholar?oi=bibs&hl=en&cites=631367259440277975,12,1990
The risk of leukemia in Seascale from radiation exposure.,"JW Stather, J Dionian, J Brown, TP Fell, CR Muirhead","Health physics 55 (2), 471-481",https://scholar.google.com/scholar?oi=bibs&hl=en&cites=17094621232164887960,12,1988
Radiosensitization in multifraction schedules: I. Evidence for an extremely low oxygen enhancement ratio,"YC Taylor, JM Brown","Radiation research 112 (1), 124-133",https://scholar.google.com/scholar?oi=bibs&hl=en&cites=2694780811261191573,12,1987
Mechanism of melphalan crosslink enhancement by misonidazole pretreatment,"YC Taylor, JM Sawyer, B Hsu, JM Brown","International Journal of Radiation Oncology* Biology* Physics 10 (9), 1603-1607",https://scholar.google.com/scholar?oi=bibs&hl=en&cites=1265361841543587969,12,1984
Cytogenetic and mutagenic assays on fluoride,GR Martin,"Fluorides, effects on vegetation, animals and humans, 271-280",https://scholar.google.com/scholar?oi=bibs&hl=en&cites=11529567986104666615,12,1982
Relative efficacy of high-pressure oxygen and misonidazole to reduce TCD50 of a mouse mammary carcinoma,"HD Suit, JM Brown","The British journal of radiology 52 (614), 159-159",https://scholar.google.com/scholar?oi=bibs&hl=en&cites=13240878557475331504,12,1979
Late recovery from head injury: case report and review,JC Brown,"Psychological medicine 5 (3), 239-248",https://scholar.google.com/scholar?oi=bibs&hl=en&cites=14915407119838590017,12,1975
Subcutaneous meningioma,"JM Brown, AP Cherry","Medical Journal of Australia 2 (21), 1072-1073",https://scholar.google.com/scholar?oi=bibs&hl=en&cites=12830592194871675284,12,1971
A technique for intra-arterial infusion of tumor-bearing mice,"JM Brown, DR Goffinet","The Journal of laboratory and clinical medicine 76 (1), 175-180",https://scholar.google.com/scholar?oi=bibs&hl=en&cites=10184729671655068876,12,1970
Adhesives,CF Brown,"US Patent 2,392,574",https://scholar.google.com/scholar?oi=bibs&hl=en&cites=10523138459852573394,12,1946
Psychometric evaluation of the EMO and the SUS in the context of a large-sample unmoderated usability study,"JR Lewis, J Brown, DK Mayes","International Journal of Human-Computer Interaction 31 (8), 545-553",https://scholar.google.com/scholar?oi=bibs&hl=en&cites=9659835600555937114,11,2015
Therapeutic uses of allogeneic myeloid progenitor cells,JM Brown,"US Patent 8,980,329",https://scholar.google.com/scholar?oi=bibs&hl=en&cites=17472436615716834986,11,2015
"Effects of fluctuating temperature and silicate supply on the growth, biochemical composition and lipid accumulation of Nitzschia sp.","Y Jiang, KS Laverty, J Brown, M Nunez, L Brown, J Chagoya, M Burow, ...","Bioresource technology 154, 336-344",https://scholar.google.com/scholar?oi=bibs&hl=en&cites=9818461652184726737,11,2014
Collaborative approaches to family systems supervision: Differentiation of self,"L MacKay, J Brown","Australian and New Zealand Journal of Family Therapy 34 (4), 325-337",https://scholar.google.com/scholar?oi=bibs&hl=en&cites=5973825762142643140,11,2013
Time to diagnosis of paediatric posterior fossa tumours: an 11-year West of Scotland experience 2000–2011,"MM Kameda-Smith, MAJ White, EJS George, JIM Brown","British journal of neurosurgery 27 (3), 364-369",https://scholar.google.com/scholar?oi=bibs&hl=en&cites=15031101381718841633,11,2013
"Historicising the present: Late Holocene emergence of a rainforest hunting camp, Gulf Province, Papua New Guinea","I McNiven, B David, K Aplin, M Pivoru, W Pivoru, A Sexton, J Brown, ...","Australian Archaeology 71 (1), 41-56",https://scholar.google.com/scholar?oi=bibs&hl=en&cites=5113801034704438892,11,2010
Risk Across Borders: Sexual Contexts and HIV Prevention Challenges among Mexican Gay and Bisexual Immigrant Men. Findings and Recommendations from the Trayectos Study,"H Carrillo, J Fontdevila, J Brown, W Gómez",Unknown Publisher,https://scholar.google.com/scholar?oi=bibs&hl=en&cites=11108168765071174389,11,2008
Considerations for developing biopharmaceuticals: FDA perspective,"K Brorson, PG Swann, J Brown, B Wilcox, MA Shapiro","Modern Biopharmaceuticals: Design, Development and Optimization, 1637-1667",https://scholar.google.com/scholar?oi=bibs&hl=en&cites=11278302094449131669,11,2005
Estimación de la carga de enfermedad en España en el año 2000,"RG Maleras, EÁ Martín, CM Ginestar","Cuadernos geográficos, 571-576",https://scholar.google.com/scholar?oi=bibs&hl=en&cites=16886665323214772464,11,2005
Rapid stabilization/polymerization of wet clay soils: phase I literature review,"JJ Brown, TL Brandon, WL Daniels, TL DeFazio, GM Filz, JK Mitchell","Air Force Research Laboratory, Tyndall AFB FL",https://scholar.google.com/scholar?oi=bibs&hl=en&cites=16564328257356857674,11,2004
Beverage dispenser,"D Harvey, D Murray, J Brown, G Wallen","US Patent 6,345,735",https://scholar.google.com/scholar?oi=bibs&hl=en&cites=16187197769173885386,11,2002
"Population biology and growth of Ozark cavefish in Logan Cave National Wildlife Refuge, Arkansas","JZ Brown, JE Johnson","Environmental biology of fishes 62 (1-3), 161-169",https://scholar.google.com/scholar?oi=bibs&hl=en&cites=4091769608092895601,11,2001
Management of acetaminophen hepatotoxicity: a survey of practicing physicians,"LG Quallich, JW Brown, TM Shehab, RJ Fontana","JCOM 8 (6), 25-32",https://scholar.google.com/scholar?oi=bibs&hl=en&cites=14564040408803404138,11,2001
"C-CAM1 expression: differential effects on morphology, differentiation state and suppression of human PC-3 prostate carcinoma cells","MM Comegys, MP Carreiro, JF Brown, A Mazzacua, DL Flanagan, ...","Oncogene 18 (21), 3261",https://scholar.google.com/scholar?oi=bibs&hl=en&cites=3336646955870788935,11,1999
Retrovirus isolated from humans,"PA Sandstrom, J Brown, TM Folks, W Heneine, WM Switzer","US Patent 5,882,912",https://scholar.google.com/scholar?oi=bibs&hl=en&cites=94199412935993585,11,1999
Cancer therapy and tumor physiology,"AJ Giaccia, JM Brown, B Wouters, N Denko, C Koumenis","Science 279 (5347), 10-15",https://scholar.google.com/scholar?oi=bibs&hl=en&cites=1729690100208880399,11,1998
"Boreal forest information content of multi-season, multi-polarization C-band SAR data","FJ Ahern, I McKirdy, J Brown","Canadian journal of remote sensing 22 (4), 456-472",https://scholar.google.com/scholar?oi=bibs&hl=en&cites=6343383770934889059,11,1996
Confirmation of the safety of central venous catheterisation in critically ill infants and children the Baragwanath experience,"DK Luyt, LR Mathivha, M Litmanovitch, MD Dance, JM Brown",South African Medical Journal 86 (5),https://scholar.google.com/scholar?oi=bibs&hl=en&cites=11580991794297910389,11,1996
Enhancement of the cytotoxicity of SR 4233 to normal and malignant tissues by hypoxic breathing,"AI Minchinton, JM Brown","British journal of cancer 66 (6), 1053",https://scholar.google.com/scholar?oi=bibs&hl=en&cites=6327779069101588221,11,1992
Validation of the FARMLAND models for radionuclide transfer through terrestrial foodchains,"J Brown, SM Haywood, BT Wilkins","Reliability of radioactive transfer models, 127-134",https://scholar.google.com/scholar?oi=bibs&hl=en&cites=5316326599771633851,11,1988
The adult male undergraduate: Who stays and who leaves,"JVE Brown, RD Robinson","College Student Journal 22 (1), 95-100",https://scholar.google.com/scholar?oi=bibs&hl=en&cites=8617428832926431620,11,1988
The effect of timing on chemosensitization by clinical levels of SR-2508,"DG Hirst, MR Horsman, JM Brown, JL Hazlehurst","International Journal of Radiation Oncology* Biology* Physics 10 (9), 1641-1645",https://scholar.google.com/scholar?oi=bibs&hl=en&cites=17538694670561273602,11,1984
Quinidine-rifampin interaction.,"A Schwartz, JR Brown","American heart journal 107 (4), 789",https://scholar.google.com/scholar?oi=bibs&hl=en&cites=12228603877740760850,11,1984
Inhibition of X-ray-induced potentially lethal damage (PLD) repair in aerobic plateau-phase Chinese hamster cells by misonidazole,"DM Brown, C Dionet, JM Brown","Radiation research 97 (1), 162-170",https://scholar.google.com/scholar?oi=bibs&hl=en&cites=9631859712383383232,11,1984
"The development of an oral prodrug, SR-2545, of the 2-nitroimidazole radiosensitizer SR-2508","CN Coleman, WW Lee, LS Constine, JM Brown","International Journal of Radiation Oncology* Biology* Physics 8 (3-4), 431-434",https://scholar.google.com/scholar?oi=bibs&hl=en&cites=12046917699630400960,11,1982
Digital-to-analog noise generator,"JE Brown, KC Overman","US Patent 4,056,788",https://scholar.google.com/scholar?oi=bibs&hl=en&cites=14379706668017971989,11,1977
Caring and clarity,"G Bateson, J Brown","CoEvolution Quarterly 7, 32-47",https://scholar.google.com/scholar?oi=bibs&hl=en&cites=11191015831190637359,11,1975
Constriction in iodine positive columns,"JM Brown, JRM Coulter, KG Emeléus, EW Gray, GA Woolsey",Proceedings of the Royal Irish Academy. Section A: Mathematical and Physical …,https://scholar.google.com/scholar?oi=bibs&hl=en&cites=15833491852170653816,11,1967
Simultaneous appendectomy and herniorrhaphy without prophylactic antibiotic therapy,"B Eiseman, RM Robinson, JH Brown","Surgery 51 (5), 578-582",https://scholar.google.com/scholar?oi=bibs&hl=en&cites=11287364945365520252,11,1962
POTASSIUM CHLORATE POISONING: REPORT OF A CASE,"S Gordon, JAH Brown","The Lancet 250 (6475), 503-504",https://scholar.google.com/scholar?oi=bibs&hl=en&cites=10306483667989544926,11,1947
Behavior change techniques used in digital behavior change interventions to reduce excessive alcohol consumption: a meta-regression,"CV Garnett, D Crane, J Brown, EFS Kaner, FR Beyer, CR Muirhead, ...","Annals of Behavioral Medicine 52 (6), 530-543",https://scholar.google.com/scholar?oi=bibs&hl=en&cites=12254369078279456220,10,2018
The potential value of priority-setting methods in public health investment decisions: qualitative findings from three English local authorities,"DJ Hunter, L Marks, J Brown, S Scalabrini, S Salway, L Vale, J Gray, ...","Critical Public Health 26 (5), 578-587",https://scholar.google.com/scholar?oi=bibs&hl=en&cites=17685326073553267154,10,2016
PKC phosphorylates residues in the N-terminal of the DA transporter to regulate amphetamine-induced DA efflux,"Q Wang, N Bubula, J Brown, Y Wang, V Kondev, P Vezina","Neuroscience letters 622, 78-82",https://scholar.google.com/scholar?oi=bibs&hl=en&cites=6307006145690668505,10,2016
Factors determining optimal fatty acid absorption in preterm infants,"CR Martin, A Cheesman, J Brown, M Makda, AJ Kutner, D DaSilva, ...","Journal of pediatric gastroenterology and nutrition 62 (1), 130",https://scholar.google.com/scholar?oi=bibs&hl=en&cites=12040683487306913965,10,2016
"Activation of persons living with HIV for treatment, the great study","K Fiscella, M Boyd, J Brown, J Carroll, A Cassells, R Corales, W Cross, ...","BMC public health 15 (1), 1056",https://scholar.google.com/scholar?oi=bibs&hl=en&cites=6567666221222158174,10,2015
Formaldehyde masers: exclusive tracers of high-mass star formation,"ED Araya, L Olmi, JM Ortiz, JE Brown, P Hofner, S Kurtz, H Linz, ...","The Astrophysical Journal Supplement Series 221 (1), 10",https://scholar.google.com/scholar?oi=bibs&hl=en&cites=6037224336943086818,10,2015
Interrater reliability in interpretation of electrocorticographic seizure detections of the responsive neurostimulator,"M Quigg, F Sun, NB Fountain, BC Jobst, VSS Wong, E Mirro, S Brown, ...","Epilepsia 56 (6), 968-971",https://scholar.google.com/scholar?oi=bibs&hl=en&cites=17076936043862162961,10,2015
Reporte de Puerto Rico,"J Bird, G Nazario","Zamorano: Escuela Argrícola Panamericana, 2014,",https://scholar.google.com/scholar?oi=bibs&hl=en&cites=16431511661813431963,10,2014
Recrystallization inhibition in ice due to ice binding protein activity detected by nuclear magnetic resonance,"JR Brown, JD Seymour, TI Brox, ML Skidmore, C Wang, BC Christner, ...","Biotechnology Reports 3, 60-64",https://scholar.google.com/scholar?oi=bibs&hl=en&cites=14597247580566721549,10,2014
Health risks from radioactive objects on beaches in the vicinity of the Sellafield site,"J Brown, G Etherington",Health Protection Agency,https://scholar.google.com/scholar?oi=bibs&hl=en&cites=6427746029545875607,10,2011
