Title,Authors,Platform,Cited_url,Cited_count,Year
SULPHIDES IN FREE-MACHINING STEEL,"DB Clayton, JR Brown","Iron Steel 42 (4), 219-226",https://scholar.google.com/scholar?oi=bibs&hl=en&cites=17817102813362569643,2,1969
Perturbations in cell populations kinetics in the irradiated hamster cheek pouch and in tumours induced in the pouch and irradiated in situ,JM Brown,University of Oxford,https://scholar.google.com/scholar?oi=bibs&hl=en&cites=18302399385626734457,2,1968
Moving striations possibly dominated by recombination,"GA Woolsey, JM Brown, JJG McCloskey, KG Emeleus",Phys. Letters 16,https://scholar.google.com/scholar?oi=bibs&hl=en&cites=4375640369860171833,2,1965
An omnidirectional medium gain 460 MC base station antenna using simplified suppressors,JS Brown,"IRE Transactions on Vehicular Communications 9 (1), 80-85",https://scholar.google.com/scholar?oi=bibs&hl=en&cites=5577773859014557708,2,1960
TYRAMINE-PRODUCING STREPTOCOCCI IN NEONATAL DIARRHOEA,"EY Bridson, J Brown","Journal of clinical pathology 13 (3), 195",https://scholar.google.com/scholar?oi=bibs&hl=en&cites=9602614972357113878,2,1960
ON MAKING THIN NYLON FILMS,"J Richards, J Brown, F Felber, D Saxon","PHYSICAL REVIEW 75 (2), 331-331",https://scholar.google.com/scholar?oi=bibs&hl=en&cites=10960870040410038348,2,1949
John Brown Papers,"J Brown, AB Adams, J Brown, MEB Brown, MAD Brown, O Brown, ...",,https://scholar.google.com/scholar?oi=bibs&hl=en&cites=11526802802463155369,2,1928
A Note on Asthma: Its Pathology and Treatment,JJG Brown,"Edinburgh medical journal 28 (2), 54",https://scholar.google.com/scholar?oi=bibs&hl=en&cites=16565135177224728801,2,1922
"Medical report of the dundalk “destitute sick society,” together with a sketch of the medical topography and statistics of the town and parish",J Brown,"Dublin Journal of Medical Science (1836-1845) 15 (3), 410-423",https://scholar.google.com/scholar?oi=bibs&hl=en&cites=12259625333059203573,2,1839
Imaging in Canine Sports Medicine,"J Brown, KE Henneman","Canine Sports Medicine and Rehabilitation], John Wiley & Sons, Ltd, 502-519",https://scholar.google.com/scholar?oi=bibs&hl=en&cites=16377250341290084148,1,2018
"Urbanization, climate and ecological stress indicators in an endemic nectarivore, the Cape Sugarbird","B Mackay, ATK Lee, P Barnard, AP Møller, M Brown","Journal of Ornithology 158 (4), 1013-1024",https://scholar.google.com/scholar?oi=bibs&hl=en&cites=6639285448327295039,1,2017
Molecular characterization of a novel bipartite begomovirus isolated from ,"YF Tang, ZF He, JK Brown, XM She, GB Lan","Archives of virology 162 (8), 2473-2476",https://scholar.google.com/scholar?oi=bibs&hl=en&cites=2426957639324947063,1,2017
2D Junction Profiling on Semiconductor Device Reliability Fail,"YY Wang, J Nxumalo, A Katnani, D Ioannou, J Brown, K Bandy, ...","Microscopy and Microanalysis 23 (S1), 1510-1511",https://scholar.google.com/scholar?oi=bibs&hl=en&cites=9844434711698722673,1,2017
Stimmlich enkodierte emotionale Erregung (Voice Stress) und Posttraumatische Reifung sowie Partnerschaftszufriedenheit bei Partnern von Brustkrebspatientinnen im Kontext der …,"T Zimmermann, JH Krüger, S Weusthoff","PPmP-Psychotherapie· Psychosomatik· Medizinische Psychologie 67 (07), 288-295",https://scholar.google.com/scholar?oi=bibs&hl=en&cites=10324543381162749016,1,2017
Changes in Bcl-2 Family Protein Profile During Idelalisib Therapy Mimic Those During Duvelisib Therapy in Chronic Lymphocytic Leukemia Lymphocytes,"Q Yang, P Modi, A Korkut, SM Fernandes, J Hanna, JR Brown, V Gandhi","JCO Precision Oncology 1, 1-5",https://scholar.google.com/scholar?oi=bibs&hl=en&cites=11904386416494261951,1,2017
Improved Ceiling and Visibility Forecasts from the US NOAA HRRR/RAP-Hydrometeor Assimilation and Modeling,"S Benjamin, C Alexander, S Weygandt, J Brown, T Smirnova, M Hu, ...","EGU General Assembly Conference Abstracts 19, 19312",https://scholar.google.com/scholar?oi=bibs&hl=en&cites=6459063369318057422,1,2017
Bcl-2 members as drug target and biomarkers for response to Ibrutinib and Venetoclax in CLL,"E Eldering, V Peperzak, H ter Burg, SM Fernandes, JR Brown, AP Kater","Blood 128 (22), 2043-2043",https://scholar.google.com/scholar?oi=bibs&hl=en&cites=8484790469550012130,1,2016
Variation in transmission of Tomato spotted wilt virus (TSWV) from Thrips tabaci is not solely influenced by virus titer within individual thrips,"J Brown, A Jacobson, G Kennedy, S Lommel, T Sit","Phytopathology 106 (12), 136-136",https://scholar.google.com/scholar?oi=bibs&hl=en&cites=12893320584413490328,1,2016
Aspergillosis complicating a microwave ablation cavity,"S Singh, S Bandula, J Brown, J Whelan, R Illing","BMJ case reports 2016, bcr2016216438",https://scholar.google.com/scholar?oi=bibs&hl=en&cites=11931498654228712937,1,2016
Outcomes with Ibrutinib by Line of Therapy in Patients with CLL: Analyses from Phase 3 Data,"N Reddy, S O'Brien, J Byrd, P Hillmen, S Coutre, J Brown, P Barr, ...","Clinical Lymphoma, Myeloma and Leukemia 16, S43",https://scholar.google.com/scholar?oi=bibs&hl=en&cites=14419857503813270134,1,2016
"Next generation intraoperative lymph node staging for stratified colon cancer surgery (glisten): a multicentre, multinational feasibility study of fluorescence in predicting …","H Andrew, G Gossedge, J Croft, N Corrigan, JM Brown, N West, P Quirke, ...",NIHR Journals Library,https://scholar.google.com/scholar?oi=bibs&hl=en&cites=14209064198053108376,1,2016
Discontinuation of idelalisib treatment due to disease progression in patients with relapsed and refractory CLL: an evaluation of outcomes,"JR Brown, P Ghia, JA Jones, AR Pettitt, JP Sharman, L Ysebaert, Y Kim, ...","Haematologica 101, 54-54",https://scholar.google.com/scholar?oi=bibs&hl=en&cites=3948320780545542498,1,2016
THU0035 Six Years Tocilizumab Use in Patients with Rheumatoid Arthritis with One Previous anti-TNF Agent Exposure: Comparison with Adalimumab and Etanercept from The Provincial …,"L Bessette, J Brown, L Coupal, B Haraoui, F Massicotte, JP Pelletier, ...","Annals of the Rheumatic Diseases 75 (Suppl 2), 190-190",https://scholar.google.com/scholar?oi=bibs&hl=en&cites=2642945814454945270,1,2016
"Updated results of a phase 3 randomized, controlled study of idelalisib in combination with ofatumumab for previously treated chronic lymphocytic leukemia (CLL)","T Robak, J Jones, M Wach, J Brown, A Menter, E Vandenberghe, ...","Haematologica 101, 53-53",https://scholar.google.com/scholar?oi=bibs&hl=en&cites=4986468601913303626,1,2016
Longitudinal Modeling of Informatively Censored Patient-Reported Outcomes Data in Oncology: Application to a Phase Iii Clinical Trial of Non-Small Cell Lung Cancer,"K Houghton, M Boye, L Bowman, J Brown, D Stull","Value in Health 19 (3), A158-A159",https://scholar.google.com/scholar?oi=bibs&hl=en&cites=2050644759718745205,1,2016
"Abstract S1-01: analysis of molecular prognostic factors associated with tumor immune and stromal microenvironment in BEATRICE, an open-label phase 3 trial in early triple …","L Molinero, J Yu, C Li, R Deurloo, RA Dent, R Bell, J Brown, M Parmar, ...","Cancer Research 76 (4 Supplement), S1-01-S1-01",https://scholar.google.com/scholar?oi=bibs&hl=en&cites=16873890516896478506,1,2016
An audit of image quality of three dental cone beam computed tomography units,"CJ Greenall, B Thomas, NA Drage, J Brown","Radiography 22 (1), 56-59",https://scholar.google.com/scholar?oi=bibs&hl=en&cites=9813784519103013783,1,2016
Is Edgar Allen Poe Really a Mathematician?,"J Brown, J Helton, TC Ragland, MT Edwards","Illinois Mathematics Teacher 63 (1), 8-19",https://scholar.google.com/scholar?oi=bibs&hl=en&cites=885987224235734199,1,2015
Non-Warfarin Oral Anticoagulants in Heparin-Induced Thrombocytopenia,"P Kunk, BG Macik, J Brown","Blood 126 (23), 3547-3547",https://scholar.google.com/scholar?oi=bibs&hl=en&cites=15485709549660400318,1,2015
Phase II trial designs for complex interventions: a single-arm single-stage design for clustered continuous outcomes,"DT Wilson, REA Walwyn, SR Brown, J Brown, AJ Farrin","Trials 16 (2), P234",https://scholar.google.com/scholar?oi=bibs&hl=en&cites=17415404094915103984,1,2015
P17. 45 Assessing the use of a peer-led mobile van for effective hiv service delivery in regional queensland: a whole of community approach,"T Rudduck, S Brown","Sex Transm Infect 91 (Suppl 2), A240-A240",https://scholar.google.com/scholar?oi=bibs&hl=en&cites=11758018907331133281,1,2015
Metabolic and Performance Effects of Different Warm-up Protocols on Aerobic Exercise in Physically Active Adults,"C Blanco, J Brown, T James, C Mojock",,https://scholar.google.com/scholar?oi=bibs&hl=en&cites=8077124171091172002,1,2015
Adherence and dose intensity following administration of the ibrutinib 420 mg dose in patients with previously treated CLL,"U Jaeger, PM Barr, JR Brown, P Hillmen, S O'Brien, JC Barrientos, ...","Haematologica 100, 155-155",https://scholar.google.com/scholar?oi=bibs&hl=en&cites=1043884280528913703,1,2015
A Stronger Construct for Manipulating Osteoporotic Bone Fragments in a Distal Femur Fracture Model,"A Aneja, J Turner Brown, M Graves","Techniques in Orthopaedics 30 (2), 125-130",https://scholar.google.com/scholar?oi=bibs&hl=en&cites=9568491749975228420,1,2015
"A phase 1b trial of duvelisib, a PI3K-δ, γ inhibitor, in combination with obinutuzumab in patients with CLL/SLL previously treated with a Bruton’s tyrosine kinase inhibitor (BTKi).","JS Blachly, JR Brown, JC Barrientos, N Jain, V Kelly, S Garnick, ...","Journal of Clinical Oncology 33 (15_suppl), TPS7100-TPS7100",https://scholar.google.com/scholar?oi=bibs&hl=en&cites=10168596838142120919,1,2015
Haematologic and immunologic function and patient-reported outcomes for the phase 3 RESONATETM study of ibrutinib versus ofatumumab in relapsed/refractory chronic lymphocytic …,"T Munir, J Barrientos, S O'Brien, J Brown, N Kay, N Reddy, S Coutre, ...",British Journal of Haematology 169,https://scholar.google.com/scholar?oi=bibs&hl=en&cites=15989661622319821316,1,2015
Abdominal training from a yoga perspective,"C Liebenson, J Brown","Journal of bodywork and movement therapies 19 (1), 186-189",https://scholar.google.com/scholar?oi=bibs&hl=en&cites=12868083443157582551,1,2015
Long Term Safety and Efficacy of Canakinumab Liquid Formulation in Acute Gouty Arthritis Patients: Results from a 36 Week Extension Study.: 174,"P Sunkureddi, E Tóth, J Brown, R Moericke, D Richard, K Lheritier, ...",Arthritis & Rheumatology 66,https://scholar.google.com/scholar?oi=bibs&hl=en&cites=13026579779293486375,1,2014
A deliberate postoperative debriefing process can effectively provide formative resident feedback,"MR Cook, JS Barton, S Brown, JM Watters, KE Deveney, LN Kiraly","Journal of the American College of Surgeons 219 (3), S117",https://scholar.google.com/scholar?oi=bibs&hl=en&cites=15613290712964952674,1,2014
High-dose chemotherapy plus autologous stem-cell transplantation as consolidation therapy in patients with relapsed multiple myeloma after previous autologous stem-cell …,"G Cook, C Williams, JM Brown","LANCET ONCOLOGY 15 (9), E365-E365",https://scholar.google.com/scholar?oi=bibs&hl=en&cites=12810786141617398230,1,2014
AB0847 Efficacy and Safety of Canakinumab Pre-Filled Syringe in Acute Gouty Arthritis Patients with Chronic Kidney Disease Stage≥ 3,"P Sunkureddi, E Toth, J Brown, A Kivitz, A Stancati, D Richard, K Lheritier, ...","Annals of the Rheumatic Diseases 73 (Suppl 2), 1083-1083",https://scholar.google.com/scholar?oi=bibs&hl=en&cites=1587443481753529754,1,2014
Social media participant economic benefit system and method,"LL Olson, JC Estes, J Brown, DB McLelland, DA Carels, C Tumer","US Patent App. 13/621,201",https://scholar.google.com/scholar?oi=bibs&hl=en&cites=6898244044788487904,1,2014
Content management system and method,"JC Estes, J Brown, DB McLelland, DA Carels, C Turner, LL Olson","US Patent App. 13/621,208",https://scholar.google.com/scholar?oi=bibs&hl=en&cites=8808863050994040792,1,2014
Is ultrasonography of salivary gland a validate tool in Sjögren syndrome? Study 1: Interobserver reliability between international group of experts,"S Jousse-Joulin, V Milic, E Theander, MV Jonsson, WF Ng, C Baldini, ...","Arthritis Rheumatol 65, S223-S223",https://scholar.google.com/scholar?oi=bibs&hl=en&cites=16391414677972181418,1,2013
SAT0341 Strontium Ranelate Improves Osteoarthritis Symptoms Compared to Placebo in Patients with Knee OA-The Sekoia Study,"O Bruyère, P Richette, N Bellamy, J Brown, R Chapurlat, X Chevalier, ...","Annals of the Rheumatic Diseases 72 (Suppl 3), A698-A699",https://scholar.google.com/scholar?oi=bibs&hl=en&cites=8299370952754620255,1,2013
Canadian Association for Enterostomal Therapy evidence-based recommendations for conservative sharp wound debridement: an executive summary,"E Rodd-Nielsen, J Brown, J Brooke, H Fatum, M Hill, J Morin, L St-Cyr","Journal of Wound Ostomy & Continence Nursing 40 (3), 246-253",https://scholar.google.com/scholar?oi=bibs&hl=en&cites=5450298143467292694,1,2013
Learning in the Collective,"JS Brown, D Thomas",Hybrid Pedagogy,https://scholar.google.com/scholar?oi=bibs&hl=en&cites=14649332943164185369,1,2013
Emergency medical considerations in sports medicine and rehabilitation,"CM Otto, J Brown","Canine Sports Medicine and Rehabilitation, 402-417",https://scholar.google.com/scholar?oi=bibs&hl=en&cites=5811670679335829781,1,2013
A second autologous stem cell transplant induces superior response durability following bortezomib-containing reinduction therapy for relapsed multiple myeloma: results from …,"G Cook, C Williams, A Szubert, K Yong, J Cavet, H Hunter, J Bird, S Bell, ...",Bone Marrow Transplantation 48,https://scholar.google.com/scholar?oi=bibs&hl=en&cites=12612472125518405483,1,2013
The Buttressed Core Structural System,"J Brown, J Williams",University of Pittsburgh Swanson School of Engineering. 2013 Freshman …,https://scholar.google.com/scholar?oi=bibs&hl=en&cites=3511868311470646623,1,2013
Defining being motivated: Alternative operational formats,JS Brown,"Psychology at Iowa, 73-90",https://scholar.google.com/scholar?oi=bibs&hl=en&cites=7996077216376444210,1,2013
Analysis of non-reducing ends (NRE) of glycosaminoglycans for the diagnosis and monitoring of therapy in Mucopolysaccharidosis Type I.,"M Pasquali, T Yuzyuk, E Schwarz, J Brown, B Crawford, P Dickson","Molecular Genetics and Metabolism 2 (108), S73",https://scholar.google.com/scholar?oi=bibs&hl=en&cites=18061693365995601505,1,2013
Determination of Root Uptake to Vegetables Grown in Soil Contaminated for Twenty-five Years,"A Eslava-Gomez, J Brown",Health Protection Agency,https://scholar.google.com/scholar?oi=bibs&hl=en&cites=633200491758825591,1,2013
"Collecting patient reported outcome measures (PROMs) and linking with clinical cancer registry data: preliminary results from feasibility testing of a novel, UK-scalable …","L Ashley, H Jones, G Velikova, J Thomas, J Brown, E Morris, A Newsham, ...","Psycho-oncology 22, 5-5",https://scholar.google.com/scholar?oi=bibs&hl=en&cites=3221865343765954832,1,2013
Real-time electronic patient outcome ReporTing of adverse events in UK Cancer trials (REPORT-UK),"K Absolom, J Brown, J Blazeby, G Velikova","PSYCHO-ONCOLOGY 22, 10-10",https://scholar.google.com/scholar?oi=bibs&hl=en&cites=17031976544917706191,1,2013
Perspectives on the'preparedness' of teaching assistants: what gets in the way?,"C Devecchi, J Brown",,https://scholar.google.com/scholar?oi=bibs&hl=en&cites=1188682120571044814,1,2013
Controversies in diabetes and pregnancy,SG Gabbe,Springer Science & Business Media,https://scholar.google.com/scholar?oi=bibs&hl=en&cites=3550607613222023248,1,2012
Current Food Allergy Diagnosis and Management Practices of Pediatricians,"R Gupta, A Dyer, CH Lau, MW Sohn, B Altshuler, JA Brown, J Necheles","ANNALS OF ALLERGY ASTHMA & IMMUNOLOGY 109 (5), A116-A116",https://scholar.google.com/scholar?oi=bibs&hl=en&cites=17352057829196049749,1,2012
PCN148 Review of National Institute for Health and Clinical Excellence (NICE) Recommendations for Anti-Cancer Agents Across Multiple Drug-Indication Combinations,"A Chawla, A Oza, D Nellesen, J Brown, AM Liepa, G Price, E Nash-Smyth, ...","Value in Health 15 (7), A436",https://scholar.google.com/scholar?oi=bibs&hl=en&cites=15378049794434054342,1,2012
"Art, Performance, and Post-Identity",J Brown,"Art Journal 71 (2), 120",https://scholar.google.com/scholar?oi=bibs&hl=en&cites=3156006874268209458,1,2012
This Might Sound Familiar…,JM Brown,Financial Statement Fraud Casebook: Baking the Ledgers and Cooking the Books …,https://scholar.google.com/scholar?oi=bibs&hl=en&cites=8400580588044262871,1,2012
Denosumab treatment for 6years in postmenopausal women with osteoporosis: The first 3years of the freedom extension,"D Mellström, J Brown, H Bone, R Chapurlat, N Franchimont, M Brandi, ...","Bone, S53-S54",https://scholar.google.com/scholar?oi=bibs&hl=en&cites=12552224260992119252,1,2012
P5-19-09: Phase II Trial of Ixabepilone Plus Carboplatin in Patients with Metastatic Breast Cancer: The ECLIPSE Study.,"C Osborne, JD Challagalla, SR Fanning, CF Eisenbeis, FA Holmes, ...","Cancer Research 71 (24 Supplement), P5-19-09-P5-19-09",https://scholar.google.com/scholar?oi=bibs&hl=en&cites=4217792686019937895,1,2011
S135 A retrospective multi-centre study of the effects of allogeneic haematopoietic stem cell transplantation on pulmonary function,"RT Dharmagunawardena, RM Pearce, J Lee, JF Apperley, T Littlewood, ...","Thorax 66 (Suppl 4), A62-A62",https://scholar.google.com/scholar?oi=bibs&hl=en&cites=7525406762671016820,1,2011
The analysis of denosumab discontinuation and associated fracture incidence in the FREEDOM trial,"J Brown, JE Beck Jensen, C Recknor","Arthritis Rheum 63, S428",https://scholar.google.com/scholar?oi=bibs&hl=en&cites=1712514130322437541,1,2011
Search for WH associated production in the lνbb final state using the DØ detector at the Tevatron,J Brown,Université Paris-Diderot-Paris VII,https://scholar.google.com/scholar?oi=bibs&hl=en&cites=7857513875964902709,1,2011
Quality of Life in the ICON7 GCIG Phase III Randomised Clinical Trial,"D Stark, M Nankivell, F Hilpert, L Elit, J Brown, A Lanceley, G Valikova, ...","European Journal of Cancer 47, 12",https://scholar.google.com/scholar?oi=bibs&hl=en&cites=6014073702478028011,1,2011
"P1-S5. 01 Heterosexual Anal Sex, Lubrication, HIV, and HSV-2 infection among women","J Brown, K Hess, S Brown, C Murphy, A Waldman, M Hezareh","Sex Transm Infect 87 (Suppl 1), A175-A175",https://scholar.google.com/scholar?oi=bibs&hl=en&cites=13312027732206107601,1,2011
PCN18 AN EPIDEMIOLOGICAL MODEL OF PROSTATE CANCER AND PROGRESSION TO BONE METASTASES IN THE UNITED KINGDOM,"S Cure, M Martin, A Bracco, J Brown, M Kearney","Value in Health 14 (3), A158",https://scholar.google.com/scholar?oi=bibs&hl=en&cites=14638118451238497414,1,2011
Improving safe use of medication through internet education for healthcare providers: A case-controlled study,"JJ Brown, GD Salinas, M Cohen, JK Jones, BL Olson, A Vaida, DW Bates","CE Measure 5 (1), 6-12",https://scholar.google.com/scholar?oi=bibs&hl=en&cites=7461618629225729264,1,2011
"Active ulcerative colitis is associated with downregulation of the TH1, TH2 and TH17 cytokine response and elevated IL-8 levels in mucosal biopsies","DS Pearl, K Shah, J Brown, JK Shute, TM Trebble","Gut 60 (Suppl 1), A214-A214",https://scholar.google.com/scholar?oi=bibs&hl=en&cites=10424444491065602037,1,2011
Review of the transfer of Technetium to terrestrial crops and animal products,"LW Ewers, A Eslava-Gomez, J Brown",Health Protection Agency,https://scholar.google.com/scholar?oi=bibs&hl=en&cites=4862993452162362279,1,2011
Compressible Gas Flow Experiment and Assisted COMSOL Modeling,"JT Brown, MP Lynch, RV Yaylaian, RT Vautrin, TJ Mazzali",Worcester Polytechnic Institute,https://scholar.google.com/scholar?oi=bibs&hl=en&cites=3227285287243209526,1,2011
Progress in development of the Flow-following finite-volume Icosahedral Model (FIM) toward improving NCEP global ensemble forecasts and toward a chemistry-coupled global,"TB Henderson, S Benjamin, R Bleck, J Brown, S Sun, J Bao, S Sahm, ...",AGU Fall Meeting Abstracts,https://scholar.google.com/scholar?oi=bibs&hl=en&cites=13790169464791863091,1,2010
Safety and clinical efficacy of early vaccination after nonmyeloablative transplant for advanced chronic lymphocytic leukemia,"CJ Wu, U Hainz, KE Stevenson, NP Goldstein, AM Brusic, JJ Choi, ...","Biology of Blood and Marrow Transplantation 16 (2), S164",https://scholar.google.com/scholar?oi=bibs&hl=en&cites=4010630819775334476,1,2010
Laboratory and field-scale evaluation of low-ph FE (II) oxidation at several sites in Pennsylvania,"TC DeSa, JF Brown, WD Burgos","Proceedings America Society of Mining and Reclamation, 190-203",https://scholar.google.com/scholar?oi=bibs&hl=en&cites=16891756741227999995,1,2010
Inviting each partner out of the fusion: Bowen Family Systems Theory and couple therapy,"J Brown, J Wright","The CAPA Quarterly 2, 17-20",https://scholar.google.com/scholar?oi=bibs&hl=en&cites=505626011699886504,1,2010
21. Glycan-based biomarkers for the mucopolysaccharidoses,"J Brown, JR Brown, R Carroll, N Tambe, C Glass, K Langford, S Le, ...","Molecular Genetics and Metabolism 2 (99), S12",https://scholar.google.com/scholar?oi=bibs&hl=en&cites=14334017090667544765,1,2010
119 ARQ 087: A potent ATP-independent fibroblast growth factor receptor (FGFR) kinase inhibitor showing in vivo anti-tumor activity in FGFR2-driven tumors,"CR Chen, S Ali, E Nakuci, D McSweeney, JO Brown, J Szwaya, C Bull, ...","Ejc Supplements 7 (8), 44-45",https://scholar.google.com/scholar?oi=bibs&hl=en&cites=5933189977917105158,1,2010
"Murder: Legal, psychological and investigative approaches",LB Schlesinger,"The Cambridge handbook of forensic psychology, 527-534",https://scholar.google.com/scholar?oi=bibs&hl=en&cites=17108361820415188521,1,2010
INTERACTION OF BRASSICACEOUS SEED MEAL AND ROOTSTOCK ON RECOVERY OF PRATYLENCHUS PENETRANS FROM ROOTS OF APPLE GROWN IN REPLANT ORCHARD SOILS.,"M Mazzola, J Brown, G Fazio","Journal of Nematology 41 (4), 354-354",https://scholar.google.com/scholar?oi=bibs&hl=en&cites=10464781075825585534,1,2009
437: Glottic View Using Direct and Glidescope® Laryngoscopes in the Hands of Emergency Physicians,"D Drigalla, R Bollinger, J Brown, C Rush, D Kjar, T Stallard","Annals of Emergency Medicine 54 (3), S138",https://scholar.google.com/scholar?oi=bibs&hl=en&cites=16838931079302998355,1,2009
Mast Cell Activation by Silica Is Dependent on Expression of SR-BI/II.,"JM Brown, EJ Swindle, DD Metcalfe",B101. GRANULOCYTE ACTIVATION AND EXECUTION OF EFFECTOR FUNCTIONS IN THE LUNG …,https://scholar.google.com/scholar?oi=bibs&hl=en&cites=5264829317220319221,1,2009
Multi-level scenario module 1: 7th Division,"JW Brown, V Bahm, O Gutierrez, C Smith, M Boetig, J Bauer, J Pruiksma, ...",TRADOC ANALYSIS CENTER FORT LEAVENWORTH KS,https://scholar.google.com/scholar?oi=bibs&hl=en&cites=10925275156393658809,1,2009
Method for detecting subjects having Paget's disease of bone,"J Brown, V Raymond, J Morissette, N Laurin","US Patent 7,479,368",https://scholar.google.com/scholar?oi=bibs&hl=en&cites=10739770036193737800,1,2009
166 POTENTIAL OF URINARY RELAXIN AS A USEFUL INDICATOR OF PREGNANCY IN THE MANED WOLF,"RC Santymire, B Steinetz, RM Santymire, JL Brown, N Songsasen","Reproduction, Fertility and Development 21 (1), 182-182",https://scholar.google.com/scholar?oi=bibs&hl=en&cites=15236975937467805804,1,2008
Once-A-Month (OAM) Risedronate 150 mg Reduced Vertebral Fracture Risk at One Year in a Historical Control Analysis.,"N Watts, A Klemes, L Wayner, J Brown","JOURNAL OF BONE AND MINERAL RESEARCH 23, S344-S345",https://scholar.google.com/scholar?oi=bibs&hl=en&cites=6082840654199580079,1,2008
Proportion of Tumour Cells and Stroma-An Inexpensive but Reliable Predictor of Patient Survival in Colorectal Cancer,"M Dattani, P McShane, D Treanor, G Hutchins, J Grabsch, J Brown, ...",The Journal of Pathology 216,https://scholar.google.com/scholar?oi=bibs&hl=en&cites=13304098530461624262,1,2008
RISK FACTORS FOR SKELETAL-RELATED EVENT (SRES) IN ZOLEDRONIC ACID-TREATED PATIENTS WITH BONE METASTASES (METS) FROM NON-SMALL CELL LUNG CANCER (NSCLC),"J Brown, R Cook, V Hirsh, P Major","ANNALS OF ONCOLOGY 19, 275-275",https://scholar.google.com/scholar?oi=bibs&hl=en&cites=906197314840814312,1,2008
Modernizing the school health workforce. Staff perceptions of a rapid roll‐out redesign programme,"BA Jack, L Bray, J Kirby, M O'BRIEN, J Brown, J Swift, R Leigh, ...","Journal of nursing management 16 (6), 700-706",https://scholar.google.com/scholar?oi=bibs&hl=en&cites=4972769405231286491,1,2008
"Ongoing phase 1 studies of Abt-263; pharmacokinetics, safety and anti-tumor activity in patients with relapsed chronic lymphocytic leukemia (Cll)/small lymphocytic lymphoma (Sll)","J Brown, A Roberts, JF Seymour, W Wierda, O O'Connor, M Czuczman, ...","ANNALS OF ONCOLOGY 19, 229-229",https://scholar.google.com/scholar?oi=bibs&hl=en&cites=1702742460576591415,1,2008
Persistent molecular chimerism is not required to maintain neonatally-induced cardiac allograft tolerance in mice,"HE Mewhort, KS Tao, S Maier, J Brown, LJ West","AMERICAN JOURNAL OF TRANSPLANTATION 8, 484-484",https://scholar.google.com/scholar?oi=bibs&hl=en&cites=8779579366567550158,1,2008
54: Inclusion of Sirolimus in the GVHD Prophylaxis Regimen is Associated with Improved Survival in Patients with Lymphoma Undergoing Allogeneic Transplantation,"P Armand, S Gannamaneni, HT Kim, CS Cutler, VT Ho, J Koreth, ...","Biology of Blood and Marrow Transplantation 14 (2), 22-23",https://scholar.google.com/scholar?oi=bibs&hl=en&cites=7871252391705556711,1,2008
